BOARDID,SECID,TRADEDATE,SHORTNAME,NAME,CLOSE,OPEN,HIGH,LOW,VALUE,DURATION,YIELD,DECIMALS,CAPITALIZATION,CURRENCYID,DIVISOR
INAV,AKEUA,2020-11-20,iNAV Альфа-Капитал ЕВРОПА 600,Расчетная цена одного пая Биржевого ПИФа «ЕВРОПА 600»,10.52,10.49,10.56,10.49,0.0,0,0.0,2,0.0,EUR,0.0
INAV,AKMBA,2020-11-20,iNAV Альфа Управляемые облигации,Расчетная цена одного пая Биржевого ПИФа РФИ «Альфа-Капитал Управляемые облигации»,1.0495,1.0491,1.0499,1.0487,0.0,0,0.0,4,0.0,RUB,0.0
INAV,AKNXA,2020-11-20,iNAV Технологии 100,Расчетная цена одного пая Биржевого ПИФа «ТЕХНОЛОГИИ 100»,17.48,17.48,17.48,17.42,0.0,0,0.0,2,0.0,USD,0.0
INAV,AKSPA,2020-11-20,iNAV Альфа - Капитал Эс энд Пи 500,Расчетная цена одного пая Биржевого ПИФа «Альфа - Капитал Эс энд Пи 500»,12.28,12.31,12.31,12.26,0.0,0,0.0,2,0.0,USD,0.0
RTSI,BPSI,2020-11-20,Субиндекс облигаций,Индексы активов пенсионных накоплений - Субиндекс облигаций,3011.4,3011.4,3011.4,3011.4,1854558750.0,0,5.2755,2,548945720000.0,RUB,549028040000.0
RTSI,BPSIG,2020-11-20,Субиндекс ОФЗ,Индексы активов пенсионных накоплений - Субиндекс ОФЗ,2084.81,2084.81,2084.81,2084.81,1991648372.0,842,4.4281,2,5245222111728.29,RUB,1000000000000.0
RTSI,EPSI,2020-11-20,Субиндекс акций,Индексы активов пенсионных накоплений - Субиндекс акций,1822.57,1822.57,1822.57,1822.57,50216958463.0,0,0.0,2,35988123421992.5,RUB,4173528234.8069
INAV,ESGRA,2020-11-20,iNAV RSHB-MOEX-RSPP ESG VecTR ,Расчетная цена одного пая Биржевого ПИФа «РСХБ–Индекс МосБиржи–РСПП Вектор развития полн дох-ти»,1187.64,1185.17,1192.01,1183.52,0.0,0,0.0,2,0.0,RUB,0.0
INAV,GPBMA,2020-11-20,iNAV ГПБ - Корп. облигации 4г,Расчетная цена одного пая Биржевого ПИФа «Газпромбанк – Корпоративные облигации 4 года»,58262.88,58186.58,58267.28,58149.44,0.0,0,0.0,2,0.0,RUB,0.0
INAV,GPBSA,2020-11-20,iNAV ГПБ - Корп. облигации 2г,Расчетная цена одного пая Биржевого ПИФа «Газпромбанк – Корпоративные облигации 2 года»,56504.57,56369.07,56563.55,56363.23,0.0,0,0.0,2,0.0,RUB,0.0
SNDX,IMOEX,2020-11-20,Индекс МосБиржи,Индекс МосБиржи,3051.04,3050.81,3060.91,3035.56,57925104990.4,0,0.0,2,14674599912213.895,RUB,4809707787.4153
SNDX,IMOEX2,2020-11-20,Индекс МосБиржи (доп. сессия),Индекс МосБиржи (Дополнительная сессия),3051.04,3051.28,3058.14,3049.52,4583268396.85,0,0.0,2,14674599912213.895,RUB,4809707787.4153
RTSI,MCFTR,2020-11-20,MOEX Russia Total Return,Индекс МосБиржи полной доходности «брутто»,5494.21,5494.21,5494.21,5494.21,57988784104.0,0,0.0,2,0.0,RUB,0.0
RTSI,MCFTRN,2020-11-20,MOEX Russia Net-TR-NR,Индекс МосБиржи полной доходности «нетто» (по налоговым ставкам иностранных организаций),5031.26,5031.26,5031.26,5031.26,57988784104.0,0,0.0,2,0.0,RUB,0.0
RTSI,MCFTRR,2020-11-20,MOEX Russia Net-TR-Res,Индекс МосБиржи полной доходности «нетто» (по налоговым ставкам российских организаций),5141.77,5141.77,5141.77,5141.77,57988784104.0,0,0.0,2,0.0,RUB,0.0
RTSI,MCXSM,2020-11-20,Индекс МосБиржи SMID,Индекс МосБиржи средней и малой капитализации,1911.6,1911.6,1911.6,1911.6,7988507643.0,0,0.0,2,4142634701869.569,RUB,312441516.846
RTSI,MEBCTR,2020-11-20,MOEX Blue Chip Total Return,Индекс МосБиржи голубых фишек полной доходности «брутто»,33503.99,33503.99,33503.99,33503.99,40779278566.0,0,0.0,2,0.0,RUB,0.0
RTSI,MEBCTRN,2020-11-20,MOEX Blue Chip Net-TR-NR,Индекс МосБиржи голубых фишек полной доходности «нетто» (по налоговым ставкам иностр. орг.),31011.73,31011.73,31011.73,31011.73,40779278566.0,0,0.0,2,0.0,RUB,0.0
RTSI,MEBCTRR,2020-11-20,MOEX Blue Chip Net-TR-Res,Индекс МосБиржи голубых фишек полной доходности «нетто» (по налоговым ставкам росс. орг.),31553.39,31553.39,31553.39,31553.39,40779278566.0,0,0.0,2,0.0,RUB,0.0
SNDX,MECHTR,2020-11-20,MOEX Chemicals Total Return,Индекс МосБиржи химии и нефтехимии полной доходности «брутто»,27521.5,27521.5,27521.5,27521.5,110553032.0,0,0.0,2,0.0,RUB,0.0
SNDX,MECHTRN,2020-11-20,MOEX Chemicals Net TR-NR,Индекс МосБиржи химии и нефтехимии полной доходности «нетто» (по налог.ставкам ин.орг-й),25830.76,25830.76,25830.76,25830.76,110553032.0,0,0.0,2,0.0,RUB,0.0
SNDX,MECHTRR,2020-11-20,MOEX Chemicals Net TR-Res,Индекс МосБиржи химии и нефтехимии полной доходности «нетто» (по налог.ставкам рос.орг-й),26092.62,26092.62,26092.62,26092.62,110553032.0,0,0.0,2,0.0,RUB,0.0
SNDX,MECNTR,2020-11-20,MOEX Consumer Total Return,Индекс МосБиржи потребительского сектора полной доходности «брутто»,10463.85,10463.85,10463.85,10463.85,3633909593.0,0,0.0,2,0.0,RUB,0.0
SNDX,MECNTRN,2020-11-20,MOEX Consumer Net TR-NR,Индекс МосБиржи потребит. сектора полной доходности «нетто» (по налог.ставкам ин.орг-й),10120.3,10120.3,10120.3,10120.3,3633909593.0,0,0.0,2,0.0,RUB,0.0
SNDX,MECNTRR,2020-11-20,MOEX Consumer Net TR-Res,Индекс МосБиржи потреб. сектора полной доходности «нетто» (по налог.ставкам рос.орг-й),10054.14,10054.14,10054.14,10054.14,3633909593.0,0,0.0,2,0.0,RUB,0.0
SNDX,MEEUTR,2020-11-20,MOEX El.Utilities Total Return,Индекс МосБиржи электроэнергетики полной доходности «брутто»,3164.62,3164.62,3164.62,3164.62,2330175627.0,0,0.0,2,0.0,RUB,0.0
SNDX,MEEUTRN,2020-11-20,MOEX El. Utilities Net TR-NR,Индекс МосБиржи электроэнергетики полной доходности «нетто» (по налог.ставкам ин.орг-й),2996.64,2996.64,2996.64,2996.64,2330175627.0,0,0.0,2,0.0,RUB,0.0
SNDX,MEEUTRR,2020-11-20,MOEX El. Utilities Net TR-Res,Индекс МосБиржи электроэнергетики полной доходности «нетто» (по налог.ставкам рос.орг-й),3023.59,3023.59,3023.59,3023.59,2330175627.0,0,0.0,2,0.0,RUB,0.0
SNDX,MEFNTR,2020-11-20,MOEX Financials Total Return,Индекс МосБиржи финансов полной доходности «брутто»,10773.3,10773.3,10773.3,10773.3,15531266042.0,0,0.0,2,0.0,RUB,0.0
SNDX,MEFNTRN,2020-11-20,MOEX Financials Net TR-NR,Индекс МосБиржи финансов полной доходности «нетто» (по налог.ставкам ин.орг-й),10307.25,10307.25,10307.25,10307.25,15531266042.0,0,0.0,2,0.0,RUB,0.0
SNDX,MEFNTRR,2020-11-20,MOEX Financials Net TR-Res,Индекс МосБиржи финансов полной доходности «нетто» (по налог.ставкам рос.орг-й),10382.73,10382.73,10382.73,10382.73,15531266042.0,0,0.0,2,0.0,RUB,0.0
SNDX,MEMMTR,2020-11-20,MOEX Metals & Min Total Return,Индекс МосБиржи металлов и добычи полной доходности «брутто»,15196.93,15196.93,15196.93,15196.93,9209639237.0,0,0.0,2,0.0,RUB,0.0
SNDX,MEMMTRN,2020-11-20,MOEX Metals & Mining Net TR-NR,Индекс МосБиржи металлов и добычи полной доходности «нетто» (по налог.ставкам ин.орг-й),14143.25,14143.25,14143.25,14143.25,9209639237.0,0,0.0,2,0.0,RUB,0.0
SNDX,MEMMTRR,2020-11-20,MOEX Metals & Min Net TR-Res,Индекс МосБиржи металлов и добычи полной доходности «нетто» (по налог.ставкам рос.орг-й),14313.34,14313.34,14313.34,14313.34,9209639237.0,0,0.0,2,0.0,RUB,0.0
SNDX,MEOGTR,2020-11-20,MOEX Oil & Gas Total Return,Индекс МосБиржи нефти и газа полной доходности «брутто»,10356.88,10356.88,10356.88,10356.88,19481283852.0,0,0.0,2,0.0,RUB,0.0
SNDX,MEOGTRN,2020-11-20,MOEX Oil & Gas Net TR-NR,Индекс МосБиржи нефти и газа полной доходности «нетто» (по налог.ставкам ин.орг-й),9807.14,9807.14,9807.14,9807.14,19481283852.0,0,0.0,2,0.0,RUB,0.0
SNDX,MEOGTRR,2020-11-20,MOEX Oil & Gas Net TR-Res,Индекс МосБиржи нефти и газа полной доходности «нетто» (по налог.ставкам рос.орг-й),9896.69,9896.69,9896.69,9896.69,19481283852.0,0,0.0,2,0.0,RUB,0.0
SNDX,MESMTR,2020-11-20,MOEX SMID Total Return,Индекс МосБиржи средней и малой капитализации полной доходности «брутто»,2676.61,2676.61,2676.61,2676.61,7988507643.0,0,0.0,2,0.0,RUB,0.0
SNDX,MESMTRN,2020-11-20,MOEX SMID Net TR-NR,Индекс МосБиржи средней капитализации полной доходности «нетто» (по нал.ставкам ин.орг-й),2544.98,2544.98,2544.98,2544.98,7988507643.0,0,0.0,2,0.0,RUB,0.0
SNDX,MESMTRR,2020-11-20,MOEX SMID Net TR-Res,Индекс МосБиржи средней капитализации полной доходности «нетто» (по нал.ставкам рос.орг-й),2567.57,2567.57,2567.57,2567.57,7988507643.0,0,0.0,2,0.0,RUB,0.0
SNDX,METLTR,2020-11-20,MOEX Telecom Total Return,Индекс МосБиржи телекоммуникаций полной доходности «брутто»,4243.27,4243.27,4243.27,4243.27,1739261445.0,0,0.0,2,0.0,RUB,0.0
SNDX,METLTRN,2020-11-20,MOEX Telecom Net TR-NR,Индекс МосБиржи телекоммуникаций полной доходности «нетто» (по налог.ставкам ин.орг-й),3856.0,3856.0,3856.0,3856.0,1739261445.0,0,0.0,2,0.0,RUB,0.0
SNDX,METLTRR,2020-11-20,MOEX Telecom Net TR-Res,Индекс МосБиржи телекоммуникаций полной доходности «нетто» (по налог.ставкам рос.орг-й),3917.44,3917.44,3917.44,3917.44,1739261445.0,0,0.0,2,0.0,RUB,0.0
SNDX,METNTR,2020-11-20,MOEX Transport Total Return,Индекс МосБиржи транспорта полной доходности «брутто»,1825.62,1825.62,1825.62,1825.62,1031422509.0,0,0.0,2,0.0,RUB,0.0
SNDX,METNTRN,2020-11-20,MOEX Transport Net TR-NR,Индекс МосБиржи транспорта полной доходности «нетто» (по налог.ставкам ин.орг-й),1735.74,1735.74,1735.74,1735.74,1031422509.0,0,0.0,2,0.0,RUB,0.0
SNDX,METNTRR,2020-11-20,MOEX Transport Net TR-Res,Индекс МосБиржи транспорта полной доходности «нетто» (по налог.ставкам рос.орг-й),1749.26,1749.26,1749.26,1749.26,1031422509.0,0,0.0,2,0.0,RUB,0.0
SNDX,MOEX10,2020-11-20,Индекс МосБиржи 10,Индекс МосБиржи 10,5073.69,5048.24,5083.17,5027.59,34201080759.95,0,0.0,2,10711773233462.748,RUB,5009.22
RTSI,MOEXBC,2020-11-20,Индекс голубых фишек,Индекс МосБиржи голубых фишек,19983.12,19990.72,20046.25,19862.82,40731307233.7,0,0.0,2,11753780808672.898,RUB,588185545.4728
SNDX,MOEXBMI,2020-11-20,Индекс широкого рынка,Индекс МосБиржи широкого рынка,2180.62,2179.36,2187.27,2169.87,59489599896.74,0,0.0,2,16517269687557.9,RUB,7574573330.9507
SNDX,MOEXCH,2020-11-20,Индекс химии и нефтехимии,Индекс МосБиржи химии и нефтехимии,17991.19,17927.87,18018.65,17846.35,110376283.2,0,0.0,2,190810436659.8,RUB,10605772.4903
SNDX,MOEXCN,2020-11-20,Индекс потребительского сектора / Индекс потребит сектора,Индекс МосБиржи потребительского сектора,7987.39,8018.38,8062.91,7979.64,3633361651.48,0,0.0,2,115833574453.7888,RUB,14502059.4659
SNDX,MOEXEU,2020-11-20,Индекс электроэнергетики,Индекс МосБиржи электроэнергетики,2199.13,2192.18,2202.22,2186.24,2329070184.6,0,0.0,2,268610871587.9368,RUB,122144387.9137
SNDX,MOEXFN,2020-11-20,Индекс финансов,Индекс МосБиржи финансов,8011.6,7985.1,8052.75,7985.1,15505014802.45,0,0.0,2,865494139511.0415,RUB,108030067.9261
SNDX,MOEXINN,2020-11-20,Индекс МосБиржи инноваций,Индекс МосБиржи инноваций,388.15,388.39,393.5,386.75,410392716.5,0,0.0,2,2451394664.0901,RUB,6315514.9888
SNDX,MOEXMM,2020-11-20,Индекс металлов и добычи,Индекс МосБиржи металлов и добычи,9401.13,9397.72,9432.48,9373.23,9189951468.71,0,0.0,2,1509160126717.0747,RUB,160529704.4824
SNDX,MOEXOG,2020-11-20,Индекс нефти и газа,Индекс МосБиржи нефти и газа,7186.7,7151.23,7215.04,7119.92,19467024107.4,0,0.0,2,1241830391556.8218,RUB,172795585.0609
SNDX,MOEXREPO,2020-11-20,MXREPO,MOEXREPO обл 12:30,4.11,4.11,4.11,4.11,335310477183.0,,,2,,RUB,
SNDX,MOEXREPO1W,2020-11-20,MOEXREPO1W,MOEXREPO 1 неделя 12:30,4.18,4.18,4.18,4.18,47121107374.0,,,2,,RUB,
SNDX,MOEXREPO1WE,2020-11-20,MOEXREPO1WE,MOEXREPO 1 неделя 19:00,4.06,4.06,4.06,4.06,,,,2,,RUB,
SNDX,MOEXREPOE,2020-11-20,MXREPOE,MOEXREPO обл 19:00,4.02,4.02,4.02,4.02,86992202985.0,,,2,,RUB,
SNDX,MOEXREPOEQ,2020-11-20,MXREPOEQ,MOEXREPO акц 12:30,3.94,3.94,3.94,3.94,30391217399.0,,,2,,RUB,
SNDX,MOEXREPOEQE,2020-11-20,MXREPOEQE,MOEXREPO акц 19:00,4.17,4.17,4.17,4.17,22611769250.0,,,2,,RUB,
SNDX,MOEXREPOUSD,2020-11-20,MOEXREPOUSD,MOEXREPO USD 12:30,0.23,0.23,0.23,0.23,891488143.0,,,2,,USD,
SNDX,MOEXREPOUSDE,2020-11-20,MOEXREPOUSDE,MOEXREPO USD 19:00,0.27,0.27,0.27,0.27,615615765.0,,,2,,USD,
SNDX,MOEXTL,2020-11-20,Индекс телекоммуникаций,Индекс МосБиржи телекоммуникаций,2223.82,2240.94,2242.93,2221.98,1739102670.4,0,0.0,2,395840902289.7588,RUB,178000185.54
SNDX,MOEXTN,2020-11-20,Индекс транспорта,Индекс МосБиржи транспорта,1298.55,1291.12,1303.32,1291.12,1030358274.2,0,0.0,2,59484730291.451,RUB,45808634.8417
SNDX,MRBC,2020-11-20,Индекс МосБиржи 15,Индекс МосБиржи 15,1538.64,1537.92,1543.05,1529.12,40731307233.7,0,0.0,2,9833943069015.072,RUB,6391340404.1646
RTSI,MRBCTR,2020-11-20,Индекс МосБиржи полн дох-ти 15,Индекс МосБиржи полной доходности 15,1847.86,1847.86,1847.86,1847.86,40779278566.0,0,0.0,2,0.0,RUB,0.0
RTSI,MRRT,2020-11-20,"Индекс ""Ответственность и открытость""",Индекс МосБиржи - РСПП Ответственность и открытость,2342.44,2342.44,2342.44,2342.44,44420366497.0,0,0.0,2,35269859787086.99,RUB,3929301536.3335
RTSI,MRSV,2020-11-20,"Индекс ""Вектор устойчивого развития""",Индекс МосБиржи - РСПП Вектор устойчивого развития,2687.24,2687.24,2687.24,2687.24,42822096447.0,0,0.0,2,34649030583092.23,RUB,81467120.5622
RTSI,MRSVT,2020-11-20,Индекс МосБиржи-РСПП Вектор TR,"Индекс МосБиржи - РСПП Вектор устойчивого развития, полной доходности брутто",3336.79,3336.79,3336.79,3336.79,42822096447.0,0,0.0,2,0.0,RUB,0.0
INAV,MTEKA,2020-11-20,iNAV Фридом - Лидеры Технологий,Расчетная цена одного пая Биржевого ПИФа «Фридом - Лидеры Технологий»,1845.11,1847.95,1851.83,1840.76,0.0,0,0.0,2,0.0,RUB,0.0
INAV,ONLYO,2020-11-20,iNAV «Открытие – Всепогодный»,Биржевой паевой инвестиционный фонд рыночных финансовых инструментов «Открытие – Всепогодный»,1.0849,1.0805,1.0862,1.0805,0.0,0,0.0,4,0.0,USD,0.0
INAV,RCMBD,2020-11-20,iNAV «Райффайзен –Еврооблигации»,Биржевой паевой инвестиционный фонд рыночных финансовых инструментов «Райффайзен – Еврооблигации»,12.87,12.88,12.88,12.86,0.0,0,0.0,2,0.0,USD,0.0
INAV,RFBC15,2020-11-20,iNAV «Raiffeisen-MOEX Index 15»,Расчетная цена одного пая Биржевого ПИФа «Райффайзен – Индекс МосБиржи полной доходности 15»,1156.86,1155.81,1160.18,1149.92,0.0,0,0.0,2,0.0,RUB,0.0
SNDX,RGBI,2020-11-20,Индекс Мосбиржи гос обл RGBI,Индекс Мосбиржи государственных облигаций ценовой,154.35,154.32,154.4,154.22,6800986577.3,1854,5.63,2,8970511850934.334,RUB,1.0
SNDX,RGBITR,2020-11-20,Индекс Мосбиржи гос обл RGBITR,Индекс Мосбиржи государственных облигаций,620.9,620.77,621.08,620.38,6800986577.3,1854,5.63,2,9109666345804.912,RUB,1.0
SNDX,RPGCC,2020-11-20,MOEXREPOGCC,MOEXREPO КСУ 12:30,4.08,4.08,4.08,4.08,74277991000.0,,,2,,RUB,
SNDX,RPGCC1W,2020-11-20,MOEXREPOGCC1W,MOEXREPO КСУ 1 неделя 12:30,4.19,4.19,4.19,4.19,7443090000.0,,,2,,RUB,
SNDX,RPGCC1WE,2020-11-20,MOEXREPOGCC1WE,MOEXREPO КСУ 1 неделя 19:00,4.15,4.15,4.15,4.15,,,,2,,RUB,
SNDX,RPGCCE,2020-11-20,MOEXREPOGCCE,MOEXREPO КСУ 19:00,4.06,4.06,4.06,4.06,44542708000.0,,,2,,RUB,
RTSI,RTSCH,2020-11-20,Индекс РТС химии и нефтехимии,Индекс РТС химии и нефтехимии,246.48,245.81,246.97,244.34,1450056.664205595,0,0.0,2,2506751788.1280003,USD,10170280.6297
RTSI,RTSCR,2020-11-20,Индекс РТС потреб. сектора,Индекс РТС потребительских товаров и розничной торговли,237.67,238.78,240.16,237.3,47732901.70181795,0,0.0,2,1521751246.7884183,USD,6402778.8808
RTSI,RTSEU,2020-11-20,Индекс РТС электроэнергетики,Индекс РТС электроэнергетики,73.24,73.07,73.37,72.83,30597911.477615193,0,0.0,2,3528846715.361775,USD,48180107.4121
RTSI,RTSFN,2020-11-20,Индекс РТС финансов,Индекс РТС финансов,182.99,182.54,184.44,182.54,203695480.5060787,0,0.0,2,11370337072.818493,USD,62134706.3129
RTSI,RTSI,2020-11-20,Индекс РТС,Индекс РТС,1262.69,1263.65,1269.02,1256.21,760984897.1263266,0,0.0,2,192785993334.26907,USD,152678585.651
RTSI,RTSMM,2020-11-20,Индекс РТС металлов и добычи,Индекс РТС металлов и добычи,259.62,259.74,260.95,258.83,120732008.585418,0,0.0,2,19826430421.960926,USD,76366315.1958
RTSI,RTSOG,2020-11-20,Индекс РТС нефти и газа,Индекс РТС нефти и газа,183.3,182.54,184.12,181.6,255745955.75063127,0,0.0,2,16314414499.962187,USD,89003323.6986
RTSI,RTSSM,2020-11-20,RTS SMID Index,Индекс РТС средней и малой капитализации,1179.87,1179.87,1179.87,1179.87,7988507643.0,0,0.0,2,714981911.8837721,USD,6650265.8786
RTSI,RTSTL,2020-11-20,Индекс РТС телекоммуникаций,Индекс РТС телекоммуникаций ,89.57,90.33,90.63,89.47,22847276.098089036,0,0.0,2,5200317692.256016,USD,58056740.3599
RTSI,RTSTN,2020-11-20,Индекс РТС транспорта,Индекс РТС транспорта,41.68,41.48,41.86,41.48,13536222.082381967,0,0.0,2,781474308.4009821,USD,18747461.487
RTSI,RTSTR,2020-11-20,RTS Total Return,Индекс РТС полной доходности «брутто»,2272.33,2272.33,2272.33,2272.33,57988784104.0,0,0.0,2,0.0,USD,0.0
RTSI,RTSTRN,2020-11-20,RTS Net-TR-NR,Индекс РТС полной доходности «нетто» (по налоговым ставкам иностранных организаций),2081.06,2081.06,2081.06,2081.06,57988784104.0,0,0.0,2,0.0,USD,0.0
RTSI,RTSTRR,2020-11-20,RTS Net-TR-Res,Индекс РТС полной доходности «нетто» (по налоговым ставкам российских организаций),2126.67,2126.67,2126.67,2126.67,57988784104.0,0,0.0,2,0.0,USD,0.0
RTSI,RTSUSDCUR,2020-11-20,RTSUSDCUR,Курс доллара США на момент закрытия Индекса РТС,76.1186,76.1186,76.1186,76.1186,0.0,,,2,0.0,USD,
RTSI,RUABICP,2020-11-20,ABI CP,Композитный индекс облигаций ,116.6,116.6,116.6,116.6,6838504996.0,1565,5.3497,2,10621910685178.53,RUB,1000000000000.0
RTSI,RUABITR,2020-11-20,ABI TR,Композитный индекс облигаций — совокупный доход,225.24,225.24,225.24,225.24,6838504996.0,1565,5.3496,2,10784545460836.94,RUB,1000000000000.0
RTSI,RUBMI,2020-11-20,Индекс РТС широкого рынка,Индекс РТС широкого рынка,919.65,919.85,924.1,915.0,781538282.3217978,0,0.0,2,216993871242.48087,USD,235953303.4342
SNDX,RUCBCP3Y,2020-11-20,Индекс Мосбиржи корп обл CBICP 3-5,Индекс Мосбиржи корпоративных облигаций MOEX 1 - 3 ценовой,93.13,93.13,93.14,93.08,1386301374.19,610,5.81,2,807668253241.6003,RUB,1.0
SNDX,RUCBCP5Y,2020-11-20,Индекс Мосбиржи корп обл CBICP 1-3,Индекс Мосбиржи корпоративных облигаций ценовой 3-5,123.76,123.59,123.77,123.55,208491796.9,1281,6.12,2,371812045185.0,RUB,1.0
SNDX,RUCBICP,2020-11-20,Индекс Мосбиржи корп обл CBICP,Индекс Мосбиржи корпоративных облигаций ценовой,97.34,97.29,97.35,97.26,1635762579.09,926,6.04,2,1280700298426.6,RUB,1.0
RTSI,RUCBICP1Y,2020-11-20,CBI CP 1Y,"Индекс корпоративных облигаций (≤ 1 года, рейтинг ≥ B-)",91.9,91.9,91.9,91.9,0.0,0,6.0002,2,183290067336.5,RUB,183632456943.9
RTSI,RUCBICP3+,2020-11-20,CBI CP 3+,"Индекс корпоративных облигаций (< 1 года, рейтинг > B-)",126.18,126.18,126.18,126.18,108658835.0,0,6.0284,2,473018464537.5,RUB,472401517137.9
RTSI,RUCBICPB,2020-11-20,CBI CP B,"Индекс корпоративных облигаций (> 1 года, B- ≤ рейтинг < BB-)",78.6,78.6,78.6,78.6,0.0,0,6.7676,2,56603457389.1,RUB,56541728947.6
RTSI,RUCBICPB3Y,2020-11-20,CBI CP B 3Y,"Индекс корпоративных облигаций (1-3 года, B- ≤ рейтинг < BB-)",79.78,79.78,79.78,79.78,0.0,0,6.7622,2,45092538036.6,RUB,45040806989.7
RTSI,RUCBICPBB,2020-11-20,CBI CP BB,"Индекс корпоративных облигаций (> 1 года, BB- ≤ рейтинг < BBB-)",94.3,94.3,94.3,94.3,1117002137.0,0,5.7457,2,544616745185.0,RUB,544295945180.0
RTSI,RUCBICPBB3+,2020-11-20,CBI CP BB 3+,"Индекс корпоративных облигаций (> 3 лет, BB- ≤ рейтинг < BBB-)",120.79,120.79,120.79,120.79,0.0,0,6.0103,2,153606545185.0,RUB,153441245180.0
RTSI,RUCBICPBB3Y,2020-11-20,CBI CP BBB 3Y,"Индекс корпоративных облигаций (1-3 года, BB- ≤ рейтинг < BBB-)",92.57,92.57,92.57,92.57,1117002137.0,0,5.6418,2,391010200000.0,RUB,390854700000.0
RTSI,RUCBICPBB5Y,2020-11-20,CBI CP BB 5Y,"Индекс корпоративных облигаций (3-5 лет, BB- ≤ рейтинг < BBB-)",120.94,120.94,120.94,120.94,0.0,0,5.9732,2,138305045185.0,RUB,138160745180.0
RTSI,RUCBICPBBB,2020-11-20,CBI CP BBB,"Индекс корпоративных облигаций (> 1 года, рейтинг ≥ BBB-)",100.32,100.32,100.32,100.32,180236523.0,0,5.214,2,679363003241.6,RUB,679124389936.0
RTSI,RUCBICPBBB3+,2020-11-20,CBI CP BBB 3+,"Индекс корпоративных облигаций (3-5 лет, рейтинг ≥ BBB-)",130.36,130.36,130.36,130.36,108658835.0,0,6.0089,2,307901000000.0,RUB,307459350000.0
RTSI,RUCBICPBBB3Y,2020-11-20,CBI CP BBB 3Y,"Индекс корпоративных облигаций (1-3 года, рейтинг ≥ BBB-)",95.86,95.86,95.86,95.86,71577688.0,0,4.5537,2,371462003241.6,RUB,371665039936.0
RTSI,RUCBICPBBB5Y,2020-11-20,CBI CP BBB 5Y,"Индекс корпоративных облигаций (3-5 лет, рейтинг ≥ BBB-)",129.07,129.07,129.07,129.07,108658835.0,0,5.8715,2,221982500000.0,RUB,221701350000.0
RTSI,RUCBICPL1,2020-11-20,CBI CP L1,Индекс корпоративных облигаций Котировальный лист 1 - ценовой,93.92,93.92,93.92,93.92,1297238660.0,0,5.7612,2,702198548956.5,RUB,702162570515.0
