BOARDID,SECID,TRADEDATE,SHORTNAME,NAME,CLOSE,OPEN,HIGH,LOW,VALUE,DURATION,YIELD,DECIMALS,CAPITALIZATION,CURRENCYID,DIVISOR
INAV,AKEUA,2020-10-26,iNAV Альфа-Капитал ЕВРОПА 600,Расчетная цена одного пая Биржевого ПИФа «ЕВРОПА 600»,9.65,9.81,9.81,9.63,0.0,0,0.0,2,0.0,EUR,0.0
INAV,AKMBA,2020-10-26,iNAV Альфа Управляемые облигации,Расчетная цена одного пая Биржевого ПИФа РФИ «Альфа-Капитал Управляемые облигации»,1.0421,1.0413,1.0424,1.0411,0.0,0,0.0,4,0.0,RUB,0.0
INAV,AKNXA,2020-10-26,iNAV Технологии 100,Расчетная цена одного пая Биржевого ПИФа «ТЕХНОЛОГИИ 100»,16.74,17.0,17.02,16.71,0.0,0,0.0,2,0.0,USD,0.0
INAV,AKSPA,2020-10-26,iNAV Альфа - Капитал Эс энд Пи 500,Расчетная цена одного пая Биржевого ПИФа «Альфа - Капитал Эс энд Пи 500»,11.67,11.91,11.91,11.66,0.0,0,0.0,2,0.0,USD,0.0
RTSI,BPSI,2020-10-26,Субиндекс облигаций,Индексы активов пенсионных накоплений - Субиндекс облигаций,2988.8595,2988.8595,2988.8595,2988.8595,67668735.1,,,2,441666827901.0,RUB,0.001
RTSI,EPSI,2020-10-26,Субиндекс акций,Индексы активов пенсионных накоплений - Субиндекс акций,1659.2699,1659.2699,1659.2699,1659.2699,43922426816.35,,,2,6925009644807.441,RUB,4173528234.8069
INAV,ESGRA,2020-10-26,iNAV RSHB-MOEX-RSPP ESG VecTR ,Расчетная цена одного пая Биржевого ПИФа «РСХБ–Индекс МосБиржи–РСПП Вектор развития полн дох-ти»,1083.94,1092.06,1092.49,1083.92,0.0,0,0.0,2,0.0,RUB,0.0
INAV,GPBMA,2020-10-26,iNAV ГПБ - Корп. облигации 4г,Расчетная цена одного пая Биржевого ПИФа «Газпромбанк – Корпоративные облигации 4 года»,57775.0,57770.57,57816.56,57713.21,0.0,0,0.0,2,0.0,RUB,0.0
INAV,GPBSA,2020-10-26,iNAV ГПБ - Корп. облигации 2г,Расчетная цена одного пая Биржевого ПИФа «Газпромбанк – Корпоративные облигации 2 года»,56222.58,56172.2,56392.39,56160.68,0.0,0,0.0,2,0.0,RUB,0.0
SNDX,IMOEX,2020-10-26,Индекс МосБиржи,Индекс МосБиржи,2785.59,2812.48,2819.05,2785.59,52620022209.0,0,0.0,2,13397887836499.066,RUB,4809707787.4153
SNDX,IMOEX2,2020-10-26,Индекс МосБиржи (доп. сессия),Индекс МосБиржи (Дополнительная сессия),2785.59,2787.81,2788.55,2771.96,7073571339.0,0,0.0,2,13397887836499.066,RUB,4809707787.4153
RTSI,MCFTR,2020-10-26,MOEX Russia Total Return,Индекс МосБиржи полной доходности «брутто»,5016.2,5016.2,5016.2,5016.2,52620022209.0,,,2,13397887836499.07,RUB,
RTSI,MCFTRN,2020-10-26,MOEX Russia Net-TR-NR,Индекс МосБиржи полной доходности «нетто» (по налоговым ставкам иностранных организаций),4593.52,4593.52,4593.52,4593.52,52620022209.0,,,2,13397887836499.07,RUB,
RTSI,MCFTRR,2020-10-26,MOEX Russia Net-TR-Res,Индекс МосБиржи полной доходности «нетто» (по налоговым ставкам российских организаций),4694.43,4694.43,4694.43,4694.43,52620022209.0,,,2,13397887836499.07,RUB,
RTSI,MCXSM,2020-10-26,Индекс МосБиржи SMID,Индекс МосБиржи средней и малой капитализации,1772.27,1772.27,1772.27,1772.27,4531612106.07,,,2,553729957280.5088,RUB,312441516.846
RTSI,MEBCTR,2020-10-26,MOEX Blue Chip Total Return,Индекс МосБиржи голубых фишек полной доходности «брутто»,30348.36,30348.36,30348.36,30348.36,38397739960.8,,,2,10646726100760.45,RUB,
RTSI,MEBCTRN,2020-10-26,MOEX Blue Chip Net-TR-NR,Индекс МосБиржи голубых фишек полной доходности «нетто» (по налоговым ставкам иностр. орг.),28090.83,28090.83,28090.83,28090.83,38397739960.8,,,2,10646726100760.45,RUB,
RTSI,MEBCTRR,2020-10-26,MOEX Blue Chip Net-TR-Res,Индекс МосБиржи голубых фишек полной доходности «нетто» (по налоговым ставкам росс. орг.),28581.48,28581.48,28581.48,28581.48,38397739960.8,,,2,10646726100760.45,RUB,
SNDX,MECHTR,2020-10-26,MOEX Chemicals Total Return,Индекс МосБиржи химии и нефтехимии полной доходности «брутто»,25582.78,25582.78,25582.78,25582.78,146387270.0,0,0.0,2,0.0,RUB,0.0
SNDX,MECHTRN,2020-10-26,MOEX Chemicals Net TR-NR,Индекс МосБиржи химии и нефтехимии полной доходности «нетто» (по налог.ставкам ин.орг-й),24011.12,24011.12,24011.12,24011.12,146387270.0,0,0.0,2,0.0,RUB,0.0
SNDX,MECHTRR,2020-10-26,MOEX Chemicals Net TR-Res,Индекс МосБиржи химии и нефтехимии полной доходности «нетто» (по налог.ставкам рос.орг-й),24254.55,24254.55,24254.55,24254.55,146387270.0,0,0.0,2,0.0,RUB,0.0
SNDX,MECNTR,2020-10-26,MOEX Consumer Total Return,Индекс МосБиржи потребительского сектора полной доходности «брутто»,10138.0,10138.0,10138.0,10138.0,2486061830.0,0,0.0,2,0.0,RUB,0.0
SNDX,MECNTRN,2020-10-26,MOEX Consumer Net TR-NR,Индекс МосБиржи потребит. сектора полной доходности «нетто» (по налог.ставкам ин.орг-й),9811.96,9811.96,9811.96,9811.96,2486061830.0,0,0.0,2,0.0,RUB,0.0
SNDX,MECNTRR,2020-10-26,MOEX Consumer Net TR-Res,Индекс МосБиржи потреб. сектора полной доходности «нетто» (по налог.ставкам рос.орг-й),9746.9,9746.9,9746.9,9746.9,2486061830.0,0,0.0,2,0.0,RUB,0.0
SNDX,MEEUTR,2020-10-26,MOEX El.Utilities Total Return,Индекс МосБиржи электроэнергетики полной доходности «брутто»,3046.81,3046.81,3046.81,3046.81,2543810284.0,0,0.0,2,0.0,RUB,0.0
SNDX,MEEUTRN,2020-10-26,MOEX El. Utilities Net TR-NR,Индекс МосБиржи электроэнергетики полной доходности «нетто» (по налог.ставкам ин.орг-й),2885.08,2885.08,2885.08,2885.08,2543810284.0,0,0.0,2,0.0,RUB,0.0
SNDX,MEEUTRR,2020-10-26,MOEX El. Utilities Net TR-Res,Индекс МосБиржи электроэнергетики полной доходности «нетто» (по налог.ставкам рос.орг-й),2911.03,2911.03,2911.03,2911.03,2543810284.0,0,0.0,2,0.0,RUB,0.0
SNDX,MEFNTR,2020-10-26,MOEX Financials Total Return,Индекс МосБиржи финансов полной доходности «брутто»,9898.56,9898.56,9898.56,9898.56,15991895614.0,0,0.0,2,0.0,RUB,0.0
SNDX,MEFNTRN,2020-10-26,MOEX Financials Net TR-NR,Индекс МосБиржи финансов полной доходности «нетто» (по налог.ставкам ин.орг-й),9470.34,9470.34,9470.34,9470.34,15991895614.0,0,0.0,2,0.0,RUB,0.0
SNDX,MEFNTRR,2020-10-26,MOEX Financials Net TR-Res,Индекс МосБиржи финансов полной доходности «нетто» (по налог.ставкам рос.орг-й),9539.71,9539.71,9539.71,9539.71,15991895614.0,0,0.0,2,0.0,RUB,0.0
SNDX,MEMMTR,2020-10-26,MOEX Metals & Min Total Return,Индекс МосБиржи металлов и добычи полной доходности «брутто»,14404.87,14404.87,14404.87,14404.87,10758477477.0,0,0.0,2,0.0,RUB,0.0
SNDX,MEMMTRN,2020-10-26,MOEX Metals & Mining Net TR-NR,Индекс МосБиржи металлов и добычи полной доходности «нетто» (по налог.ставкам ин.орг-й),13406.11,13406.11,13406.11,13406.11,10758477477.0,0,0.0,2,0.0,RUB,0.0
SNDX,MEMMTRR,2020-10-26,MOEX Metals & Min Net TR-Res,Индекс МосБиржи металлов и добычи полной доходности «нетто» (по налог.ставкам рос.орг-й),13567.31,13567.31,13567.31,13567.31,10758477477.0,0,0.0,2,0.0,RUB,0.0
SNDX,MEOGTR,2020-10-26,MOEX Oil & Gas Total Return,Индекс МосБиржи нефти и газа полной доходности «брутто»,9015.65,9015.65,9015.65,9015.65,15358076420.0,0,0.0,2,0.0,RUB,0.0
SNDX,MEOGTRN,2020-10-26,MOEX Oil & Gas Net TR-NR,Индекс МосБиржи нефти и газа полной доходности «нетто» (по налог.ставкам ин.орг-й),8537.13,8537.13,8537.13,8537.13,15358076420.0,0,0.0,2,0.0,RUB,0.0
SNDX,MEOGTRR,2020-10-26,MOEX Oil & Gas Net TR-Res,Индекс МосБиржи нефти и газа полной доходности «нетто» (по налог.ставкам рос.орг-й),8615.1,8615.1,8615.1,8615.1,15358076420.0,0,0.0,2,0.0,RUB,0.0
SNDX,MESMTR,2020-10-26,MOEX SMID Total Return,Индекс МосБиржи средней и малой капитализации полной доходности «брутто»,2471.03,2471.03,2471.03,2471.03,4531612107.0,0,0.0,2,0.0,RUB,0.0
SNDX,MESMTRN,2020-10-26,MOEX SMID Net TR-NR,Индекс МосБиржи средней капитализации полной доходности «нетто» (по нал.ставкам ин.орг-й),2351.0,2351.0,2351.0,2351.0,4531612107.0,0,0.0,2,0.0,RUB,0.0
SNDX,MESMTRR,2020-10-26,MOEX SMID Net TR-Res,Индекс МосБиржи средней капитализации полной доходности «нетто» (по нал.ставкам рос.орг-й),2371.65,2371.65,2371.65,2371.65,4531612107.0,0,0.0,2,0.0,RUB,0.0
SNDX,METLTR,2020-10-26,MOEX Telecom Total Return,Индекс МосБиржи телекоммуникаций полной доходности «брутто»,4258.24,4258.24,4258.24,4258.24,845366202.0,0,0.0,2,0.0,RUB,0.0
SNDX,METLTRN,2020-10-26,MOEX Telecom Net TR-NR,Индекс МосБиржи телекоммуникаций полной доходности «нетто» (по налог.ставкам ин.орг-й),3869.61,3869.61,3869.61,3869.61,845366202.0,0,0.0,2,0.0,RUB,0.0
SNDX,METLTRR,2020-10-26,MOEX Telecom Net TR-Res,Индекс МосБиржи телекоммуникаций полной доходности «нетто» (по налог.ставкам рос.орг-й),3931.25,3931.25,3931.25,3931.25,845366202.0,0,0.0,2,0.0,RUB,0.0
SNDX,METNTR,2020-10-26,MOEX Transport Total Return,Индекс МосБиржи транспорта полной доходности «брутто»,1610.88,1610.88,1610.88,1610.88,1253865731.0,0,0.0,2,0.0,RUB,0.0
SNDX,METNTRN,2020-10-26,MOEX Transport Net TR-NR,Индекс МосБиржи транспорта полной доходности «нетто» (по налог.ставкам ин.орг-й),1531.56,1531.56,1531.56,1531.56,1253865731.0,0,0.0,2,0.0,RUB,0.0
SNDX,METNTRR,2020-10-26,MOEX Transport Net TR-Res,Индекс МосБиржи транспорта полной доходности «нетто» (по налог.ставкам рос.орг-й),1543.49,1543.49,1543.49,1543.49,1253865731.0,0,0.0,2,0.0,RUB,0.0
SNDX,MOEX10,2020-10-26,Индекс МосБиржи 10,Индекс МосБиржи 10,4551.9,4612.35,4623.56,4551.9,34994363142.85,0,0.0,2,9606983944529.637,RUB,5009.22
RTSI,MOEXBC,2020-10-26,Индекс голубых фишек,Индекс МосБиржи голубых фишек,18100.97,18306.24,18355.04,18100.97,38397739960.8,0,0.0,2,10646726100760.451,RUB,588185545.4728
SNDX,MOEXBMI,2020-10-26,Индекс широкого рынка,Индекс МосБиржи широкого рынка,1991.11,2012.63,2014.75,1991.11,53435768200.77,0,0.0,2,15081838139481.258,RUB,7574573330.9507
SNDX,MOEXCH,2020-10-26,Индекс химии и нефтехимии,Индекс МосБиржи химии и нефтехимии,16723.81,16747.7,16836.44,16656.96,146361786.2,0,0.0,2,177368960380.0,RUB,10605772.4903
SNDX,MOEXCN,2020-10-26,Индекс потребительского сектора / Индекс потребит сектора,Индекс МосБиржи потребительского сектора,7774.63,7881.24,7881.24,7765.26,2484223641.84,0,0.0,2,112748187474.7769,RUB,14502059.4659
SNDX,MOEXEU,2020-10-26,Индекс электроэнергетики,Индекс МосБиржи электроэнергетики,2117.27,2131.7,2137.37,2113.8,2539497779.4,0,0.0,2,258613086519.4845,RUB,122144387.9137
SNDX,MOEXFN,2020-10-26,Индекс финансов,Индекс МосБиржи финансов,7361.1,7350.43,7413.19,7314.32,15963783448.95,0,0.0,2,795219743573.2772,RUB,108030067.9261
SNDX,MOEXINN,2020-10-26,Индекс МосБиржи инноваций,Индекс МосБиржи инноваций,374.48,382.49,384.06,374.48,56979125.5,0,0.0,2,2365014183.3198,RUB,6315514.9888
SNDX,MOEXMM,2020-10-26,Индекс металлов и добычи,Индекс МосБиржи металлов и добычи,8911.15,8987.36,8991.45,8911.15,10749462402.7,0,0.0,2,1430504949036.984,RUB,160529704.4824
SNDX,MOEXOG,2020-10-26,Индекс нефти и газа,Индекс МосБиржи нефти и газа,6256.03,6308.16,6317.92,6256.03,15318493411.7,0,0.0,2,1081014196333.071,RUB,172795585.0609
SNDX,MOEXREPO,2020-10-26,MXREPO,MOEXREPO обл 12:30,4.25,4.25,4.25,4.25,237993012471.0,,,2,,RUB,
SNDX,MOEXREPO1W,2020-10-26,MOEXREPO1W,MOEXREPO 1 неделя 12:30,4.38,4.38,4.38,4.38,97426600902.0,,,2,,RUB,
SNDX,MOEXREPO1WE,2020-10-26,MOEXREPO1WE,MOEXREPO 1 неделя 19:00,4.46,4.46,4.46,4.46,53105474114.0,,,2,,RUB,
SNDX,MOEXREPOE,2020-10-26,MXREPOE,MOEXREPO обл 19:00,4.34,4.34,4.34,4.34,192446818131.0,,,2,,RUB,
SNDX,MOEXREPOEQ,2020-10-26,MXREPOEQ,MOEXREPO акц 12:30,4.29,4.29,4.29,4.29,41496652022.0,,,2,,RUB,
SNDX,MOEXREPOEQE,2020-10-26,MXREPOEQE,MOEXREPO акц 19:00,4.31,4.31,4.31,4.31,33413682411.0,,,2,,RUB,
SNDX,MOEXREPOUSD,2020-10-26,MOEXREPOUSD,MOEXREPO USD 12:30,0.4,0.4,0.4,0.4,1367588258.0,,,2,,USD,
SNDX,MOEXREPOUSDE,2020-10-26,MOEXREPOUSDE,MOEXREPO USD 19:00,0.38,0.38,0.38,0.38,628928532.0,,,2,,USD,
SNDX,MOEXTL,2020-10-26,Индекс телекоммуникаций,Индекс МосБиржи телекоммуникаций,2231.67,2236.81,2244.33,2228.18,844709570.8,0,0.0,2,397238473448.3,RUB,178000185.54
SNDX,MOEXTN,2020-10-26,Индекс транспорта,Индекс МосБиржи транспорта,1145.8,1164.1,1166.82,1142.62,1251883883.6,0,0.0,2,52487666832.1452,RUB,45808634.8417
SNDX,MRBC,2020-10-26,Индекс МосБиржи 15,Индекс МосБиржи 15,1401.31,1417.33,1421.48,1401.31,38397739960.8,0,0.0,2,8956233391270.502,RUB,6391340404.1646
RTSI,MRBCTR,2020-10-26,Индекс МосБиржи полн дох-ти 15,Индекс МосБиржи полной доходности 15,1682.93,1682.93,1682.93,1682.93,38462619468.0,0,0.0,2,0.0,RUB,0.0
RTSI,MRRT,2020-10-26,"Индекс ""Ответственность и открытость""",Индекс МосБиржи - РСПП Ответственность и открытость,2099.4,2099.4,2099.4,2099.4,39228419377.0,0,0.0,2,31379153613060.74,RUB,3929301536.3335
RTSI,MRSV,2020-10-26,"Индекс ""Вектор устойчивого развития""",Индекс МосБиржи - РСПП Вектор устойчивого развития,2450.18,2450.18,2450.18,2450.18,37495779009.0,0,0.0,2,30793520993826.34,RUB,81467120.5622
RTSI,MRSVT,2020-10-26,Индекс МосБиржи-РСПП Вектор TR,"Индекс МосБиржи - РСПП Вектор устойчивого развития, полной доходности брутто",3042.42,3042.42,3042.42,3042.42,37495779009.0,0,0.0,2,0.0,RUB,0.0
INAV,MTEKA,2020-10-26,iNAV Фридом - Лидеры Технологий,Расчетная цена одного пая Биржевого ПИФа «Фридом - Лидеры Технологий»,1831.85,1860.76,1909.03,1827.61,0.0,0,0.0,2,0.0,RUB,0.0
INAV,ONLYO,2020-10-26,iNAV «Открытие – Всепогодный»,Биржевой паевой инвестиционный фонд рыночных финансовых инструментов «Открытие – Всепогодный»,1.045,1.0513,1.0513,1.0439,0.0,0,0.0,4,0.0,USD,0.0
RTSI,OPSI,2020-10-26,Субиндекс ОФЗ,Индексы активов пенсионных накоплений - Субиндекс ОФЗ,2076.8669,2076.8669,2076.8669,2076.8669,1781468112.66,,,2,5233008671061.86,RUB,
INAV,RCMBD,2020-10-26,iNAV «Райффайзен –Еврооблигации»,Биржевой паевой инвестиционный фонд рыночных финансовых инструментов «Райффайзен – Еврооблигации»,12.82,12.83,12.84,12.81,0.0,0,0.0,2,0.0,USD,0.0
INAV,RFBC15,2020-10-26,iNAV «Raiffeisen-MOEX Index 15»,Расчетная цена одного пая Биржевого ПИФа «Райффайзен – Индекс МосБиржи полной доходности 15»,1055.72,1068.38,1070.46,1055.72,0.0,0,0.0,2,0.0,RUB,0.0
SNDX,RGBI,2020-10-26,Индекс Мосбиржи гос обл RGBI,Индекс Мосбиржи государственных облигаций ценовой,153.79,153.9,153.94,153.78,30170031948.05,1872,5.72,2,8937758997179.87,RUB,1.0
SNDX,RGBITR,2020-10-26,Индекс Мосбиржи гос обл RGBITR,Индекс Мосбиржи государственных облигаций,615.97,616.4,616.56,615.91,30170031948.05,1872,5.72,2,9053134506219.596,RUB,1.0
SNDX,RPGCC,2020-10-26,MOEXREPOGCC,MOEXREPO КСУ 12:30,4.31,4.31,4.31,4.31,90214335000.0,,,2,,RUB,
SNDX,RPGCC1W,2020-10-26,MOEXREPOGCC1W,MOEXREPO КСУ 1 неделя 12:30,4.32,4.32,4.32,4.32,2912835000.0,,,2,,RUB,
SNDX,RPGCC1WE,2020-10-26,MOEXREPOGCC1WE,MOEXREPO КСУ 1 неделя 19:00,4.32,4.32,4.32,4.32,1152253000.0,,,2,,RUB,
SNDX,RPGCCE,2020-10-26,MOEXREPOGCCE,MOEXREPO КСУ 19:00,4.34,4.34,4.34,4.34,83765492000.0,,,2,,RUB,
RTSI,RTSCH,2020-10-26,Индекс РТС химии и нефтехимии,Индекс РТС химии и нефтехимии,229.02,229.43,229.99,227.1,1921971.5621015364,0,0.0,2,2329146881.1677713,USD,10170280.6297
RTSI,RTSCR,2020-10-26,Индекс РТС потреб. сектора,Индекс РТС потребительских товаров и розничной торговли,231.24,234.49,234.49,230.73,32621952.201323938,0,0.0,2,1480569591.4977434,USD,6402778.8808
RTSI,RTSEU,2020-10-26,Индекс РТС электроэнергетики,Индекс РТС электроэнергетики,70.49,70.99,70.99,70.29,33347792.758946266,0,0.0,2,3396016206.023546,USD,48180107.4121
RTSI,RTSFN,2020-10-26,Индекс РТС финансов,Индекс РТС финансов,168.06,167.88,168.88,166.34,209630796.4601015,0,0.0,2,10442546326.136015,USD,62134706.3129
RTSI,RTSI,2020-10-26,Индекс РТС,Индекс РТС,1152.33,1163.89,1165.58,1151.45,690987647.1762359,0,0.0,2,175936356630.6168,USD,152678585.651
RTSI,RTSMM,2020-10-26,Индекс РТС металлов и добычи,Индекс РТС металлов и добычи,245.98,248.18,248.18,245.46,141158164.1784381,0,0.0,2,18784888479.958923,USD,76366315.1958
RTSI,RTSOG,2020-10-26,Индекс РТС нефти и газа,Индекс РТС нефти и газа,159.49,160.88,160.88,159.15,201157074.36977938,0,0.0,2,14195498685.299658,USD,89003323.6986
RTSI,RTSSM,2020-10-26,RTS SMID Index,Индекс РТС средней и малой капитализации,1093.4,1093.4,1093.4,1093.4,59507538.3,,,2,7271387283.5803,USD,6650265.8786
RTSI,RTSTL,2020-10-26,Индекс РТС телекоммуникаций,Индекс РТС телекоммуникаций ,89.85,90.09,90.29,89.36,11092429.35238648,0,0.0,2,5216396090.554537,USD,58056740.3599
RTSI,RTSTN,2020-10-26,Индекс РТС транспорта,Индекс РТС транспорта,36.76,37.37,37.38,36.63,16439299.395024942,0,0.0,2,689249602.8614546,USD,18747461.487
RTSI,RTSTR,2020-10-26,RTS Total Return,Индекс РТС полной доходности «брутто»,2073.72,2073.72,2073.72,2073.72,690987647.14,,,2,175936356630.62,USD,
RTSI,RTSTRN,2020-10-26,RTS Net-TR-NR,Индекс РТС полной доходности «нетто» (по налоговым ставкам иностранных организаций),1899.17,1899.17,1899.17,1899.17,690987647.14,,,2,175936356630.62,USD,
RTSI,RTSTRR,2020-10-26,RTS Net-TR-Res,Индекс РТС полной доходности «нетто» (по налоговым ставкам российских организаций),1940.81,1940.81,1940.81,1940.81,690987647.14,,,2,175936356630.62,USD,
RTSI,RTSUSDCUR,2020-10-26,RTSUSDCUR,Курс доллара США на момент закрытия Индекса РТС,76.1519,76.1519,76.1519,76.1519,0.0,,,2,0.0,USD,
RTSI,RUABICP,2020-10-26,ABI CP,Композитный индекс облигаций ,116.21,116.21,116.21,116.21,3680859317.69,1727,5.49,2,10727171519716.39,RUB,
RTSI,RUABITR,2020-10-26,ABI TR,Композитный индекс облигаций — совокупный доход,223.52,223.52,223.52,223.52,3680859317.69,1727,5.49,2,10727171519716.39,RUB,
RTSI,RUBMI,2020-10-26,Индекс РТС широкого рынка,Индекс РТС широкого рынка,839.36,848.74,848.74,838.73,701699736.9831876,0,0.0,2,198049400467.76584,USD,235953303.4342
SNDX,RUCBCP3Y,2020-10-26,Индекс Мосбиржи корп обл CBICP 3-5,Индекс Мосбиржи корпоративных облигаций MOEX 1 - 3 ценовой,93.05,93.08,93.32,93.05,2922076830.92,631,5.93,2,806964663903.9999,RUB,1.0
SNDX,RUCBCP5Y,2020-10-26,Индекс Мосбиржи корп обл CBICP 1-3,Индекс Мосбиржи корпоративных облигаций ценовой 3-5,123.41,123.45,123.6,123.33,37906283.9,1300,6.22,2,370773295275.0,RUB,1.0
SNDX,RUCBICP,2020-10-26,Индекс Мосбиржи корп обл CBICP,Индекс Мосбиржи корпоративных облигаций ценовой,97.15,97.19,97.37,97.14,2977622014.82,944,6.15,2,1278371459179.0002,RUB,1.0
RTSI,RUCBICP1Y,2020-10-26,CBI CP 1Y,"Индекс корпоративных облигаций (≤ 1 года, рейтинг ≥ B-)",92.12,92.12,92.12,92.12,132785929.77,129,5.63,2,186399198608.14,RUB,
RTSI,RUCBICP3+,2020-10-26,CBI CP 3+,"Индекс корпоративных облигаций (< 1 года, рейтинг > B-)",125.74,125.74,125.74,125.74,55365112.8,1480,6.27,2,478968193975.16,RUB,
RTSI,RUCBICPB,2020-10-26,CBI CP B,"Индекс корпоративных облигаций (> 1 года, B- ≤ рейтинг < BB-)",78.22,78.22,78.22,78.22,16359477.02,794,7.07,2,57199185114.01,RUB,
RTSI,RUCBICPB3Y,2020-10-26,CBI CP B 3Y,"Индекс корпоративных облигаций (1-3 года, B- ≤ рейтинг < BB-)",79.46,79.46,79.46,79.46,14424046.12,732,7.07,2,45489235988.85,RUB,
RTSI,RUCBICPBB,2020-10-26,CBI CP BB,"Индекс корпоративных облигаций (> 1 года, BB- ≤ рейтинг < BBB-)",94.06,94.06,94.06,94.06,113315456.4,866,6.3,2,551865994850.0,RUB,
RTSI,RUCBICPBB3+,2020-10-26,CBI CP BB 3+,"Индекс корпоративных облигаций (> 3 лет, BB- ≤ рейтинг < BBB-)",120.3,120.3,120.3,120.3,41120822.2,1357,6.56,2,155042524850.0,RUB,
RTSI,RUCBICPBB3Y,2020-10-26,CBI CP BBB 3Y,"Индекс корпоративных облигаций (1-3 года, BB- ≤ рейтинг < BBB-)",92.42,92.42,92.42,92.42,72194634.2,675,6.2,2,396823470000.0,RUB,
RTSI,RUCBICPBB5Y,2020-10-26,CBI CP BB 5Y,"Индекс корпоративных облигаций (3-5 лет, BB- ≤ рейтинг < BBB-)",120.44,120.44,120.44,120.44,27380825.7,1299,6.57,2,139605724850.0,RUB,
RTSI,RUCBICPBBB,2020-10-26,CBI CP BBB,"Индекс корпоративных облигаций (> 1 года, рейтинг ≥ BBB-)",100.2,100.2,100.2,100.2,114786005.2,1020,5.72,2,687929573532.8,RUB,
RTSI,RUCBICPBBB3+,2020-10-26,CBI CP BBB 3+,"Индекс корпоративных облигаций (3-5 лет, рейтинг ≥ BBB-)",129.95,129.95,129.95,129.95,12308859.7,1558,6.1,2,312215720000.0,RUB,
RTSI,RUCBICPBBB3Y,2020-10-26,CBI CP BBB 3Y,"Индекс корпоративных облигаций (1-3 года, рейтинг ≥ BBB-)",95.9,95.9,95.9,95.9,102477145.5,572,5.4,2,375713853532.8,RUB,
RTSI,RUCBICPBBB5Y,2020-10-26,CBI CP BBB 5Y,"Индекс корпоративных облигаций (3-5 лет, рейтинг ≥ BBB-)",128.85,128.85,128.85,128.85,8406896.8,1316,5.95,2,225718920000.0,RUB,
RTSI,RUCBICPL1,2020-10-26,CBI CP L1,Индекс корпоративных облигаций Котировальный лист 1 - ценовой,93.8,93.8,93.8,93.8,152738799.9,929,5.94,2,711887456411.29,RUB,
RTSI,RUCBICPL2,2020-10-26,CBI CP L2,Индекс корпоративных облигаций Котировальный лист 2 - ценовой,105.25,105.25,105.25,105.25,53742407.62,928,6.1,2,419159552085.52,RUB,
