BOARDID,SECID,TRADEDATE,SHORTNAME,NAME,CLOSE,OPEN,HIGH,LOW,VALUE,DURATION,YIELD,DECIMALS,CAPITALIZATION,CURRENCYID,DIVISOR
INAV,AKCHA,2021-03-03,iNAV Альфа Китайские акции,Расчетная цена одного пая Биржевого ПИФа РФИ «Альфа-Капитал Китайские акции»,110.17,109.86,111.14,109.42,0.0,0,0.0,2,0.0,RUB,0.0
INAV,AKEUA,2021-03-03,iNAV Альфа-Капитал ЕВРОПА 600,Расчетная цена одного пая Биржевого ПИФа «ЕВРОПА 600»,11.13,11.17,11.25,11.1,0.0,0,0.0,2,0.0,EUR,0.0
INAV,AKMBA,2021-03-03,iNAV Альфа Управляемые облигации,Расчетная цена одного пая Биржевого ПИФа РФИ «Альфа-Капитал Управляемые облигации»,1.0665,1.066,1.0665,1.0659,0.0,0,0.0,4,0.0,RUB,0.0
INAV,AKMEI,2021-03-03,iNAV Альфа Управляемые акции,Расчетная цена одного пая Биржевого ПИФа РФИ «Альфа-Капитал Управляемые Российские Акции»,107.88,108.17,108.8,107.33,0.0,0,0.0,2,0.0,RUB,0.0
INAV,AKNXA,2021-03-03,iNAV Технологии 100,Расчетная цена одного пая Биржевого ПИФа «ТЕХНОЛОГИИ 100»,18.8,19.08,19.08,18.75,0.0,0,0.0,2,0.0,USD,0.0
INAV,AKSPA,2021-03-03,iNAV Альфа - Капитал Эс энд Пи 500,Расчетная цена одного пая Биржевого ПИФа «Альфа - Капитал Эс энд Пи 500»,13.22,13.3,13.31,13.19,0.0,0,0.0,2,0.0,USD,0.0
RTSI,BPSI,2021-03-03,Субиндекс облигаций,Субиндекс облигаций активов пенсионных накоплений,3025.74,3025.74,3025.74,3025.74,3512273925.0,946,6.33,2,1988501046889.52,RUB,1000000000000.0
RTSI,BPSIG,2021-03-03,Субиндекс облигаций ОФЗ,Субиндекс облигаций ОФЗ активов пенсионных накоплений,2039.45,2039.45,2039.45,2039.45,23420404804.0,1750,6.11,2,8755456188306.1,RUB,1000000000000.0
INAV,DIVDA,2021-03-03,iNAV ДОХОДЪ Дивидендные акции РФ,Расчетная цена одного пая Биржевого ПИФа РФИ «ДОХОДЪ Индекс дивидендных акций РФ»,989.87,989.32,995.98,986.73,0.0,0,0.0,2,0.0,RUB,0.0
RTSI,EPSI,2021-03-03,Субиндекс акций,Субиндекс акций активов пенсионных накоплений,2021.04,2021.04,2021.04,2021.04,91848107109.0,0,0.0,2,49389964808309.586,RUB,7568983455.3956
RTSI,EPSITR,2021-03-03,Субиндекс акций полной доходности,Субиндекс акций полной дох-ти,2034.56,2034.56,2034.56,2034.56,91848107109.0,0,0.0,2,0.0,RUB,0.0
INAV,ESGRA,2021-03-03,iNAV RSHB-MOEX-RSPP ESG VecTR ,Расчетная цена одного пая Биржевого ПИФа «РСХБ–Индекс МосБиржи–РСПП Вектор развития полн дох-ти»,1344.21,1345.83,1352.18,1341.63,0.0,0,0.0,2,0.0,RUB,0.0
INAV,FMUSA,2021-03-03,iNAV Дивидендные аристократы США,Расчетная цена одного пая Биржевого ПИФа РФИ «Дивидендные Аристократы США»,10.08,9.99,10.08,9.94,0.0,0,0.0,2,0.0,RUB,0.0
INAV,GPBMA,2021-03-03,iNAV ГПБ - Корп. облигации 4г,Расчетная цена одного пая Биржевого ПИФа «Газпромбанк – Корпоративные облигации 4 года»,58263.65,58294.45,58392.5,58257.28,0.0,0,0.0,2,0.0,RUB,0.0
INAV,GPBSA,2021-03-03,iNAV ГПБ - Корп. облигации 2г,Расчетная цена одного пая Биржевого ПИФа «Газпромбанк – Корпоративные облигации 2 года»,56928.24,56988.47,57020.56,56920.87,0.0,0,0.0,2,0.0,RUB,0.0
SNDX,IMOEX,2021-03-03,Индекс МосБиржи,Индекс МосБиржи,3416.04,3432.88,3450.76,3408.47,91738079532.4,0,0.0,2,17350845475513.639,RUB,5079230865.8227
SNDX,IMOEX2,2021-03-03,Индекс МосБиржи (доп. сессия),Индекс МосБиржи (Дополнительная сессия),3416.04,3417.19,3423.3,3398.15,8377169953.45,0,0.0,2,17350845475513.643,RUB,5079230865.8227
RTSI,MCFTR,2021-03-03,MOEX Russia Total Return,Индекс МосБиржи полной доходности «брутто»,6190.56,6190.56,6190.56,6190.56,91848107109.0,0,0.0,2,0.0,RUB,0.0
RTSI,MCFTRN,2021-03-03,MOEX Russia Net-TR-NR,Индекс МосБиржи полной доходности «нетто» (по налоговым ставкам иностранных организаций),5663.61,5663.61,5663.61,5663.61,91848107109.0,0,0.0,2,0.0,RUB,0.0
RTSI,MCFTRR,2021-03-03,MOEX Russia Net-TR-Res,Индекс МосБиржи полной доходности «нетто» (по налоговым ставкам российских организаций),5788.0,5788.0,5788.0,5788.0,91848107109.0,0,0.0,2,0.0,RUB,0.0
RTSI,MCXSM,2021-03-03,Индекс МосБиржи SMID,Индекс МосБиржи средней и малой капитализации,2052.05,2052.05,2052.05,2052.05,5678912583.0,0,0.0,2,4899010904561.056,RUB,414265307.9884
RTSI,MEBCTR,2021-03-03,MOEX Blue Chip Total Return,Индекс МосБиржи голубых фишек полной доходности «брутто»,37253.42,37253.42,37253.42,37253.42,67029545923.0,0,0.0,2,0.0,RUB,0.0
RTSI,MEBCTRN,2021-03-03,MOEX Blue Chip Net-TR-NR,Индекс МосБиржи голубых фишек полной доходности «нетто» (по налоговым ставкам иностр. орг.),34453.07,34453.07,34453.07,34453.07,67029545923.0,0,0.0,2,0.0,RUB,0.0
RTSI,MEBCTRR,2021-03-03,MOEX Blue Chip Net-TR-Res,Индекс МосБиржи голубых фишек полной доходности «нетто» (по налоговым ставкам росс. орг.),35054.82,35054.82,35054.82,35054.82,67029545923.0,0,0.0,2,0.0,RUB,0.0
SNDX,MECHTR,2021-03-03,MOEX Chemicals Total Return,Индекс МосБиржи химии и нефтехимии полной доходности «брутто»,33428.58,33428.58,33428.58,33428.58,589425247.0,0,0.0,2,0.0,RUB,0.0
SNDX,MECHTRN,2021-03-03,MOEX Chemicals Net TR-NR,Индекс МосБиржи химии и нефтехимии полной доходности «нетто» (по налог.ставкам ин.орг-й),31278.38,31278.38,31278.38,31278.38,589425247.0,0,0.0,2,0.0,RUB,0.0
SNDX,MECHTRR,2021-03-03,MOEX Chemicals Net TR-Res,Индекс МосБиржи химии и нефтехимии полной доходности «нетто» (по налог.ставкам рос.орг-й),31608.45,31608.45,31608.45,31608.45,589425247.0,0,0.0,2,0.0,RUB,0.0
SNDX,MECNTR,2021-03-03,MOEX Consumer Total Return,Индекс МосБиржи потребительского сектора полной доходности «брутто»,11793.65,11793.65,11793.65,11793.65,4445952178.0,0,0.0,2,0.0,RUB,0.0
SNDX,MECNTRN,2021-03-03,MOEX Consumer Net TR-NR,Индекс МосБиржи потребит. сектора полной доходности «нетто» (по налог.ставкам ин.орг-й),11379.59,11379.59,11379.59,11379.59,4445952178.0,0,0.0,2,0.0,RUB,0.0
SNDX,MECNTRR,2021-03-03,MOEX Consumer Net TR-Res,Индекс МосБиржи потреб. сектора полной доходности «нетто» (по налог.ставкам рос.орг-й),11308.77,11308.77,11308.77,11308.77,4445952178.0,0,0.0,2,0.0,RUB,0.0
SNDX,MEEUTR,2021-03-03,MOEX El.Utilities Total Return,Индекс МосБиржи электроэнергетики полной доходности «брутто»,3273.92,3273.92,3273.92,3273.92,2386958211.0,0,0.0,2,0.0,RUB,0.0
SNDX,MEEUTRN,2021-03-03,MOEX El. Utilities Net TR-NR,Индекс МосБиржи электроэнергетики полной доходности «нетто» (по налог.ставкам ин.орг-й),3098.25,3098.25,3098.25,3098.25,2386958211.0,0,0.0,2,0.0,RUB,0.0
SNDX,MEEUTRR,2021-03-03,MOEX El. Utilities Net TR-Res,Индекс МосБиржи электроэнергетики полной доходности «нетто» (по налог.ставкам рос.орг-й),3126.42,3126.42,3126.42,3126.42,2386958211.0,0,0.0,2,0.0,RUB,0.0
SNDX,MEFNTR,2021-03-03,MOEX Financials Total Return,Индекс МосБиржи финансов полной доходности «брутто»,13774.75,13774.75,13774.75,13774.75,23214228583.0,0,0.0,2,0.0,RUB,0.0
SNDX,MEFNTRN,2021-03-03,MOEX Financials Net TR-NR,Индекс МосБиржи финансов полной доходности «нетто» (по налог.ставкам ин.орг-й),13171.53,13171.53,13171.53,13171.53,23214228583.0,0,0.0,2,0.0,RUB,0.0
SNDX,MEFNTRR,2021-03-03,MOEX Financials Net TR-Res,Индекс МосБиржи финансов полной доходности «нетто» (по налог.ставкам рос.орг-й),13269.07,13269.07,13269.07,13269.07,23214228583.0,0,0.0,2,0.0,RUB,0.0
SNDX,MEMMTR,2021-03-03,MOEX Metals & Min Total Return,Индекс МосБиржи металлов и добычи полной доходности «брутто»,16929.24,16929.24,16929.24,16929.24,32196177519.0,0,0.0,2,0.0,RUB,0.0
SNDX,MEMMTRN,2021-03-03,MOEX Metals & Mining Net TR-NR,Индекс МосБиржи металлов и добычи полной доходности «нетто» (по налог.ставкам ин.орг-й),15721.6,15721.6,15721.6,15721.6,32196177519.0,0,0.0,2,0.0,RUB,0.0
SNDX,MEMMTRR,2021-03-03,MOEX Metals & Min Net TR-Res,Индекс МосБиржи металлов и добычи полной доходности «нетто» (по налог.ставкам рос.орг-й),15915.16,15915.16,15915.16,15915.16,32196177519.0,0,0.0,2,0.0,RUB,0.0
SNDX,MEOGTR,2021-03-03,MOEX Oil & Gas Total Return,Индекс МосБиржи нефти и газа полной доходности «брутто»,11277.1,11277.1,11277.1,11277.1,21411074358.0,0,0.0,2,0.0,RUB,0.0
SNDX,MEOGTRN,2021-03-03,MOEX Oil & Gas Net TR-NR,Индекс МосБиржи нефти и газа полной доходности «нетто» (по налог.ставкам ин.орг-й),10676.39,10676.39,10676.39,10676.39,21411074358.0,0,0.0,2,0.0,RUB,0.0
SNDX,MEOGTRR,2021-03-03,MOEX Oil & Gas Net TR-Res,Индекс МосБиржи нефти и газа полной доходности «нетто» (по налог.ставкам рос.орг-й),10774.18,10774.18,10774.18,10774.18,21411074358.0,0,0.0,2,0.0,RUB,0.0
SNDX,MESMTR,2021-03-03,MOEX SMID Total Return,Индекс МосБиржи средней и малой капитализации полной доходности «брутто»,2890.36,2890.36,2890.36,2890.36,5678912583.0,0,0.0,2,0.0,RUB,0.0
SNDX,MESMTRN,2021-03-03,MOEX SMID Net TR-NR,Индекс МосБиржи средней капитализации полной доходности «нетто» (по нал.ставкам ин.орг-й),2745.79,2745.79,2745.79,2745.79,5678912583.0,0,0.0,2,0.0,RUB,0.0
SNDX,MESMTRR,2021-03-03,MOEX SMID Net TR-Res,Индекс МосБиржи средней капитализации полной доходности «нетто» (по нал.ставкам рос.орг-й),2770.51,2770.51,2770.51,2770.51,5678912583.0,0,0.0,2,0.0,RUB,0.0
SNDX,METLTR,2021-03-03,MOEX Telecom Total Return,Индекс МосБиржи телекоммуникаций полной доходности «брутто»,4430.97,4430.97,4430.97,4430.97,1258263665.0,0,0.0,2,0.0,RUB,0.0
SNDX,METLTRN,2021-03-03,MOEX Telecom Net TR-NR,Индекс МосБиржи телекоммуникаций полной доходности «нетто» (по налог.ставкам ин.орг-й),4026.6,4026.6,4026.6,4026.6,1258263665.0,0,0.0,2,0.0,RUB,0.0
SNDX,METLTRR,2021-03-03,MOEX Telecom Net TR-Res,Индекс МосБиржи телекоммуникаций полной доходности «нетто» (по налог.ставкам рос.орг-й),4090.76,4090.76,4090.76,4090.76,1258263665.0,0,0.0,2,0.0,RUB,0.0
SNDX,METNTR,2021-03-03,MOEX Transport Total Return,Индекс МосБиржи транспорта полной доходности «брутто»,1903.91,1903.91,1903.91,1903.91,1686586291.0,0,0.0,2,0.0,RUB,0.0
SNDX,METNTRN,2021-03-03,MOEX Transport Net TR-NR,Индекс МосБиржи транспорта полной доходности «нетто» (по налог.ставкам ин.орг-й),1809.97,1809.97,1809.97,1809.97,1686586291.0,0,0.0,2,0.0,RUB,0.0
SNDX,METNTRR,2021-03-03,MOEX Transport Net TR-Res,Индекс МосБиржи транспорта полной доходности «нетто» (по налог.ставкам рос.орг-й),1824.15,1824.15,1824.15,1824.15,1686586291.0,0,0.0,2,0.0,RUB,0.0
SNDX,MOEX10,2021-03-03,Индекс МосБиржи 10,Индекс МосБиржи 10,5403.74,5441.52,5459.79,5384.9,59276841014.3,0,0.0,2,12278603945181.201,RUB,5391.01
RTSI,MOEXBC,2021-03-03,Индекс голубых фишек,Индекс МосБиржи голубых фишек,22094.11,22225.53,22350.09,22030.64,66951901024.9,0,0.0,2,13612147753677.943,RUB,616098470.6265
SNDX,MOEXBMI,2021-03-03,Индекс широкого рынка,Индекс МосБиржи широкого рынка,2443.49,2456.02,2468.32,2438.51,93676979646.3,0,0.0,2,18961502088790.965,RUB,7760008376.088
SNDX,MOEXCH,2021-03-03,Индекс химии и нефтехимии,Индекс МосБиржи химии и нефтехимии,21404.22,21065.79,21404.22,21065.79,589343387.6,0,0.0,2,224188489033.35,RUB,10474029.9738
SNDX,MOEXCN,2021-03-03,Индекс потребительского сектора / Индекс потребит сектора,Индекс МосБиржи потребительского сектора,8861.72,8879.22,8932.56,8835.09,4443067767.8,0,0.0,2,171155160723.6449,RUB,19313982.7282
SNDX,MOEXEU,2021-03-03,Индекс электроэнергетики,Индекс МосБиржи электроэнергетики,2265.85,2280.12,2284.03,2264.01,2385918007.7,0,0.0,2,282188441615.0237,RUB,124539818.5684
SNDX,MOEXFN,2021-03-03,Индекс финансов,Индекс МосБиржи финансов,10205.97,10326.71,10347.52,10205.97,23149305631.75,0,0.0,2,1042046672804.3195,RUB,102101671.187
SNDX,MOEXINN,2021-03-03,Индекс МосБиржи инноваций,Индекс МосБиржи инноваций,418.42,412.4,418.9,412.12,174426347.5,0,0.0,2,11751160252.9317,RUB,28084330.4761
SNDX,MOEXMM,2021-03-03,Индекс металлов и добычи,Индекс МосБиржи металлов и добычи,10323.23,10326.13,10396.15,10312.16,32185585301.47,0,0.0,2,1832812612358.1897,RUB,177542507.7844
SNDX,MOEXOG,2021-03-03,Индекс нефти и газа,Индекс МосБиржи нефти и газа,7814.97,7809.93,7865.25,7750.68,21390019694.2,0,0.0,2,1271606137743.7312,RUB,162714074.6339
SNDX,MOEXREPO,2021-03-03,MXREPO,MOEXREPO обл 12:30,4.09,4.09,4.09,4.09,384414961874.0,,,2,,RUB,
SNDX,MOEXREPO1W,2021-03-03,MOEXREPO1W,MOEXREPO 1 неделя 12:30,4.33,4.33,4.33,4.33,205703761879.0,,,2,,RUB,
SNDX,MOEXREPO1WE,2021-03-03,MOEXREPO1WE,MOEXREPO 1 неделя 19:00,4.03,4.03,4.03,4.03,63020139034.0,,,2,,RUB,
SNDX,MOEXREPOE,2021-03-03,MXREPOE,MOEXREPO обл 19:00,4.02,4.02,4.02,4.02,147063099024.0,,,2,,RUB,
SNDX,MOEXREPOEQ,2021-03-03,MXREPOEQ,MOEXREPO акц 12:30,4.06,4.06,4.06,4.06,36266643695.0,,,2,,RUB,
SNDX,MOEXREPOEQE,2021-03-03,MXREPOEQE,MOEXREPO акц 19:00,4.24,4.24,4.24,4.24,30330477114.0,,,2,,RUB,
SNDX,MOEXREPOUSD,2021-03-03,MOEXREPOUSD,MOEXREPO USD 12:30,0.21,0.21,0.21,0.21,934119002.0,,,2,,USD,
SNDX,MOEXREPOUSDE,2021-03-03,MOEXREPOUSDE,MOEXREPO USD 19:00,0.2,0.2,0.2,0.2,48783805.0,,,2,,USD,
SNDX,MOEXTL,2021-03-03,Индекс телекоммуникаций,Индекс МосБиржи телекоммуникаций,2322.21,2328.32,2341.15,2310.61,1257622785.8,0,0.0,2,413353808758.4389,RUB,178000185.54
SNDX,MOEXTN,2021-03-03,Индекс транспорта,Индекс МосБиржи транспорта,1353.47,1363.88,1363.88,1349.16,1682448588.9,0,0.0,2,185473237800.9936,RUB,137035373.9192
SNDX,MRBC,2021-03-03,Индекс МосБиржи 15,Индекс МосБиржи 15,1679.35,1689.67,1698.52,1674.29,66951901024.9,0,0.0,2,10935775893634.215,RUB,6511921170.5989
RTSI,MRBCTR,2021-03-03,Индекс МосБиржи полн дох-ти 15,Индекс МосБиржи полной доходности 15,2030.52,2030.52,2030.52,2030.52,67029545923.0,0,0.0,2,0.0,RUB,0.0
RTSI,MREDC,2021-03-03,Индекс недвиж-ти ДомКлик Москва,Индекс московской недвижимости ДомКлик,212773.53,212773.53,212773.53,212773.53,0.0,0,0.0,2,6937594.1,RUB,1.0
RTSI,MRRT,2021-03-03,"Индекс ""Ответственность и открытость""",Индекс МосБиржи - РСПП Ответственность и открытость,2648.44,2648.44,2648.44,2648.44,78911106461.0,0,0.0,2,42301291985890.71,RUB,4957833678.8508
RTSI,MRSV,2021-03-03,"Индекс ""Вектор устойчивого развития""",Индекс МосБиржи - РСПП Вектор устойчивого развития,3020.33,3020.33,3020.33,3020.33,75269687380.0,0,0.0,2,40284416495477.04,RUB,291060494.3854
RTSI,MRSVT,2021-03-03,Индекс МосБиржи-РСПП Вектор TR,"Индекс МосБиржи - РСПП Вектор устойчивого развития, полной доходности брутто",3787.67,3787.67,3787.67,3787.67,75269687380.0,0,0.0,2,0.0,RUB,0.0
INAV,MTEKA,2021-03-03,iNAV Фридом - Лидеры Технологий,Расчетная цена одного пая Биржевого ПИФа «Фридом - Лидеры Технологий»,1850.7,1883.87,1891.35,1845.09,0.0,0,0.0,2,0.0,RUB,0.0
INAV,OPNWO,2021-03-03,iNAV «Открытие – Всепогодный»,Биржевой паевой инвестиционный фонд рыночных финансовых инструментов «Открытие – Всепогодный»,1.1001,1.1056,1.1056,1.0985,0.0,0,0.0,4,0.0,USD,0.0
INAV,RCMBD,2021-03-03,iNAV «Райффайзен –Еврооблигации»,Биржевой паевой инвестиционный фонд рыночных финансовых инструментов «Райффайзен – Еврооблигации»,12.96,12.97,12.97,12.96,0.0,0,0.0,2,0.0,USD,0.0
INAV,RFBC15,2021-03-03,iNAV «Raiffeisen-MOEX Index 15»,Расчетная цена одного пая Биржевого ПИФа «Райффайзен – Индекс МосБиржи полной доходности 15»,1262.55,1270.21,1276.74,1258.76,0.0,0,0.0,2,0.0,RUB,0.0
SNDX,RGBI,2021-03-03,Индекс Мосбиржи гос обл RGBI,Индекс Мосбиржи государственных облигаций ценовой,148.26,147.85,148.27,147.85,22307294122.74,1874,6.49,2,9205115698913.275,RUB,1.0
SNDX,RGBITR,2021-03-03,Индекс Мосбиржи гос обл RGBITR,Индекс Мосбиржи государственных облигаций,607.63,605.98,607.69,605.98,22307294122.74,1833,6.47,2,8939717910165.166,RUB,1.0
SNDX,RPGCC,2021-03-03,MOEXREPOGCC,MOEXREPO КСУ 12:30,4.06,4.06,4.06,4.06,40850111000.0,,,2,,RUB,
SNDX,RPGCC1W,2021-03-03,MOEXREPOGCC1W,MOEXREPO КСУ 1 неделя 12:30,4.14,4.14,4.14,4.14,7772000000.0,,,2,,RUB,
SNDX,RPGCC1WE,2021-03-03,MOEXREPOGCC1WE,MOEXREPO КСУ 1 неделя 19:00,4.13,4.13,4.13,4.13,1643583000.0,,,2,,RUB,
SNDX,RPGCCE,2021-03-03,MOEXREPOGCCE,MOEXREPO КСУ 19:00,4.03,4.03,4.03,4.03,69691185000.0,,,2,,RUB,
RTSI,RTSCH,2021-03-03,Индекс РТС химии и нефтехимии,Индекс РТС химии и нефтехимии,301.5,297.84,301.83,297.84,7960711.15133423,0,0.0,2,3028285108.816518,USD,10043947.695
RTSI,RTSCR,2021-03-03,Индекс РТС потреб. сектора,Индекс РТС потребительских товаров и розничной торговли,271.12,272.67,275.55,270.46,60015909.00900293,0,0.0,2,2311923447.7708125,USD,8527282.6944
RTSI,RTSEU,2021-03-03,Индекс РТС электроэнергетики,Индекс РТС электроэнергетики,77.59,78.37,78.71,77.55,32228416.38626801,0,0.0,2,3811734756.3540335,USD,49124990.0073
RTSI,RTSFN,2021-03-03,Индекс РТС финансов,Индекс РТС финансов,239.69,243.43,244.97,239.69,312695347.67970395,0,0.0,2,14075720102.987505,USD,58724922.3762
RTSI,RTSI,2021-03-03,Индекс РТС,Индекс РТС,1453.61,1465.95,1477.98,1450.65,1239176290.260227,0,0.0,2,234371118719.9185,USD,161234282.6352
RTSI,RTSMM,2021-03-03,Индекс РТС металлов и добычи,Индекс РТС металлов и добычи,293.12,294.3,297.3,292.86,434755277.16539586,0,0.0,2,24757199467.22936,USD,84459553.1639
RTSI,RTSOG,2021-03-03,Индекс РТС нефти и газа,Индекс РТС нефти и газа,204.95,205.58,207.59,203.26,288931329.15313077,0,0.0,2,17176555084.575232,USD,83810552.5083
RTSI,RTSSM,2021-03-03,RTS SMID Index,Индекс РТС средней и малой капитализации,1302.27,1302.27,1302.27,1302.27,1036172.5563185943,0,0.0,2,893871947.8808616,USD,8817568.3892
RTSI,RTSTL,2021-03-03,Индекс РТС телекоммуникаций,Индекс РТС телекоммуникаций ,96.17,96.79,97.71,95.73,16987671.272363793,0,0.0,2,5583485526.545307,USD,58056740.3599
RTSI,RTSTN,2021-03-03,Индекс РТС транспорта,Индекс РТС транспорта,44.67,45.18,45.22,44.55,22726117.786347706,0,0.0,2,2505328647.953825,USD,56082557.4433
RTSI,RTSTR,2021-03-03,RTS Total Return,Индекс РТС полной доходности «брутто»,2632.63,2632.63,2632.63,2632.63,91848107109.0,0,0.0,2,0.0,USD,0.0
RTSI,RTSTRN,2021-03-03,RTS Net-TR-NR,Индекс РТС полной доходности «нетто» (по налоговым ставкам иностранных организаций),2408.64,2408.64,2408.64,2408.64,91848107109.0,0,0.0,2,0.0,USD,0.0
RTSI,RTSTRR,2021-03-03,RTS Net-TR-Res,Индекс РТС полной доходности «нетто» (по налоговым ставкам российских организаций),2461.49,2461.49,2461.49,2461.49,91848107109.0,0,0.0,2,0.0,USD,0.0
RTSI,RTSUSDCUR,2021-03-03,RTSUSDCUR,Курс доллара США на момент закрытия Индекса РТС,74.0315,74.0315,74.0315,74.0315,0.0,,,2,0.0,USD,
RTSI,RUABICP,2021-03-03,ABI CP,Композитный индекс облигаций ,112.47,112.47,112.47,112.47,25973915107.0,1634,6.2,2,10664141642695.133,RUB,1000000000000.0
RTSI,RUABITR,2021-03-03,ABI TR,Композитный индекс облигаций — совокупный доход,221.31,221.31,221.31,221.31,25973915107.0,1637,6.2,2,10838961860916.951,RUB,1000000000000.0
RTSI,RUBMI,2021-03-03,Индекс РТС широкого рынка,Индекс РТС широкого рынка,1059.56,1068.96,1077.24,1057.54,1265366494.6178317,0,0.0,2,256127487472.10275,USD,241729735.9223
RTSI,RUCBCP3A3YNS,2021-03-03,RUCBCP3A3YNS,Индекс МосБиржи Корпоративных Облигаций RUCBCP3A3YNS,104.27,104.27,104.27,104.27,891979030.0,668,5.89,2,617953600000.0,RUB,244176933642.1
RTSI,RUCBCP3A5YNS,2021-03-03,RUCBCP3A5YNS,Индекс МосБиржи Корпоративных Облигаций RUCBCP3A5YNS,109.15,109.15,109.15,109.15,69844188.0,1343,6.4,2,343912500000.0,RUB,344310000000.0
SNDX,RUCBCP3Y,2021-03-03,Индекс Мосбиржи корп обл CBICP 3-5,Индекс Мосбиржи корпоративных облигаций MOEX 1 - 3 ценовой,92.2,92.23,92.23,92.14,1607473658.88,654,6.15,2,1024059886126.7997,RUB,1.0
RTSI,RUCBCP3YNS,2021-03-03,RUCBCP3YNS,Индекс МосБиржи Корпоративных Облигаций RUCBCP3YNS,102.79,102.79,102.79,102.79,1635932212.0,658,6.12,2,1147848946500.2,RUB,1000000000000.0
SNDX,RUCBCP5Y,2021-03-03,Индекс Мосбиржи корп обл CBICP 1-3,Индекс Мосбиржи корпоративных облигаций ценовой 3-5,121.84,121.99,122.03,121.83,798407472.12,1321,6.56,2,485011498239.4997,RUB,1.0
RTSI,RUCBCP5YNS,2021-03-03,RUCBCP5YNS,Индекс МосБиржи Корпоративных Облигаций RUCBCP5YNS,108.67,108.67,108.67,108.67,798539759.0,1318,6.56,2,582692000000.0,RUB,518181440059.2
RTSI,RUCBCPA3YNS,2021-03-03,RUCBCPA3YNS,Индекс МосБиржи Корпоративных Облигаций RUCBCPA3YNS,99.71,99.71,99.71,99.71,71428832.0,673,6.85,2,189178600000.0,RUB,161260336361.75
RTSI,RUCBCPA5YNS,2021-03-03,RUCBCPA5YNS,Индекс МосБиржи Корпоративных Облигаций RUCBCPA5YNS,108.55,108.55,108.55,108.55,416291792.0,1301,7.13,2,88625300000.0,RUB,88797250000.0
RTSI,RUCBCPAA3YNS,2021-03-03,RUCBCPAA3YNS,Индекс МосБиржи Корпоративных Облигаций RUCBCPAA3YNS,99.45,99.45,99.45,99.45,672524350.0,607,6.05,2,340716746500.2,RUB,201551728156.2926
