BOARDID,SECID,TRADEDATE,SHORTNAME,NAME,CLOSE,OPEN,HIGH,LOW,VALUE,DURATION,YIELD,DECIMALS,CAPITALIZATION,CURRENCYID,DIVISOR
RTSI,AKCBI,2020-09-25,iАльфа-Капитал Облигации,Индикатор «Альфа-Капитал. Облигации»,1058.73,1058.73,1058.73,1058.73,428185414.0,0,6.2855,2,206165177.51,RUB,206377559.02
INAV,AKEUA,2020-09-25,iNAV Альфа-Капитал ЕВРОПА 600,Расчетная цена одного пая Биржевого ПИФа «ЕВРОПА 600»,9.63,9.64,9.66,9.51,0.0,0,0.0,2,0.0,EUR,0.0
INAV,AKMBA,2020-09-25,iNAV Альфа Управляемые облигации,Расчетная цена одного пая Биржевого ПИФа РФИ «Альфа-Капитал Управляемые облигации»,1.0322,1.0334,1.0335,1.0319,0.0,0,0.0,4,0.0,RUB,0.0
INAV,AKNXA,2020-09-25,iNAV Технологии 100,Расчетная цена одного пая Биржевого ПИФа «ТЕХНОЛОГИИ 100»,16.05,15.85,16.05,15.79,0.0,0,0.0,2,0.0,USD,0.0
INAV,AKSPA,2020-09-25,iNAV Альфа - Капитал Эс энд Пи 500,Расчетная цена одного пая Биржевого ПИФа «Альфа - Капитал Эс энд Пи 500»,11.2,11.13,11.2,11.07,0.0,0,0.0,2,0.0,USD,0.0
RTSI,AWTEUR,2020-09-25,TINKOFF ALL-WEATHER INDEX (EUR),TINKOFF ALL-WEATHER INDEX (EUR),333.85,333.85,333.85,333.85,0.0,0,0.0,2,0.0,EUR,0.0
RTSI,AWTRUR,2020-09-25,TINKOFF ALL-WEATHER INDEX (RUB),TINKOFF ALL-WEATHER INDEX (RUB),1043.0,1043.0,1043.0,1043.0,67544439021.0,0,0.0,2,0.0,RUB,0.0
RTSI,AWTUSD,2020-09-25,TINKOFF ALL-WEATHER INDEX (USD),TINKOFF ALL-WEATHER INDEX (USD),476.49,476.49,476.49,476.49,0.0,0,0.0,2,0.0,USD,0.0
RTSI,BPSI,2020-09-25,Субиндекс облигаций,Индексы активов пенсионных накоплений - Субиндекс облигаций,2981.4997,2981.4997,2981.4997,2981.4997,65840182.0,,,2,444701290574.0,RUB,0.001
RTSI,EPSI,2020-09-25,Субиндекс акций,Индексы активов пенсионных накоплений - Субиндекс акций,1694.6796,1694.6796,1694.6796,1694.6796,60227229156.6,,,2,7072793351652.291,RUB,4173528234.8069
INAV,ESGRA,2020-09-25,iNAV RSHB-MOEX-RSPP ESG VecTR ,Расчетная цена одного пая Биржевого ПИФа «РСХБ–Индекс МосБиржи–РСПП Вектор развития полн дох-ти»,1079.81,1085.05,1086.37,1074.5,0.0,0,0.0,2,0.0,RUB,0.0
RTSI,GPBCBI2Y,2020-09-25,Индикатор GPBCBI2Y,Индикатор GPBCBI2Y,1168.57,1168.57,1168.57,1168.57,468501144.0,0,5.2114,2,547297402.69,RUB,546522069.06
RTSI,GPBCBI4Y,2020-09-25,Индикатор GPBCBI4Y,Индикатор GPBCBI4Y,1210.44,1210.44,1210.44,1210.44,132941022.0,0,6.1696,2,563163242.49,RUB,563493540.07
INAV,GPBMA,2020-09-25,iNAV ГПБ - Корп. облигации 4г,Расчетная цена одного пая Биржевого ПИФа «Газпромбанк – Корпоративные облигации 4 года»,57550.5,57597.86,57646.21,57485.64,0.0,0,0.0,2,0.0,RUB,0.0
INAV,GPBSA,2020-09-25,iNAV ГПБ - Корп. облигации 2г,Расчетная цена одного пая Биржевого ПИФа «Газпромбанк – Корпоративные облигации 2 года»,55998.87,55940.7,56038.16,55925.7,0.0,0,0.0,2,0.0,RUB,0.0
SNDX,IMOEX,2020-09-25,Индекс МосБиржи,Индекс МосБиржи,2896.83,2912.83,2912.83,2870.16,75662859146.4,0,0.0,2,13932922146500.0,RUB,4809707787.42
SNDX,IMOEX2,2020-09-25,Индекс МосБиржи (доп. сессия),Индекс МосБиржи (Дополнительная сессия),2896.83,2897.6,2914.36,2896.83,6157719100.05,0,0.0,2,13932922146500.0,RUB,4809707787.42
RTSI,MCFTR,2020-09-25,MOEX Russia Total Return,Индекс МосБиржи полной доходности «брутто»,5129.44,5129.44,5129.44,5129.44,75662859146.4,,,2,13932922146487.36,RUB,
RTSI,MCFTRN,2020-09-25,MOEX Russia Net-TR-NR,Индекс МосБиржи полной доходности «нетто» (по налоговым ставкам иностранных организаций),4709.04,4709.04,4709.04,4709.04,75662859146.4,,,2,13932922146487.36,RUB,
RTSI,MCFTRR,2020-09-25,MOEX Russia Net-TR-Res,Индекс МосБиржи полной доходности «нетто» (по налоговым ставкам российских организаций),4810.86,4810.86,4810.86,4810.86,75662859146.4,,,2,13932922146487.36,RUB,
RTSI,MCXSM,2020-09-25,Индекс МосБиржи SMID,Индекс МосБиржи средней и малой капитализации,1783.92,1783.92,1783.92,1783.92,5295814368.01,,,2,557369594702.643,RUB,312441516.846
RTSI,MEBCTR,2020-09-25,MOEX Blue Chip Total Return,Индекс МосБиржи голубых фишек полной доходности «брутто»,31160.68,31160.68,31160.68,31160.68,59818262219.6,,,2,11125297771601.57,RUB,
RTSI,MEBCTRN,2020-09-25,MOEX Blue Chip Net-TR-NR,Индекс МосБиржи голубых фишек полной доходности «нетто» (по налоговым ставкам иностр. орг.),28918.36,28918.36,28918.36,28918.36,59818262219.6,,,2,11125297771601.57,RUB,
RTSI,MEBCTRR,2020-09-25,MOEX Blue Chip Net-TR-Res,Индекс МосБиржи голубых фишек полной доходности «нетто» (по налоговым ставкам росс. орг.),29413.19,29413.19,29413.19,29413.19,59818262219.6,,,2,11125297771601.57,RUB,
SNDX,MECHTR,2020-09-25,MOEX Chemicals Total Return,Индекс МосБиржи химии и нефтехимии полной доходности «брутто»,25806.28,25806.28,25806.28,25806.28,94069344.0,0,0.0,2,0.0,RUB,0.0
SNDX,MECHTRN,2020-09-25,MOEX Chemicals Net TR-NR,Индекс МосБиржи химии и нефтехимии полной доходности «нетто» (по налог.ставкам ин.орг-й),24242.35,24242.35,24242.35,24242.35,94069344.0,0,0.0,2,0.0,RUB,0.0
SNDX,MECHTRR,2020-09-25,MOEX Chemicals Net TR-Res,Индекс МосБиржи химии и нефтехимии полной доходности «нетто» (по налог.ставкам рос.орг-й),24485.21,24485.21,24485.21,24485.21,94069344.0,0,0.0,2,0.0,RUB,0.0
SNDX,MECNTR,2020-09-25,MOEX Consumer Total Return,Индекс МосБиржи потребительского сектора полной доходности «брутто»,10050.05,10050.05,10050.05,10050.05,4930444472.0,0,0.0,2,0.0,RUB,0.0
SNDX,MECNTRN,2020-09-25,MOEX Consumer Net TR-NR,Индекс МосБиржи потребит. сектора полной доходности «нетто» (по налог.ставкам ин.орг-й),9731.68,9731.68,9731.68,9731.68,4930444472.0,0,0.0,2,0.0,RUB,0.0
SNDX,MECNTRR,2020-09-25,MOEX Consumer Net TR-Res,Индекс МосБиржи потреб. сектора полной доходности «нетто» (по налог.ставкам рос.орг-й),9666.5,9666.5,9666.5,9666.5,4930444472.0,0,0.0,2,0.0,RUB,0.0
SNDX,MEEUTR,2020-09-25,MOEX El.Utilities Total Return,Индекс МосБиржи электроэнергетики полной доходности «брутто»,3106.14,3106.14,3106.14,3106.14,1984574711.0,0,0.0,2,0.0,RUB,0.0
SNDX,MEEUTRN,2020-09-25,MOEX El. Utilities Net TR-NR,Индекс МосБиржи электроэнергетики полной доходности «нетто» (по налог.ставкам ин.орг-й),2944.51,2944.51,2944.51,2944.51,1984574711.0,0,0.0,2,0.0,RUB,0.0
SNDX,MEEUTRR,2020-09-25,MOEX El. Utilities Net TR-Res,Индекс МосБиржи электроэнергетики полной доходности «нетто» (по налог.ставкам рос.орг-й),2970.54,2970.54,2970.54,2970.54,1984574711.0,0,0.0,2,0.0,RUB,0.0
SNDX,MEFNTR,2020-09-25,MOEX Financials Total Return,Индекс МосБиржи финансов полной доходности «брутто»,10180.42,10180.42,10180.42,10180.42,18097494614.0,0,0.0,2,0.0,RUB,0.0
SNDX,MEFNTRN,2020-09-25,MOEX Financials Net TR-NR,Индекс МосБиржи финансов полной доходности «нетто» (по налог.ставкам ин.орг-й),9774.6,9774.6,9774.6,9774.6,18097494614.0,0,0.0,2,0.0,RUB,0.0
SNDX,MEFNTRR,2020-09-25,MOEX Financials Net TR-Res,Индекс МосБиржи финансов полной доходности «нетто» (по налог.ставкам рос.орг-й),9841.56,9841.56,9841.56,9841.56,18097494614.0,0,0.0,2,0.0,RUB,0.0
SNDX,MEMMTR,2020-09-25,MOEX Metals & Min Total Return,Индекс МосБиржи металлов и добычи полной доходности «брутто»,14016.32,14016.32,14016.32,14016.32,11725815832.0,0,0.0,2,0.0,RUB,0.0
SNDX,MEMMTRN,2020-09-25,MOEX Metals & Mining Net TR-NR,Индекс МосБиржи металлов и добычи полной доходности «нетто» (по налог.ставкам ин.орг-й),13056.01,13056.01,13056.01,13056.01,11725815832.0,0,0.0,2,0.0,RUB,0.0
SNDX,MEMMTRR,2020-09-25,MOEX Metals & Min Net TR-Res,Индекс МосБиржи металлов и добычи полной доходности «нетто» (по налог.ставкам рос.орг-й),13211.44,13211.44,13211.44,13211.44,11725815832.0,0,0.0,2,0.0,RUB,0.0
SNDX,MEOGTR,2020-09-25,MOEX Oil & Gas Total Return,Индекс МосБиржи нефти и газа полной доходности «брутто»,9323.58,9323.58,9323.58,9323.58,27832199171.0,0,0.0,2,0.0,RUB,0.0
SNDX,MEOGTRN,2020-09-25,MOEX Oil & Gas Net TR-NR,Индекс МосБиржи нефти и газа полной доходности «нетто» (по налог.ставкам ин.орг-й),8842.86,8842.86,8842.86,8842.86,27832199171.0,0,0.0,2,0.0,RUB,0.0
SNDX,MEOGTRR,2020-09-25,MOEX Oil & Gas Net TR-Res,Индекс МосБиржи нефти и газа полной доходности «нетто» (по налог.ставкам рос.орг-й),8921.72,8921.72,8921.72,8921.72,27832199171.0,0,0.0,2,0.0,RUB,0.0
SNDX,MESMTR,2020-09-25,MOEX SMID Total Return,Индекс МосБиржи средней и малой капитализации полной доходности «брутто»,2474.84,2474.84,2474.84,2474.84,5295814369.0,0,0.0,2,0.0,RUB,0.0
SNDX,MESMTRN,2020-09-25,MOEX SMID Net TR-NR,Индекс МосБиржи средней капитализации полной доходности «нетто» (по нал.ставкам ин.орг-й),2356.4,2356.4,2356.4,2356.4,5295814369.0,0,0.0,2,0.0,RUB,0.0
SNDX,MESMTRR,2020-09-25,MOEX SMID Net TR-Res,Индекс МосБиржи средней капитализации полной доходности «нетто» (по нал.ставкам рос.орг-й),2376.83,2376.83,2376.83,2376.83,5295814369.0,0,0.0,2,0.0,RUB,0.0
SNDX,METLTR,2020-09-25,MOEX Telecom Total Return,Индекс МосБиржи телекоммуникаций полной доходности «брутто»,4385.16,4385.16,4385.16,4385.16,1558277735.0,0,0.0,2,0.0,RUB,0.0
SNDX,METLTRN,2020-09-25,MOEX Telecom Net TR-NR,Индекс МосБиржи телекоммуникаций полной доходности «нетто» (по налог.ставкам ин.орг-й),3996.59,3996.59,3996.59,3996.59,1558277735.0,0,0.0,2,0.0,RUB,0.0
SNDX,METLTRR,2020-09-25,MOEX Telecom Net TR-Res,Индекс МосБиржи телекоммуникаций полной доходности «нетто» (по налог.ставкам рос.орг-й),4058.69,4058.69,4058.69,4058.69,1558277735.0,0,0.0,2,0.0,RUB,0.0
SNDX,METNTR,2020-09-25,MOEX Transport Total Return,Индекс МосБиржи транспорта полной доходности «брутто»,1835.73,1835.73,1835.73,1835.73,931228772.0,0,0.0,2,0.0,RUB,0.0
SNDX,METNTRN,2020-09-25,MOEX Transport Net TR-NR,Индекс МосБиржи транспорта полной доходности «нетто» (по налог.ставкам ин.орг-й),1745.32,1745.32,1745.32,1745.32,931228772.0,0,0.0,2,0.0,RUB,0.0
SNDX,METNTRR,2020-09-25,MOEX Transport Net TR-Res,Индекс МосБиржи транспорта полной доходности «нетто» (по налог.ставкам рос.орг-й),1758.91,1758.91,1758.91,1758.91,931228772.0,0,0.0,2,0.0,RUB,0.0
SNDX,MOEX10,2020-09-25,Индекс МосБиржи 10,Индекс МосБиржи 10,4811.71,4844.59,4845.03,4775.58,51350705517.0,0,0.0,2,10124991686500.0,RUB,5009.22
RTSI,MOEXBC,2020-09-25,Индекс голубых фишек,Индекс МосБиржи голубых фишек,18914.61,19050.14,19050.14,18727.53,59818262219.6,0,0.0,2,11125297771600.0,RUB,588185545.473
SNDX,MOEXBMI,2020-09-25,Индекс широкого рынка,Индекс МосБиржи широкого рынка,2071.77,2079.95,2081.86,2052.94,76923670756.5,0,0.0,2,15692798013700.0,RUB,7574573330.95
SNDX,MOEXCH,2020-09-25,Индекс химии и нефтехимии,Индекс МосБиржи химии и нефтехимии,16969.94,16976.91,17012.27,16872.61,94005033.3,0,0.0,2,179979352765.0,RUB,10605772.4903
SNDX,MOEXCN,2020-09-25,Индекс потребительского сектора / Индекс потребит сектора,Индекс МосБиржи потребительского сектора,7732.81,7779.93,7810.08,7699.36,4928824050.62,0,0.0,2,112141658237.0,RUB,14502059.4659
SNDX,MOEXEU,2020-09-25,Индекс электроэнергетики,Индекс МосБиржи электроэнергетики,2174.4,2196.94,2208.12,2174.4,1983003906.7,0,0.0,2,265590942556.0,RUB,122144387.914
SNDX,MOEXFN,2020-09-25,Индекс финансов,Индекс МосБиржи финансов,7753.8,7724.68,7762.09,7640.66,18059128622.6,0,0.0,2,837643749621.0,RUB,108030067.926
SNDX,MOEXINN,2020-09-25,Индекс МосБиржи инноваций,Индекс МосБиржи инноваций,420.48,414.49,422.6,407.42,320947495.0,0,0.0,2,2655522498.74,RUB,6315514.9888
SNDX,MOEXMM,2020-09-25,Индекс металлов и добычи,Индекс МосБиржи металлов и добычи,8726.34,8758.6,8773.1,8664.76,11719494731.0,0,0.0,2,1400836796720.0,RUB,160529704.482
SNDX,MOEXOG,2020-09-25,Индекс нефти и газа,Индекс МосБиржи нефти и газа,6539.36,6580.8,6584.63,6495.8,27808080330.9,0,0.0,2,1129972218600.0,RUB,172795585.061
SNDX,MOEXREPO,2020-09-25,MXREPO,MOEXREPO обл 12:30,4.18,4.18,4.18,4.18,465521749208.0,,,2,,RUB,
SNDX,MOEXREPO1W,2020-09-25,MOEXREPO1W,MOEXREPO 1 неделя 12:30,4.21,4.21,4.21,4.21,58937360193.0,,,2,,RUB,
SNDX,MOEXREPO1WE,2020-09-25,MOEXREPO1WE,MOEXREPO 1 неделя 19:00,4.37,4.37,4.37,4.37,10571002095.0,,,2,,RUB,
SNDX,MOEXREPOE,2020-09-25,MXREPOE,MOEXREPO обл 19:00,4.14,4.14,4.14,4.14,142961652771.0,,,2,,RUB,
SNDX,MOEXREPOEQ,2020-09-25,MXREPOEQ,MOEXREPO акц 12:30,4.11,4.11,4.11,4.11,54870526291.0,,,2,,RUB,
SNDX,MOEXREPOEQE,2020-09-25,MXREPOEQE,MOEXREPO акц 19:00,4.36,4.36,4.36,4.36,27935706766.0,,,2,,RUB,
SNDX,MOEXREPOUSD,2020-09-25,MOEXREPOUSD,MOEXREPO USD 12:30,0.3,0.3,0.3,0.3,1250772159.0,,,2,,USD,
SNDX,MOEXREPOUSDE,2020-09-25,MOEXREPOUSDE,MOEXREPO USD 19:00,0.29,0.29,0.29,0.29,433379775.0,,,2,,USD,
SNDX,MOEXTL,2020-09-25,Индекс телекоммуникаций,Индекс МосБиржи телекоммуникаций,2343.69,2342.3,2355.87,2329.08,1556517746.8,0,0.0,2,417177395112.0,RUB,178000185.54
SNDX,MOEXTN,2020-09-25,Индекс транспорта,Индекс МосБиржи транспорта,1305.72,1327.18,1332.83,1295.11,930721852.6,0,0.0,2,59813113472.8,RUB,45808634.8417
SNDX,MRBC,2020-09-25,Индекс МосБиржи 15,Индекс МосБиржи 15,1454.79,1462.21,1462.21,1439.48,59818262219.6,0,0.0,2,9298078359830.0,RUB,6391340404.16
RTSI,MRBCTR,2020-09-25,Индекс МосБиржи полн дох-ти 15,Индекс МосБиржи полной доходности 15,1723.52,1723.52,1723.52,1723.52,59895434026.0,0,0.0,2,0.0,RUB,0.0
RTSI,MRRT,2020-09-25,"Индекс ""Ответственность и открытость""",Индекс МосБиржи - РСПП Ответственность и открытость,2164.69,2164.69,2164.69,2164.69,52396472156.0,0,0.0,2,32236437615800.0,RUB,3929301536.33
RTSI,MRSV,2020-09-25,"Индекс ""Вектор устойчивого развития""",Индекс МосБиржи - РСПП Вектор устойчивого развития,2459.03,2459.03,2459.03,2459.03,50664870389.0,0,0.0,2,31610407683500.0,RUB,81467120.5622
RTSI,MRSVT,2020-09-25,Индекс МосБиржи-РСПП Вектор TR,"Индекс МосБиржи - РСПП Вектор устойчивого развития, полной доходности брутто",3027.7,3027.7,3027.7,3027.7,50664870389.0,0,0.0,2,0.0,RUB,0.0
INAV,MTEKA,2020-09-25,iNAV Фридом - Лидеры Технологий,Расчетная цена одного пая Биржевого ПИФа «Фридом - Лидеры Технологий»,1788.64,1741.75,1788.64,1730.82,0.0,0,0.0,2,0.0,RUB,0.0
RTSI,OPSI,2020-09-25,Субиндекс ОФЗ,Индексы активов пенсионных накоплений - Субиндекс ОФЗ,2063.3368,2063.3368,2063.3368,2063.3368,3510216219.28,,,2,5227432286083.72,RUB,
INAV,RFBC15,2020-09-25,iNAV «Raiffeisen-MOEX Index 15»,Расчетная цена одного пая Биржевого ПИФа «Райффайзен – Индекс МосБиржи полной доходности 15»,1081.36,1085.0,1086.24,1070.52,0.0,0,0.0,2,0.0,RUB,0.0
SNDX,RGBI,2020-09-25,Индекс Мосбиржи гос обл RGBI,Индекс Мосбиржи государственных облигаций ценовой,152.16,152.08,152.32,152.08,19975144690.5,1865,5.94,2,8842885797350.0,RUB,1.0
SNDX,RGBITR,2020-09-25,Индекс Мосбиржи гос обл RGBITR,Индекс Мосбиржи государственных облигаций,606.24,605.91,606.86,605.89,19975144690.5,1865,5.94,2,9014745132840.0,RUB,1.0
SNDX,RPGCC,2020-09-25,MOEXREPOGCC,MOEXREPO КСУ 12:30,4.19,4.19,4.19,4.19,94752659000.0,,,2,,RUB,
SNDX,RPGCC1W,2020-09-25,MOEXREPOGCC1W,MOEXREPO КСУ 1 неделя 12:30,4.26,4.26,4.26,4.26,3452891000.0,,,2,,RUB,
SNDX,RPGCC1WE,2020-09-25,MOEXREPOGCC1WE,MOEXREPO КСУ 1 неделя 19:00,4.25,4.25,4.25,4.25,2846074000.0,,,2,,RUB,
SNDX,RPGCCE,2020-09-25,MOEXREPOGCCE,MOEXREPO КСУ 19:00,4.25,4.25,4.25,4.25,44657324000.0,,,2,,RUB,
RTSI,RTSCH,2020-09-25,Индекс РТС химии и нефтехимии,Индекс РТС химии и нефтехимии,225.86,229.48,230.76,225.18,1199755.3817,0,0.0,2,2297017398.9,USD,10170280.6297
RTSI,RTSCR,2020-09-25,Индекс РТС потреб. сектора,Индекс РТС потребительских товаров и розничной торговли,223.53,228.41,230.68,223.12,62904963.411,0,0.0,2,1431227172.2,USD,6402778.8808
RTSI,RTSEU,2020-09-25,Индекс РТС электроэнергетики,Индекс РТС электроэнергетики,70.35,72.19,73.01,70.31,25308427.9158,0,0.0,2,3389650016.35,USD,48180107.4121
RTSI,RTSFN,2020-09-25,Индекс РТС финансов,Индекс РТС финансов,172.05,174.09,175.81,170.61,230482730.479,0,0.0,2,10690572209.6,USD,62134706.3129
RTSI,RTSI,2020-09-25,Индекс РТС,Индекс РТС,1164.68,1189.4,1193.58,1160.28,965660234.021,0,0.0,2,177821311703.0,USD,152678585.651
RTSI,RTSMM,2020-09-25,Индекс РТС металлов и добычи,Индекс РТС металлов и добычи,234.11,238.65,240.01,232.72,149572064.184,0,0.0,2,17878420194.7,USD,76366315.1958
RTSI,RTSOG,2020-09-25,Индекс РТС нефти и газа,Индекс РТС нефти и газа,162.03,165.61,166.35,161.83,354905400.919,0,0.0,2,14421464498.7,USD,89003323.6986
RTSI,RTSSM,2020-09-25,RTS SMID Index,Индекс РТС средней и малой капитализации,1069.66,1069.66,1069.66,1069.66,67588740.36,,,2,7113525173.7657,USD,6650265.8786
RTSI,RTSTL,2020-09-25,Индекс РТС телекоммуникаций,Индекс РТС телекоммуникаций ,91.71,93.09,93.93,91.49,19865325.0563,0,0.0,2,5324298150.21,USD,58056740.3599
RTSI,RTSTN,2020-09-25,Индекс РТС транспорта,Индекс РТС транспорта,40.72,42.03,42.46,40.52,11878497.4838,0,0.0,2,763375132.864,USD,18747461.487
RTSI,RTSTR,2020-09-25,RTS Total Return,Индекс РТС полной доходности «брутто»,2060.96,2060.96,2060.96,2060.96,965660234.02,,,2,177821311702.57,USD,
RTSI,RTSTRN,2020-09-25,RTS Net-TR-NR,Индекс РТС полной доходности «нетто» (по налоговым ставкам иностранных организаций),1892.23,1892.23,1892.23,1892.23,965660234.02,,,2,177821311702.57,USD,
RTSI,RTSTRR,2020-09-25,RTS Net-TR-Res,Индекс РТС полной доходности «нетто» (по налоговым ставкам российских организаций),1933.07,1933.07,1933.07,1933.07,965660234.02,,,2,177821311702.57,USD,
RTSI,RTSUSDCUR,2020-09-25,RTSUSDCUR,Курс доллара США на момент закрытия Индекса РТС,78.3535,78.3535,78.3535,78.3535,0.0,,,2,0.0,USD,
RTSI,RUABICP,2020-09-25,ABI CP,Композитный индекс облигаций ,115.2,115.2,115.2,115.2,4731204697.86,1728,5.68,2,10694030146078.22,RUB,
RTSI,RUABITR,2020-09-25,ABI TR,Композитный индекс облигаций — совокупный доход,220.45,220.45,220.45,220.45,4731204697.86,1728,5.68,2,10694030146078.22,RUB,
RTSI,RUBMI,2020-09-25,Индекс РТС широкого рынка,Индекс РТС широкого рынка,848.82,865.48,869.65,845.68,981751558.724,0,0.0,2,200282029696.0,USD,235953303.434
SNDX,RUCBCP3Y,2020-09-25,Индекс Мосбиржи корп обл CBICP 3-5,Индекс Мосбиржи корпоративных облигаций MOEX 1 - 3 ценовой,93.15,93.07,93.17,93.07,452087784.31,656,5.93,2,807951528821.0,RUB,1.0
SNDX,RUCBCP5Y,2020-09-25,Индекс Мосбиржи корп обл CBICP 1-3,Индекс Мосбиржи корпоративных облигаций ценовой 3-5,123.76,123.63,123.89,123.57,1031069768.2,1322,6.16,2,371805445230.0,RUB,1.0
SNDX,RUCBICP,2020-09-25,Индекс Мосбиржи корп обл CBICP,Индекс Мосбиржи корпоративных облигаций ценовой,97.34,97.26,97.37,97.24,1501594126.61,968,6.11,2,1280763974050.0,RUB,1.0
RTSI,RUCBICP1Y,2020-09-25,CBI CP 1Y,"Индекс корпоративных облигаций (≤ 1 года, рейтинг ≥ B-)",92.34,92.34,92.34,92.34,129512672.15,157,5.37,2,189075218546.9,RUB,
RTSI,RUCBICP3+,2020-09-25,CBI CP 3+,"Индекс корпоративных облигаций (< 1 года, рейтинг > B-)",126.1,126.1,126.1,126.1,426685088.3,1501,6.21,2,481107492136.53,RUB,
RTSI,RUCBICPB,2020-09-25,CBI CP B,"Индекс корпоративных облигаций (> 1 года, B- ≤ рейтинг < BB-)",77.98,77.98,77.98,77.98,33245442.31,819,7.3,2,57006032573.37,RUB,
RTSI,RUCBICPB3Y,2020-09-25,CBI CP B 3Y,"Индекс корпоративных облигаций (1-3 года, B- ≤ рейтинг < BB-)",79.27,79.27,79.27,79.27,28489675.11,756,7.29,2,45446585653.34,RUB,
RTSI,RUCBICPBB,2020-09-25,CBI CP BB,"Индекс корпоративных облигаций (> 1 года, BB- ≤ рейтинг < BBB-)",94.14,94.14,94.14,94.14,309247160.1,890,6.3,2,553295685216.5,RUB,
RTSI,RUCBICPBB3+,2020-09-25,CBI CP BB 3+,"Индекс корпоративных облигаций (> 3 лет, BB- ≤ рейтинг < BBB-)",120.27,120.27,120.27,120.27,133695290.2,1377,6.58,2,155390055216.5,RUB,
RTSI,RUCBICPBB3Y,2020-09-25,CBI CP BBB 3Y,"Индекс корпоративных облигаций (1-3 года, BB- ≤ рейтинг < BBB-)",92.53,92.53,92.53,92.53,175551869.9,700,6.19,2,397905630000.0,RUB,
RTSI,RUCBICPBB5Y,2020-09-25,CBI CP BB 5Y,"Индекс корпоративных облигаций (3-5 лет, BB- ≤ рейтинг < BBB-)",120.4,120.4,120.4,120.4,128124191.9,1318,6.6,2,139998405216.5,RUB,
RTSI,RUCBICPBBB,2020-09-25,CBI CP BBB,"Индекс корпоративных облигаций (> 1 года, рейтинг ≥ BBB-)",100.53,100.53,100.53,100.53,429176813.1,1043,5.63,2,692813308449.6,RUB,
RTSI,RUCBICPBBB3+,2020-09-25,CBI CP BBB 3+,"Индекс корпоративных облигаций (3-5 лет, рейтинг ≥ BBB-)",130.61,130.61,130.61,130.61,288234030.9,1579,5.99,2,314157990000.0,RUB,
RTSI,RUCBICPBBB3Y,2020-09-25,CBI CP BBB 3Y,"Индекс корпоративных облигаций (1-3 года, рейтинг ≥ BBB-)",96.08,96.08,96.08,96.08,140942782.2,597,5.34,2,378655318449.6,RUB,
RTSI,RUCBICPBBB5Y,2020-09-25,CBI CP BBB 5Y,"Индекс корпоративных облигаций (3-5 лет, рейтинг ≥ BBB-)",129.55,129.55,129.55,129.55,275368555.1,1339,5.82,2,226924440000.0,RUB,
RTSI,RUCBICPL1,2020-09-25,CBI CP L1,Индекс корпоративных облигаций Котировальный лист 1 - ценовой,93.89,93.89,93.89,93.89,397997196.4,956,5.94,2,712930705500.35,RUB,
