BOARDID,SECID,TRADEDATE,SHORTNAME,NAME,CLOSE,OPEN,HIGH,LOW,VALUE,DURATION,YIELD,DECIMALS,CAPITALIZATION,CURRENCYID,DIVISOR
INAV,AKEUA,2020-07-16,iNAV Альфа-Капитал ЕВРОПА 600,Расчетная цена одного пая Биржевого ПИФа «ЕВРОПА 600»,10.09,10.13,10.13,10.04,,,,2,,EUR,
INAV,AKMBA,2020-07-16,iNAV Альфа Управляемые облигации,Расчетная цена одного пая Биржевого ПИФа РФИ «Альфа-Капитал Управляемые облигации»,1.018,1.0159,1.018,1.0159,,,,2,,RUB,
INAV,AKNXA,2020-07-16,iNAV Технологии 100,Расчетная цена одного пая Биржевого ПИФа «ТЕХНОЛОГИИ 100»,15.28,15.56,15.56,15.25,,,,2,,USD,
INAV,AKSPA,2020-07-16,iNAV Альфа - Капитал Эс энд Пи 500,Расчетная цена одного пая Биржевого ПИФа «Альфа - Капитал Эс энд Пи 500»,11.04,11.11,11.11,11.02,,,,2,,USD,
RTSI,BPSI,2020-07-16,Субиндекс облигаций,Индексы активов пенсионных накоплений - Субиндекс облигаций,2945.1862,2945.1862,2945.1862,2945.1862,844870362.8,,,2,413012904980.0,RUB,0.001
RTSI,EPSI,2020-07-16,Субиндекс акций,Индексы активов пенсионных накоплений - Субиндекс акций,1633.0342,1633.0342,1633.0342,1633.0342,37428054489.65,,,2,6399340074707.522,RUB,3918680996.809
INAV,ESGRA,2020-07-16,iNAV RSHB-MOEX-RSPP ESG VecTR ,Расчетная цена одного пая Биржевого ПИФа «РСХБ–Индекс МосБиржи–РСПП Вектор развития полн дох-ти»,1004.96,1003.8,1005.02,997.91,,,,2,,RUB,
RTSI,GPBCBI2Y,2020-07-16,Индикатор GPBCBI2Y,Индикатор GPBCBI2Y,1154.24,1154.24,1154.24,1154.24,,,,2,,RUB,
RTSI,GPBCBI4Y,2020-07-16,Индикатор GPBCBI4Y,Индикатор GPBCBI4Y,1199.14,1199.14,1199.14,1199.14,,,,2,,RUB,
INAV,GPBMA,2020-07-16,iNAV ГПБ - Корп. облигации 4г,Расчетная цена одного пая Биржевого ПИФа «Газпромбанк – Корпоративные облигации 4 года»,57008.75,57040.44,57095.72,56993.1,,,,2,,RUB,
INAV,GPBSA,2020-07-16,iNAV ГПБ - Корп. облигации 2г,Расчетная цена одного пая Биржевого ПИФа «Газпромбанк – Корпоративные облигации 2 года»,55290.15,55440.36,55527.05,55290.15,,,,2,,RUB,
SNDX,IMOEX,2020-07-16,Индекс МосБиржи,Индекс МосБиржи,2760.01,2741.68,2762.68,2734.3,43145441365.6,0,0.0,2,11751676952400.0,RUB,4257839328.87
SNDX,IMOEX2,2020-07-16,Индекс МосБиржи (доп. сессия),Индекс МосБиржи (Дополнительная сессия),2756.62,2760.38,2760.41,2755.27,2315803825.7,0,0.0,2,11737262409500.0,RUB,4257839328.87
RTSI,MCFTR,2020-07-16,MOEX Russia Total Return,Индекс МосБиржи полной доходности «брутто»,4874.14,4874.14,4874.14,4874.14,43145441365.55,,,2,11751676952423.37,RUB,
RTSI,MCFTRN,2020-07-16,MOEX Russia Net-TR-NR,Индекс МосБиржи полной доходности «нетто» (по налоговым ставкам иностранных организаций),4476.46,4476.46,4476.46,4476.46,43145441365.55,,,2,11751676952423.37,RUB,
RTSI,MCFTRR,2020-07-16,MOEX Russia Net-TR-Res,Индекс МосБиржи полной доходности «нетто» (по налоговым ставкам российских организаций),4573.01,4573.01,4573.01,4573.01,43145441365.55,,,2,11751676952423.37,RUB,
RTSI,MCXSM,2020-07-16,Индекс МосБиржи SMID,Индекс МосБиржи средней и малой капитализации,1655.02,1655.02,1655.02,1655.02,2656405506.36,,,2,455079265628.0567,RUB,274969708.379
RTSI,MEBCTR,2020-07-16,MOEX Blue Chip Total Return,Индекс МосБиржи голубых фишек полной доходности «брутто»,29990.5,29990.5,29990.5,29990.5,35243837599.6,,,2,9634814846788.6,RUB,
RTSI,MEBCTRN,2020-07-16,MOEX Blue Chip Net-TR-NR,Индекс МосБиржи голубых фишек полной доходности «нетто» (по налоговым ставкам иностр. орг.),27840.2,27840.2,27840.2,27840.2,35243837599.6,,,2,9634814846788.6,RUB,
RTSI,MEBCTRR,2020-07-16,MOEX Blue Chip Net-TR-Res,Индекс МосБиржи голубых фишек полной доходности «нетто» (по налоговым ставкам росс. орг.),28315.52,28315.52,28315.52,28315.52,35243837599.6,,,2,9634814846788.6,RUB,
SNDX,MECHTR,2020-07-16,MOEX Chemicals Total Return,Индекс МосБиржи химии и нефтехимии полной доходности «брутто»,25479.61,25479.61,25479.61,25479.61,,,,2,,RUB,
SNDX,MECHTRN,2020-07-16,MOEX Chemicals Net TR-NR,Индекс МосБиржи химии и нефтехимии полной доходности «нетто» (по налог.ставкам ин.орг-й),23935.49,23935.49,23935.49,23935.49,,,,2,,RUB,
SNDX,MECHTRR,2020-07-16,MOEX Chemicals Net TR-Res,Индекс МосБиржи химии и нефтехимии полной доходности «нетто» (по налог.ставкам рос.орг-й),24175.25,24175.25,24175.25,24175.25,,,,2,,RUB,
SNDX,MECNTR,2020-07-16,MOEX Consumer Total Return,Индекс МосБиржи потребительского сектора полной доходности «брутто»,8660.77,8660.77,8660.77,8660.77,,,,2,,RUB,
SNDX,MECNTRN,2020-07-16,MOEX Consumer Net TR-NR,Индекс МосБиржи потребит. сектора полной доходности «нетто» (по налог.ставкам ин.орг-й),8389.3,8389.3,8389.3,8389.3,,,,2,,RUB,
SNDX,MECNTRR,2020-07-16,MOEX Consumer Net TR-Res,Индекс МосБиржи потреб. сектора полной доходности «нетто» (по налог.ставкам рос.орг-й),8332.75,8332.75,8332.75,8332.75,,,,2,,RUB,
SNDX,MEEUTR,2020-07-16,MOEX El.Utilities Total Return,Индекс МосБиржи электроэнергетики полной доходности «брутто»,3027.28,3027.28,3027.28,3027.28,,,,2,,RUB,
SNDX,MEEUTRN,2020-07-16,MOEX El. Utilities Net TR-NR,Индекс МосБиржи электроэнергетики полной доходности «нетто» (по налог.ставкам ин.орг-й),2869.72,2869.72,2869.72,2869.72,,,,2,,RUB,
SNDX,MEEUTRR,2020-07-16,MOEX El. Utilities Net TR-Res,Индекс МосБиржи электроэнергетики полной доходности «нетто» (по налог.ставкам рос.орг-й),2895.11,2895.11,2895.11,2895.11,,,,2,,RUB,
SNDX,MEFNTR,2020-07-16,MOEX Financials Total Return,Индекс МосБиржи финансов полной доходности «брутто»,9097.01,9097.01,9097.01,9097.01,,,,2,,RUB,
SNDX,MEFNTRN,2020-07-16,MOEX Financials Net TR-NR,Индекс МосБиржи финансов полной доходности «нетто» (по налог.ставкам ин.орг-й),8737.99,8737.99,8737.99,8737.99,,,,2,,RUB,
SNDX,MEFNTRR,2020-07-16,MOEX Financials Net TR-Res,Индекс МосБиржи финансов полной доходности «нетто» (по налог.ставкам рос.орг-й),8797.38,8797.38,8797.38,8797.38,,,,2,,RUB,
SNDX,MEMMTR,2020-07-16,MOEX Metals & Min Total Return,Индекс МосБиржи металлов и добычи полной доходности «брутто»,12252.04,12252.04,12252.04,12252.04,,,,2,,RUB,
SNDX,MEMMTRN,2020-07-16,MOEX Metals & Mining Net TR-NR,Индекс МосБиржи металлов и добычи полной доходности «нетто» (по налог.ставкам ин.орг-й),11426.4,11426.4,11426.4,11426.4,,,,2,,RUB,
SNDX,MEMMTRR,2020-07-16,MOEX Metals & Min Net TR-Res,Индекс МосБиржи металлов и добычи полной доходности «нетто» (по налог.ставкам рос.орг-й),11560.54,11560.54,11560.54,11560.54,,,,2,,RUB,
SNDX,MEOGTR,2020-07-16,MOEX Oil & Gas Total Return,Индекс МосБиржи нефти и газа полной доходности «брутто»,9717.83,9717.83,9717.83,9717.83,,,,2,,RUB,
SNDX,MEOGTRN,2020-07-16,MOEX Oil & Gas Net TR-NR,Индекс МосБиржи нефти и газа полной доходности «нетто» (по налог.ставкам ин.орг-й),9221.07,9221.07,9221.07,9221.07,,,,2,,RUB,
SNDX,MEOGTRR,2020-07-16,MOEX Oil & Gas Net TR-Res,Индекс МосБиржи нефти и газа полной доходности «нетто» (по налог.ставкам рос.орг-й),9302.73,9302.73,9302.73,9302.73,,,,2,,RUB,
SNDX,MESMTR,2020-07-16,MOEX SMID Total Return,Индекс МосБиржи средней и малой капитализации полной доходности «брутто»,2283.23,2283.23,2283.23,2283.23,,,,2,,RUB,
SNDX,MESMTRN,2020-07-16,MOEX SMID Net TR-NR,Индекс МосБиржи средней капитализации полной доходности «нетто» (по нал.ставкам ин.орг-й),2175.76,2175.76,2175.76,2175.76,,,,2,,RUB,
SNDX,MESMTRR,2020-07-16,MOEX SMID Net TR-Res,Индекс МосБиржи средней капитализации полной доходности «нетто» (по нал.ставкам рос.орг-й),2194.4,2194.4,2194.4,2194.4,,,,2,,RUB,
SNDX,METLTR,2020-07-16,MOEX Telecom Total Return,Индекс МосБиржи телекоммуникаций полной доходности «брутто»,4069.44,4069.44,4069.44,4069.44,,,,2,,RUB,
SNDX,METLTRN,2020-07-16,MOEX Telecom Net TR-NR,Индекс МосБиржи телекоммуникаций полной доходности «нетто» (по налог.ставкам ин.орг-й),3715.02,3715.02,3715.02,3715.02,,,,2,,RUB,
SNDX,METLTRR,2020-07-16,MOEX Telecom Net TR-Res,Индекс МосБиржи телекоммуникаций полной доходности «нетто» (по налог.ставкам рос.орг-й),3771.89,3771.89,3771.89,3771.89,,,,2,,RUB,
SNDX,METNTR,2020-07-16,MOEX Transport Total Return,Индекс МосБиржи транспорта полной доходности «брутто»,1972.08,1972.08,1972.08,1972.08,,,,2,,RUB,
SNDX,METNTRN,2020-07-16,MOEX Transport Net TR-NR,Индекс МосБиржи транспорта полной доходности «нетто» (по налог.ставкам ин.орг-й),1885.56,1885.56,1885.56,1885.56,,,,2,,RUB,
SNDX,METNTRR,2020-07-16,MOEX Transport Net TR-Res,Индекс МосБиржи транспорта полной доходности «нетто» (по налог.ставкам рос.орг-й),1898.85,1898.85,1898.85,1898.85,,,,2,,RUB,
SNDX,MOEX10,2020-07-16,Индекс МосБиржи 10,Индекс МосБиржи 10,4848.99,4818.11,4860.78,4807.42,26209099340.5,0,0.0,2,8828666180950.0,RUB,4928.35
RTSI,MOEXBC,2020-07-16,Индекс голубых фишек,Индекс МосБиржи голубых фишек,18238.42,18103.63,18255.66,18048.76,35243837599.6,0,0.0,2,9634814846790.0,RUB,528270321.54
SNDX,MOEXBMI,2020-07-16,Индекс широкого рынка,Индекс МосБиржи широкого рынка,1981.91,1975.55,1983.89,1963.88,44430998088.6,0,0.0,2,14398458258300.0,RUB,7264932269.15
SNDX,MOEXCH,2020-07-16,Индекс химии и нефтехимии,Индекс МосБиржи химии и нефтехимии,16755.12,16791.53,16818.85,16685.1,110070082.3,0,0.0,2,177700972381.0,RUB,10605772.4903
SNDX,MOEXCN,2020-07-16,Индекс потребительского сектора / Индекс потребит сектора,Индекс МосБиржи потребительского сектора,6679.06,6662.59,6694.64,6624.74,4155884318.16,0,0.0,2,173635561176.0,RUB,25997023.5935
SNDX,MOEXEU,2020-07-16,Индекс электроэнергетики,Индекс МосБиржи электроэнергетики,2119.19,2130.62,2130.62,2116.2,1532067411.1,0,0.0,2,272255398629.0,RUB,128471361.257
SNDX,MOEXFN,2020-07-16,Индекс финансов,Индекс МосБиржи финансов,6947.79,6918.53,6971.3,6877.49,10461416505.5,0,0.0,2,752776650685.0,RUB,108347612.073
SNDX,MOEXINN,2020-07-16,Индекс МосБиржи инноваций,Индекс МосБиржи инноваций,403.8,401.38,405.98,399.85,65258544.5,0,0.0,2,2928272868.7,RUB,7251762.984
SNDX,MOEXMM,2020-07-16,Индекс металлов и добычи,Индекс МосБиржи металлов и добычи,7685.88,7696.53,7716.74,7641.44,11981744754.5,0,0.0,2,1218086437120.0,RUB,158483724.864
SNDX,MOEXOG,2020-07-16,Индекс нефти и газа,Индекс МосБиржи нефти и газа,6836.99,6819.02,6845.7,6781.71,13710767188.7,0,0.0,2,1131095755040.0,RUB,165437748.083
SNDX,MOEXREPO,2020-07-16,MXREPO,MOEXREPO обл 12:30,4.2,4.2,4.2,4.2,408114951945.0,,,2,,RUB,
SNDX,MOEXREPO1W,2020-07-16,MOEXREPO1W,MOEXREPO 1 неделя 12:30,4.3,4.3,4.3,4.3,81997194126.0,,,2,,RUB,
SNDX,MOEXREPO1WE,2020-07-16,MOEXREPO1WE,MOEXREPO 1 неделя 19:00,4.49,4.49,4.49,4.49,,,,2,,RUB,
SNDX,MOEXREPOE,2020-07-16,MXREPOE,MOEXREPO обл 19:00,4.13,4.13,4.13,4.13,98423984831.0,,,2,,RUB,
SNDX,MOEXREPOEQ,2020-07-16,MXREPOEQ,MOEXREPO акц 12:30,4.25,4.25,4.25,4.25,40111001187.0,,,2,,RUB,
SNDX,MOEXREPOEQE,2020-07-16,MXREPOEQE,MOEXREPO акц 19:00,4.39,4.39,4.39,4.39,36090664145.0,,,2,,RUB,
SNDX,MOEXREPOUSD,2020-07-16,MOEXREPOUSD,MOEXREPO USD 12:30,0.45,0.45,0.45,0.45,1147472798.0,,,2,,USD,
SNDX,MOEXREPOUSDE,2020-07-16,MOEXREPOUSDE,MOEXREPO USD 19:00,0.35,0.35,0.35,0.35,286978895.0,,,2,,USD,
SNDX,MOEXTL,2020-07-16,Индекс телекоммуникаций,Индекс МосБиржи телекоммуникаций,2199.08,2200.09,2211.45,2185.27,1229928867.7,0,0.0,2,372802773776.0,RUB,169526680.988
SNDX,MOEXTN,2020-07-16,Индекс транспорта,Индекс МосБиржи транспорта,1457.47,1456.22,1462.75,1451.73,701597285.5,0,0.0,2,66764840019.4,RUB,45808634.8417
SNDX,MRBC,2020-07-16,Индекс МосБиржи 15,Индекс МосБиржи 15,1382.53,1374.12,1384.18,1369.93,,,,2,,RUB,
RTSI,MRBCTR,2020-07-16,Индекс МосБиржи полн дох-ти 15,Индекс МосБиржи полной доходности 15,1634.37,1634.37,1634.37,1634.37,,,,2,,RUB,
RTSI,MRRT,2020-07-16,"Индекс ""Ответственность и открытость""",Индекс МосБиржи - РСПП Ответственность и открытость,2126.19,2126.19,2126.19,2126.19,,,,2,,RUB,
RTSI,MRSV,2020-07-16,"Индекс ""Вектор устойчивого развития""",Индекс МосБиржи - РСПП Вектор устойчивого развития,2297.32,2297.32,2297.32,2297.32,,,,2,,RUB,
RTSI,MRSVT,2020-07-16,Индекс МосБиржи-РСПП Вектор TR,"Индекс МосБиржи - РСПП Вектор устойчивого развития, полной доходности брутто",2814.28,2814.28,2814.28,2814.28,,,,2,,RUB,
INAV,MTEKA,2020-07-16,iNAV Фридом - Лидеры Технологий,Расчетная цена одного пая Биржевого ПИФа «Фридом - Лидеры Технологий»,1497.87,1523.87,1530.54,1495.12,,,,2,,RUB,
RTSI,OPSI,2020-07-16,Субиндекс ОФЗ,Индексы активов пенсионных накоплений - Субиндекс ОФЗ,2061.798,2061.798,2061.798,2061.798,2087705364.9,,,2,4858994871678.95,RUB,
INAV,RFBC15,2020-07-16,iNAV «Raiffeisen-MOEX Index 15»,Расчетная цена одного пая Биржевого ПИФа «Райффайзен – Индекс МосБиржи полной доходности 15»,1030.86,1028.18,1031.96,1021.8,,,,2,,RUB,
SNDX,RGBI,2020-07-16,Индекс Мосбиржи гос обл RGBI,Индекс Мосбиржи государственных облигаций ценовой,155.44,155.62,155.62,155.35,20850573886.9,1808,5.5,2,8397051949660.0,RUB,1.0
SNDX,RGBITR,2020-07-16,Индекс Мосбиржи гос обл RGBITR,Индекс Мосбиржи государственных облигаций,611.52,612.21,612.21,611.18,20850573886.9,1808,5.5,2,8559595943830.0,RUB,1.0
SNDX,RPGCC,2020-07-16,MOEXREPOGCC,MOEXREPO КСУ 12:30,4.22,4.22,4.22,4.22,113244908000.0,,,2,,RUB,
SNDX,RPGCC1W,2020-07-16,MOEXREPOGCC1W,MOEXREPO КСУ 1 неделя 12:30,4.27,4.27,4.27,4.27,2617563000.0,,,2,,RUB,
SNDX,RPGCC1WE,2020-07-16,MOEXREPOGCC1WE,MOEXREPO КСУ 1 неделя 19:00,4.2,4.2,4.2,4.2,1160459000.0,,,2,,RUB,
SNDX,RPGCCE,2020-07-16,MOEXREPOGCCE,MOEXREPO КСУ 19:00,4.14,4.14,4.14,4.14,55913311000.0,,,2,,RUB,
RTSI,RTSCH,2020-07-16,Индекс РТС химии и нефтехимии,Индекс РТС химии и нефтехимии,245.16,246.67,247.0,244.09,1544381.57154,0,0.0,2,2493303368.69,USD,10170280.6297
RTSI,RTSCR,2020-07-16,Индекс РТС потреб. сектора,Индекс РТС потребительских товаров и розничной торговли,212.26,212.58,212.97,210.59,58310769.1057,0,0.0,2,2436262018.18,USD,11477900.3644
RTSI,RTSEU,2020-07-16,Индекс РТС электроэнергетики,Индекс РТС электроэнергетики,75.38,76.09,76.09,75.25,21496274.252,0,0.0,2,3819986426.91,USD,50675795.1837
RTSI,RTSFN,2020-07-16,Индекс РТС финансов,Индекс РТС финансов,169.49,169.45,170.35,167.8,146783017.925,0,0.0,2,10562128804.8,USD,62317345.3938
RTSI,RTSI,2020-07-16,Индекс РТС,Индекс РТС,1219.93,1216.67,1222.16,1208.29,605369080.76,0,0.0,2,164886524484.0,USD,135160162.611
RTSI,RTSMM,2020-07-16,Индекс РТС металлов и добычи,Индекс РТС металлов и добычи,226.69,227.91,228.09,225.59,168114581.248,0,0.0,2,17090840732.8,USD,75393012.9342
RTSI,RTSOG,2020-07-16,Индекс РТС нефти и газа,Индекс РТС нефти и газа,186.24,186.49,186.64,184.71,192374310.398,0,0.0,2,15870283761.3,USD,85213458.6621
RTSI,RTSSM,2020-07-16,RTS SMID Index,Индекс РТС средней и малой капитализации,1090.98,1090.98,1090.98,1090.98,37271742.01,,,2,6385168582.979,USD,5852684.6488
RTSI,RTSTL,2020-07-16,Индекс РТС телекоммуникаций,Индекс РТС телекоммуникаций ,94.6,95.02,95.32,94.03,17257000.6117,0,0.0,2,5230755911.23,USD,55293012.6018
RTSI,RTSTN,2020-07-16,Индекс РТС транспорта,Индекс РТС транспорта,49.97,50.12,50.18,49.76,9844036.59678,0,0.0,2,936770341.209,USD,18747461.487
RTSI,RTSTR,2020-07-16,RTS Total Return,Индекс РТС полной доходности «брутто»,2152.97,2152.97,2152.97,2152.97,605369080.77,,,2,164886524483.54,USD,
RTSI,RTSTRN,2020-07-16,RTS Net-TR-NR,Индекс РТС полной доходности «нетто» (по налоговым ставкам иностранных организаций),1977.5,1977.5,1977.5,1977.5,605369080.77,,,2,164886524483.54,USD,
RTSI,RTSTRR,2020-07-16,RTS Net-TR-Res,Индекс РТС полной доходности «нетто» (по налоговым ставкам российских организаций),2020.07,2020.07,2020.07,2020.07,605369080.77,,,2,164886524483.54,USD,
RTSI,RTSUSDCUR,2020-07-16,RTSUSDCUR,Курс доллара США на момент закрытия Индекса РТС,71.2713,71.2713,71.2713,71.2713,0.0,,,2,0.0,USD,
RTSI,RUABICP,2020-07-16,ABI CP,Композитный индекс облигаций ,117.37,117.37,117.37,117.37,9920095140.39,1685,5.32,2,10181056526202.35,RUB,
RTSI,RUABITR,2020-07-16,ABI TR,Композитный индекс облигаций — совокупный доход,221.67,221.67,221.67,221.67,9920095140.39,1685,5.32,2,10181056526202.35,RUB,
RTSI,RUBMI,2020-07-16,Индекс РТС широкого рынка,Индекс РТС широкого рынка,892.69,893.38,894.39,884.4,623406589.869,0,0.0,2,202023230365.0,USD,226307765.894
SNDX,RUCBCP3Y,2020-07-16,Индекс Мосбиржи корп обл CBICP 3-5,Индекс Мосбиржи корпоративных облигаций MOEX 1 - 3 ценовой,93.33,93.38,93.43,93.3,657340841.5,652,5.86,2,637861994391.0,RUB,1.0
SNDX,RUCBCP5Y,2020-07-16,Индекс Мосбиржи корп обл CBICP 1-3,Индекс Мосбиржи корпоративных облигаций ценовой 3-5,123.98,123.93,124.02,123.93,153569879.0,1346,6.26,2,506055644390.0,RUB,1.0
SNDX,RUCBICP,2020-07-16,Индекс Мосбиржи корп обл CBICP,Индекс Мосбиржи корпоративных облигаций ценовой,97.57,97.59,97.64,97.56,819957928.0,1061,6.15,2,1245535138780.0,RUB,1.0
RTSI,RUCBICP1Y,2020-07-16,CBI CP 1Y,"Индекс корпоративных облигаций (≤ 1 года, рейтинг ≥ B-)",92.83,92.83,92.83,92.83,271169995.88,155,5.72,2,204935578036.35,RUB,
RTSI,RUCBICP3+,2020-07-16,CBI CP 3+,"Индекс корпоративных облигаций (< 1 года, рейтинг > B-)",126.36,126.36,126.36,126.36,161177725.5,1489,6.28,2,617190414271.18,RUB,
RTSI,RUCBICPB,2020-07-16,CBI CP B,"Индекс корпоративных облигаций (> 1 года, B- ≤ рейтинг < BB-)",77.99,77.99,77.99,77.99,48765728.7,866,7.2,2,54465790665.86,RUB,
RTSI,RUCBICPB3Y,2020-07-16,CBI CP B 3Y,"Индекс корпоративных облигаций (1-3 года, B- ≤ рейтинг < BB-)",79.46,79.46,79.46,79.46,41093303.6,738,7.01,2,35758295505.68,RUB,
RTSI,RUCBICPBB,2020-07-16,CBI CP BB,"Индекс корпоративных облигаций (> 1 года, BB- ≤ рейтинг < BBB-)",94.39,94.39,94.39,94.39,150207137.4,988,6.33,2,476638828111.0,RUB,
RTSI,RUCBICPBB3+,2020-07-16,CBI CP BB 3+,"Индекс корпоративных облигаций (> 3 лет, BB- ≤ рейтинг < BBB-)",120.62,120.62,120.62,120.62,53340680.2,1367,6.57,2,207581244111.0,RUB,
RTSI,RUCBICPBB3Y,2020-07-16,CBI CP BBB 3Y,"Индекс корпоративных облигаций (1-3 года, BB- ≤ рейтинг < BBB-)",92.75,92.75,92.75,92.75,96866457.2,696,6.14,2,269057584000.0,RUB,
RTSI,RUCBICPBB5Y,2020-07-16,CBI CP BB 5Y,"Индекс корпоративных облигаций (3-5 лет, BB- ≤ рейтинг < BBB-)",120.76,120.76,120.76,120.76,51478304.9,1320,6.59,2,192105294111.0,RUB,
RTSI,RUCBICPBBB,2020-07-16,CBI CP BBB,"Индекс корпоративных облигаций (> 1 года, рейтинг ≥ BBB-)",100.76,100.76,100.76,100.76,209385568.5,1120,5.81,2,735486127772.9,RUB,
RTSI,RUCBICPBBB3+,2020-07-16,CBI CP BBB 3+,"Индекс корпоративных облигаций (3-5 лет, рейтинг ≥ BBB-)",130.91,130.91,130.91,130.91,100164620.2,1573,6.07,2,390901675000.0,RUB,
RTSI,RUCBICPBBB3Y,2020-07-16,CBI CP BBB 3Y,"Индекс корпоративных облигаций (1-3 года, рейтинг ≥ BBB-)",96.23,96.23,96.23,96.23,109220948.3,608,5.51,2,344584452772.9,RUB,
RTSI,RUCBICPBBB5Y,2020-07-16,CBI CP BBB 5Y,"Индекс корпоративных облигаций (3-5 лет, рейтинг ≥ BBB-)",129.63,129.63,129.63,129.63,92979788.0,1376,5.99,2,303222725000.0,RUB,
RTSI,RUCBICPL1,2020-07-16,CBI CP L1,Индекс корпоративных облигаций Котировальный лист 1 - ценовой,94.08,94.08,94.08,94.08,213070821.9,946,6.03,2,557808930665.86,RUB,
RTSI,RUCBICPL2,2020-07-16,CBI CP L2,Индекс корпоративных облигаций Котировальный лист 2 - ценовой,105.88,105.88,105.88,105.88,127076721.1,1153,5.99,2,470839585680.38,RUB,
RTSI,RUCBICPL3,2020-07-16,CBI CP L3,Индекс корпоративных облигаций Котировальный лист 3 - ценовой,103.53,103.53,103.53,103.53,68210891.6,1142,6.29,2,237942230203.52,RUB,
SNDX,RUCBITR,2020-07-16,Индекс Мосбиржи корп обл CBITR,Индекс Мосбиржи корпоративных облигаций,445.26,445.33,445.56,445.21,819957928.0,1061,6.15,2,1266706485880.0,RUB,1.0
RTSI,RUCBITR1Y,2020-07-16,CBI TR 1Y,"Индекс корпоративных облигаций (≤ 1 года, рейтинг ≥ B-)— совокупный доход",230.38,230.38,230.38,230.38,271169995.88,155,5.72,2,204935578036.35,RUB,
RTSI,RUCBITR3+,2020-07-16,CBI TR 3+,"Индекс корпоративных облигаций (> 3 лет, рейтинг ≥ B-) — совокупный доход",573.73,573.73,573.73,573.73,161177725.5,1489,6.28,2,617190414271.18,RUB,
RTSI,RUCBITRB,2020-07-16,CBI TR B,"Индекс корпоративных облигаций (> 1 года, B- ≤ рейтинг < BB-) — совокупный доход",438.15,438.15,438.15,438.15,48765728.7,866,7.2,2,54465790665.86,RUB,
RTSI,RUCBITRB3Y,2020-07-16,CBI TR B 3Y,"Индекс корпоративных облигаций (1-3 года, B- ≤ рейтинг < BB-) — совокупный доход",441.76,441.76,441.76,441.76,41093303.6,738,7.01,2,35758295505.68,RUB,
