BOARDID,SECID,TRADEDATE,SHORTNAME,NAME,CLOSE,OPEN,HIGH,LOW,VALUE,DURATION,YIELD,DECIMALS,CAPITALIZATION,CURRENCYID,DIVISOR
INAV,AKEUA,2020-10-29,iNAV Альфа-Капитал ЕВРОПА 600,Расчетная цена одного пая Биржевого ПИФа «ЕВРОПА 600»,9.3,9.27,9.33,9.18,0.0,0,0.0,2,0.0,EUR,0.0
INAV,AKMBA,2020-10-29,iNAV Альфа Управляемые облигации,Расчетная цена одного пая Биржевого ПИФа РФИ «Альфа-Капитал Управляемые облигации»,1.0404,1.0395,1.0404,1.0393,0.0,0,0.0,4,0.0,RUB,0.0
INAV,AKNXA,2020-10-29,iNAV Технологии 100,Расчетная цена одного пая Биржевого ПИФа «ТЕХНОЛОГИИ 100»,16.48,16.2,16.48,16.2,0.0,0,0.0,2,0.0,USD,0.0
INAV,AKSPA,2020-10-29,iNAV Альфа - Капитал Эс энд Пи 500,Расчетная цена одного пая Биржевого ПИФа «Альфа - Капитал Эс энд Пи 500»,11.36,11.26,11.36,11.22,0.0,0,0.0,2,0.0,USD,0.0
RTSI,BPSI,2020-10-29,Субиндекс облигаций,Индексы активов пенсионных накоплений - Субиндекс облигаций,2990.7188,2990.7188,2990.7188,2990.7188,189874316.6,,,2,441389663215.0,RUB,0.001
RTSI,EPSI,2020-10-29,Субиндекс акций,Индексы активов пенсионных накоплений - Субиндекс акций,1588.4208,1588.4208,1588.4208,1588.4208,62097102983.5,,,2,6629319075027.4375,RUB,4173528234.8069
INAV,ESGRA,2020-10-29,iNAV RSHB-MOEX-RSPP ESG VecTR ,Расчетная цена одного пая Биржевого ПИФа «РСХБ–Индекс МосБиржи–РСПП Вектор развития полн дох-ти»,1054.31,1047.93,1058.03,1037.97,0.0,0,0.0,2,0.0,RUB,0.0
INAV,GPBMA,2020-10-29,iNAV ГПБ - Корп. облигации 4г,Расчетная цена одного пая Биржевого ПИФа «Газпромбанк – Корпоративные облигации 4 года»,57950.18,57835.56,57950.18,57782.23,0.0,0,0.0,2,0.0,RUB,0.0
INAV,GPBSA,2020-10-29,iNAV ГПБ - Корп. облигации 2г,Расчетная цена одного пая Биржевого ПИФа «Газпромбанк – Корпоративные облигации 2 года»,56232.4,56197.21,56232.4,56118.55,0.0,0,0.0,2,0.0,RUB,0.0
SNDX,IMOEX,2020-10-29,Индекс МосБиржи,Индекс МосБиржи,2709.04,2704.5,2728.97,2682.68,74274727007.0,0,0.0,2,13029709306520.393,RUB,4809707787.4153
SNDX,IMOEX2,2020-10-29,Индекс МосБиржи (доп. сессия),Индекс МосБиржи (Дополнительная сессия),2709.04,2711.1,2725.51,2709.04,5166900022.8,0,0.0,2,13029709306520.393,RUB,4809707787.4153
RTSI,MCFTR,2020-10-29,MOEX Russia Total Return,Индекс МосБиржи полной доходности «брутто»,4878.35,4878.35,4878.35,4878.35,74274727007.0,,,2,13029709306520.39,RUB,
RTSI,MCFTRN,2020-10-29,MOEX Russia Net-TR-NR,Индекс МосБиржи полной доходности «нетто» (по налоговым ставкам иностранных организаций),4467.29,4467.29,4467.29,4467.29,74274727007.0,,,2,13029709306520.39,RUB,
RTSI,MCFTRR,2020-10-29,MOEX Russia Net-TR-Res,Индекс МосБиржи полной доходности «нетто» (по налоговым ставкам российских организаций),4565.42,4565.42,4565.42,4565.42,74274727007.0,,,2,13029709306520.39,RUB,
RTSI,MCXSM,2020-10-29,Индекс МосБиржи SMID,Индекс МосБиржи средней и малой капитализации,1743.61,1743.61,1743.61,1743.61,5869779704.11,,,2,544775075267.7825,RUB,312441516.846
RTSI,MEBCTR,2020-10-29,MOEX Blue Chip Total Return,Индекс МосБиржи голубых фишек полной доходности «брутто»,29420.17,29420.17,29420.17,29420.17,56828482758.1,,,2,10321105529928.57,RUB,
RTSI,MEBCTRN,2020-10-29,MOEX Blue Chip Net-TR-NR,Индекс МосБиржи голубых фишек полной доходности «нетто» (по налоговым ставкам иностр. орг.),27231.68,27231.68,27231.68,27231.68,56828482758.1,,,2,10321105529928.57,RUB,
RTSI,MEBCTRR,2020-10-29,MOEX Blue Chip Net-TR-Res,Индекс МосБиржи голубых фишек полной доходности «нетто» (по налоговым ставкам росс. орг.),27707.33,27707.33,27707.33,27707.33,56828482758.1,,,2,10321105529928.57,RUB,
SNDX,MECHTR,2020-10-29,MOEX Chemicals Total Return,Индекс МосБиржи химии и нефтехимии полной доходности «брутто»,25548.42,25548.42,25548.42,25548.42,247888485.0,0,0.0,2,0.0,RUB,0.0
SNDX,MECHTRN,2020-10-29,MOEX Chemicals Net TR-NR,Индекс МосБиржи химии и нефтехимии полной доходности «нетто» (по налог.ставкам ин.орг-й),23978.88,23978.88,23978.88,23978.88,247888485.0,0,0.0,2,0.0,RUB,0.0
SNDX,MECHTRR,2020-10-29,MOEX Chemicals Net TR-Res,Индекс МосБиржи химии и нефтехимии полной доходности «нетто» (по налог.ставкам рос.орг-й),24221.97,24221.97,24221.97,24221.97,247888485.0,0,0.0,2,0.0,RUB,0.0
SNDX,MECNTR,2020-10-29,MOEX Consumer Total Return,Индекс МосБиржи потребительского сектора полной доходности «брутто»,9827.17,9827.17,9827.17,9827.17,3771306639.0,0,0.0,2,0.0,RUB,0.0
SNDX,MECNTRN,2020-10-29,MOEX Consumer Net TR-NR,Индекс МосБиржи потребит. сектора полной доходности «нетто» (по налог.ставкам ин.орг-й),9511.14,9511.14,9511.14,9511.14,3771306639.0,0,0.0,2,0.0,RUB,0.0
SNDX,MECNTRR,2020-10-29,MOEX Consumer Net TR-Res,Индекс МосБиржи потреб. сектора полной доходности «нетто» (по налог.ставкам рос.орг-й),9448.07,9448.07,9448.07,9448.07,3771306639.0,0,0.0,2,0.0,RUB,0.0
SNDX,MEEUTR,2020-10-29,MOEX El.Utilities Total Return,Индекс МосБиржи электроэнергетики полной доходности «брутто»,2985.44,2985.44,2985.44,2985.44,3037653643.0,0,0.0,2,0.0,RUB,0.0
SNDX,MEEUTRN,2020-10-29,MOEX El. Utilities Net TR-NR,Индекс МосБиржи электроэнергетики полной доходности «нетто» (по налог.ставкам ин.орг-й),2826.96,2826.96,2826.96,2826.96,3037653643.0,0,0.0,2,0.0,RUB,0.0
SNDX,MEEUTRR,2020-10-29,MOEX El. Utilities Net TR-Res,Индекс МосБиржи электроэнергетики полной доходности «нетто» (по налог.ставкам рос.орг-й),2852.39,2852.39,2852.39,2852.39,3037653643.0,0,0.0,2,0.0,RUB,0.0
SNDX,MEFNTR,2020-10-29,MOEX Financials Total Return,Индекс МосБиржи финансов полной доходности «брутто»,9749.12,9749.12,9749.12,9749.12,22775584687.0,0,0.0,2,0.0,RUB,0.0
SNDX,MEFNTRN,2020-10-29,MOEX Financials Net TR-NR,Индекс МосБиржи финансов полной доходности «нетто» (по налог.ставкам ин.орг-й),9327.36,9327.36,9327.36,9327.36,22775584687.0,0,0.0,2,0.0,RUB,0.0
SNDX,MEFNTRR,2020-10-29,MOEX Financials Net TR-Res,Индекс МосБиржи финансов полной доходности «нетто» (по налог.ставкам рос.орг-й),9395.69,9395.69,9395.69,9395.69,22775584687.0,0,0.0,2,0.0,RUB,0.0
SNDX,MEMMTR,2020-10-29,MOEX Metals & Min Total Return,Индекс МосБиржи металлов и добычи полной доходности «брутто»,14068.86,14068.86,14068.86,14068.86,13175259898.0,0,0.0,2,0.0,RUB,0.0
SNDX,MEMMTRN,2020-10-29,MOEX Metals & Mining Net TR-NR,Индекс МосБиржи металлов и добычи полной доходности «нетто» (по налог.ставкам ин.орг-й),13093.4,13093.4,13093.4,13093.4,13175259898.0,0,0.0,2,0.0,RUB,0.0
SNDX,MEMMTRR,2020-10-29,MOEX Metals & Min Net TR-Res,Индекс МосБиржи металлов и добычи полной доходности «нетто» (по налог.ставкам рос.орг-й),13250.85,13250.85,13250.85,13250.85,13175259898.0,0,0.0,2,0.0,RUB,0.0
SNDX,MEOGTR,2020-10-29,MOEX Oil & Gas Total Return,Индекс МосБиржи нефти и газа полной доходности «брутто»,8638.85,8638.85,8638.85,8638.85,23238575372.0,0,0.0,2,0.0,RUB,0.0
SNDX,MEOGTRN,2020-10-29,MOEX Oil & Gas Net TR-NR,Индекс МосБиржи нефти и газа полной доходности «нетто» (по налог.ставкам ин.орг-й),8180.32,8180.32,8180.32,8180.32,23238575372.0,0,0.0,2,0.0,RUB,0.0
SNDX,MEOGTRR,2020-10-29,MOEX Oil & Gas Net TR-Res,Индекс МосБиржи нефти и газа полной доходности «нетто» (по налог.ставкам рос.орг-й),8255.03,8255.03,8255.03,8255.03,23238575372.0,0,0.0,2,0.0,RUB,0.0
SNDX,MESMTR,2020-10-29,MOEX SMID Total Return,Индекс МосБиржи средней и малой капитализации полной доходности «брутто»,2431.07,2431.07,2431.07,2431.07,5869779708.0,0,0.0,2,0.0,RUB,0.0
SNDX,MESMTRN,2020-10-29,MOEX SMID Net TR-NR,Индекс МосБиржи средней капитализации полной доходности «нетто» (по нал.ставкам ин.орг-й),2312.97,2312.97,2312.97,2312.97,5869779708.0,0,0.0,2,0.0,RUB,0.0
SNDX,MESMTRR,2020-10-29,MOEX SMID Net TR-Res,Индекс МосБиржи средней капитализации полной доходности «нетто» (по нал.ставкам рос.орг-й),2333.3,2333.3,2333.3,2333.3,5869779708.0,0,0.0,2,0.0,RUB,0.0
SNDX,METLTR,2020-10-29,MOEX Telecom Total Return,Индекс МосБиржи телекоммуникаций полной доходности «брутто»,4171.45,4171.45,4171.45,4171.45,1362892652.0,0,0.0,2,0.0,RUB,0.0
SNDX,METLTRN,2020-10-29,MOEX Telecom Net TR-NR,Индекс МосБиржи телекоммуникаций полной доходности «нетто» (по налог.ставкам ин.орг-й),3790.73,3790.73,3790.73,3790.73,1362892652.0,0,0.0,2,0.0,RUB,0.0
SNDX,METLTRR,2020-10-29,MOEX Telecom Net TR-Res,Индекс МосБиржи телекоммуникаций полной доходности «нетто» (по налог.ставкам рос.орг-й),3851.12,3851.12,3851.12,3851.12,1362892652.0,0,0.0,2,0.0,RUB,0.0
SNDX,METNTR,2020-10-29,MOEX Transport Total Return,Индекс МосБиржи транспорта полной доходности «брутто»,1555.09,1555.09,1555.09,1555.09,1247681741.0,0,0.0,2,0.0,RUB,0.0
SNDX,METNTRN,2020-10-29,MOEX Transport Net TR-NR,Индекс МосБиржи транспорта полной доходности «нетто» (по налог.ставкам ин.орг-й),1478.52,1478.52,1478.52,1478.52,1247681741.0,0,0.0,2,0.0,RUB,0.0
SNDX,METNTRR,2020-10-29,MOEX Transport Net TR-Res,Индекс МосБиржи транспорта полной доходности «нетто» (по налог.ставкам рос.орг-й),1490.04,1490.04,1490.04,1490.04,1247681741.0,0,0.0,2,0.0,RUB,0.0
SNDX,MOEX10,2020-10-29,Индекс МосБиржи 10,Индекс МосБиржи 10,4396.04,4389.39,4432.92,4348.0,48480239812.3,0,0.0,2,9329291355608.39,RUB,5009.22
RTSI,MOEXBC,2020-10-29,Индекс голубых фишек,Индекс МосБиржи голубых фишек,17547.36,17533.52,17707.03,17391.7,56828482758.1,0,0.0,2,10321105529928.574,RUB,588185545.4728
SNDX,MOEXBMI,2020-10-29,Индекс широкого рынка,Индекс МосБиржи широкого рынка,1936.71,1937.1,1949.08,1918.78,75262433140.41,0,0.0,2,14669728083830.117,RUB,7574573330.9507
SNDX,MOEXCH,2020-10-29,Индекс химии и нефтехимии,Индекс МосБиржи химии и нефтехимии,16701.35,16795.0,16803.68,16625.13,247549088.7,0,0.0,2,177130693987.65,RUB,10605772.4903
SNDX,MOEXCN,2020-10-29,Индекс потребительского сектора / Индекс потребит сектора,Индекс МосБиржи потребительского сектора,7536.27,7552.6,7622.41,7452.11,3769526130.08,0,0.0,2,109291488171.6028,RUB,14502059.4659
SNDX,MOEXEU,2020-10-29,Индекс электроэнергетики,Индекс МосБиржи электроэнергетики,2074.62,2045.74,2078.21,2029.97,3034796523.4,0,0.0,2,253403299826.051,RUB,122144387.9137
SNDX,MOEXFN,2020-10-29,Индекс финансов,Индекс МосБиржи финансов,7249.97,7266.1,7301.06,7165.43,22727689712.9,0,0.0,2,783214443706.4169,RUB,108030067.9261
SNDX,MOEXINN,2020-10-29,Индекс МосБиржи инноваций,Индекс МосБиржи инноваций,367.42,361.35,368.57,360.93,38459770.5,0,0.0,2,2320437652.5758,RUB,6315514.9888
SNDX,MOEXMM,2020-10-29,Индекс металлов и добычи,Индекс МосБиржи металлов и добычи,8703.29,8682.91,8752.06,8593.03,13168555064.29,0,0.0,2,1397136697295.8745,RUB,160529704.4824
SNDX,MOEXOG,2020-10-29,Индекс нефти и газа,Индекс МосБиржи нефти и газа,5994.56,5985.73,6031.9,5914.1,23219514276.1,0,0.0,2,1035834218703.2986,RUB,172795585.0609
SNDX,MOEXREPO,2020-10-29,MXREPO,MOEXREPO обл 12:30,4.31,4.31,4.31,4.31,317179240429.0,,,2,,RUB,
SNDX,MOEXREPO1W,2020-10-29,MOEXREPO1W,MOEXREPO 1 неделя 12:30,4.32,4.32,4.32,4.32,32223419587.0,,,2,,RUB,
SNDX,MOEXREPO1WE,2020-10-29,MOEXREPO1WE,MOEXREPO 1 неделя 19:00,4.45,4.45,4.45,4.45,18485785089.0,,,2,,RUB,
SNDX,MOEXREPOE,2020-10-29,MXREPOE,MOEXREPO обл 19:00,4.27,4.27,4.27,4.27,139224492370.0,,,2,,RUB,
SNDX,MOEXREPOEQ,2020-10-29,MXREPOEQ,MOEXREPO акц 12:30,4.3,4.3,4.3,4.3,50365861256.0,,,2,,RUB,
SNDX,MOEXREPOEQE,2020-10-29,MXREPOEQE,MOEXREPO акц 19:00,4.39,4.39,4.39,4.39,30074210176.0,,,2,,RUB,
SNDX,MOEXREPOUSD,2020-10-29,MOEXREPOUSD,MOEXREPO USD 12:30,0.51,0.51,0.51,0.51,1493399493.0,,,2,,USD,
SNDX,MOEXREPOUSDE,2020-10-29,MOEXREPOUSDE,MOEXREPO USD 19:00,0.37,0.37,0.37,0.37,618696509.0,,,2,,USD,
SNDX,MOEXTL,2020-10-29,Индекс телекоммуникаций,Индекс МосБиржи телекоммуникаций,2186.18,2192.64,2202.99,2161.6,1362542359.0,0,0.0,2,389140268971.7668,RUB,178000185.54
SNDX,MOEXTN,2020-10-29,Индекс транспорта,Индекс МосБиржи транспорта,1106.12,1092.51,1106.93,1084.8,1245141930.5,0,0.0,2,50669648685.658,RUB,45808634.8417
SNDX,MRBC,2020-10-29,Индекс МосБиржи 15,Индекс МосБиржи 15,1358.97,1356.99,1370.72,1345.65,56828482758.1,0,0.0,2,8685653790051.323,RUB,6391340404.1646
RTSI,MRBCTR,2020-10-29,Индекс МосБиржи полн дох-ти 15,Индекс МосБиржи полной доходности 15,1632.09,1632.09,1632.09,1632.09,56907388818.0,0,0.0,2,0.0,RUB,0.0
RTSI,MRRT,2020-10-29,"Индекс ""Ответственность и открытость""",Индекс МосБиржи - РСПП Ответственность и открытость,2024.78,2024.78,2024.78,2024.78,55201173896.0,0,0.0,2,30206061144094.85,RUB,3929301536.3335
RTSI,MRSV,2020-10-29,"Индекс ""Вектор устойчивого развития""",Индекс МосБиржи - РСПП Вектор устойчивого развития,2382.66,2382.66,2382.66,2382.66,53409935641.0,0,0.0,2,29627009305766.58,RUB,81467120.5622
RTSI,MRSVT,2020-10-29,Индекс МосБиржи-РСПП Вектор TR,"Индекс МосБиржи - РСПП Вектор устойчивого развития, полной доходности брутто",2958.58,2958.58,2958.58,2958.58,53409935641.0,0,0.0,2,0.0,RUB,0.0
INAV,MTEKA,2020-10-29,iNAV Фридом - Лидеры Технологий,Расчетная цена одного пая Биржевого ПИФа «Фридом - Лидеры Технологий»,1875.9,1844.42,1876.97,1831.05,0.0,0,0.0,2,0.0,RUB,0.0
INAV,ONLYO,2020-10-29,iNAV «Открытие – Всепогодный»,Биржевой паевой инвестиционный фонд рыночных финансовых инструментов «Открытие – Всепогодный»,1.0286,1.0268,1.0292,1.0205,0.0,0,0.0,4,0.0,USD,0.0
RTSI,OPSI,2020-10-29,Субиндекс ОФЗ,Индексы активов пенсионных накоплений - Субиндекс ОФЗ,2072.901,2072.901,2072.901,2072.901,1802345514.98,,,2,5223015972664.65,RUB,
INAV,RCMBD,2020-10-29,iNAV «Райффайзен –Еврооблигации»,Биржевой паевой инвестиционный фонд рыночных финансовых инструментов «Райффайзен – Еврооблигации»,12.77,12.77,12.81,12.77,0.0,0,0.0,2,0.0,USD,0.0
INAV,RFBC15,2020-10-29,iNAV «Raiffeisen-MOEX Index 15»,Расчетная цена одного пая Биржевого ПИФа «Райффайзен – Индекс МосБиржи полной доходности 15»,1025.04,1026.98,1033.68,1015.52,0.0,0,0.0,2,0.0,RUB,0.0
SNDX,RGBI,2020-10-29,Индекс Мосбиржи гос обл RGBI,Индекс Мосбиржи государственных облигаций ценовой,152.86,153.16,153.18,152.86,12397692722.62,1862,5.84,2,8883411645734.547,RUB,1.0
SNDX,RGBITR,2020-10-29,Индекс Мосбиржи гос обл RGBITR,Индекс Мосбиржи государственных облигаций,612.6,613.8,613.88,612.58,12397692722.62,1862,5.84,2,9003572483027.547,RUB,1.0
SNDX,RPGCC,2020-10-29,MOEXREPOGCC,MOEXREPO КСУ 12:30,4.36,4.36,4.36,4.36,96232934000.0,,,2,,RUB,
SNDX,RPGCC1W,2020-10-29,MOEXREPOGCC1W,MOEXREPO КСУ 1 неделя 12:30,4.4,4.4,4.4,4.4,1526908000.0,,,2,,RUB,
SNDX,RPGCC1WE,2020-10-29,MOEXREPOGCC1WE,MOEXREPO КСУ 1 неделя 19:00,4.39,4.39,4.39,4.39,1250000000.0,,,2,,RUB,
SNDX,RPGCCE,2020-10-29,MOEXREPOGCCE,MOEXREPO КСУ 19:00,4.33,4.33,4.33,4.33,69986746000.0,,,2,,RUB,
RTSI,RTSCH,2020-10-29,Индекс РТС химии и нефтехимии,Индекс РТС химии и нефтехимии,220.2,221.06,222.47,218.53,3129761.2080126223,0,0.0,2,2239461989.9519815,USD,10170280.6297
RTSI,RTSCR,2020-10-29,Индекс РТС потреб. сектора,Индекс РТС потребительских товаров и розничной торговли,215.81,215.92,219.59,212.46,47658089.61959764,0,0.0,2,1381771437.0986202,USD,6402778.8808
RTSI,RTSEU,2020-10-29,Индекс РТС электроэнергетики,Индекс РТС электроэнергетики,66.5,65.46,66.93,64.75,38368908.9021837,0,0.0,2,3203775953.8638363,USD,48180107.4121
RTSI,RTSFN,2020-10-29,Индекс РТС финансов,Индекс РТС финансов,159.37,159.46,161.44,156.69,287346004.7246862,0,0.0,2,9902174135.806177,USD,62134706.3129
RTSI,RTSI,2020-10-29,Индекс РТС,Индекс РТС,1078.96,1075.4,1091.43,1062.7,939054797.3454773,0,0.0,2,164734513681.23972,USD,152678585.651
RTSI,RTSMM,2020-10-29,Индекс РТС металлов и добычи,Индекс РТС металлов и добычи,231.31,230.38,233.48,227.11,166489939.51959157,0,0.0,2,17663988425.28844,USD,76366315.1958
RTSI,RTSOG,2020-10-29,Индекс РТС нефти и газа,Индекс РТС нефти и газа,147.14,146.68,148.93,144.44,293564138.86177665,0,0.0,2,13096043991.33321,USD,89003323.6986
RTSI,RTSSM,2020-10-29,RTS SMID Index,Индекс РТС средней и малой капитализации,1035.69,1035.69,1035.69,1035.69,74211579.26,,,2,6887587050.3874,USD,6650265.8786
RTSI,RTSTL,2020-10-29,Индекс РТС телекоммуникаций,Индекс РТС телекоммуникаций ,84.74,84.85,85.77,83.33,17226612.474587586,0,0.0,2,4919897401.761002,USD,58056740.3599
RTSI,RTSTN,2020-10-29,Индекс РТС транспорта,Индекс РТС транспорта,34.17,33.69,34.3,33.37,15742319.76782409,0,0.0,2,640615975.2508116,USD,18747461.487
RTSI,RTSTR,2020-10-29,RTS Total Return,Индекс РТС полной доходности «брутто»,1941.69,1941.69,1941.69,1941.69,939054797.33,,,2,164734513681.24,USD,
RTSI,RTSTRN,2020-10-29,RTS Net-TR-NR,Индекс РТС полной доходности «нетто» (по налоговым ставкам иностранных организаций),1778.25,1778.25,1778.25,1778.25,939054797.33,,,2,164734513681.24,USD,
RTSI,RTSTRR,2020-10-29,RTS Net-TR-Res,Индекс РТС полной доходности «нетто» (по налоговым ставкам российских организаций),1817.24,1817.24,1817.24,1817.24,939054797.33,,,2,164734513681.24,USD,
RTSI,RTSUSDCUR,2020-10-29,RTSUSDCUR,Курс доллара США на момент закрытия Индекса РТС,79.0952,79.0952,79.0952,79.0952,0.0,,,2,0.0,USD,
RTSI,RUABICP,2020-10-29,ABI CP,Композитный индекс облигаций ,115.59,115.59,115.59,115.59,8212571250.96,1718,5.6,2,10674641505310.21,RUB,
RTSI,RUABITR,2020-10-29,ABI TR,Композитный индекс облигаций — совокупный доход,222.46,222.46,222.46,222.46,8212571250.96,1718,5.6,2,10674641505310.21,RUB,
RTSI,RUBMI,2020-10-29,Индекс РТС широкого рынка,Индекс РТС широкого рынка,786.04,784.89,794.64,774.59,951542358.3278126,0,0.0,2,185469258359.92722,USD,235953303.4342
SNDX,RUCBCP3Y,2020-10-29,Индекс Мосбиржи корп обл CBICP 3-5,Индекс Мосбиржи корпоративных облигаций MOEX 1 - 3 ценовой,92.98,93.03,93.07,92.98,1608202851.98,629,5.97,2,806433555142.3997,RUB,1.0
SNDX,RUCBCP5Y,2020-10-29,Индекс Мосбиржи корп обл CBICP 1-3,Индекс Мосбиржи корпоративных облигаций ценовой 3-5,123.32,122.97,123.32,122.85,142548798.7,1297,6.24,2,370477395255.0,RUB,1.0
SNDX,RUCBICP,2020-10-29,Индекс Мосбиржи корп обл CBICP,Индекс Мосбиржи корпоративных облигаций ценовой,97.08,97.03,97.1,96.98,1757088732.18,943,6.17,2,1277509950397.4,RUB,1.0
RTSI,RUCBICP1Y,2020-10-29,CBI CP 1Y,"Индекс корпоративных облигаций (≤ 1 года, рейтинг ≥ B-)",91.97,91.97,91.97,91.97,86482708.72,126,6.02,2,186220319870.8,RUB,
RTSI,RUCBICP3+,2020-10-29,CBI CP 3+,"Индекс корпоративных облигаций (< 1 года, рейтинг > B-)",125.66,125.66,125.66,125.66,148885880.2,1478,6.29,2,478914288008.0,RUB,
RTSI,RUCBICPB,2020-10-29,CBI CP B,"Индекс корпоративных облигаций (> 1 года, B- ≤ рейтинг < BB-)",77.94,77.94,77.94,77.94,37308577.38,793,7.26,2,57034685225.45,RUB,
RTSI,RUCBICPB3Y,2020-10-29,CBI CP B 3Y,"Индекс корпоративных облигаций (1-3 года, B- ≤ рейтинг < BB-)",79.19,79.19,79.19,79.19,31494288.38,729,7.27,2,45371532007.45,RUB,
RTSI,RUCBICPBB,2020-10-29,CBI CP BB,"Индекс корпоративных облигаций (> 1 года, BB- ≤ рейтинг < BBB-)",94.01,94.01,94.01,94.01,754226363.0,865,6.32,2,551088264790.0,RUB,
RTSI,RUCBICPBB3+,2020-10-29,CBI CP BB 3+,"Индекс корпоративных облигаций (> 3 лет, BB- ≤ рейтинг < BBB-)",120.19,120.19,120.19,120.19,134899183.8,1354,6.58,2,154995934790.0,RUB,
RTSI,RUCBICPBB3Y,2020-10-29,CBI CP BBB 3Y,"Индекс корпоративных облигаций (1-3 года, BB- ≤ рейтинг < BBB-)",92.38,92.38,92.38,92.38,619327179.2,674,6.22,2,396092330000.0,RUB,
RTSI,RUCBICPBB5Y,2020-10-29,CBI CP BB 5Y,"Индекс корпоративных облигаций (3-5 лет, BB- ≤ рейтинг < BBB-)",120.31,120.31,120.31,120.31,134380261.8,1296,6.6,2,139543534790.0,RUB,
RTSI,RUCBICPBBB,2020-10-29,CBI CP BBB,"Индекс корпоративных облигаций (> 1 года, рейтинг ≥ BBB-)",100.15,100.15,100.15,100.15,36577662.8,1017,5.73,2,687619720267.2,RUB,
RTSI,RUCBICPBBB3+,2020-10-29,CBI CP BBB 3+,"Индекс корпоративных облигаций (3-5 лет, рейтинг ≥ BBB-)",129.89,129.89,129.89,129.89,8172407.4,1556,6.1,2,312255200000.0,RUB,
RTSI,RUCBICPBBB3Y,2020-10-29,CBI CP BBB 3Y,"Индекс корпоративных облигаций (1-3 года, рейтинг ≥ BBB-)",95.84,95.84,95.84,95.84,28405255.4,570,5.42,2,375364520267.2,RUB,
RTSI,RUCBICPBBB5Y,2020-10-29,CBI CP BBB 5Y,"Индекс корпоративных облигаций (3-5 лет, рейтинг ≥ BBB-)",128.79,128.79,128.79,128.79,2354247.9,1312,5.95,2,225751350000.0,RUB,
RTSI,RUCBICPL1,2020-10-29,CBI CP L1,Индекс корпоративных облигаций Котировальный лист 1 - ценовой,93.75,93.75,93.75,93.75,657878733.3,928,5.96,2,711122307912.77,RUB,
RTSI,RUCBICPL2,2020-10-29,CBI CP L2,Индекс корпоративных облигаций Котировальный лист 2 - ценовой,105.18,105.18,105.18,105.18,147244618.58,926,6.15,2,418798132369.88,RUB,
