BOARDID,SECID,TRADEDATE,SHORTNAME,NAME,CLOSE,OPEN,HIGH,LOW,VALUE,DURATION,YIELD,DECIMALS,CAPITALIZATION,CURRENCYID,DIVISOR
INAV,AKCHA,2021-01-15,iNAV Альфа Китайские акции,Расчетная цена одного пая Биржевого ПИФа РФИ «Альфа-Капитал Китайские акции»,107.72,108.05,108.51,107.69,0.0,0,0.0,2,0.0,RUB,0.0
INAV,AKEUA,2021-01-15,iNAV Альфа-Капитал ЕВРОПА 600,Расчетная цена одного пая Биржевого ПИФа «ЕВРОПА 600»,11.0,11.15,11.15,10.97,0.0,0,0.0,2,0.0,EUR,0.0
INAV,AKMBA,2021-01-15,iNAV Альфа Управляемые облигации,Расчетная цена одного пая Биржевого ПИФа РФИ «Альфа-Капитал Управляемые облигации»,1.0648,1.0648,1.0651,1.0647,0.0,0,0.0,4,0.0,RUB,0.0
INAV,AKMEI,2021-01-15,iNAV Альфа Управляемые акции,Расчетная цена одного пая Биржевого ПИФа РФИ «Альфа-Капитал Управляемые Российские Акции»,108.74,109.91,110.73,108.68,0.0,0,0.0,2,0.0,RUB,0.0
INAV,AKNXA,2021-01-15,iNAV Технологии 100,Расчетная цена одного пая Биржевого ПИФа «ТЕХНОЛОГИИ 100»,18.66,18.84,18.89,18.66,0.0,0,0.0,2,0.0,USD,0.0
INAV,AKSPA,2021-01-15,iNAV Альфа - Капитал Эс энд Пи 500,Расчетная цена одного пая Биржевого ПИФа «Альфа - Капитал Эс энд Пи 500»,12.9,13.05,13.05,12.9,0.0,0,0.0,2,0.0,USD,0.0
RTSI,BPSI,2021-01-15,Субиндекс облигаций,Субиндекс облигаций активов пенсионных накоплений,3038.37,3038.37,3038.37,3038.37,4169164838.0,985,5.83,2,2017628608386.66,RUB,1000000000000.0
RTSI,BPSIG,2021-01-15,Субиндекс облигаций ОФЗ,Субиндекс облигаций ОФЗ активов пенсионных накоплений,2070.58,2070.58,2070.58,2070.58,10452959333.0,1791,5.6,2,9000090232988.07,RUB,1000000000000.0
RTSI,EPSI,2021-01-15,Субиндекс акций,Субиндекс акций активов пенсионных накоплений,2044.91,2044.91,2044.91,2044.91,105079082079.0,0,0.0,2,49637995069047.234,RUB,7568983455.3956
RTSI,EPSITR,2021-01-15,Субиндекс акций полной доходности,Субиндекс акций полной дох-ти,2058.58,2058.58,2058.58,2058.58,105079082079.0,0,0.0,2,0.0,RUB,0.0
INAV,ESGRA,2021-01-15,iNAV RSHB-MOEX-RSPP ESG VecTR ,Расчетная цена одного пая Биржевого ПИФа «РСХБ–Индекс МосБиржи–РСПП Вектор развития полн дох-ти»,1347.76,1351.82,1358.74,1346.01,0.0,0,0.0,2,0.0,RUB,0.0
INAV,GPBMA,2021-01-15,iNAV ГПБ - Корп. облигации 4г,Расчетная цена одного пая Биржевого ПИФа «Газпромбанк – Корпоративные облигации 4 года»,58866.23,58819.15,58968.93,58819.15,0.0,0,0.0,2,0.0,RUB,0.0
INAV,GPBSA,2021-01-15,iNAV ГПБ - Корп. облигации 2г,Расчетная цена одного пая Биржевого ПИФа «Газпромбанк – Корпоративные облигации 2 года»,57057.62,57047.54,57081.29,57043.61,0.0,0,0.0,2,0.0,RUB,0.0
SNDX,IMOEX,2021-01-15,Индекс МосБиржи,Индекс МосБиржи,3450.95,3486.02,3509.24,3448.54,104977695775.4,0,0.0,2,17528152332620.562,RUB,5079230865.8227
SNDX,IMOEX2,2021-01-15,Индекс МосБиржи (доп. сессия),Индекс МосБиржи (Дополнительная сессия),3450.95,3452.04,3458.84,3448.95,9115948053.55,0,0.0,2,17528152332620.562,RUB,5079230865.8227
RTSI,MCFTR,2021-01-15,MOEX Russia Total Return,Индекс МосБиржи полной доходности «брутто»,6253.84,6253.84,6253.84,6253.84,105079082079.0,0,0.0,2,0.0,RUB,0.0
RTSI,MCFTRN,2021-01-15,MOEX Russia Net-TR-NR,Индекс МосБиржи полной доходности «нетто» (по налоговым ставкам иностранных организаций),5721.49,5721.49,5721.49,5721.49,105079082079.0,0,0.0,2,0.0,RUB,0.0
RTSI,MCFTRR,2021-01-15,MOEX Russia Net-TR-Res,Индекс МосБиржи полной доходности «нетто» (по налоговым ставкам российских организаций),5847.16,5847.16,5847.16,5847.16,105079082079.0,0,0.0,2,0.0,RUB,0.0
RTSI,MCXSM,2021-01-15,Индекс МосБиржи SMID,Индекс МосБиржи средней и малой капитализации,1988.65,1988.65,1988.65,1988.65,6496046271.0,0,0.0,2,4709122980138.749,RUB,414265307.9884
RTSI,MEBCTR,2021-01-15,MOEX Blue Chip Total Return,Индекс МосБиржи голубых фишек полной доходности «брутто»,38225.25,38225.25,38225.25,38225.25,77913023044.0,0,0.0,2,0.0,RUB,0.0
RTSI,MEBCTRN,2021-01-15,MOEX Blue Chip Net-TR-NR,Индекс МосБиржи голубых фишек полной доходности «нетто» (по налоговым ставкам иностр. орг.),35351.81,35351.81,35351.81,35351.81,77913023044.0,0,0.0,2,0.0,RUB,0.0
RTSI,MEBCTRR,2021-01-15,MOEX Blue Chip Net-TR-Res,Индекс МосБиржи голубых фишек полной доходности «нетто» (по налоговым ставкам росс. орг.),35969.26,35969.26,35969.26,35969.26,77913023044.0,0,0.0,2,0.0,RUB,0.0
SNDX,MECHTR,2021-01-15,MOEX Chemicals Total Return,Индекс МосБиржи химии и нефтехимии полной доходности «брутто»,30117.47,30117.47,30117.47,30117.47,452569674.0,0,0.0,2,0.0,RUB,0.0
SNDX,MECHTRN,2021-01-15,MOEX Chemicals Net TR-NR,Индекс МосБиржи химии и нефтехимии полной доходности «нетто» (по налог.ставкам ин.орг-й),28180.23,28180.23,28180.23,28180.23,452569674.0,0,0.0,2,0.0,RUB,0.0
SNDX,MECHTRR,2021-01-15,MOEX Chemicals Net TR-Res,Индекс МосБиржи химии и нефтехимии полной доходности «нетто» (по налог.ставкам рос.орг-й),28477.62,28477.62,28477.62,28477.62,452569674.0,0,0.0,2,0.0,RUB,0.0
SNDX,MECNTR,2021-01-15,MOEX Consumer Total Return,Индекс МосБиржи потребительского сектора полной доходности «брутто»,11283.68,11283.68,11283.68,11283.68,6877798543.0,0,0.0,2,0.0,RUB,0.0
SNDX,MECNTRN,2021-01-15,MOEX Consumer Net TR-NR,Индекс МосБиржи потребит. сектора полной доходности «нетто» (по налог.ставкам ин.орг-й),10887.51,10887.51,10887.51,10887.51,6877798543.0,0,0.0,2,0.0,RUB,0.0
SNDX,MECNTRR,2021-01-15,MOEX Consumer Net TR-Res,Индекс МосБиржи потреб. сектора полной доходности «нетто» (по налог.ставкам рос.орг-й),10819.76,10819.76,10819.76,10819.76,6877798543.0,0,0.0,2,0.0,RUB,0.0
SNDX,MEEUTR,2021-01-15,MOEX El.Utilities Total Return,Индекс МосБиржи электроэнергетики полной доходности «брутто»,3365.17,3365.17,3365.17,3365.17,2904573041.0,0,0.0,2,0.0,RUB,0.0
SNDX,MEEUTRN,2021-01-15,MOEX El. Utilities Net TR-NR,Индекс МосБиржи электроэнергетики полной доходности «нетто» (по налог.ставкам ин.орг-й),3184.62,3184.62,3184.62,3184.62,2904573041.0,0,0.0,2,0.0,RUB,0.0
SNDX,MEEUTRR,2021-01-15,MOEX El. Utilities Net TR-Res,Индекс МосБиржи электроэнергетики полной доходности «нетто» (по налог.ставкам рос.орг-й),3213.52,3213.52,3213.52,3213.52,2904573041.0,0,0.0,2,0.0,RUB,0.0
SNDX,MEFNTR,2021-01-15,MOEX Financials Total Return,Индекс МосБиржи финансов полной доходности «брутто»,12908.76,12908.76,12908.76,12908.76,29043504590.0,0,0.0,2,0.0,RUB,0.0
SNDX,MEFNTRN,2021-01-15,MOEX Financials Net TR-NR,Индекс МосБиржи финансов полной доходности «нетто» (по налог.ставкам ин.орг-й),12343.49,12343.49,12343.49,12343.49,29043504590.0,0,0.0,2,0.0,RUB,0.0
SNDX,MEFNTRR,2021-01-15,MOEX Financials Net TR-Res,Индекс МосБиржи финансов полной доходности «нетто» (по налог.ставкам рос.орг-й),12434.84,12434.84,12434.84,12434.84,29043504590.0,0,0.0,2,0.0,RUB,0.0
SNDX,MEMMTR,2021-01-15,MOEX Metals & Min Total Return,Индекс МосБиржи металлов и добычи полной доходности «брутто»,17413.97,17413.97,17413.97,17413.97,19433958023.0,0,0.0,2,0.0,RUB,0.0
SNDX,MEMMTRN,2021-01-15,MOEX Metals & Mining Net TR-NR,Индекс МосБиржи металлов и добычи полной доходности «нетто» (по налог.ставкам ин.орг-й),16171.75,16171.75,16171.75,16171.75,19433958023.0,0,0.0,2,0.0,RUB,0.0
SNDX,MEMMTRR,2021-01-15,MOEX Metals & Min Net TR-Res,Индекс МосБиржи металлов и добычи полной доходности «нетто» (по налог.ставкам рос.орг-й),16370.89,16370.89,16370.89,16370.89,19433958023.0,0,0.0,2,0.0,RUB,0.0
SNDX,MEOGTR,2021-01-15,MOEX Oil & Gas Total Return,Индекс МосБиржи нефти и газа полной доходности «брутто»,11514.55,11514.55,11514.55,11514.55,39871915349.0,0,0.0,2,0.0,RUB,0.0
SNDX,MEOGTRN,2021-01-15,MOEX Oil & Gas Net TR-NR,Индекс МосБиржи нефти и газа полной доходности «нетто» (по налог.ставкам ин.орг-й),10901.18,10901.18,10901.18,10901.18,39871915349.0,0,0.0,2,0.0,RUB,0.0
SNDX,MEOGTRR,2021-01-15,MOEX Oil & Gas Net TR-Res,Индекс МосБиржи нефти и газа полной доходности «нетто» (по налог.ставкам рос.орг-й),11001.01,11001.01,11001.01,11001.01,39871915349.0,0,0.0,2,0.0,RUB,0.0
SNDX,MESMTR,2021-01-15,MOEX SMID Total Return,Индекс МосБиржи средней и малой капитализации полной доходности «брутто»,2801.07,2801.07,2801.07,2801.07,6496046271.0,0,0.0,2,0.0,RUB,0.0
SNDX,MESMTRN,2021-01-15,MOEX SMID Net TR-NR,Индекс МосБиржи средней капитализации полной доходности «нетто» (по нал.ставкам ин.орг-й),2660.95,2660.95,2660.95,2660.95,6496046271.0,0,0.0,2,0.0,RUB,0.0
SNDX,MESMTRR,2021-01-15,MOEX SMID Net TR-Res,Индекс МосБиржи средней капитализации полной доходности «нетто» (по нал.ставкам рос.орг-й),2684.91,2684.91,2684.91,2684.91,6496046271.0,0,0.0,2,0.0,RUB,0.0
SNDX,METLTR,2021-01-15,MOEX Telecom Total Return,Индекс МосБиржи телекоммуникаций полной доходности «брутто»,4466.42,4466.42,4466.42,4466.42,1073063467.0,0,0.0,2,0.0,RUB,0.0
SNDX,METLTRN,2021-01-15,MOEX Telecom Net TR-NR,Индекс МосБиржи телекоммуникаций полной доходности «нетто» (по налог.ставкам ин.орг-й),4058.82,4058.82,4058.82,4058.82,1073063467.0,0,0.0,2,0.0,RUB,0.0
SNDX,METLTRR,2021-01-15,MOEX Telecom Net TR-Res,Индекс МосБиржи телекоммуникаций полной доходности «нетто» (по налог.ставкам рос.орг-й),4123.5,4123.5,4123.5,4123.5,1073063467.0,0,0.0,2,0.0,RUB,0.0
SNDX,METNTR,2021-01-15,MOEX Transport Total Return,Индекс МосБиржи транспорта полной доходности «брутто»,1925.05,1925.05,1925.05,1925.05,1342423056.0,0,0.0,2,0.0,RUB,0.0
SNDX,METNTRN,2021-01-15,MOEX Transport Net TR-NR,Индекс МосБиржи транспорта полной доходности «нетто» (по налог.ставкам ин.орг-й),1830.09,1830.09,1830.09,1830.09,1342423056.0,0,0.0,2,0.0,RUB,0.0
SNDX,METNTRR,2021-01-15,MOEX Transport Net TR-Res,Индекс МосБиржи транспорта полной доходности «нетто» (по налог.ставкам рос.орг-й),1844.4,1844.4,1844.4,1844.4,1342423056.0,0,0.0,2,0.0,RUB,0.0
SNDX,MOEX10,2021-01-15,Индекс МосБиржи 10,Индекс МосБиржи 10,5549.63,5634.12,5667.74,5539.1,60506340506.9,0,0.0,2,12568763948801.57,RUB,5391.01
RTSI,MOEXBC,2021-01-15,Индекс голубых фишек,Индекс МосБиржи голубых фишек,22670.47,22987.41,23148.17,22646.47,77846987404.5,0,0.0,2,13967241429688.861,RUB,616098470.6265
SNDX,MOEXBMI,2021-01-15,Индекс широкого рынка,Индекс МосБиржи широкого рынка,2469.71,2492.64,2511.23,2468.4,107420797485.84,0,0.0,2,19165006944608.56,RUB,7760008376.088
SNDX,MOEXCH,2021-01-15,Индекс химии и нефтехимии,Индекс МосБиржи химии и нефтехимии,19284.11,19249.88,19374.14,19183.61,451207746.2,0,0.0,2,201982364179.15,RUB,10474029.9738
SNDX,MOEXCN,2021-01-15,Индекс потребительского сектора / Индекс потребит сектора,Индекс МосБиржи потребительского сектора,8478.52,8543.68,8560.51,8469.2,6876946604.12,0,0.0,2,163753923833.2167,RUB,19313982.7282
SNDX,MOEXEU,2021-01-15,Индекс электроэнергетики,Индекс МосБиржи электроэнергетики,2329.01,2332.91,2347.27,2326.38,2900553036.4,0,0.0,2,290054227397.917,RUB,124539818.5684
SNDX,MOEXFN,2021-01-15,Индекс финансов,Индекс МосБиржи финансов,9564.35,9357.29,9731.02,9348.61,29012431931.4,0,0.0,2,976535665789.073,RUB,102101671.187
SNDX,MOEXINN,2021-01-15,Индекс МосБиржи инноваций,Индекс МосБиржи инноваций,380.91,375.32,385.04,373.52,247166647.2,0,0.0,2,10697601382.1485,RUB,28084330.4761
SNDX,MOEXMM,2021-01-15,Индекс металлов и добычи,Индекс МосБиржи металлов и добычи,10618.82,10748.44,10805.25,10618.82,19396228702.82,0,0.0,2,1885292550382.2576,RUB,177542507.7844
SNDX,MOEXOG,2021-01-15,Индекс нефти и газа,Индекс МосБиржи нефти и газа,7979.52,8048.26,8099.56,7960.19,39845245103.4,0,0.0,2,1298381001236.7627,RUB,162714074.6339
SNDX,MOEXREPO,2021-01-15,MXREPO,MOEXREPO обл 12:30,4.28,4.28,4.28,4.28,323693655866.0,,,2,,RUB,
SNDX,MOEXREPO1W,2021-01-15,MOEXREPO1W,MOEXREPO 1 неделя 12:30,4.28,4.28,4.28,4.28,26014694363.0,,,2,,RUB,
SNDX,MOEXREPO1WE,2021-01-15,MOEXREPO1WE,MOEXREPO 1 неделя 19:00,3.96,3.96,3.96,3.96,,,,2,,RUB,
SNDX,MOEXREPOE,2021-01-15,MXREPOE,MOEXREPO обл 19:00,4.28,4.28,4.28,4.28,143960455189.0,,,2,,RUB,
SNDX,MOEXREPOEQ,2021-01-15,MXREPOEQ,MOEXREPO акц 12:30,4.19,4.19,4.19,4.19,30295430510.0,,,2,,RUB,
SNDX,MOEXREPOEQE,2021-01-15,MXREPOEQE,MOEXREPO акц 19:00,4.47,4.47,4.47,4.47,32016598563.0,,,2,,RUB,
SNDX,MOEXREPOUSD,2021-01-15,MOEXREPOUSD,MOEXREPO USD 12:30,0.19,0.19,0.19,0.19,1678014059.0,,,2,,USD,
SNDX,MOEXREPOUSDE,2021-01-15,MOEXREPOUSDE,MOEXREPO USD 19:00,0.17,0.17,0.17,0.17,65241569.0,,,2,,USD,
SNDX,MOEXTL,2021-01-15,Индекс телекоммуникаций,Индекс МосБиржи телекоммуникаций,2340.79,2346.81,2355.18,2332.74,1071649103.0,0,0.0,2,416661753198.8712,RUB,178000185.54
SNDX,MOEXTN,2021-01-15,Индекс транспорта,Индекс МосБиржи транспорта,1368.5,1369.74,1382.7,1365.16,1341757480.3,0,0.0,2,187532877764.204,RUB,137035373.9192
SNDX,MRBC,2021-01-15,Индекс МосБиржи 15,Индекс МосБиржи 15,1731.8,1756.95,1767.1,1729.81,77846987404.5,0,0.0,2,11277342223770.555,RUB,6511921170.5989
RTSI,MRBCTR,2021-01-15,Индекс МосБиржи полн дох-ти 15,Индекс МосБиржи полной доходности 15,2093.9,2093.9,2093.9,2093.9,77913023044.0,0,0.0,2,0.0,RUB,0.0
RTSI,MRRT,2021-01-15,"Индекс ""Ответственность и открытость""",Индекс МосБиржи - РСПП Ответственность и открытость,2707.33,2707.33,2707.33,2707.33,91997884738.0,0,0.0,2,42804496386641.38,RUB,4957833678.8508
RTSI,MRSV,2021-01-15,"Индекс ""Вектор устойчивого развития""",Индекс МосБиржи - РСПП Вектор устойчивого развития,3021.39,3021.39,3021.39,3021.39,89068116495.0,0,0.0,2,40799865377882.984,RUB,291060494.3854
RTSI,MRSVT,2021-01-15,Индекс МосБиржи-РСПП Вектор TR,"Индекс МосБиржи - РСПП Вектор устойчивого развития, полной доходности брутто",3789.0,3789.0,3789.0,3789.0,89068116495.0,0,0.0,2,0.0,RUB,0.0
INAV,MTEKA,2021-01-15,iNAV Фридом - Лидеры Технологий,Расчетная цена одного пая Биржевого ПИФа «Фридом - Лидеры Технологий»,1784.15,1784.53,1806.97,1783.41,0.0,0,0.0,2,0.0,RUB,0.0
INAV,OPNWO,2021-01-15,iNAV «Открытие – Всепогодный»,Биржевой паевой инвестиционный фонд рыночных финансовых инструментов «Открытие – Всепогодный»,1.1098,1.1195,1.1195,1.1098,0.0,0,0.0,4,0.0,USD,0.0
INAV,RCMBD,2021-01-15,iNAV «Райффайзен –Еврооблигации»,Биржевой паевой инвестиционный фонд рыночных финансовых инструментов «Райффайзен – Еврооблигации»,12.98,12.98,12.98,12.97,0.0,0,0.0,2,0.0,USD,0.0
INAV,RFBC15,2021-01-15,iNAV «Raiffeisen-MOEX Index 15»,Расчетная цена одного пая Биржевого ПИФа «Райффайзен – Индекс МосБиржи полной доходности 15»,1306.34,1322.04,1329.78,1305.06,0.0,0,0.0,2,0.0,RUB,0.0
SNDX,RGBI,2021-01-15,Индекс Мосбиржи гос обл RGBI,Индекс Мосбиржи государственных облигаций ценовой,151.8,152.48,152.62,151.8,10452942218.1,1791,5.95,2,8821560059152.344,RUB,1.0
SNDX,RGBITR,2021-01-15,Индекс Мосбиржи гос обл RGBITR,Индекс Мосбиржи государственных облигаций,616.79,619.5,620.06,616.79,10452942218.1,1791,5.95,2,9000086732988.05,RUB,1.0
SNDX,RPGCC,2021-01-15,MOEXREPOGCC,MOEXREPO КСУ 12:30,4.33,4.33,4.33,4.33,96085647000.0,,,2,,RUB,
SNDX,RPGCC1W,2021-01-15,MOEXREPOGCC1W,MOEXREPO КСУ 1 неделя 12:30,4.35,4.35,4.35,4.35,1705000000.0,,,2,,RUB,
SNDX,RPGCC1WE,2021-01-15,MOEXREPOGCC1WE,MOEXREPO КСУ 1 неделя 19:00,4.41,4.41,4.41,4.41,4368900000.0,,,2,,RUB,
SNDX,RPGCCE,2021-01-15,MOEXREPOGCCE,MOEXREPO КСУ 19:00,4.39,4.39,4.39,4.39,131463473000.0,,,2,,RUB,
RTSI,RTSCH,2021-01-15,Индекс РТС химии и нефтехимии,Индекс РТС химии и нефтехимии,272.72,274.17,274.84,272.25,6118958.902511957,0,0.0,2,2739141328.696502,USD,10043947.695
RTSI,RTSCR,2021-01-15,Индекс РТС потреб. сектора,Индекс РТС потребительских товаров и розничной торговли,260.42,264.3,264.3,259.79,93260264.25691591,0,0.0,2,2220714379.3501797,USD,8527282.6944
RTSI,RTSEU,2021-01-15,Индекс РТС электроэнергетики,Индекс РТС электроэнергетики,80.07,80.78,81.12,79.86,39335239.64019187,0,0.0,2,3933509368.7886515,USD,49124990.0073
RTSI,RTSFN,2021-01-15,Индекс РТС финансов,Индекс РТС финансов,225.51,222.2,230.36,220.98,393445990.555918,0,0.0,2,13243082939.342697,USD,58724922.3762
RTSI,RTSI,2021-01-15,Индекс РТС,Индекс РТС,1474.28,1499.87,1507.06,1470.92,1423632930.8170812,0,0.0,2,237704349412.32913,USD,161234282.6352
RTSI,RTSMM,2021-01-15,Индекс РТС металлов и добычи,Индекс РТС металлов и добычи,302.71,308.59,308.89,302.26,263037874.00775436,0,0.0,2,25566998200.17626,USD,84459553.1639
RTSI,RTSOG,2021-01-15,Индекс РТС нефти и газа,Индекс РТС нефти и газа,210.09,213.41,213.98,209.33,540352906.8407214,0,0.0,2,17607720730.15018,USD,83810552.5083
RTSI,RTSSM,2021-01-15,RTS SMID Index,Индекс РТС средней и малой капитализации,1267.04,1267.04,1267.04,1267.04,1194678.6115694074,0,0.0,2,866048095.8606753,USD,8817568.3892
RTSI,RTSTL,2021-01-15,Индекс РТС телекоммуникаций,Индекс РТС телекоммуникаций ,97.33,98.27,98.47,96.9,14532943.80337215,0,0.0,2,5650470687.93535,USD,58056740.3599
RTSI,RTSTN,2021-01-15,Индекс РТС транспорта,Индекс РТС транспорта,45.35,45.71,46.03,45.19,18195961.723260187,0,0.0,2,2543187659.283503,USD,56082557.4433
RTSI,RTSTR,2021-01-15,RTS Total Return,Индекс РТС полной доходности «брутто»,2670.04,2670.04,2670.04,2670.04,105079082079.0,0,0.0,2,0.0,USD,0.0
RTSI,RTSTRN,2021-01-15,RTS Net-TR-NR,Индекс РТС полной доходности «нетто» (по налоговым ставкам иностранных организаций),2442.91,2442.91,2442.91,2442.91,105079082079.0,0,0.0,2,0.0,USD,0.0
RTSI,RTSTRR,2021-01-15,RTS Net-TR-Res,Индекс РТС полной доходности «нетто» (по налоговым ставкам российских организаций),2496.48,2496.48,2496.48,2496.48,105079082079.0,0,0.0,2,0.0,USD,0.0
RTSI,RTSUSDCUR,2021-01-15,RTSUSDCUR,Курс доллара США на момент закрытия Индекса РТС,73.7393,73.7393,73.7393,73.7393,0.0,,,2,0.0,USD,
RTSI,RUABICP,2021-01-15,ABI CP,Композитный индекс облигаций ,114.98,114.98,114.98,114.98,15081173363.0,1665,5.65,2,10514263336480.129,RUB,1000000000000.0
RTSI,RUABITR,2021-01-15,ABI TR,Композитный индекс облигаций — совокупный доход,224.28,224.28,224.28,224.28,15081173363.0,1665,5.65,2,10716322041718.56,RUB,1000000000000.0
RTSI,RUBMI,2021-01-15,Индекс РТС широкого рынка,Индекс РТС широкого рынка,1075.18,1092.9,1098.95,1072.84,1456764540.5616815,0,0.0,2,259902208789.73035,USD,241729735.9223
RTSI,RUCBCP3A3YNS,2021-01-15,RUCBCP3A3YNS,Индекс МосБиржи Корпоративных Облигаций RUCBCP3A3YNS,105.85,105.85,105.85,105.85,74862049.0,610,5.16,2,194711700000.0,RUB,194584800000.0
RTSI,RUCBCP3A5YNS,2021-01-15,RUCBCP3A5YNS,Индекс МосБиржи Корпоративных Облигаций RUCBCP3A5YNS,110.56,110.56,110.56,110.56,48630265.0,1380,6.04,2,215201000000.0,RUB,215390500000.0
SNDX,RUCBCP3Y,2021-01-15,Индекс Мосбиржи корп обл CBICP 3-5,Индекс Мосбиржи корпоративных облигаций MOEX 1 - 3 ценовой,93.2,93.19,93.29,93.18,1775675110.9,659,5.75,2,750829705614.5009,RUB,1.0
RTSI,RUCBCP3YNS,2021-01-15,RUCBCP3YNS,Индекс МосБиржи Корпоративных Облигаций RUCBCP3YNS,103.89,103.89,103.89,103.89,1744964489.0,659,5.64,2,787748421061.8,RUB,760055620127.4772
SNDX,RUCBCP5Y,2021-01-15,Индекс Мосбиржи корп обл CBICP 1-3,Индекс Мосбиржи корпоративных облигаций ценовой 3-5,123.57,123.68,123.79,123.57,656056008.0,1309,6.16,2,448732950000.0,RUB,1.0
RTSI,RUCBCP5YNS,2021-01-15,RUCBCP5YNS,Индекс МосБиржи Корпоративных Облигаций RUCBCP5YNS,110.33,110.33,110.33,110.33,393631726.0,1334,6.23,2,431518950000.0,RUB,356371434519.3
RTSI,RUCBCPA3YNS,2021-01-15,RUCBCPA3YNS,Индекс МосБиржи Корпоративных Облигаций RUCBCPA3YNS,100.73,100.73,100.73,100.73,90294083.0,650,6.24,2,158521000000.0,RUB,104557260563.52
RTSI,RUCBCPA5YNS,2021-01-15,RUCBCPA5YNS,Индекс МосБиржи Корпоративных Облигаций RUCBCPA5YNS,110.49,110.49,110.49,110.49,315064478.0,1348,6.67,2,101747500000.0,RUB,101783500000.0
RTSI,RUCBCPAA3YNS,2021-01-15,RUCBCPAA3YNS,Индекс МосБиржи Корпоративных Облигаций RUCBCPAA3YNS,100.35,100.35,100.35,100.35,1559296987.0,655,5.62,2,398812221061.8,RUB,256060559976.2772
RTSI,RUCBCPAA5YNS,2021-01-15,RUCBCPAA5YNS,Индекс МосБиржи Корпоративных Облигаций RUCBCPAA5YNS,111.41,111.41,111.41,111.41,29936983.0,1311,6.13,2,114570450000.0,RUB,114820750000.0
RTSI,RUCBCPAAANS,2021-01-15,RUCBCPAAANS,Индекс МосБиржи Корпоративных Облигаций RUCBCPAAANS,108.62,108.62,108.62,108.62,182172599.0,1235,5.67,2,546543200000.0,RUB,270715597244.39
RTSI,RUCBCPAANS,2021-01-15,RUCBCPAANS,Индекс МосБиржи Корпоративных Облигаций RUCBCPAANS,105.02,105.02,105.02,105.02,1591134220.0,862,5.77,2,544020171061.8,RUB,409838407103.7885
RTSI,RUCBCPANS,2021-01-15,RUCBCPANS,Индекс МосБиржи Корпоративных Облигаций RUCBCPANS,105.22,105.22,105.22,105.22,405358561.0,890,6.34,2,260268500000.0,RUB,180389731839.67
