BOARDID,SECID,TRADEDATE,SHORTNAME,NAME,CLOSE,OPEN,HIGH,LOW,VALUE,DURATION,YIELD,DECIMALS,CAPITALIZATION,CURRENCYID,DIVISOR
INAV,AKEUA,2020-07-23,iNAV Альфа-Капитал ЕВРОПА 600,Расчетная цена одного пая Биржевого ПИФа «ЕВРОПА 600»,10.13,10.13,10.2,10.11,,,,2,,EUR,
INAV,AKMBA,2020-07-23,iNAV Альфа Управляемые облигации,Расчетная цена одного пая Биржевого ПИФа РФИ «Альфа-Капитал Управляемые облигации»,1.0165,1.016,1.0168,1.0157,,,,2,,RUB,
INAV,AKNXA,2020-07-23,iNAV Технологии 100,Расчетная цена одного пая Биржевого ПИФа «ТЕХНОЛОГИИ 100»,15.73,15.8,15.81,15.68,,,,2,,USD,
INAV,AKSPA,2020-07-23,iNAV Альфа - Капитал Эс энд Пи 500,Расчетная цена одного пая Биржевого ПИФа «Альфа - Капитал Эс энд Пи 500»,11.26,11.28,11.29,11.24,,,,2,,USD,
RTSI,BPSI,2020-07-23,Субиндекс облигаций,Индексы активов пенсионных накоплений - Субиндекс облигаций,2949.2709,2949.2709,2949.2709,2949.2709,172422288.1,,,2,413585715350.0,RUB,0.001
RTSI,EPSI,2020-07-23,Субиндекс акций,Индексы активов пенсионных накоплений - Субиндекс акций,1691.3744,1691.3744,1691.3744,1691.3744,47258621493.55,,,2,6627956542980.194,RUB,3918680996.809
INAV,ESGRA,2020-07-23,iNAV RSHB-MOEX-RSPP ESG VecTR ,Расчетная цена одного пая Биржевого ПИФа «РСХБ–Индекс МосБиржи–РСПП Вектор развития полн дох-ти»,1044.18,1045.69,1048.7,1042.08,,,,2,,RUB,
RTSI,GPBCBI2Y,2020-07-23,Индикатор GPBCBI2Y,Индикатор GPBCBI2Y,1154.46,1154.46,1154.46,1154.46,,,,2,,RUB,
RTSI,GPBCBI4Y,2020-07-23,Индикатор GPBCBI4Y,Индикатор GPBCBI4Y,1201.52,1201.52,1201.52,1201.52,,,,2,,RUB,
INAV,GPBMA,2020-07-23,iNAV ГПБ - Корп. облигации 4г,Расчетная цена одного пая Биржевого ПИФа «Газпромбанк – Корпоративные облигации 4 года»,57170.65,57082.86,57186.2,57082.39,,,,2,,RUB,
INAV,GPBSA,2020-07-23,iNAV ГПБ - Корп. облигации 2г,Расчетная цена одного пая Биржевого ПИФа «Газпромбанк – Корпоративные облигации 2 года»,55308.41,55340.29,55393.58,55307.61,,,,2,,RUB,
SNDX,IMOEX,2020-07-23,Индекс МосБиржи,Индекс МосБиржи,2851.79,2848.41,2866.78,2843.93,55384618689.1,0,0.0,2,12142451480200.0,RUB,4257839328.87
SNDX,IMOEX2,2020-07-23,Индекс МосБиржи (доп. сессия),Индекс МосБиржи (Дополнительная сессия),2837.19,2851.41,2852.53,2828.75,4946916201.15,0,0.0,2,12080288091500.0,RUB,4257839328.87
RTSI,MCFTR,2020-07-23,MOEX Russia Total Return,Индекс МосБиржи полной доходности «брутто»,5041.02,5041.02,5041.02,5041.02,55384618689.05,,,2,12142451480165.63,RUB,
RTSI,MCFTRN,2020-07-23,MOEX Russia Net-TR-NR,Индекс МосБиржи полной доходности «нетто» (по налоговым ставкам иностранных организаций),4629.06,4629.06,4629.06,4629.06,55384618689.05,,,2,12142451480165.63,RUB,
RTSI,MCFTRR,2020-07-23,MOEX Russia Net-TR-Res,Индекс МосБиржи полной доходности «нетто» (по налоговым ставкам российских организаций),4729.0,4729.0,4729.0,4729.0,55384618689.05,,,2,12142451480165.63,RUB,
RTSI,MCXSM,2020-07-23,Индекс МосБиржи SMID,Индекс МосБиржи средней и малой капитализации,1712.91,1712.91,1712.91,1712.91,4347266298.18,,,2,470998605725.2288,RUB,274969708.379
RTSI,MEBCTR,2020-07-23,MOEX Blue Chip Total Return,Индекс МосБиржи голубых фишек полной доходности «брутто»,30968.66,30968.66,30968.66,30968.66,44113302213.4,,,2,9943097355258.79,RUB,
RTSI,MEBCTRN,2020-07-23,MOEX Blue Chip Net-TR-NR,Индекс МосБиржи голубых фишек полной доходности «нетто» (по налоговым ставкам иностр. орг.),28745.64,28745.64,28745.64,28745.64,44113302213.4,,,2,9943097355258.79,RUB,
RTSI,MEBCTRR,2020-07-23,MOEX Blue Chip Net-TR-Res,Индекс МосБиржи голубых фишек полной доходности «нетто» (по налоговым ставкам росс. орг.),29236.77,29236.77,29236.77,29236.77,44113302213.4,,,2,9943097355258.79,RUB,
SNDX,MECHTR,2020-07-23,MOEX Chemicals Total Return,Индекс МосБиржи химии и нефтехимии полной доходности «брутто»,25409.57,25409.57,25409.57,25409.57,,,,2,,RUB,
SNDX,MECHTRN,2020-07-23,MOEX Chemicals Net TR-NR,Индекс МосБиржи химии и нефтехимии полной доходности «нетто» (по налог.ставкам ин.орг-й),23869.7,23869.7,23869.7,23869.7,,,,2,,RUB,
SNDX,MECHTRR,2020-07-23,MOEX Chemicals Net TR-Res,Индекс МосБиржи химии и нефтехимии полной доходности «нетто» (по налог.ставкам рос.орг-й),24108.79,24108.79,24108.79,24108.79,,,,2,,RUB,
SNDX,MECNTR,2020-07-23,MOEX Consumer Total Return,Индекс МосБиржи потребительского сектора полной доходности «брутто»,9213.85,9213.85,9213.85,9213.85,,,,2,,RUB,
SNDX,MECNTRN,2020-07-23,MOEX Consumer Net TR-NR,Индекс МосБиржи потребит. сектора полной доходности «нетто» (по налог.ставкам ин.орг-й),8925.04,8925.04,8925.04,8925.04,,,,2,,RUB,
SNDX,MECNTRR,2020-07-23,MOEX Consumer Net TR-Res,Индекс МосБиржи потреб. сектора полной доходности «нетто» (по налог.ставкам рос.орг-й),8864.88,8864.88,8864.88,8864.88,,,,2,,RUB,
SNDX,MEEUTR,2020-07-23,MOEX El.Utilities Total Return,Индекс МосБиржи электроэнергетики полной доходности «брутто»,3178.38,3178.38,3178.38,3178.38,,,,2,,RUB,
SNDX,MEEUTRN,2020-07-23,MOEX El. Utilities Net TR-NR,Индекс МосБиржи электроэнергетики полной доходности «нетто» (по налог.ставкам ин.орг-й),3012.95,3012.95,3012.95,3012.95,,,,2,,RUB,
SNDX,MEEUTRR,2020-07-23,MOEX El. Utilities Net TR-Res,Индекс МосБиржи электроэнергетики полной доходности «нетто» (по налог.ставкам рос.орг-й),3039.6,3039.6,3039.6,3039.6,,,,2,,RUB,
SNDX,MEFNTR,2020-07-23,MOEX Financials Total Return,Индекс МосБиржи финансов полной доходности «брутто»,9478.49,9478.49,9478.49,9478.49,,,,2,,RUB,
SNDX,MEFNTRN,2020-07-23,MOEX Financials Net TR-NR,Индекс МосБиржи финансов полной доходности «нетто» (по налог.ставкам ин.орг-й),9104.41,9104.41,9104.41,9104.41,,,,2,,RUB,
SNDX,MEFNTRR,2020-07-23,MOEX Financials Net TR-Res,Индекс МосБиржи финансов полной доходности «нетто» (по налог.ставкам рос.орг-й),9166.28,9166.28,9166.28,9166.28,,,,2,,RUB,
SNDX,MEMMTR,2020-07-23,MOEX Metals & Min Total Return,Индекс МосБиржи металлов и добычи полной доходности «брутто»,12928.83,12928.83,12928.83,12928.83,,,,2,,RUB,
SNDX,MEMMTRN,2020-07-23,MOEX Metals & Mining Net TR-NR,Индекс МосБиржи металлов и добычи полной доходности «нетто» (по налог.ставкам ин.орг-й),12057.59,12057.59,12057.59,12057.59,,,,2,,RUB,
SNDX,MEMMTRR,2020-07-23,MOEX Metals & Min Net TR-Res,Индекс МосБиржи металлов и добычи полной доходности «нетто» (по налог.ставкам рос.орг-й),12199.15,12199.15,12199.15,12199.15,,,,2,,RUB,
SNDX,MEOGTR,2020-07-23,MOEX Oil & Gas Total Return,Индекс МосБиржи нефти и газа полной доходности «брутто»,9851.26,9851.26,9851.26,9851.26,,,,2,,RUB,
SNDX,MEOGTRN,2020-07-23,MOEX Oil & Gas Net TR-NR,Индекс МосБиржи нефти и газа полной доходности «нетто» (по налог.ставкам ин.орг-й),9343.35,9343.35,9343.35,9343.35,,,,2,,RUB,
SNDX,MEOGTRR,2020-07-23,MOEX Oil & Gas Net TR-Res,Индекс МосБиржи нефти и газа полной доходности «нетто» (по налог.ставкам рос.орг-й),9426.68,9426.68,9426.68,9426.68,,,,2,,RUB,
SNDX,MESMTR,2020-07-23,MOEX SMID Total Return,Индекс МосБиржи средней и малой капитализации полной доходности «брутто»,2363.11,2363.11,2363.11,2363.11,,,,2,,RUB,
SNDX,MESMTRN,2020-07-23,MOEX SMID Net TR-NR,Индекс МосБиржи средней капитализации полной доходности «нетто» (по нал.ставкам ин.орг-й),2251.87,2251.87,2251.87,2251.87,,,,2,,RUB,
SNDX,MESMTRR,2020-07-23,MOEX SMID Net TR-Res,Индекс МосБиржи средней капитализации полной доходности «нетто» (по нал.ставкам рос.орг-й),2271.17,2271.17,2271.17,2271.17,,,,2,,RUB,
SNDX,METLTR,2020-07-23,MOEX Telecom Total Return,Индекс МосБиржи телекоммуникаций полной доходности «брутто»,4132.15,4132.15,4132.15,4132.15,,,,2,,RUB,
SNDX,METLTRN,2020-07-23,MOEX Telecom Net TR-NR,Индекс МосБиржи телекоммуникаций полной доходности «нетто» (по налог.ставкам ин.орг-й),3772.28,3772.28,3772.28,3772.28,,,,2,,RUB,
SNDX,METLTRR,2020-07-23,MOEX Telecom Net TR-Res,Индекс МосБиржи телекоммуникаций полной доходности «нетто» (по налог.ставкам рос.орг-й),3830.01,3830.01,3830.01,3830.01,,,,2,,RUB,
SNDX,METNTR,2020-07-23,MOEX Transport Total Return,Индекс МосБиржи транспорта полной доходности «брутто»,2022.8,2022.8,2022.8,2022.8,,,,2,,RUB,
SNDX,METNTRN,2020-07-23,MOEX Transport Net TR-NR,Индекс МосБиржи транспорта полной доходности «нетто» (по налог.ставкам ин.орг-й),1934.06,1934.06,1934.06,1934.06,,,,2,,RUB,
SNDX,METNTRR,2020-07-23,MOEX Transport Net TR-Res,Индекс МосБиржи транспорта полной доходности «нетто» (по налог.ставкам рос.орг-й),1947.69,1947.69,1947.69,1947.69,,,,2,,RUB,
SNDX,MOEX10,2020-07-23,Индекс МосБиржи 10,Индекс МосБиржи 10,4968.93,4972.65,5006.15,4965.45,32025726400.5,0,0.0,2,8982763869280.0,RUB,4928.35
RTSI,MOEXBC,2020-07-23,Индекс голубых фишек,Индекс МосБиржи голубых фишек,18821.99,18777.85,18919.1,18767.19,44113302213.4,0,0.0,2,9943097355260.0,RUB,528270321.54
SNDX,MOEXBMI,2020-07-23,Индекс широкого рынка,Индекс МосБиржи широкого рынка,2044.47,2047.32,2055.41,2039.48,57563698451.0,0,0.0,2,14848067192100.0,RUB,7262560801.2
SNDX,MOEXCH,2020-07-23,Индекс химии и нефтехимии,Индекс МосБиржи химии и нефтехимии,16709.06,16658.74,16786.27,16658.55,176257253.4,0,0.0,2,177212479968.0,RUB,10605772.4903
SNDX,MOEXCN,2020-07-23,Индекс потребительского сектора / Индекс потребит сектора,Индекс МосБиржи потребительского сектора,7105.58,7058.93,7110.75,7058.93,6137721454.76,0,0.0,2,179736371714.0,RUB,25295101.5043
SNDX,MOEXEU,2020-07-23,Индекс электроэнергетики,Индекс МосБиржи электроэнергетики,2224.96,2245.69,2248.9,2218.59,3674016217.5,0,0.0,2,285843503008.0,RUB,128471361.257
SNDX,MOEXFN,2020-07-23,Индекс финансов,Индекс МосБиржи финансов,7239.14,7307.44,7312.5,7206.8,12050712084.0,0,0.0,2,784343942155.0,RUB,108347612.073
SNDX,MOEXINN,2020-07-23,Индекс МосБиржи инноваций,Индекс МосБиржи инноваций,413.83,412.86,418.3,406.81,144847417.5,0,0.0,2,3001002538.24,RUB,7251762.984
SNDX,MOEXMM,2020-07-23,Индекс металлов и добычи,Индекс МосБиржи металлов и добычи,8110.45,7974.6,8112.97,7952.22,18243217468.9,0,0.0,2,1285374342280.0,RUB,158483724.864
SNDX,MOEXOG,2020-07-23,Индекс нефти и газа,Индекс МосБиржи нефти и газа,6909.47,6966.04,6978.74,6902.73,14574874171.3,0,0.0,2,1143087839160.0,RUB,165437748.083
SNDX,MOEXREPO,2020-07-23,MXREPO,MOEXREPO обл 12:30,4.08,4.08,4.08,4.08,363440933571.0,,,2,,RUB,
SNDX,MOEXREPO1W,2020-07-23,MOEXREPO1W,MOEXREPO 1 неделя 12:30,4.16,4.16,4.16,4.16,78711235333.0,,,2,,RUB,
SNDX,MOEXREPO1WE,2020-07-23,MOEXREPO1WE,MOEXREPO 1 неделя 19:00,4.42,4.42,4.42,4.42,,,,2,,RUB,
SNDX,MOEXREPOE,2020-07-23,MXREPOE,MOEXREPO обл 19:00,4.16,4.16,4.16,4.16,191455314346.0,,,2,,RUB,
SNDX,MOEXREPOEQ,2020-07-23,MXREPOEQ,MOEXREPO акц 12:30,4.23,4.23,4.23,4.23,44870945667.0,,,2,,RUB,
SNDX,MOEXREPOEQE,2020-07-23,MXREPOEQE,MOEXREPO акц 19:00,4.21,4.21,4.21,4.21,30869039215.0,,,2,,RUB,
SNDX,MOEXREPOUSD,2020-07-23,MOEXREPOUSD,MOEXREPO USD 12:30,0.4,0.4,0.4,0.4,1060122971.0,,,2,,USD,
SNDX,MOEXREPOUSDE,2020-07-23,MOEXREPOUSDE,MOEXREPO USD 19:00,0.42,0.42,0.42,0.42,470977920.0,,,2,,USD,
SNDX,MOEXTL,2020-07-23,Индекс телекоммуникаций,Индекс МосБиржи телекоммуникаций,2232.97,2240.34,2244.16,2230.55,867906103.9,0,0.0,2,378547198389.0,RUB,169526680.988
SNDX,MOEXTN,2020-07-23,Индекс транспорта,Индекс МосБиржи транспорта,1494.96,1511.5,1511.5,1492.98,994788196.2,0,0.0,2,68481851855.1,RUB,45808634.8417
SNDX,MRBC,2020-07-23,Индекс МосБиржи 15,Индекс МосБиржи 15,1433.09,1426.88,1438.67,1426.88,,,,2,,RUB,
RTSI,MRBCTR,2020-07-23,Индекс МосБиржи полн дох-ти 15,Индекс МосБиржи полной доходности 15,1695.33,1695.33,1695.33,1695.33,,,,2,,RUB,
RTSI,MRRT,2020-07-23,"Индекс ""Ответственность и открытость""",Индекс МосБиржи - РСПП Ответственность и открытость,2179.43,2179.43,2179.43,2179.43,,,,2,,RUB,
RTSI,MRSV,2020-07-23,"Индекс ""Вектор устойчивого развития""",Индекс МосБиржи - РСПП Вектор устойчивого развития,2380.92,2380.92,2380.92,2380.92,,,,2,,RUB,
RTSI,MRSVT,2020-07-23,Индекс МосБиржи-РСПП Вектор TR,"Индекс МосБиржи - РСПП Вектор устойчивого развития, полной доходности брутто",2916.69,2916.69,2916.69,2916.69,,,,2,,RUB,
INAV,MTEKA,2020-07-23,iNAV Фридом - Лидеры Технологий,Расчетная цена одного пая Биржевого ПИФа «Фридом - Лидеры Технологий»,1541.07,1543.53,1557.34,1538.46,,,,2,,RUB,
RTSI,OPSI,2020-07-23,Субиндекс ОФЗ,Индексы активов пенсионных накоплений - Субиндекс ОФЗ,2064.2935,2064.2935,2064.2935,2064.2935,1101492702.08,,,2,4833592510857.82,RUB,
INAV,RFBC15,2020-07-23,iNAV «Raiffeisen-MOEX Index 15»,Расчетная цена одного пая Биржевого ПИФа «Райффайзен – Индекс МосБиржи полной доходности 15»,1067.76,1066.18,1071.82,1063.74,,,,2,,RUB,
SNDX,RGBI,2020-07-23,Индекс Мосбиржи гос обл RGBI,Индекс Мосбиржи государственных облигаций ценовой,155.99,156.06,156.2,155.98,11145942932.8,1809,5.42,2,8426515252070.0,RUB,1.0
SNDX,RGBITR,2020-07-23,Индекс Мосбиржи гос обл RGBITR,Индекс Мосбиржи государственных облигаций,614.39,614.67,615.2,614.35,11145942932.8,1809,5.42,2,8569603031660.0,RUB,1.0
SNDX,RPGCC,2020-07-23,MOEXREPOGCC,MOEXREPO КСУ 12:30,4.13,4.13,4.13,4.13,137111602000.0,,,2,,RUB,
SNDX,RPGCC1W,2020-07-23,MOEXREPOGCC1W,MOEXREPO КСУ 1 неделя 12:30,4.1,4.1,4.1,4.1,1820200000.0,,,2,,RUB,
SNDX,RPGCC1WE,2020-07-23,MOEXREPOGCC1WE,MOEXREPO КСУ 1 неделя 19:00,4.29,4.29,4.29,4.29,,,,2,,RUB,
SNDX,RPGCCE,2020-07-23,MOEXREPOGCCE,MOEXREPO КСУ 19:00,4.02,4.02,4.02,4.02,48831715000.0,,,2,,RUB,
RTSI,RTSCH,2020-07-23,Индекс РТС химии и нефтехимии,Индекс РТС химии и нефтехимии,244.7,244.41,246.36,243.6,2475241.62841,0,0.0,2,2488656205.8,USD,10170280.6297
RTSI,RTSCR,2020-07-23,Индекс РТС потреб. сектора,Индекс РТС потребительских товаров и розничной торговли,226.01,224.94,227.25,223.84,86194147.2215,0,0.0,2,2524100091.34,USD,11167995.9719
RTSI,RTSEU,2020-07-23,Индекс РТС электроэнергетики,Индекс РТС электроэнергетики,79.21,80.1,80.38,78.73,51595481.6587,0,0.0,2,4014199269.58,USD,50675795.1837
RTSI,RTSFN,2020-07-23,Индекс РТС финансов,Индекс РТС финансов,176.75,178.75,179.31,175.26,169232321.66,0,0.0,2,11014813513.6,USD,62317345.3938
RTSI,RTSI,2020-07-23,Индекс РТС,Индекс РТС,1261.62,1262.61,1274.56,1254.06,777785373.982,0,0.0,2,170520649760.0,USD,135160162.611
RTSI,RTSMM,2020-07-23,Индекс РТС металлов и добычи,Индекс РТС металлов и добычи,239.42,235.85,239.42,235.45,256195818.578,0,0.0,2,18050956875.4,USD,75393012.9342
RTSI,RTSOG,2020-07-23,Индекс РТС нефти и газа,Индекс РТС нефти и газа,188.38,190.27,191.28,187.34,204680003.698,0,0.0,2,16052778253.6,USD,85213458.6621
RTSI,RTSSM,2020-07-23,RTS SMID Index,Индекс РТС средней и малой капитализации,1130.15,1130.15,1130.15,1130.15,61050165.62,,,2,6614396476.3172,USD,5852684.6488
RTSI,RTSTL,2020-07-23,Индекс РТС телекоммуникаций,Индекс РТС телекоммуникаций ,96.14,96.64,97.1,95.7,12188305.8795,0,0.0,2,5316069357.12,USD,55293012.6018
RTSI,RTSTN,2020-07-23,Индекс РТС транспорта,Индекс РТС транспорта,51.3,51.96,51.99,50.96,13970155.0273,0,0.0,2,961714353.495,USD,18747461.487
RTSI,RTSTR,2020-07-23,RTS Total Return,Индекс РТС полной доходности «брутто»,2228.67,2228.67,2228.67,2228.67,777785373.98,,,2,170520649759.87,USD,
RTSI,RTSTRN,2020-07-23,RTS Net-TR-NR,Индекс РТС полной доходности «нетто» (по налоговым ставкам иностранных организаций),2046.74,2046.74,2046.74,2046.74,777785373.98,,,2,170520649759.87,USD,
RTSI,RTSTRR,2020-07-23,RTS Net-TR-Res,Индекс РТС полной доходности «нетто» (по налоговым ставкам российских организаций),2090.84,2090.84,2090.84,2090.84,777785373.98,,,2,170520649759.87,USD,
RTSI,RTSUSDCUR,2020-07-23,RTSUSDCUR,Курс доллара США на момент закрытия Индекса РТС,71.2081,71.2081,71.2081,71.2081,0.0,,,2,0.0,USD,
RTSI,RUABICP,2020-07-23,ABI CP,Композитный индекс облигаций ,117.72,117.72,117.72,117.72,2718669260.77,1688,5.27,2,10192728461363.22,RUB,
RTSI,RUABITR,2020-07-23,ABI TR,Композитный индекс облигаций — совокупный доход,222.6,222.6,222.6,222.6,2718669260.77,1688,5.27,2,10192728461363.22,RUB,
RTSI,RUBMI,2020-07-23,Индекс РТС широкого рынка,Индекс РТС широкого рынка,921.69,924.66,931.42,916.32,808386945.46,0,0.0,2,208516547866.0,USD,226233892.995
SNDX,RUCBCP3Y,2020-07-23,Индекс Мосбиржи корп обл CBICP 3-5,Индекс Мосбиржи корпоративных облигаций MOEX 1 - 3 ценовой,93.27,93.33,93.36,93.19,669249908.62,645,5.89,2,637378115817.0,RUB,1.0
SNDX,RUCBCP5Y,2020-07-23,Индекс Мосбиржи корп обл CBICP 1-3,Индекс Мосбиржи корпоративных облигаций ценовой 3-5,124.02,123.98,124.13,123.97,727806343.7,1340,6.25,2,506215944375.0,RUB,1.0
SNDX,RUCBICP,2020-07-23,Индекс Мосбиржи корп обл CBICP,Индекс Мосбиржи корпоративных облигаций ценовой,97.56,97.59,97.65,97.55,1507249909.12,1054,6.15,2,1245338060190.0,RUB,1.0
RTSI,RUCBICP1Y,2020-07-23,CBI CP 1Y,"Индекс корпоративных облигаций (≤ 1 года, рейтинг ≥ B-)",92.85,92.85,92.85,92.85,133727820.58,148,5.47,2,205109205589.06,RUB,
RTSI,RUCBICP3+,2020-07-23,CBI CP 3+,"Индекс корпоративных облигаций (< 1 года, рейтинг > B-)",126.43,126.43,126.43,126.43,389785008.8,1484,6.27,2,617722198028.65,RUB,
RTSI,RUCBICPB,2020-07-23,CBI CP B,"Индекс корпоративных облигаций (> 1 года, B- ≤ рейтинг < BB-)",77.85,77.85,77.85,77.85,67678477.82,862,7.25,2,54227506186.49,RUB,
RTSI,RUCBICPB3Y,2020-07-23,CBI CP B 3Y,"Индекс корпоративных облигаций (1-3 года, B- ≤ рейтинг < BB-)",79.22,79.22,79.22,79.22,18621249.02,735,7.08,2,35483622160.84,RUB,
RTSI,RUCBICPBB,2020-07-23,CBI CP BB,"Индекс корпоративных облигаций (> 1 года, BB- ≤ рейтинг < BBB-)",94.39,94.39,94.39,94.39,199309938.2,982,6.32,2,477335067003.0,RUB,
RTSI,RUCBICPBB3+,2020-07-23,CBI CP BB 3+,"Индекс корпоративных облигаций (> 3 лет, BB- ≤ рейтинг < BBB-)",120.95,120.95,120.95,120.95,88842409.4,1361,6.49,2,208422774003.0,RUB,
RTSI,RUCBICPBB3Y,2020-07-23,CBI CP BBB 3Y,"Индекс корпоративных облигаций (1-3 года, BB- ≤ рейтинг < BBB-)",92.56,92.56,92.56,92.56,110467528.8,688,6.18,2,268912293000.0,RUB,
RTSI,RUCBICPBB5Y,2020-07-23,CBI CP BB 5Y,"Индекс корпоративных облигаций (3-5 лет, BB- ≤ рейтинг < BBB-)",121.12,121.12,121.12,121.12,86215623.3,1314,6.51,2,192908424003.0,RUB,
RTSI,RUCBICPBBB,2020-07-23,CBI CP BBB,"Индекс корпоративных облигаций (> 1 года, рейтинг ≥ BBB-)",100.74,100.74,100.74,100.74,356919654.5,1114,5.79,2,735777265696.66,RUB,
RTSI,RUCBICPBBB3+,2020-07-23,CBI CP BBB 3+,"Индекс корпоративных облигаций (3-5 лет, рейтинг ≥ BBB-)",130.81,130.81,130.81,130.81,251885370.6,1568,6.09,2,390555540000.0,RUB,
RTSI,RUCBICPBBB3Y,2020-07-23,CBI CP BBB 3Y,"Индекс корпоративных облигаций (1-3 года, рейтинг ≥ BBB-)",96.27,96.27,96.27,96.27,105034283.9,601,5.46,2,345221725696.66,RUB,
RTSI,RUCBICPBBB5Y,2020-07-23,CBI CP BBB 5Y,"Индекс корпоративных облигаций (3-5 лет, рейтинг ≥ BBB-)",129.46,129.46,129.46,129.46,200418499.9,1371,6.02,2,302655640000.0,RUB,
RTSI,RUCBICPL1,2020-07-23,CBI CP L1,Индекс корпоративных облигаций Котировальный лист 1 - ценовой,94.12,94.12,94.12,94.12,281039377.22,940,6.0,2,558715906186.49,RUB,
RTSI,RUCBICPL2,2020-07-23,CBI CP L2,Индекс корпоративных облигаций Котировальный лист 2 - ценовой,105.76,105.76,105.76,105.76,249565901.3,1146,6.0,2,470230165747.02,RUB,
RTSI,RUCBICPL3,2020-07-23,CBI CP L3,Индекс корпоративных облигаций Котировальный лист 3 - ценовой,103.58,103.58,103.58,103.58,93302792.0,1136,6.27,2,238393766952.64,RUB,
SNDX,RUCBITR,2020-07-23,Индекс Мосбиржи корп обл CBITR,Индекс Мосбиржи корпоративных облигаций,445.81,445.95,446.23,445.75,1507249909.12,1054,6.15,2,1267455582700.0,RUB,1.0
RTSI,RUCBITR1Y,2020-07-23,CBI TR 1Y,"Индекс корпоративных облигаций (≤ 1 года, рейтинг ≥ B-)— совокупный доход",230.79,230.79,230.79,230.79,133727820.58,148,5.47,2,205109205589.06,RUB,
RTSI,RUCBITR3+,2020-07-23,CBI TR 3+,"Индекс корпоративных облигаций (> 3 лет, рейтинг ≥ B-) — совокупный доход",574.76,574.76,574.76,574.76,389785008.8,1484,6.27,2,617722198028.65,RUB,
RTSI,RUCBITRB,2020-07-23,CBI TR B,"Индекс корпоративных облигаций (> 1 года, B- ≤ рейтинг < BB-) — совокупный доход",438.09,438.09,438.09,438.09,67678477.82,862,7.25,2,54227506186.49,RUB,
RTSI,RUCBITRB3Y,2020-07-23,CBI TR B 3Y,"Индекс корпоративных облигаций (1-3 года, B- ≤ рейтинг < BB-) — совокупный доход",441.21,441.21,441.21,441.21,18621249.02,735,7.08,2,35483622160.84,RUB,
