BOARDID,SECID,TRADEDATE,SHORTNAME,NAME,CLOSE,OPEN,HIGH,LOW,VALUE,DURATION,YIELD,DECIMALS,CAPITALIZATION,CURRENCYID,DIVISOR
INAV,AKEUA,2020-10-13,iNAV Альфа-Капитал ЕВРОПА 600,Расчетная цена одного пая Биржевого ПИФа «ЕВРОПА 600»,10.04,10.09,10.09,10.01,0.0,0,0.0,2,0.0,EUR,0.0
INAV,AKMBA,2020-10-13,iNAV Альфа Управляемые облигации,Расчетная цена одного пая Биржевого ПИФа РФИ «Альфа-Капитал Управляемые облигации»,1.0381,1.0379,1.0385,1.0375,0.0,0,0.0,4,0.0,RUB,0.0
INAV,AKNXA,2020-10-13,iNAV Технологии 100,Расчетная цена одного пая Биржевого ПИФа «ТЕХНОЛОГИИ 100»,17.69,17.56,17.69,17.51,0.0,0,0.0,2,0.0,USD,0.0
INAV,AKSPA,2020-10-13,iNAV Альфа - Капитал Эс энд Пи 500,Расчетная цена одного пая Биржевого ПИФа «Альфа - Капитал Эс энд Пи 500»,12.12,12.14,12.14,12.09,0.0,0,0.0,2,0.0,USD,0.0
RTSI,BPSI,2020-10-13,Субиндекс облигаций,Индексы активов пенсионных накоплений - Субиндекс облигаций,2985.3233,2985.3233,2985.3233,2985.3233,255790091.5,,,2,443485336851.0,RUB,0.001
RTSI,EPSI,2020-10-13,Субиндекс акций,Индексы активов пенсионных накоплений - Субиндекс акций,1679.6734,1679.6734,1679.6734,1679.6734,44662832951.6,,,2,7010164204640.811,RUB,4173528234.8069
INAV,ESGRA,2020-10-13,iNAV RSHB-MOEX-RSPP ESG VecTR ,Расчетная цена одного пая Биржевого ПИФа «РСХБ–Индекс МосБиржи–РСПП Вектор развития полн дох-ти»,1081.63,1086.63,1091.95,1078.79,0.0,0,0.0,2,0.0,RUB,0.0
INAV,GPBMA,2020-10-13,iNAV ГПБ - Корп. облигации 4г,Расчетная цена одного пая Биржевого ПИФа «Газпромбанк – Корпоративные облигации 4 года»,57705.18,57670.39,57711.14,57643.27,0.0,0,0.0,2,0.0,RUB,0.0
INAV,GPBSA,2020-10-13,iNAV ГПБ - Корп. облигации 2г,Расчетная цена одного пая Биржевого ПИФа «Газпромбанк – Корпоративные облигации 2 года»,56097.07,56047.65,56097.63,56036.92,0.0,0,0.0,2,0.0,RUB,0.0
SNDX,IMOEX,2020-10-13,Индекс МосБиржи,Индекс МосБиржи,2829.23,2846.04,2859.52,2822.97,56828024719.1,0,0.0,2,13607767077509.918,RUB,4809707787.4153
SNDX,IMOEX2,2020-10-13,Индекс МосБиржи (доп. сессия),Индекс МосБиржи (Дополнительная сессия),2829.23,2829.22,2831.22,2824.28,3365724217.25,0,0.0,2,13607767077509.918,RUB,4809707787.4153
RTSI,MCFTR,2020-10-13,MOEX Russia Total Return,Индекс МосБиржи полной доходности «брутто»,5089.3,5089.3,5089.3,5089.3,56828024719.1,,,2,13607767077509.92,RUB,
RTSI,MCFTRN,2020-10-13,MOEX Russia Net-TR-NR,Индекс МосБиржи полной доходности «нетто» (по налоговым ставкам иностранных организаций),4661.21,4661.21,4661.21,4661.21,56828024719.1,,,2,13607767077509.92,RUB,
RTSI,MCFTRR,2020-10-13,MOEX Russia Net-TR-Res,Индекс МосБиржи полной доходности «нетто» (по налоговым ставкам российских организаций),4763.5,4763.5,4763.5,4763.5,56828024719.1,,,2,13607767077509.92,RUB,
RTSI,MCXSM,2020-10-13,Индекс МосБиржи SMID,Индекс МосБиржи средней и малой капитализации,1781.86,1781.86,1781.86,1781.86,7614185935.18,,,2,556727558077.7343,RUB,312441516.846
RTSI,MEBCTR,2020-10-13,MOEX Blue Chip Total Return,Индекс МосБиржи голубых фишек полной доходности «брутто»,30919.66,30919.66,30919.66,30919.66,38740783380.9,,,2,10854001399036.49,RUB,
RTSI,MEBCTRN,2020-10-13,MOEX Blue Chip Net-TR-NR,Индекс МосБиржи голубых фишек полной доходности «нетто» (по налоговым ставкам иностр. орг.),28622.34,28622.34,28622.34,28622.34,38740783380.9,,,2,10854001399036.49,RUB,
RTSI,MEBCTRR,2020-10-13,MOEX Blue Chip Net-TR-Res,Индекс МосБиржи голубых фишек полной доходности «нетто» (по налоговым ставкам росс. орг.),29121.91,29121.91,29121.91,29121.91,38740783380.9,,,2,10854001399036.49,RUB,
SNDX,MECHTR,2020-10-13,MOEX Chemicals Total Return,Индекс МосБиржи химии и нефтехимии полной доходности «брутто»,25923.59,25923.59,25923.59,25923.59,153349349.0,0,0.0,2,0.0,RUB,0.0
SNDX,MECHTRN,2020-10-13,MOEX Chemicals Net TR-NR,Индекс МосБиржи химии и нефтехимии полной доходности «нетто» (по налог.ставкам ин.орг-й),24352.54,24352.54,24352.54,24352.54,153349349.0,0,0.0,2,0.0,RUB,0.0
SNDX,MECHTRR,2020-10-13,MOEX Chemicals Net TR-Res,Индекс МосБиржи химии и нефтехимии полной доходности «нетто» (по налог.ставкам рос.орг-й),24596.51,24596.51,24596.51,24596.51,153349349.0,0,0.0,2,0.0,RUB,0.0
SNDX,MECNTR,2020-10-13,MOEX Consumer Total Return,Индекс МосБиржи потребительского сектора полной доходности «брутто»,10236.77,10236.77,10236.77,10236.77,3647695050.0,0,0.0,2,0.0,RUB,0.0
SNDX,MECNTRN,2020-10-13,MOEX Consumer Net TR-NR,Индекс МосБиржи потребит. сектора полной доходности «нетто» (по налог.ставкам ин.орг-й),9907.97,9907.97,9907.97,9907.97,3647695050.0,0,0.0,2,0.0,RUB,0.0
SNDX,MECNTRR,2020-10-13,MOEX Consumer Net TR-Res,Индекс МосБиржи потреб. сектора полной доходности «нетто» (по налог.ставкам рос.орг-й),9842.23,9842.23,9842.23,9842.23,3647695050.0,0,0.0,2,0.0,RUB,0.0
SNDX,MEEUTR,2020-10-13,MOEX El.Utilities Total Return,Индекс МосБиржи электроэнергетики полной доходности «брутто»,3025.29,3025.29,3025.29,3025.29,1943447139.0,0,0.0,2,0.0,RUB,0.0
SNDX,MEEUTRN,2020-10-13,MOEX El. Utilities Net TR-NR,Индекс МосБиржи электроэнергетики полной доходности «нетто» (по налог.ставкам ин.орг-й),2864.71,2864.71,2864.71,2864.71,1943447139.0,0,0.0,2,0.0,RUB,0.0
SNDX,MEEUTRR,2020-10-13,MOEX El. Utilities Net TR-Res,Индекс МосБиржи электроэнергетики полной доходности «нетто» (по налог.ставкам рос.орг-й),2890.47,2890.47,2890.47,2890.47,1943447139.0,0,0.0,2,0.0,RUB,0.0
SNDX,MEFNTR,2020-10-13,MOEX Financials Total Return,Индекс МосБиржи финансов полной доходности «брутто»,9926.75,9926.75,9926.75,9926.75,14307489824.0,0,0.0,2,0.0,RUB,0.0
SNDX,MEFNTRN,2020-10-13,MOEX Financials Net TR-NR,Индекс МосБиржи финансов полной доходности «нетто» (по налог.ставкам ин.орг-й),9497.3,9497.3,9497.3,9497.3,14307489824.0,0,0.0,2,0.0,RUB,0.0
SNDX,MEFNTRR,2020-10-13,MOEX Financials Net TR-Res,Индекс МосБиржи финансов полной доходности «нетто» (по налог.ставкам рос.орг-й),9566.86,9566.86,9566.86,9566.86,14307489824.0,0,0.0,2,0.0,RUB,0.0
SNDX,MEMMTR,2020-10-13,MOEX Metals & Min Total Return,Индекс МосБиржи металлов и добычи полной доходности «брутто»,14311.91,14311.91,14311.91,14311.91,11229017769.0,0,0.0,2,0.0,RUB,0.0
SNDX,MEMMTRN,2020-10-13,MOEX Metals & Mining Net TR-NR,Индекс МосБиржи металлов и добычи полной доходности «нетто» (по налог.ставкам ин.орг-й),13323.78,13323.78,13323.78,13323.78,11229017769.0,0,0.0,2,0.0,RUB,0.0
SNDX,MEMMTRR,2020-10-13,MOEX Metals & Min Net TR-Res,Индекс МосБиржи металлов и добычи полной доходности «нетто» (по налог.ставкам рос.орг-й),13483.43,13483.43,13483.43,13483.43,11229017769.0,0,0.0,2,0.0,RUB,0.0
SNDX,MEOGTR,2020-10-13,MOEX Oil & Gas Total Return,Индекс МосБиржи нефти и газа полной доходности «брутто»,9221.54,9221.54,9221.54,9221.54,14206637650.0,0,0.0,2,0.0,RUB,0.0
SNDX,MEOGTRN,2020-10-13,MOEX Oil & Gas Net TR-NR,Индекс МосБиржи нефти и газа полной доходности «нетто» (по налог.ставкам ин.орг-й),8740.09,8740.09,8740.09,8740.09,14206637650.0,0,0.0,2,0.0,RUB,0.0
SNDX,MEOGTRR,2020-10-13,MOEX Oil & Gas Net TR-Res,Индекс МосБиржи нефти и газа полной доходности «нетто» (по налог.ставкам рос.орг-й),8818.84,8818.84,8818.84,8818.84,14206637650.0,0,0.0,2,0.0,RUB,0.0
SNDX,MESMTR,2020-10-13,MOEX SMID Total Return,Индекс МосБиржи средней и малой капитализации полной доходности «брутто»,2483.67,2483.67,2483.67,2483.67,7614185938.0,0,0.0,2,0.0,RUB,0.0
SNDX,MESMTRN,2020-10-13,MOEX SMID Net TR-NR,Индекс МосБиржи средней капитализации полной доходности «нетто» (по нал.ставкам ин.орг-й),2363.14,2363.14,2363.14,2363.14,7614185938.0,0,0.0,2,0.0,RUB,0.0
SNDX,MESMTRR,2020-10-13,MOEX SMID Net TR-Res,Индекс МосБиржи средней капитализации полной доходности «нетто» (по нал.ставкам рос.орг-й),2383.86,2383.86,2383.86,2383.86,7614185938.0,0,0.0,2,0.0,RUB,0.0
SNDX,METLTR,2020-10-13,MOEX Telecom Total Return,Индекс МосБиржи телекоммуникаций полной доходности «брутто»,4391.88,4391.88,4391.88,4391.88,1122378891.0,0,0.0,2,0.0,RUB,0.0
SNDX,METLTRN,2020-10-13,MOEX Telecom Net TR-NR,Индекс МосБиржи телекоммуникаций полной доходности «нетто» (по налог.ставкам ин.орг-й),3991.05,3991.05,3991.05,3991.05,1122378891.0,0,0.0,2,0.0,RUB,0.0
SNDX,METLTRR,2020-10-13,MOEX Telecom Net TR-Res,Индекс МосБиржи телекоммуникаций полной доходности «нетто» (по налог.ставкам рос.орг-й),4054.62,4054.62,4054.62,4054.62,1122378891.0,0,0.0,2,0.0,RUB,0.0
SNDX,METNTR,2020-10-13,MOEX Transport Total Return,Индекс МосБиржи транспорта полной доходности «брутто»,1635.57,1635.57,1635.57,1635.57,2892620333.0,0,0.0,2,0.0,RUB,0.0
SNDX,METNTRN,2020-10-13,MOEX Transport Net TR-NR,Индекс МосБиржи транспорта полной доходности «нетто» (по налог.ставкам ин.орг-й),1555.02,1555.02,1555.02,1555.02,2892620333.0,0,0.0,2,0.0,RUB,0.0
SNDX,METNTRR,2020-10-13,MOEX Transport Net TR-Res,Индекс МосБиржи транспорта полной доходности «нетто» (по налог.ставкам рос.орг-й),1567.12,1567.12,1567.12,1567.12,2892620333.0,0,0.0,2,0.0,RUB,0.0
SNDX,MOEX10,2020-10-13,Индекс МосБиржи 10,Индекс МосБиржи 10,4628.46,4659.25,4677.9,4617.54,34856282004.6,0,0.0,2,9789941679447.283,RUB,5009.22
RTSI,MOEXBC,2020-10-13,Индекс голубых фишек,Индекс МосБиржи голубых фишек,18453.36,18557.56,18661.99,18415.8,38740783380.9,0,0.0,2,10854001399036.488,RUB,588185545.4728
SNDX,MOEXBMI,2020-10-13,Индекс широкого рынка,Индекс МосБиржи широкого рынка,2023.05,2036.54,2044.41,2018.79,58513924520.18,0,0.0,2,15323702885623.066,RUB,7574573330.9507
SNDX,MOEXCH,2020-10-13,Индекс химии и нефтехимии,Индекс МосБиржи химии и нефтехимии,17047.08,17115.12,17220.53,16968.21,153344391.6,0,0.0,2,180797444777.7,RUB,10605772.4903
SNDX,MOEXCN,2020-10-13,Индекс потребительского сектора / Индекс потребит сектора,Индекс МосБиржи потребительского сектора,7852.67,7853.37,7936.99,7835.91,3646432556.66,0,0.0,2,113879823339.7245,RUB,14502059.4659
SNDX,MOEXEU,2020-10-13,Индекс электроэнергетики,Индекс МосБиржи электроэнергетики,2102.32,2124.29,2125.73,2097.26,1943138467.3,0,0.0,2,256786724211.8737,RUB,122144387.9137
SNDX,MOEXFN,2020-10-13,Индекс финансов,Индекс МосБиржи финансов,7382.06,7476.52,7495.52,7364.33,14300660745.0,0,0.0,2,797484652673.5372,RUB,108030067.9261
SNDX,MOEXINN,2020-10-13,Индекс МосБиржи инноваций,Индекс МосБиржи инноваций,399.56,398.14,405.51,397.93,53745200.5,0,0.0,2,2523439312.623,RUB,6315514.9888
SNDX,MOEXMM,2020-10-13,Индекс металлов и добычи,Индекс МосБиржи металлов и добычи,8872.2,8946.85,8952.6,8836.69,11224640043.12,0,0.0,2,1424251811586.1785,RUB,160529704.4824
SNDX,MOEXOG,2020-10-13,Индекс нефти и газа,Индекс МосБиржи нефти и газа,6438.26,6530.3,6542.47,6430.54,14198152125.0,0,0.0,2,1112502286175.0168,RUB,172795585.0609
SNDX,MOEXREPO,2020-10-13,MXREPO,MOEXREPO обл 12:30,4.28,4.28,4.28,4.28,357282056416.0,,,2,,RUB,
SNDX,MOEXREPO1W,2020-10-13,MOEXREPO1W,MOEXREPO 1 неделя 12:30,4.25,4.25,4.25,4.25,52029803276.0,,,2,,RUB,
SNDX,MOEXREPO1WE,2020-10-13,MOEXREPO1WE,MOEXREPO 1 неделя 19:00,4.33,4.33,4.33,4.33,27789089585.0,,,2,,RUB,
SNDX,MOEXREPOE,2020-10-13,MXREPOE,MOEXREPO обл 19:00,4.21,4.21,4.21,4.21,145483420215.0,,,2,,RUB,
SNDX,MOEXREPOEQ,2020-10-13,MXREPOEQ,MOEXREPO акц 12:30,4.34,4.34,4.34,4.34,38129145757.0,,,2,,RUB,
SNDX,MOEXREPOEQE,2020-10-13,MXREPOEQE,MOEXREPO акц 19:00,4.34,4.34,4.34,4.34,45048524988.0,,,2,,RUB,
SNDX,MOEXREPOUSD,2020-10-13,MOEXREPOUSD,MOEXREPO USD 12:30,0.33,0.33,0.33,0.33,1044074643.0,,,2,,USD,
SNDX,MOEXREPOUSDE,2020-10-13,MOEXREPOUSDE,MOEXREPO USD 19:00,0.36,0.36,0.36,0.36,829413515.0,,,2,,USD,
SNDX,MOEXTL,2020-10-13,Индекс телекоммуникаций,Индекс МосБиржи телекоммуникаций,2301.71,2290.72,2309.43,2280.62,1122126393.3,0,0.0,2,409704338735.6008,RUB,178000185.54
SNDX,MOEXTN,2020-10-13,Индекс транспорта,Индекс МосБиржи транспорта,1163.35,1182.72,1184.41,1160.76,2890481679.0,0,0.0,2,53291316102.738,RUB,45808634.8417
SNDX,MRBC,2020-10-13,Индекс МосБиржи 15,Индекс МосБиржи 15,1431.54,1438.35,1446.3,1427.71,38740783380.9,0,0.0,2,9149458393067.33,RUB,6391340404.1646
RTSI,MRBCTR,2020-10-13,Индекс МосБиржи полн дох-ти 15,Индекс МосБиржи полной доходности 15,1717.96,1717.96,1717.96,1717.96,38758241001.0,0,0.0,2,0.0,RUB,0.0
RTSI,MRRT,2020-10-13,"Индекс ""Ответственность и открытость""",Индекс МосБиржи - РСПП Ответственность и открытость,2122.67,2122.67,2122.67,2122.67,38284387759.0,0,0.0,2,31640014309742.902,RUB,3929301536.3335
RTSI,MRSV,2020-10-13,"Индекс ""Вектор устойчивого развития""",Индекс МосБиржи - РСПП Вектор устойчивого развития,2447.28,2447.28,2447.28,2447.28,34778590471.0,0,0.0,2,31041233570185.223,RUB,81467120.5622
RTSI,MRSVT,2020-10-13,Индекс МосБиржи-РСПП Вектор TR,"Индекс МосБиржи - РСПП Вектор устойчивого развития, полной доходности брутто",3035.44,3035.44,3035.44,3035.44,34778590471.0,0,0.0,2,0.0,RUB,0.0
INAV,MTEKA,2020-10-13,iNAV Фридом - Лидеры Технологий,Расчетная цена одного пая Биржевого ПИФа «Фридом - Лидеры Технологий»,1960.7,1943.72,1960.86,1937.51,0.0,0,0.0,2,0.0,RUB,0.0
INAV,ONLYO,2020-10-13,iNAV «Открытие – Всепогодный»,Биржевой паевой инвестиционный фонд рыночных финансовых инструментов «Открытие – Всепогодный»,1.0617,1.0697,1.0697,1.061,0.0,0,0.0,4,0.0,USD,0.0
RTSI,OPSI,2020-10-13,Субиндекс ОФЗ,Индексы активов пенсионных накоплений - Субиндекс ОФЗ,2073.6905,2073.6905,2073.6905,2073.6905,2415116629.25,,,2,5243067587031.51,RUB,
INAV,RFBC15,2020-10-13,iNAV «Raiffeisen-MOEX Index 15»,Расчетная цена одного пая Биржевого ПИФа «Райффайзен – Индекс МосБиржи полной доходности 15»,1078.83,1085.07,1089.41,1075.89,0.0,0,0.0,2,0.0,RUB,0.0
SNDX,RGBI,2020-10-13,Индекс Мосбиржи гос обл RGBI,Индекс Мосбиржи государственных облигаций ценовой,153.96,153.94,153.97,153.85,19311349518.33,1875,5.71,2,8947740299176.4,RUB,1.0
SNDX,RGBITR,2020-10-13,Индекс Мосбиржи гос обл RGBITR,Индекс Мосбиржи государственных облигаций,615.25,615.16,615.3,614.82,19311349518.33,1875,5.71,2,9099302775471.143,RUB,1.0
SNDX,RPGCC,2020-10-13,MOEXREPOGCC,MOEXREPO КСУ 12:30,4.38,4.38,4.38,4.38,98967367000.0,,,2,,RUB,
SNDX,RPGCC1W,2020-10-13,MOEXREPOGCC1W,MOEXREPO КСУ 1 неделя 12:30,4.37,4.37,4.37,4.37,16500000000.0,,,2,,RUB,
SNDX,RPGCC1WE,2020-10-13,MOEXREPOGCC1WE,MOEXREPO КСУ 1 неделя 19:00,4.3,4.3,4.3,4.3,4519880000.0,,,2,,RUB,
SNDX,RPGCCE,2020-10-13,MOEXREPOGCCE,MOEXREPO КСУ 19:00,4.28,4.28,4.28,4.28,57405817000.0,,,2,,RUB,
RTSI,RTSCH,2020-10-13,Индекс РТС химии и нефтехимии,Индекс РТС химии и нефтехимии,230.6,231.39,232.34,229.07,1989114.1677843814,0,0.0,2,2345222770.4853177,USD,10170280.6297
RTSI,RTSCR,2020-10-13,Индекс РТС потреб. сектора,Индекс РТС потребительских товаров и розничной торговли,230.71,230.61,232.95,229.82,47299875.689243205,0,0.0,2,1477197618.1607447,USD,6402778.8808
RTSI,RTSEU,2020-10-13,Индекс РТС электроэнергетики,Индекс РТС электроэнергетики,69.13,69.82,70.05,68.92,25205514.29983474,0,0.0,2,3330921371.8174133,USD,48180107.4121
RTSI,RTSFN,2020-10-13,Индекс РТС финансов,Индекс РТС финансов,166.49,168.52,169.06,165.7,185501710.23377323,0,0.0,2,10344610615.83122,USD,62134706.3129
RTSI,RTSI,2020-10-13,Индекс РТС,Индекс РТС,1156.11,1162.18,1169.8,1151.18,737147462.104919,0,0.0,2,176513806624.17944,USD,152678585.651
RTSI,RTSMM,2020-10-13,Индекс РТС металлов и добычи,Индекс РТС металлов и добычи,241.92,243.82,244.04,240.46,145600959.41617656,0,0.0,2,18474751031.707375,USD,76366315.1958
RTSI,RTSOG,2020-10-13,Индекс РТС нефти и газа,Индекс РТС нефти и газа,162.14,164.37,164.83,161.83,184172014.72789583,0,0.0,2,14430877034.587551,USD,89003323.6986
RTSI,RTSSM,2020-10-13,RTS SMID Index,Индекс РТС средней и малой капитализации,1085.91,1085.91,1085.91,1085.91,98767779.91,,,2,7221618357.3054,USD,6650265.8786
RTSI,RTSTL,2020-10-13,Индекс РТС телекоммуникаций,Индекс РТС телекоммуникаций ,91.54,91.05,91.97,90.49,14555716.604100564,0,0.0,2,5314499580.183636,USD,58056740.3599
RTSI,RTSTN,2020-10-13,Индекс РТС транспорта,Индекс РТС транспорта,36.87,37.47,37.52,36.73,37494022.43818408,0,0.0,2,691270875.7966216,USD,18747461.487
RTSI,RTSTR,2020-10-13,RTS Total Return,Индекс РТС полной доходности «брутто»,2078.28,2078.28,2078.28,2078.28,737147462.11,,,2,176513806624.18,USD,
RTSI,RTSTRN,2020-10-13,RTS Net-TR-NR,Индекс РТС полной доходности «нетто» (по налоговым ставкам иностранных организаций),1903.65,1903.65,1903.65,1903.65,737147462.11,,,2,176513806624.18,USD,
RTSI,RTSTRR,2020-10-13,RTS Net-TR-Res,Индекс РТС полной доходности «нетто» (по налоговым ставкам российских организаций),1945.35,1945.35,1945.35,1945.35,737147462.11,,,2,176513806624.18,USD,
RTSI,RTSUSDCUR,2020-10-13,RTSUSDCUR,Курс доллара США на момент закрытия Индекса РТС,77.0918,77.0918,77.0918,77.0918,0.0,,,2,0.0,USD,
RTSI,RUABICP,2020-10-13,ABI CP,Композитный индекс облигаций ,116.33,116.33,116.33,116.33,3754846694.64,1732,5.5,2,10774205109982.93,RUB,
RTSI,RUABITR,2020-10-13,ABI TR,Композитный индекс облигаций — совокупный доход,223.22,223.22,223.22,223.22,3754846694.64,1732,5.5,2,10774205109982.93,RUB,
RTSI,RUBMI,2020-10-13,Индекс РТС широкого рынка,Индекс РТС широкого рынка,842.42,847.57,852.37,838.93,759016192.6453916,0,0.0,2,198772150677.80322,USD,235953303.4342
SNDX,RUCBCP3Y,2020-10-13,Индекс Мосбиржи корп обл CBICP 3-5,Индекс Мосбиржи корпоративных облигаций MOEX 1 - 3 ценовой,93.15,93.13,93.21,93.13,1685247924.55,641,5.9,2,807837171796.8,RUB,1.0
SNDX,RUCBCP5Y,2020-10-13,Индекс Мосбиржи корп обл CBICP 1-3,Индекс Мосбиржи корпоративных облигаций ценовой 3-5,123.4,123.73,123.8,123.28,250945213.4,1310,6.23,2,370706845105.0,RUB,1.0
SNDX,RUCBICP,2020-10-13,Индекс Мосбиржи корп обл CBICP,Индекс Мосбиржи корпоративных облигаций ценовой,97.23,97.29,97.35,97.2,1951269044.45,955,6.14,2,1279217516901.8,RUB,1.0
RTSI,RUCBICP1Y,2020-10-13,CBI CP 1Y,"Индекс корпоративных облигаций (≤ 1 года, рейтинг ≥ B-)",92.19,92.19,92.19,92.19,1636303940.23,141,5.74,2,187121278516.15,RUB,
RTSI,RUCBICP3+,2020-10-13,CBI CP 3+,"Индекс корпоративных облигаций (< 1 года, рейтинг > B-)",125.73,125.73,125.73,125.73,66308943.2,1491,6.29,2,478773264039.24,RUB,
RTSI,RUCBICPB,2020-10-13,CBI CP B,"Индекс корпоративных облигаций (> 1 года, B- ≤ рейтинг < BB-)",78.3,78.3,78.3,78.3,13668631.65,805,7.05,2,57213539366.5,RUB,
RTSI,RUCBICPB3Y,2020-10-13,CBI CP B 3Y,"Индекс корпоративных облигаций (1-3 года, B- ≤ рейтинг < BB-)",79.57,79.57,79.57,79.57,9757502.15,743,7.02,2,45549610179.76,RUB,
RTSI,RUCBICPBB,2020-10-13,CBI CP BB,"Индекс корпоративных облигаций (> 1 года, BB- ≤ рейтинг < BBB-)",94.2,94.2,94.2,94.2,445843004.9,877,6.25,2,552970224852.5,RUB,
RTSI,RUCBICPBB3+,2020-10-13,CBI CP BB 3+,"Индекс корпоративных облигаций (> 3 лет, BB- ≤ рейтинг < BBB-)",120.54,120.54,120.54,120.54,35386900.9,1365,6.5,2,155554344852.5,RUB,
RTSI,RUCBICPBB3Y,2020-10-13,CBI CP BBB 3Y,"Индекс корпоративных облигаций (1-3 года, BB- ≤ рейтинг < BBB-)",92.53,92.53,92.53,92.53,410456104.0,685,6.15,2,397415880000.0,RUB,
RTSI,RUCBICPBB5Y,2020-10-13,CBI CP BB 5Y,"Индекс корпоративных облигаций (3-5 лет, BB- ≤ рейтинг < BBB-)",120.67,120.67,120.67,120.67,30335480.1,1307,6.52,2,140082444852.5,RUB,
RTSI,RUCBICPBBB,2020-10-13,CBI CP BBB,"Индекс корпоративных облигаций (> 1 года, рейтинг ≥ BBB-)",100.19,100.19,100.19,100.19,123806425.7,1029,5.73,2,688824662292.8,RUB,
RTSI,RUCBICPBBB3+,2020-10-13,CBI CP BBB 3+,"Индекс корпоративных облигаций (3-5 лет, рейтинг ≥ BBB-)",129.81,129.81,129.81,129.81,27010912.8,1570,6.15,2,311554990000.0,RUB,
RTSI,RUCBICPBBB3Y,2020-10-13,CBI CP BBB 3Y,"Индекс корпоративных облигаций (1-3 года, рейтинг ≥ BBB-)",95.99,95.99,95.99,95.99,96795512.9,583,5.39,2,377269672292.8,RUB,
RTSI,RUCBICPBBB5Y,2020-10-13,CBI CP BBB 5Y,"Индекс корпоративных облигаций (3-5 лет, рейтинг ≥ BBB-)",128.67,128.67,128.67,128.67,16986427.1,1326,6.01,2,225300440000.0,RUB,
RTSI,RUCBICPL1,2020-10-13,CBI CP L1,Индекс корпоративных облигаций Котировальный лист 1 - ценовой,93.83,93.83,93.83,93.83,437807851.7,941,5.93,2,711324524474.0,RUB,
RTSI,RUCBICPL2,2020-10-13,CBI CP L2,Индекс корпоративных облигаций Котировальный лист 2 - ценовой,105.41,105.41,105.41,105.41,105780839.85,937,6.07,2,420768477037.8,RUB,
RTSI,RUCBICPL3,2020-10-13,CBI CP L3,Индекс корпоративных облигаций Котировальный лист 3 - ценовой,103.15,103.15,103.15,103.15,39729370.7,1055,6.2,2,166915425000.0,RUB,
