BOARDID,SECID,TRADEDATE,SHORTNAME,NAME,CLOSE,OPEN,HIGH,LOW,VALUE,DURATION,YIELD,DECIMALS,CAPITALIZATION,CURRENCYID,DIVISOR
INAV,AKCHA,2021-03-10,iNAV Альфа Китайские акции,Расчетная цена одного пая Биржевого ПИФа РФИ «Альфа-Капитал Китайские акции»,101.6,103.53,103.65,101.6,0.0,0,0.0,2,0.0,RUB,0.0
INAV,AKEUA,2021-03-10,iNAV Альфа-Капитал ЕВРОПА 600,Расчетная цена одного пая Биржевого ПИФа «ЕВРОПА 600»,11.41,11.37,11.43,11.32,0.0,0,0.0,2,0.0,EUR,0.0
INAV,AKMBA,2021-03-10,iNAV Альфа Управляемые облигации,Расчетная цена одного пая Биржевого ПИФа РФИ «Альфа-Капитал Управляемые облигации»,1.0677,1.0663,1.0678,1.0662,0.0,0,0.0,4,0.0,RUB,0.0
INAV,AKMEI,2021-03-10,iNAV Альфа Управляемые акции,Расчетная цена одного пая Биржевого ПИФа РФИ «Альфа-Капитал Управляемые Российские Акции»,111.85,112.09,113.55,111.64,0.0,0,0.0,2,0.0,RUB,0.0
INAV,AKNXA,2021-03-10,iNAV Технологии 100,Расчетная цена одного пая Биржевого ПИФа «ТЕХНОЛОГИИ 100»,18.79,18.69,18.97,18.69,0.0,0,0.0,2,0.0,USD,0.0
INAV,AKSPA,2021-03-10,iNAV Альфа - Капитал Эс энд Пи 500,Расчетная цена одного пая Биржевого ПИФа «Альфа - Капитал Эс энд Пи 500»,13.39,13.31,13.44,13.31,0.0,0,0.0,2,0.0,USD,0.0
RTSI,BPSI,2021-03-10,Субиндекс облигаций,Субиндекс облигаций активов пенсионных накоплений,3033.91,3033.91,3033.91,3033.91,1134760931.0,939,6.22,2,1993265297229.78,RUB,1000000000000.0
RTSI,BPSIG,2021-03-10,Субиндекс облигаций ОФЗ,Субиндекс облигаций ОФЗ активов пенсионных накоплений,2036.55,2036.55,2036.55,2036.55,15085245052.0,1740,6.17,2,8743058896724.649,RUB,1000000000000.0
INAV,DIVDA,2021-03-10,iNAV ДОХОДЪ Дивидендные акции РФ,Расчетная цена одного пая Биржевого ПИФа РФИ «ДОХОДЪ Индекс дивидендных акций РФ»,1005.75,1006.11,1016.85,1002.07,0.0,0,0.0,2,0.0,RUB,0.0
RTSI,EPSI,2021-03-10,Субиндекс акций,Субиндекс акций активов пенсионных накоплений,2044.78,2044.78,2044.78,2044.78,102155248983.0,0,0.0,2,50296055891965.81,RUB,7568983455.3956
RTSI,EPSITR,2021-03-10,Субиндекс акций полной доходности,Субиндекс акций полной дох-ти,2058.46,2058.46,2058.46,2058.46,102155248983.0,0,0.0,2,0.0,RUB,0.0
INAV,ESGRA,2021-03-10,iNAV RSHB-MOEX-RSPP ESG VecTR ,Расчетная цена одного пая Биржевого ПИФа «РСХБ–Индекс МосБиржи–РСПП Вектор развития полн дох-ти»,1343.32,1349.33,1357.57,1340.91,0.0,0,0.0,2,0.0,RUB,0.0
INAV,FMUSA,2021-03-10,iNAV Дивидендные аристократы США,Расчетная цена одного пая Биржевого ПИФа РФИ «Дивидендные Аристократы США»,10.35,10.3,10.37,10.24,0.0,0,0.0,2,0.0,RUB,0.0
INAV,GPBMA,2021-03-10,iNAV ГПБ - Корп. облигации 4г,Расчетная цена одного пая Биржевого ПИФа «Газпромбанк – Корпоративные облигации 4 года»,58455.99,58325.17,58603.93,58325.17,0.0,0,0.0,2,0.0,RUB,0.0
INAV,GPBSA,2021-03-10,iNAV ГПБ - Корп. облигации 2г,Расчетная цена одного пая Биржевого ПИФа «Газпромбанк – Корпоративные облигации 2 года»,57084.53,57031.87,57174.35,57031.87,0.0,0,0.0,2,0.0,RUB,0.0
SNDX,IMOEX,2021-03-10,Индекс МосБиржи,Индекс МосБиржи,3463.06,3476.91,3514.35,3455.42,102035182953.05,0,0.0,2,17589701056663.49,RUB,5079230865.8227
SNDX,IMOEX2,2021-03-10,Индекс МосБиржи (доп. сессия),Индекс МосБиржи (Дополнительная сессия),3463.06,3459.17,3472.28,3451.89,7390793852.25,0,0.0,2,17589701056663.488,RUB,5079230865.8227
RTSI,MCFTR,2021-03-10,MOEX Russia Total Return,Индекс МосБиржи полной доходности «брутто»,6275.77,6275.77,6275.77,6275.77,102155248983.0,0,0.0,2,0.0,RUB,0.0
RTSI,MCFTRN,2021-03-10,MOEX Russia Net-TR-NR,Индекс МосБиржи полной доходности «нетто» (по налоговым ставкам иностранных организаций),5741.57,5741.57,5741.57,5741.57,102155248983.0,0,0.0,2,0.0,RUB,0.0
RTSI,MCFTRR,2021-03-10,MOEX Russia Net-TR-Res,Индекс МосБиржи полной доходности «нетто» (по налоговым ставкам российских организаций),5867.68,5867.68,5867.68,5867.68,102155248983.0,0,0.0,2,0.0,RUB,0.0
RTSI,MCXSM,2021-03-10,Индекс МосБиржи SMID,Индекс МосБиржи средней и малой капитализации,2025.42,2025.42,2025.42,2025.42,6430726801.0,0,0.0,2,4859968653156.209,RUB,414265307.9884
RTSI,MEBCTR,2021-03-10,MOEX Blue Chip Total Return,Индекс МосБиржи голубых фишек полной доходности «брутто»,38099.09,38099.09,38099.09,38099.09,78323059037.0,0,0.0,2,0.0,RUB,0.0
RTSI,MEBCTRN,2021-03-10,MOEX Blue Chip Net-TR-NR,Индекс МосБиржи голубых фишек полной доходности «нетто» (по налоговым ставкам иностр. орг.),35235.16,35235.16,35235.16,35235.16,78323059037.0,0,0.0,2,0.0,RUB,0.0
RTSI,MEBCTRR,2021-03-10,MOEX Blue Chip Net-TR-Res,Индекс МосБиржи голубых фишек полной доходности «нетто» (по налоговым ставкам росс. орг.),35850.57,35850.57,35850.57,35850.57,78323059037.0,0,0.0,2,0.0,RUB,0.0
SNDX,MECHTR,2021-03-10,MOEX Chemicals Total Return,Индекс МосБиржи химии и нефтехимии полной доходности «брутто»,32399.82,32399.82,32399.82,32399.82,439911932.0,0,0.0,2,0.0,RUB,0.0
SNDX,MECHTRN,2021-03-10,MOEX Chemicals Net TR-NR,Индекс МосБиржи химии и нефтехимии полной доходности «нетто» (по налог.ставкам ин.орг-й),30315.8,30315.8,30315.8,30315.8,439911932.0,0,0.0,2,0.0,RUB,0.0
SNDX,MECHTRR,2021-03-10,MOEX Chemicals Net TR-Res,Индекс МосБиржи химии и нефтехимии полной доходности «нетто» (по налог.ставкам рос.орг-й),30635.71,30635.71,30635.71,30635.71,439911932.0,0,0.0,2,0.0,RUB,0.0
SNDX,MECNTR,2021-03-10,MOEX Consumer Total Return,Индекс МосБиржи потребительского сектора полной доходности «брутто»,11504.78,11504.78,11504.78,11504.78,4032915390.0,0,0.0,2,0.0,RUB,0.0
SNDX,MECNTRN,2021-03-10,MOEX Consumer Net TR-NR,Индекс МосБиржи потребит. сектора полной доходности «нетто» (по налог.ставкам ин.орг-й),11100.85,11100.85,11100.85,11100.85,4032915390.0,0,0.0,2,0.0,RUB,0.0
SNDX,MECNTRR,2021-03-10,MOEX Consumer Net TR-Res,Индекс МосБиржи потреб. сектора полной доходности «нетто» (по налог.ставкам рос.орг-й),11031.77,11031.77,11031.77,11031.77,4032915390.0,0,0.0,2,0.0,RUB,0.0
SNDX,MEEUTR,2021-03-10,MOEX El.Utilities Total Return,Индекс МосБиржи электроэнергетики полной доходности «брутто»,3262.13,3262.13,3262.13,3262.13,2671634993.0,0,0.0,2,0.0,RUB,0.0
SNDX,MEEUTRN,2021-03-10,MOEX El. Utilities Net TR-NR,Индекс МосБиржи электроэнергетики полной доходности «нетто» (по налог.ставкам ин.орг-й),3087.09,3087.09,3087.09,3087.09,2671634993.0,0,0.0,2,0.0,RUB,0.0
SNDX,MEEUTRR,2021-03-10,MOEX El. Utilities Net TR-Res,Индекс МосБиржи электроэнергетики полной доходности «нетто» (по налог.ставкам рос.орг-й),3115.16,3115.16,3115.16,3115.16,2671634993.0,0,0.0,2,0.0,RUB,0.0
SNDX,MEFNTR,2021-03-10,MOEX Financials Total Return,Индекс МосБиржи финансов полной доходности «брутто»,13715.59,13715.59,13715.59,13715.59,20291848966.0,0,0.0,2,0.0,RUB,0.0
SNDX,MEFNTRN,2021-03-10,MOEX Financials Net TR-NR,Индекс МосБиржи финансов полной доходности «нетто» (по налог.ставкам ин.орг-й),13114.97,13114.97,13114.97,13114.97,20291848966.0,0,0.0,2,0.0,RUB,0.0
SNDX,MEFNTRR,2021-03-10,MOEX Financials Net TR-Res,Индекс МосБиржи финансов полной доходности «нетто» (по налог.ставкам рос.орг-й),13212.08,13212.08,13212.08,13212.08,20291848966.0,0,0.0,2,0.0,RUB,0.0
SNDX,MEMMTR,2021-03-10,MOEX Metals & Min Total Return,Индекс МосБиржи металлов и добычи полной доходности «брутто»,16636.25,16636.25,16636.25,16636.25,25809886951.0,0,0.0,2,0.0,RUB,0.0
SNDX,MEMMTRN,2021-03-10,MOEX Metals & Mining Net TR-NR,Индекс МосБиржи металлов и добычи полной доходности «нетто» (по налог.ставкам ин.орг-й),15449.51,15449.51,15449.51,15449.51,25809886951.0,0,0.0,2,0.0,RUB,0.0
SNDX,MEMMTRR,2021-03-10,MOEX Metals & Min Net TR-Res,Индекс МосБиржи металлов и добычи полной доходности «нетто» (по налог.ставкам рос.орг-й),15639.73,15639.73,15639.73,15639.73,25809886951.0,0,0.0,2,0.0,RUB,0.0
SNDX,MEOGTR,2021-03-10,MOEX Oil & Gas Total Return,Индекс МосБиржи нефти и газа полной доходности «брутто»,12015.9,12015.9,12015.9,12015.9,38174111348.0,0,0.0,2,0.0,RUB,0.0
SNDX,MEOGTRN,2021-03-10,MOEX Oil & Gas Net TR-NR,Индекс МосБиржи нефти и газа полной доходности «нетто» (по налог.ставкам ин.орг-й),11375.83,11375.83,11375.83,11375.83,38174111348.0,0,0.0,2,0.0,RUB,0.0
SNDX,MEOGTRR,2021-03-10,MOEX Oil & Gas Net TR-Res,Индекс МосБиржи нефти и газа полной доходности «нетто» (по налог.ставкам рос.орг-й),11480.03,11480.03,11480.03,11480.03,38174111348.0,0,0.0,2,0.0,RUB,0.0
SNDX,MESMTR,2021-03-10,MOEX SMID Total Return,Индекс МосБиржи средней и малой капитализации полной доходности «брутто»,2852.86,2852.86,2852.86,2852.86,6430726801.0,0,0.0,2,0.0,RUB,0.0
SNDX,MESMTRN,2021-03-10,MOEX SMID Net TR-NR,Индекс МосБиржи средней капитализации полной доходности «нетто» (по нал.ставкам ин.орг-й),2710.16,2710.16,2710.16,2710.16,6430726801.0,0,0.0,2,0.0,RUB,0.0
SNDX,MESMTRR,2021-03-10,MOEX SMID Net TR-Res,Индекс МосБиржи средней капитализации полной доходности «нетто» (по нал.ставкам рос.орг-й),2734.55,2734.55,2734.55,2734.55,6430726801.0,0,0.0,2,0.0,RUB,0.0
SNDX,METLTR,2021-03-10,MOEX Telecom Total Return,Индекс МосБиржи телекоммуникаций полной доходности «брутто»,4355.8,4355.8,4355.8,4355.8,2788900328.0,0,0.0,2,0.0,RUB,0.0
SNDX,METLTRN,2021-03-10,MOEX Telecom Net TR-NR,Индекс МосБиржи телекоммуникаций полной доходности «нетто» (по налог.ставкам ин.орг-й),3958.27,3958.27,3958.27,3958.27,2788900328.0,0,0.0,2,0.0,RUB,0.0
SNDX,METLTRR,2021-03-10,MOEX Telecom Net TR-Res,Индекс МосБиржи телекоммуникаций полной доходности «нетто» (по налог.ставкам рос.орг-й),4021.35,4021.35,4021.35,4021.35,2788900328.0,0,0.0,2,0.0,RUB,0.0
SNDX,METNTR,2021-03-10,MOEX Transport Total Return,Индекс МосБиржи транспорта полной доходности «брутто»,1883.75,1883.75,1883.75,1883.75,1032486870.0,0,0.0,2,0.0,RUB,0.0
SNDX,METNTRN,2021-03-10,MOEX Transport Net TR-NR,Индекс МосБиржи транспорта полной доходности «нетто» (по налог.ставкам ин.орг-й),1790.81,1790.81,1790.81,1790.81,1032486870.0,0,0.0,2,0.0,RUB,0.0
SNDX,METNTRR,2021-03-10,MOEX Transport Net TR-Res,Индекс МосБиржи транспорта полной доходности «нетто» (по налог.ставкам рос.орг-й),1804.84,1804.84,1804.84,1804.84,1032486870.0,0,0.0,2,0.0,RUB,0.0
SNDX,MOEX10,2021-03-10,Индекс МосБиржи 10,Индекс МосБиржи 10,5494.18,5528.39,5574.48,5481.16,64788048916.3,0,0.0,2,12491703612402.41,RUB,5391.01
RTSI,MOEXBC,2021-03-10,Индекс голубых фишек,Индекс МосБиржи голубых фишек,22595.65,22718.68,22977.72,22539.6,78238463379.2,0,0.0,2,13921143767801.027,RUB,616098470.6265
SNDX,MOEXBMI,2021-03-10,Индекс широкого рынка,Индекс МосБиржи широкого рынка,2476.44,2484.21,2512.91,2471.06,104309378577.95,0,0.0,2,19217219006896.86,RUB,7760008376.088
SNDX,MOEXCH,2021-03-10,Индекс химии и нефтехимии,Индекс МосБиржи химии и нефтехимии,20745.51,21011.62,21113.0,20629.58,439605193.9,0,0.0,2,217289100367.65,RUB,10474029.9738
SNDX,MOEXCN,2021-03-10,Индекс потребительского сектора / Индекс потребит сектора,Индекс МосБиржи потребительского сектора,8644.66,8605.67,8675.76,8586.21,4025243310.34,0,0.0,2,166962789653.0696,RUB,19313982.7282
SNDX,MOEXEU,2021-03-10,Индекс электроэнергетики,Индекс МосБиржи электроэнергетики,2257.69,2268.31,2275.12,2256.26,2671211663.35,0,0.0,2,281172591605.6509,RUB,124539818.5684
SNDX,MOEXFN,2021-03-10,Индекс финансов,Индекс МосБиржи финансов,10162.14,10185.0,10349.58,10151.98,20264916376.3,0,0.0,2,1037571362298.8088,RUB,102101671.187
SNDX,MOEXINN,2021-03-10,Индекс МосБиржи инноваций,Индекс МосБиржи инноваций,391.63,389.93,394.72,386.97,223854185.3,0,0.0,2,10998790583.7983,RUB,28084330.4761
SNDX,MOEXMM,2021-03-10,Индекс металлов и добычи,Индекс МосБиржи металлов и добычи,10144.57,10192.18,10239.33,10105.7,25769449621.7,0,0.0,2,1801092028194.102,RUB,177542507.7844
SNDX,MOEXOG,2021-03-10,Индекс нефти и газа,Индекс МосБиржи нефти и газа,8326.95,8330.0,8460.3,8300.99,38146364697.3,0,0.0,2,1354911245446.1406,RUB,162714074.6339
SNDX,MOEXREPO,2021-03-10,MXREPO,MOEXREPO обл 12:30,4.12,4.12,4.12,4.12,301553251495.0,,,2,,RUB,
SNDX,MOEXREPO1W,2021-03-10,MOEXREPO1W,MOEXREPO 1 неделя 12:30,4.21,4.21,4.21,4.21,243723813068.0,,,2,,RUB,
SNDX,MOEXREPO1WE,2021-03-10,MOEXREPO1WE,MOEXREPO 1 неделя 19:00,4.1,4.1,4.1,4.1,8792711029.0,,,2,,RUB,
SNDX,MOEXREPOE,2021-03-10,MXREPOE,MOEXREPO обл 19:00,4.07,4.07,4.07,4.07,137787174787.0,,,2,,RUB,
SNDX,MOEXREPOEQ,2021-03-10,MXREPOEQ,MOEXREPO акц 12:30,4.05,4.05,4.05,4.05,38032167203.0,,,2,,RUB,
SNDX,MOEXREPOEQE,2021-03-10,MXREPOEQE,MOEXREPO акц 19:00,4.18,4.18,4.18,4.18,38706611553.0,,,2,,RUB,
SNDX,MOEXREPOUSD,2021-03-10,MOEXREPOUSD,MOEXREPO USD 12:30,0.21,0.21,0.21,0.21,1216147555.0,,,2,,USD,
SNDX,MOEXREPOUSDE,2021-03-10,MOEXREPOUSDE,MOEXREPO USD 19:00,0.19,0.19,0.19,0.19,66919558.0,,,2,,USD,
SNDX,MOEXTL,2021-03-10,Индекс телекоммуникаций,Индекс МосБиржи телекоммуникаций,2282.81,2285.68,2305.7,2281.17,2786244218.3,0,0.0,2,406340537138.7063,RUB,178000185.54
SNDX,MOEXTN,2021-03-10,Индекс транспорта,Индекс МосБиржи транспорта,1339.14,1340.79,1349.06,1338.05,1030977331.0,0,0.0,2,183509977258.5832,RUB,137035373.9192
SNDX,MRBC,2021-03-10,Индекс МосБиржи 15,Индекс МосБиржи 15,1716.12,1723.97,1743.9,1711.87,78238463379.2,0,0.0,2,11175233202219.377,RUB,6511921170.5989
RTSI,MRBCTR,2021-03-10,Индекс МосБиржи полн дох-ти 15,Индекс МосБиржи полной доходности 15,2074.98,2074.98,2074.98,2074.98,78323059037.0,0,0.0,2,0.0,RUB,0.0
RTSI,MREDC,2021-03-10,Индекс недвиж-ти ДомКлик Москва,Индекс московской недвижимости ДомКлик,214959.15,214959.15,214959.15,214959.15,0.0,0,0.0,2,7026003.59,RUB,1.0
RTSI,MRRT,2021-03-10,"Индекс ""Ответственность и открытость""",Индекс МосБиржи - РСПП Ответственность и открытость,2720.49,2720.49,2720.49,2720.49,85027313455.0,0,0.0,2,43442420884097.016,RUB,4957833678.8508
RTSI,MRSV,2021-03-10,"Индекс ""Вектор устойчивого развития""",Индекс МосБиржи - РСПП Вектор устойчивого развития,3018.68,3018.68,3018.68,3018.68,79009035639.0,0,0.0,2,41403541783667.12,RUB,291060494.3854
RTSI,MRSVT,2021-03-10,Индекс МосБиржи-РСПП Вектор TR,"Индекс МосБиржи - РСПП Вектор устойчивого развития, полной доходности брутто",3785.61,3785.61,3785.61,3785.61,79009035639.0,0,0.0,2,0.0,RUB,0.0
INAV,MTEKA,2021-03-10,iNAV Фридом - Лидеры Технологий,Расчетная цена одного пая Биржевого ПИФа «Фридом - Лидеры Технологий»,1829.39,1823.11,1846.3,1812.99,0.0,0,0.0,2,0.0,RUB,0.0
INAV,OPNWO,2021-03-10,iNAV «Открытие – Всепогодный»,Биржевой паевой инвестиционный фонд рыночных финансовых инструментов «Открытие – Всепогодный»,1.0983,1.0982,1.1019,1.0982,0.0,0,0.0,4,0.0,USD,0.0
INAV,RCMBD,2021-03-10,iNAV «Райффайзен –Еврооблигации»,Биржевой паевой инвестиционный фонд рыночных финансовых инструментов «Райффайзен – Еврооблигации»,12.9,12.9,12.91,12.9,0.0,0,0.0,2,0.0,USD,0.0
INAV,RFBC15,2021-03-10,iNAV «Raiffeisen-MOEX Index 15»,Расчетная цена одного пая Биржевого ПИФа «Райффайзен – Индекс МосБиржи полной доходности 15»,1289.93,1294.1,1310.63,1286.88,0.0,0,0.0,2,0.0,RUB,0.0
SNDX,RGBI,2021-03-10,Индекс Мосбиржи гос обл RGBI,Индекс Мосбиржи государственных облигаций ценовой,147.89,148.28,148.51,147.89,15721578036.24,1865,6.54,2,9181616031093.338,RUB,1.0
SNDX,RGBITR,2021-03-10,Индекс Мосбиржи гос обл RGBITR,Индекс Мосбиржи государственных облигаций,606.8,608.4,609.25,606.8,15721578036.24,1824,6.52,2,8916086642297.537,RUB,1.0
SNDX,RPGCC,2021-03-10,MOEXREPOGCC,MOEXREPO КСУ 12:30,4.11,4.11,4.11,4.11,64346543000.0,,,2,,RUB,
SNDX,RPGCC1W,2021-03-10,MOEXREPOGCC1W,MOEXREPO КСУ 1 неделя 12:30,4.19,4.19,4.19,4.19,8400000000.0,,,2,,RUB,
SNDX,RPGCC1WE,2021-03-10,MOEXREPOGCC1WE,MOEXREPO КСУ 1 неделя 19:00,4.19,4.19,4.19,4.19,2962640000.0,,,2,,RUB,
SNDX,RPGCCE,2021-03-10,MOEXREPOGCCE,MOEXREPO КСУ 19:00,4.1,4.1,4.1,4.1,32344166000.0,,,2,,RUB,
RTSI,RTSCH,2021-03-10,Индекс РТС химии и нефтехимии,Индекс РТС химии и нефтехимии,293.41,295.97,297.4,291.81,5962090.36745898,0,0.0,2,2946956201.228344,USD,10043947.695
RTSI,RTSCR,2021-03-10,Индекс РТС потреб. сектора,Индекс РТС потребительских товаров и розничной торговли,265.55,263.29,266.41,262.68,54591858.10419701,0,0.0,2,2264411917.164672,USD,8527282.6944
RTSI,RTSEU,2021-03-10,Индекс РТС электроэнергетики,Индекс РТС электроэнергетики,77.63,77.68,78.05,77.42,36227973.5282789,0,0.0,2,3813368047.6642995,USD,49124990.0073
RTSI,RTSFN,2021-03-10,Индекс РТС финансов,Индекс РТС финансов,239.62,239.2,242.98,238.44,274840389.51547056,0,0.0,2,14071931611.709332,USD,58724922.3762
RTSI,RTSI,2021-03-10,Индекс РТС,Индекс РТС,1479.57,1479.41,1498.32,1472.73,1383839385.5844164,0,0.0,2,238558116900.3937,USD,161234282.6352
RTSI,RTSMM,2021-03-10,Индекс РТС металлов и добычи,Индекс РТС металлов и добычи,289.22,289.41,290.97,286.91,349494932.0348716,0,0.0,2,24427084987.18493,USD,84459553.1639
RTSI,RTSOG,2021-03-10,Индекс РТС нефти и газа,Индекс РТС нефти и газа,219.25,218.45,222.29,217.85,517355292.13762015,0,0.0,2,18375814019.781273,USD,83810552.5083
RTSI,RTSSM,2021-03-10,RTS SMID Index,Индекс РТС средней и малой капитализации,1290.57,1290.57,1290.57,1290.57,1182855.077636458,0,0.0,2,893932952.9048871,USD,8817568.3892
RTSI,RTSTL,2021-03-10,Индекс РТС телекоммуникаций,Индекс РТС телекоммуникаций ,94.92,94.66,95.84,94.47,37788088.14322953,0,0.0,2,5510942627.611181,USD,58056740.3599
RTSI,RTSTN,2021-03-10,Индекс РТС транспорта,Индекс РТС транспорта,44.38,44.25,44.6,44.14,13982500.888335543,0,0.0,2,2488831075.99247,USD,56082557.4433
RTSI,RTSTR,2021-03-10,RTS Total Return,Индекс РТС полной доходности «брутто»,2679.64,2679.64,2679.64,2679.64,102155248983.0,0,0.0,2,0.0,USD,0.0
RTSI,RTSTRN,2021-03-10,RTS Net-TR-NR,Индекс РТС полной доходности «нетто» (по налоговым ставкам иностранных организаций),2451.65,2451.65,2451.65,2451.65,102155248983.0,0,0.0,2,0.0,USD,0.0
RTSI,RTSTRR,2021-03-10,RTS Net-TR-Res,Индекс РТС полной доходности «нетто» (по налоговым ставкам российских организаций),2505.44,2505.44,2505.44,2505.44,102155248983.0,0,0.0,2,0.0,USD,0.0
RTSI,RTSUSDCUR,2021-03-10,RTSUSDCUR,Курс доллара США на момент закрытия Индекса РТС,73.7334,73.7334,73.7334,73.7334,0.0,,,2,0.0,USD,
RTSI,RUABICP,2021-03-10,ABI CP,Композитный индекс облигаций ,112.24,112.24,112.24,112.24,16446298225.0,1625,6.23,2,10642305102802.24,RUB,1000000000000.0
RTSI,RUABITR,2021-03-10,ABI TR,Композитный индекс облигаций — совокупный доход,221.15,221.15,221.15,221.15,16446298225.0,1628,6.23,2,10828949464700.42,RUB,1000000000000.0
RTSI,RUBMI,2021-03-10,Индекс РТС широкого рынка,Индекс РТС широкого рынка,1078.19,1077.23,1091.75,1073.59,1414682878.8303535,0,0.0,2,260631125201.01974,USD,241729735.9223
RTSI,RUCBCP3A3YNS,2021-03-10,RUCBCP3A3YNS,Индекс МосБиржи Корпоративных Облигаций RUCBCP3A3YNS,104.92,104.92,104.92,104.92,381069569.0,661,5.53,2,619757000000.0,RUB,244097036547.0
RTSI,RUCBCP3A5YNS,2021-03-10,RUCBCP3A5YNS,Индекс МосБиржи Корпоративных Облигаций RUCBCP3A5YNS,109.06,109.06,109.06,109.06,162521653.0,1335,6.41,2,343628000000.0,RUB,343696000000.0
SNDX,RUCBCP3Y,2021-03-10,Индекс Мосбиржи корп обл CBICP 3-5,Индекс Мосбиржи корпоративных облигаций MOEX 1 - 3 ценовой,92.38,92.2,92.4,92.19,841558664.2,648,6.02,2,1026037289837.9998,RUB,1.0
RTSI,RUCBCP3YNS,2021-03-10,RUCBCP3YNS,Индекс МосБиржи Корпоративных Облигаций RUCBCP3YNS,102.98,102.98,102.98,102.98,877270720.0,652,5.99,2,1149773617898.0,RUB,1000000000000.0
SNDX,RUCBCP5Y,2021-03-10,Индекс Мосбиржи корп обл CBICP 1-3,Индекс Мосбиржи корпоративных облигаций ценовой 3-5,121.95,121.9,122.06,121.58,239127294.58,1313,6.53,2,485474994163.1002,RUB,1.0
RTSI,RUCBCP5YNS,2021-03-10,RUCBCP5YNS,Индекс МосБиржи Корпоративных Облигаций RUCBCP5YNS,108.73,108.73,108.73,108.73,240273910.0,1311,6.54,2,582738775000.0,RUB,518137737111.4
RTSI,RUCBCPA3YNS,2021-03-10,RUCBCPA3YNS,Индекс МосБиржи Корпоративных Облигаций RUCBCPA3YNS,99.51,99.51,99.51,99.51,460875646.0,665,6.94,2,188868100000.0,RUB,160960055611.12
RTSI,RUCBCPA5YNS,2021-03-10,RUCBCPA5YNS,Индекс МосБиржи Корпоративных Облигаций RUCBCPA5YNS,108.58,108.58,108.58,108.58,39386162.0,1294,7.11,2,88646775000.0,RUB,88740250000.0
RTSI,RUCBCPAA3YNS,2021-03-10,RUCBCPAA3YNS,Индекс МосБиржи Корпоративных Облигаций RUCBCPAA3YNS,99.57,99.57,99.57,99.57,35325505.0,601,5.95,2,341148517898.0,RUB,201658979521.2992
