BOARDID,SECID,TRADEDATE,SHORTNAME,NAME,CLOSE,OPEN,HIGH,LOW,VALUE,DURATION,YIELD,DECIMALS,CAPITALIZATION,CURRENCYID,DIVISOR
INAV,AKCHA,2021-02-22,iNAV Альфа Китайские акции,Расчетная цена одного пая Биржевого ПИФа РФИ «Альфа-Капитал Китайские акции»,117.95,120.77,121.88,117.92,0.0,0,0.0,2,0.0,RUB,0.0
INAV,AKEUA,2021-02-22,iNAV Альфа-Капитал ЕВРОПА 600,Расчетная цена одного пая Биржевого ПИФа «ЕВРОПА 600»,11.16,11.21,11.21,11.08,0.0,0,0.0,2,0.0,EUR,0.0
INAV,AKMBA,2021-02-22,iNAV Альфа Управляемые облигации,Расчетная цена одного пая Биржевого ПИФа РФИ «Альфа-Капитал Управляемые облигации»,1.0661,1.0662,1.0665,1.0653,0.0,0,0.0,4,0.0,RUB,0.0
INAV,AKMEI,2021-02-22,iNAV Альфа Управляемые акции,Расчетная цена одного пая Биржевого ПИФа РФИ «Альфа-Капитал Управляемые Российские Акции»,107.06,107.49,107.56,106.1,0.0,0,0.0,2,0.0,RUB,0.0
INAV,AKNXA,2021-02-22,iNAV Технологии 100,Расчетная цена одного пая Биржевого ПИФа «ТЕХНОЛОГИИ 100»,19.52,19.84,19.84,19.52,0.0,0,0.0,2,0.0,USD,0.0
INAV,AKSPA,2021-02-22,iNAV Альфа - Капитал Эс энд Пи 500,Расчетная цена одного пая Биржевого ПИФа «Альфа - Капитал Эс энд Пи 500»,13.33,13.42,13.42,13.31,0.0,0,0.0,2,0.0,USD,0.0
RTSI,BPSI,2021-02-22,Субиндекс облигаций,Субиндекс облигаций активов пенсионных накоплений,3032.7,3032.7,3032.7,3032.7,60309506.0,954,6.16,2,1996866450479.5,RUB,1000000000000.0
RTSI,BPSIG,2021-02-22,Субиндекс облигаций ОФЗ,Субиндекс облигаций ОФЗ активов пенсионных накоплений,2037.59,2037.59,2037.59,2037.59,268211354.0,1751,6.06,2,8758821867719.17,RUB,1000000000000.0
INAV,DIVDA,2021-02-22,iNAV ДОХОДЪ Дивидендные акции РФ,Расчетная цена одного пая Биржевого ПИФа РФИ «ДОХОДЪ Индекс дивидендных акций РФ»,983.22,987.21,987.82,975.38,0.0,0,0.0,2,0.0,RUB,0.0
RTSI,EPSI,2021-02-22,Субиндекс акций,Субиндекс акций активов пенсионных накоплений,2037.14,2037.14,2037.14,2037.14,88674216215.0,0,0.0,2,49356561730672.88,RUB,7568983455.3956
RTSI,EPSITR,2021-02-22,Субиндекс акций полной доходности,Субиндекс акций полной дох-ти,2050.77,2050.77,2050.77,2050.77,88674216215.0,0,0.0,2,0.0,RUB,0.0
INAV,ESGRA,2021-02-22,iNAV RSHB-MOEX-RSPP ESG VecTR ,Расчетная цена одного пая Биржевого ПИФа «РСХБ–Индекс МосБиржи–РСПП Вектор развития полн дох-ти»,1339.71,1345.93,1346.85,1332.26,0.0,0,0.0,2,0.0,RUB,0.0
INAV,FMUSA,2021-02-22,iNAV Дивидендные аристократы США,Расчетная цена одного пая Биржевого ПИФа РФИ «Дивидендные Аристократы США»,9.95,9.87,10.0,9.87,0.0,0,0.0,2,0.0,RUB,0.0
INAV,GPBMA,2021-02-22,iNAV ГПБ - Корп. облигации 4г,Расчетная цена одного пая Биржевого ПИФа «Газпромбанк – Корпоративные облигации 4 года»,58512.49,58397.51,58607.29,58351.47,0.0,0,0.0,2,0.0,RUB,0.0
INAV,GPBSA,2021-02-22,iNAV ГПБ - Корп. облигации 2г,Расчетная цена одного пая Биржевого ПИФа «Газпромбанк – Корпоративные облигации 2 года»,57075.85,57093.2,57264.57,57069.65,0.0,0,0.0,2,0.0,RUB,0.0
SNDX,IMOEX,2021-02-22,Индекс МосБиржи,Индекс МосБиржи,3433.93,3447.57,3456.26,3415.37,88526795000.8,0,0.0,2,17441709732566.35,RUB,5079230865.8227
SNDX,IMOEX2,2021-02-22,Индекс МосБиржи (доп. сессия),Индекс МосБиржи (Дополнительная сессия),3433.93,3434.2,3457.09,3433.68,9404219454.45,0,0.0,2,17441709732566.342,RUB,5079230865.8227
RTSI,MCFTR,2021-02-22,MOEX Russia Total Return,Индекс МосБиржи полной доходности «брутто»,6222.99,6222.99,6222.99,6222.99,88674216215.0,0,0.0,2,0.0,RUB,0.0
RTSI,MCFTRN,2021-02-22,MOEX Russia Net-TR-NR,Индекс МосБиржи полной доходности «нетто» (по налоговым ставкам иностранных организаций),5693.28,5693.28,5693.28,5693.28,88674216215.0,0,0.0,2,0.0,RUB,0.0
RTSI,MCFTRR,2021-02-22,MOEX Russia Net-TR-Res,Индекс МосБиржи полной доходности «нетто» (по налоговым ставкам российских организаций),5818.32,5818.32,5818.32,5818.32,88674216215.0,0,0.0,2,0.0,RUB,0.0
RTSI,MCXSM,2021-02-22,Индекс МосБиржи SMID,Индекс МосБиржи средней и малой капитализации,2055.84,2055.84,2055.84,2055.84,4655444830.0,0,0.0,2,4901122520577.061,RUB,414265307.9884
RTSI,MEBCTR,2021-02-22,MOEX Blue Chip Total Return,Индекс МосБиржи голубых фишек полной доходности «брутто»,37562.78,37562.78,37562.78,37562.78,63705199704.0,0,0.0,2,0.0,RUB,0.0
RTSI,MEBCTRN,2021-02-22,MOEX Blue Chip Net-TR-NR,Индекс МосБиржи голубых фишек полной доходности «нетто» (по налоговым ставкам иностр. орг.),34739.17,34739.17,34739.17,34739.17,63705199704.0,0,0.0,2,0.0,RUB,0.0
RTSI,MEBCTRR,2021-02-22,MOEX Blue Chip Net-TR-Res,Индекс МосБиржи голубых фишек полной доходности «нетто» (по налоговым ставкам росс. орг.),35345.91,35345.91,35345.91,35345.91,63705199704.0,0,0.0,2,0.0,RUB,0.0
SNDX,MECHTR,2021-02-22,MOEX Chemicals Total Return,Индекс МосБиржи химии и нефтехимии полной доходности «брутто»,32258.11,32258.11,32258.11,32258.11,371143854.0,0,0.0,2,0.0,RUB,0.0
SNDX,MECHTRN,2021-02-22,MOEX Chemicals Net TR-NR,Индекс МосБиржи химии и нефтехимии полной доходности «нетто» (по налог.ставкам ин.орг-й),30183.2,30183.2,30183.2,30183.2,371143854.0,0,0.0,2,0.0,RUB,0.0
SNDX,MECHTRR,2021-02-22,MOEX Chemicals Net TR-Res,Индекс МосБиржи химии и нефтехимии полной доходности «нетто» (по налог.ставкам рос.орг-й),30501.7,30501.7,30501.7,30501.7,371143854.0,0,0.0,2,0.0,RUB,0.0
SNDX,MECNTR,2021-02-22,MOEX Consumer Total Return,Индекс МосБиржи потребительского сектора полной доходности «брутто»,11746.17,11746.17,11746.17,11746.17,2541300599.0,0,0.0,2,0.0,RUB,0.0
SNDX,MECNTRN,2021-02-22,MOEX Consumer Net TR-NR,Индекс МосБиржи потребит. сектора полной доходности «нетто» (по налог.ставкам ин.орг-й),11333.78,11333.78,11333.78,11333.78,2541300599.0,0,0.0,2,0.0,RUB,0.0
SNDX,MECNTRR,2021-02-22,MOEX Consumer Net TR-Res,Индекс МосБиржи потреб. сектора полной доходности «нетто» (по налог.ставкам рос.орг-й),11263.25,11263.25,11263.25,11263.25,2541300599.0,0,0.0,2,0.0,RUB,0.0
SNDX,MEEUTR,2021-02-22,MOEX El.Utilities Total Return,Индекс МосБиржи электроэнергетики полной доходности «брутто»,3297.72,3297.72,3297.72,3297.72,1915073744.0,0,0.0,2,0.0,RUB,0.0
SNDX,MEEUTRN,2021-02-22,MOEX El. Utilities Net TR-NR,Индекс МосБиржи электроэнергетики полной доходности «нетто» (по налог.ставкам ин.орг-й),3120.79,3120.79,3120.79,3120.79,1915073744.0,0,0.0,2,0.0,RUB,0.0
SNDX,MEEUTRR,2021-02-22,MOEX El. Utilities Net TR-Res,Индекс МосБиржи электроэнергетики полной доходности «нетто» (по налог.ставкам рос.орг-й),3149.14,3149.14,3149.14,3149.14,1915073744.0,0,0.0,2,0.0,RUB,0.0
SNDX,MEFNTR,2021-02-22,MOEX Financials Total Return,Индекс МосБиржи финансов полной доходности «брутто»,14041.54,14041.54,14041.54,14041.54,22372476740.0,0,0.0,2,0.0,RUB,0.0
SNDX,MEFNTRN,2021-02-22,MOEX Financials Net TR-NR,Индекс МосБиржи финансов полной доходности «нетто» (по налог.ставкам ин.орг-й),13426.63,13426.63,13426.63,13426.63,22372476740.0,0,0.0,2,0.0,RUB,0.0
SNDX,MEFNTRR,2021-02-22,MOEX Financials Net TR-Res,Индекс МосБиржи финансов полной доходности «нетто» (по налог.ставкам рос.орг-й),13526.06,13526.06,13526.06,13526.06,22372476740.0,0,0.0,2,0.0,RUB,0.0
SNDX,MEMMTR,2021-02-22,MOEX Metals & Min Total Return,Индекс МосБиржи металлов и добычи полной доходности «брутто»,16917.42,16917.42,16917.42,16917.42,36131867384.0,0,0.0,2,0.0,RUB,0.0
SNDX,MEMMTRN,2021-02-22,MOEX Metals & Mining Net TR-NR,Индекс МосБиржи металлов и добычи полной доходности «нетто» (по налог.ставкам ин.орг-й),15710.64,15710.64,15710.64,15710.64,36131867384.0,0,0.0,2,0.0,RUB,0.0
SNDX,MEMMTRR,2021-02-22,MOEX Metals & Min Net TR-Res,Индекс МосБиржи металлов и добычи полной доходности «нетто» (по налог.ставкам рос.орг-й),15904.06,15904.06,15904.06,15904.06,36131867384.0,0,0.0,2,0.0,RUB,0.0
SNDX,MEOGTR,2021-02-22,MOEX Oil & Gas Total Return,Индекс МосБиржи нефти и газа полной доходности «брутто»,11209.69,11209.69,11209.69,11209.69,18908886326.0,0,0.0,2,0.0,RUB,0.0
SNDX,MEOGTRN,2021-02-22,MOEX Oil & Gas Net TR-NR,Индекс МосБиржи нефти и газа полной доходности «нетто» (по налог.ставкам ин.орг-й),10612.56,10612.56,10612.56,10612.56,18908886326.0,0,0.0,2,0.0,RUB,0.0
SNDX,MEOGTRR,2021-02-22,MOEX Oil & Gas Net TR-Res,Индекс МосБиржи нефти и газа полной доходности «нетто» (по налог.ставкам рос.орг-й),10709.76,10709.76,10709.76,10709.76,18908886326.0,0,0.0,2,0.0,RUB,0.0
SNDX,MESMTR,2021-02-22,MOEX SMID Total Return,Индекс МосБиржи средней и малой капитализации полной доходности «брутто»,2895.7,2895.7,2895.7,2895.7,4655444830.0,0,0.0,2,0.0,RUB,0.0
SNDX,MESMTRN,2021-02-22,MOEX SMID Net TR-NR,Индекс МосБиржи средней капитализации полной доходности «нетто» (по нал.ставкам ин.орг-й),2750.86,2750.86,2750.86,2750.86,4655444830.0,0,0.0,2,0.0,RUB,0.0
SNDX,MESMTRR,2021-02-22,MOEX SMID Net TR-Res,Индекс МосБиржи средней капитализации полной доходности «нетто» (по нал.ставкам рос.орг-й),2775.62,2775.62,2775.62,2775.62,4655444830.0,0,0.0,2,0.0,RUB,0.0
SNDX,METLTR,2021-02-22,MOEX Telecom Total Return,Индекс МосБиржи телекоммуникаций полной доходности «брутто»,4423.93,4423.93,4423.93,4423.93,855159409.0,0,0.0,2,0.0,RUB,0.0
SNDX,METLTRN,2021-02-22,MOEX Telecom Net TR-NR,Индекс МосБиржи телекоммуникаций полной доходности «нетто» (по налог.ставкам ин.орг-й),4020.2,4020.2,4020.2,4020.2,855159409.0,0,0.0,2,0.0,RUB,0.0
SNDX,METLTRR,2021-02-22,MOEX Telecom Net TR-Res,Индекс МосБиржи телекоммуникаций полной доходности «нетто» (по налог.ставкам рос.орг-й),4084.26,4084.26,4084.26,4084.26,855159409.0,0,0.0,2,0.0,RUB,0.0
SNDX,METNTR,2021-02-22,MOEX Transport Total Return,Индекс МосБиржи транспорта полной доходности «брутто»,1864.93,1864.93,1864.93,1864.93,1142300102.0,0,0.0,2,0.0,RUB,0.0
SNDX,METNTRN,2021-02-22,MOEX Transport Net TR-NR,Индекс МосБиржи транспорта полной доходности «нетто» (по налог.ставкам ин.орг-й),1772.93,1772.93,1772.93,1772.93,1142300102.0,0,0.0,2,0.0,RUB,0.0
SNDX,METNTRR,2021-02-22,MOEX Transport Net TR-Res,Индекс МосБиржи транспорта полной доходности «нетто» (по налог.ставкам рос.орг-й),1786.81,1786.81,1786.81,1786.81,1142300102.0,0,0.0,2,0.0,RUB,0.0
SNDX,MOEX10,2021-02-22,Индекс МосБиржи 10,Индекс МосБиржи 10,5435.74,5451.18,5466.84,5399.53,58359421690.0,0,0.0,2,12401778954160.713,RUB,5391.01
RTSI,MOEXBC,2021-02-22,Индекс голубых фишек,Индекс МосБиржи голубых фишек,22277.58,22371.8,22443.96,22099.6,63577594665.6,0,0.0,2,13725185626074.744,RUB,616098470.6265
SNDX,MOEXBMI,2021-02-22,Индекс широкого рынка,Индекс МосБиржи широкого рынка,2457.15,2472.32,2472.37,2443.81,90402175379.13,0,0.0,2,19067539476106.152,RUB,7760008376.088
SNDX,MOEXCH,2021-02-22,Индекс химии и нефтехимии,Индекс МосБиржи химии и нефтехимии,20654.77,20662.71,20918.4,20568.89,370985609.3,0,0.0,2,216338681658.3,RUB,10474029.9738
SNDX,MOEXCN,2021-02-22,Индекс потребительского сектора / Индекс потребит сектора,Индекс МосБиржи потребительского сектора,8826.04,8876.09,8954.92,8817.76,2539933945.02,0,0.0,2,170465955059.5211,RUB,19313982.7282
SNDX,MOEXEU,2021-02-22,Индекс электроэнергетики,Индекс МосБиржи электроэнергетики,2282.33,2302.95,2302.95,2282.05,1914786718.5,0,0.0,2,284240442608.9361,RUB,124539818.5684
SNDX,MOEXFN,2021-02-22,Индекс финансов,Индекс МосБиржи финансов,10403.64,10402.93,10588.99,10243.41,22355982568.1,0,0.0,2,1062229379958.2441,RUB,102101671.187
SNDX,MOEXINN,2021-02-22,Индекс МосБиржи инноваций,Индекс МосБиржи инноваций,406.14,408.02,409.58,404.88,89164604.8,0,0.0,2,11406310154.991,RUB,28084330.4761
SNDX,MOEXMM,2021-02-22,Индекс металлов и добычи,Индекс МосБиржи металлов и добычи,10316.03,10358.5,10378.22,10239.37,36017092960.59,0,0.0,2,1831533470441.3655,RUB,177542507.7844
SNDX,MOEXOG,2021-02-22,Индекс нефти и газа,Индекс МосБиржи нефти и газа,7768.25,7812.35,7814.73,7703.16,18895588122.9,0,0.0,2,1264003376094.3142,RUB,162714074.6339
SNDX,MOEXREPO,2021-02-22,MXREPO,MOEXREPO обл 12:30,3.73,3.73,3.73,3.73,20727366632.0,,,2,,RUB,
SNDX,MOEXREPO1W,2021-02-22,MOEXREPO1W,MOEXREPO 1 неделя 12:30,4.06,4.06,4.06,4.06,,,,2,,RUB,
SNDX,MOEXREPO1WE,2021-02-22,MOEXREPO1WE,MOEXREPO 1 неделя 19:00,4.05,4.05,4.05,4.05,,,,2,,RUB,
SNDX,MOEXREPOE,2021-02-22,MXREPOE,MOEXREPO обл 19:00,3.93,3.93,3.93,3.93,8278773877.0,,,2,,RUB,
SNDX,MOEXREPOEQ,2021-02-22,MXREPOEQ,MOEXREPO акц 12:30,3.85,3.85,3.85,3.85,37140658272.0,,,2,,RUB,
SNDX,MOEXREPOEQE,2021-02-22,MXREPOEQE,MOEXREPO акц 19:00,4.18,4.18,4.18,4.18,27379245494.0,,,2,,RUB,
SNDX,MOEXREPOUSD,2021-02-22,MOEXREPOUSD,MOEXREPO USD 12:30,0.22,,,,,,,2,,USD,
SNDX,MOEXREPOUSDE,2021-02-22,MOEXREPOUSDE,MOEXREPO USD 19:00,0.22,,,,,,,2,,USD,
SNDX,MOEXTL,2021-02-22,Индекс телекоммуникаций,Индекс МосБиржи телекоммуникаций,2318.52,2349.6,2353.3,2314.89,854600302.3,0,0.0,2,412696774340.8991,RUB,178000185.54
SNDX,MOEXTN,2021-02-22,Индекс транспорта,Индекс МосБиржи транспорта,1325.76,1350.53,1350.53,1324.36,1142033163.5,0,0.0,2,181675853650.962,RUB,137035373.9192
SNDX,MRBC,2021-02-22,Индекс МосБиржи 15,Индекс МосБиржи 15,1700.16,1711.35,1717.46,1689.07,63577594665.6,0,0.0,2,11071283481694.77,RUB,6511921170.5989
RTSI,MRBCTR,2021-02-22,Индекс МосБиржи полн дох-ти 15,Индекс МосБиржи полной доходности 15,2055.68,2055.68,2055.68,2055.68,63705199704.0,0,0.0,2,0.0,RUB,0.0
RTSI,MRRT,2021-02-22,"Индекс ""Ответственность и открытость""",Индекс МосБиржи - РСПП Ответственность и открытость,2671.17,2671.17,2671.17,2671.17,72975126123.0,0,0.0,2,42237449499780.55,RUB,4957833678.8508
RTSI,MRSV,2021-02-22,"Индекс ""Вектор устойчивого развития""",Индекс МосБиржи - РСПП Вектор устойчивого развития,3009.44,3009.44,3009.44,3009.44,69970081191.0,0,0.0,2,40252488873942.2,RUB,291060494.3854
RTSI,MRSVT,2021-02-22,Индекс МосБиржи-РСПП Вектор TR,"Индекс МосБиржи - РСПП Вектор устойчивого развития, полной доходности брутто",3774.02,3774.02,3774.02,3774.02,69970081191.0,0,0.0,2,0.0,RUB,0.0
INAV,MTEKA,2021-02-22,iNAV Фридом - Лидеры Технологий,Расчетная цена одного пая Биржевого ПИФа «Фридом - Лидеры Технологий»,1956.17,1981.48,2007.79,1956.17,0.0,0,0.0,2,0.0,RUB,0.0
INAV,OPNWO,2021-02-22,iNAV «Открытие – Всепогодный»,Биржевой паевой инвестиционный фонд рыночных финансовых инструментов «Открытие – Всепогодный»,1.1262,1.1346,1.1346,1.1232,0.0,0,0.0,4,0.0,USD,0.0
INAV,RCMBD,2021-02-22,iNAV «Райффайзен –Еврооблигации»,Биржевой паевой инвестиционный фонд рыночных финансовых инструментов «Райффайзен – Еврооблигации»,12.97,12.99,12.99,12.97,0.0,0,0.0,2,0.0,USD,0.0
INAV,RFBC15,2021-02-22,iNAV «Raiffeisen-MOEX Index 15»,Расчетная цена одного пая Биржевого ПИФа «Райффайзен – Индекс МосБиржи полной доходности 15»,1278.04,1289.07,1289.69,1270.71,0.0,0,0.0,2,0.0,RUB,0.0
SNDX,RGBI,2021-02-22,Индекс Мосбиржи гос обл RGBI,Индекс Мосбиржи государственных облигаций ценовой,148.33,148.41,148.46,148.33,267902244.11,1749,6.43,2,8618991209485.513,RUB,1.0
SNDX,RGBITR,2021-02-22,Индекс Мосбиржи гос обл RGBITR,Индекс Мосбиржи государственных облигаций,606.93,607.27,607.46,606.93,267902244.11,1749,6.43,2,8758878644082.163,RUB,1.0
SNDX,RPGCC,2021-02-22,MOEXREPOGCC,MOEXREPO КСУ 12:30,3.88,3.88,3.88,3.88,4410814000.0,,,2,,RUB,
SNDX,RPGCC1W,2021-02-22,MOEXREPOGCC1W,MOEXREPO КСУ 1 неделя 12:30,4.25,,,,,,,2,,RUB,
SNDX,RPGCC1WE,2021-02-22,MOEXREPOGCC1WE,MOEXREPO КСУ 1 неделя 19:00,4.14,4.14,4.14,4.14,,,,2,,RUB,
SNDX,RPGCCE,2021-02-22,MOEXREPOGCCE,MOEXREPO КСУ 19:00,3.55,3.55,3.55,3.55,7243612000.0,,,2,,RUB,
RTSI,RTSCH,2021-02-22,Индекс РТС химии и нефтехимии,Индекс РТС химии и нефтехимии,289.77,290.99,292.22,286.92,4991001.175823244,0,0.0,2,2910481127.744989,USD,10043947.695
RTSI,RTSCR,2021-02-22,Индекс РТС потреб. сектора,Индекс РТС потребительских товаров и розничной торговли,268.94,271.49,272.73,267.23,34170633.545672126,0,0.0,2,2293339042.841148,USD,8527282.6944
RTSI,RTSEU,2021-02-22,Индекс РТС электроэнергетики,Индекс РТС электроэнергетики,77.84,78.84,78.84,77.19,25760305.855303783,0,0.0,2,3823987636.486792,USD,49124990.0073
RTSI,RTSFN,2021-02-22,Индекс РТС финансов,Индекс РТС финансов,243.35,244.25,247.26,238.05,300762974.3229262,0,0.0,2,14290549151.944134,USD,58724922.3762
RTSI,RTSI,2021-02-22,Индекс РТС,Индекс РТС,1455.33,1466.66,1470.35,1434.84,1190982417.8208525,0,0.0,2,234649516319.13983,USD,161234282.6352
RTSI,RTSMM,2021-02-22,Индекс РТС металлов и добычи,Индекс РТС металлов и добычи,291.74,294.05,294.61,287.04,484550744.85294807,0,0.0,2,24640270337.65723,USD,84459553.1639
RTSI,RTSOG,2021-02-22,Индекс РТС нефти и газа,Индекс РТС нефти и газа,202.9,204.83,204.89,199.61,254209058.7212048,0,0.0,2,17005086391.989252,USD,83810552.5083
RTSI,RTSSM,2021-02-22,RTS SMID Index,Индекс РТС средней и малой капитализации,1299.42,1299.42,1299.42,1299.42,842601.8373220289,0,0.0,2,887067722.1140885,USD,8817568.3892
RTSI,RTSTL,2021-02-22,Индекс РТС телекоммуникаций,Индекс РТС телекоммуникаций ,95.63,97.28,97.32,95.34,11497241.420459054,0,0.0,2,5552156294.904261,USD,58056740.3599
RTSI,RTSTN,2021-02-22,Индекс РТС транспорта,Индекс РТС транспорта,43.58,44.56,44.56,43.41,15364177.79819698,0,0.0,2,2444149790.3424015,USD,56082557.4433
RTSI,RTSTR,2021-02-22,RTS Total Return,Индекс РТС полной доходности «брутто»,2635.74,2635.74,2635.74,2635.74,88674216215.0,0,0.0,2,0.0,USD,0.0
RTSI,RTSTRN,2021-02-22,RTS Net-TR-NR,Индекс РТС полной доходности «нетто» (по налоговым ставкам иностранных организаций),2411.49,2411.49,2411.49,2411.49,88674216215.0,0,0.0,2,0.0,USD,0.0
RTSI,RTSTRR,2021-02-22,RTS Net-TR-Res,Индекс РТС полной доходности «нетто» (по налоговым ставкам российских организаций),2464.4,2464.4,2464.4,2464.4,88674216215.0,0,0.0,2,0.0,USD,0.0
RTSI,RTSUSDCUR,2021-02-22,RTSUSDCUR,Курс доллара США на момент закрытия Индекса РТС,74.3309,74.3309,74.3309,74.3309,0.0,,,2,0.0,USD,
RTSI,RUABICP,2021-02-22,ABI CP,Композитный индекс облигаций ,112.6,112.6,112.6,112.6,350395533.0,1623,6.09,2,10295371641692.863,RUB,1000000000000.0
RTSI,RUABITR,2021-02-22,ABI TR,Композитный индекс облигаций — совокупный доход,221.19,221.19,221.19,221.19,350395533.0,1625,6.09,2,10459629924545.123,RUB,1000000000000.0
RTSI,RUBMI,2021-02-22,Индекс РТС широкого рынка,Индекс РТС широкого рынка,1061.19,1071.79,1071.82,1046.56,1216212576.1847363,0,0.0,2,256522381352.92532,USD,241729735.9223
RTSI,RUCBCP3A3YNS,2021-02-22,RUCBCP3A3YNS,Индекс МосБиржи Корпоративных Облигаций RUCBCP3A3YNS,104.69,104.69,104.69,104.69,7552610.0,579,5.64,2,192610800000.0,RUB,192714400000.0
RTSI,RUCBCP3A5YNS,2021-02-22,RUCBCP3A5YNS,Индекс МосБиржи Корпоративных Облигаций RUCBCP3A5YNS,109.49,109.49,109.49,109.49,1631073.0,1351,6.29,2,213098500000.0,RUB,213517500000.0
SNDX,RUCBCP3Y,2021-02-22,Индекс Мосбиржи корп обл CBICP 3-5,Индекс Мосбиржи корпоративных облигаций MOEX 1 - 3 ценовой,92.44,92.4,92.44,92.36,70001924.3,627,6.14,2,744679809097.2996,RUB,1.0
RTSI,RUCBCP3YNS,2021-02-22,RUCBCP3YNS,Индекс МосБиржи Корпоративных Облигаций RUCBCP3YNS,103.1,103.1,103.1,103.1,43204757.0,628,6.01,2,781515557017.2,RUB,753547725121.8843
SNDX,RUCBCP5Y,2021-02-22,Индекс Мосбиржи корп обл CBICP 1-3,Индекс Мосбиржи корпоративных облигаций ценовой 3-5,122.29,122.39,122.62,122.16,5446663.1,1275,6.43,2,444142650000.0,RUB,1.0
RTSI,RUCBCP5YNS,2021-02-22,RUCBCP5YNS,Индекс МосБиржи Корпоративных Облигаций RUCBCP5YNS,109.41,109.41,109.41,109.41,5606874.0,1299,6.44,2,427799150000.0,RUB,352528104223.45
RTSI,RUCBCPA3YNS,2021-02-22,RUCBCPA3YNS,Индекс МосБиржи Корпоративных Облигаций RUCBCPA3YNS,99.85,99.85,99.85,99.85,4084802.0,617,6.66,2,157187200000.0,RUB,103587943618.6
RTSI,RUCBCPA5YNS,2021-02-22,RUCBCPA5YNS,Индекс МосБиржи Корпоративных Облигаций RUCBCPA5YNS,109.6,109.6,109.6,109.6,2048034.0,1308,6.89,2,100918200000.0,RUB,100681300000.0
RTSI,RUCBCPAA3YNS,2021-02-22,RUCBCPAA3YNS,Индекс МосБиржи Корпоративных Облигаций RUCBCPAA3YNS,99.69,99.69,99.69,99.69,12673917.0,621,5.94,2,396269557017.2,RUB,254103252740.9123
RTSI,RUCBCPAA5YNS,2021-02-22,RUCBCPAA5YNS,Индекс МосБиржи Корпоративных Облигаций RUCBCPAA5YNS,110.63,110.63,110.63,110.63,1927767.0,1278,6.31,2,113782450000.0,RUB,113175250000.0
RTSI,RUCBCPAAANS,2021-02-22,RUCBCPAAANS,Индекс МосБиржи Корпоративных Облигаций RUCBCPAAANS,107.26,107.26,107.26,107.26,31127734.0,1202,6.07,2,540199800000.0,RUB,267581696259.82
