BOARDID,SECID,TRADEDATE,SHORTNAME,NAME,CLOSE,OPEN,HIGH,LOW,VALUE,DURATION,YIELD,DECIMALS,CAPITALIZATION,CURRENCYID,DIVISOR
RTSI,AKCBI,2020-09-23,iАльфа-Капитал Облигации,Индикатор «Альфа-Капитал. Облигации»,1060.96,1060.96,1060.96,1060.96,566783917.0,0,5.7246,2,116290987.04,RUB,116345507.96
INAV,AKEUA,2020-09-23,iNAV Альфа-Капитал ЕВРОПА 600,Расчетная цена одного пая Биржевого ПИФа «ЕВРОПА 600»,9.73,9.66,9.83,9.66,0.0,0,0.0,2,0.0,EUR,0.0
INAV,AKMBA,2020-09-23,iNAV Альфа Управляемые облигации,Расчетная цена одного пая Биржевого ПИФа РФИ «Альфа-Капитал Управляемые облигации»,1.0335,1.0324,1.0335,1.0308,0.0,0,0.0,4,0.0,RUB,0.0
INAV,AKNXA,2020-09-23,iNAV Технологии 100,Расчетная цена одного пая Биржевого ПИФа «ТЕХНОЛОГИИ 100»,16.11,16.28,16.28,16.09,0.0,0,0.0,2,0.0,USD,0.0
INAV,AKSPA,2020-09-23,iNAV Альфа - Капитал Эс энд Пи 500,Расчетная цена одного пая Биржевого ПИФа «Альфа - Капитал Эс энд Пи 500»,11.31,11.42,11.42,11.3,0.0,0,0.0,2,0.0,USD,0.0
RTSI,AWTEUR,2020-09-23,TINKOFF ALL-WEATHER INDEX (EUR),TINKOFF ALL-WEATHER INDEX (EUR),336.14,336.14,336.14,336.14,0.0,0,0.0,2,0.0,EUR,0.0
RTSI,AWTRUR,2020-09-23,TINKOFF ALL-WEATHER INDEX (RUB),TINKOFF ALL-WEATHER INDEX (RUB),1045.78,1045.78,1045.78,1045.78,127395229789.0,0,0.0,2,0.0,RUB,0.0
RTSI,AWTUSD,2020-09-23,TINKOFF ALL-WEATHER INDEX (USD),TINKOFF ALL-WEATHER INDEX (USD),480.71,480.71,480.71,480.71,0.0,0,0.0,2,0.0,USD,0.0
RTSI,BPSI,2020-09-23,Субиндекс облигаций,Индексы активов пенсионных накоплений - Субиндекс облигаций,2979.2393,2979.2393,2979.2393,2979.2393,59482689.5,,,2,445187963209.0,RUB,0.001
RTSI,EPSI,2020-09-23,Субиндекс акций,Индексы активов пенсионных накоплений - Субиндекс акций,1708.7794,1708.7794,1708.7794,1708.7794,65376566138.65,,,2,7131638888682.155,RUB,4173528234.8069
INAV,ESGRA,2020-09-23,iNAV RSHB-MOEX-RSPP ESG VecTR ,Расчетная цена одного пая Биржевого ПИФа «РСХБ–Индекс МосБиржи–РСПП Вектор развития полн дох-ти»,1082.43,1086.79,1096.51,1082.43,0.0,0,0.0,2,0.0,RUB,0.0
RTSI,GPBCBI2Y,2020-09-23,Индикатор GPBCBI2Y,Индикатор GPBCBI2Y,1168.67,1168.67,1168.67,1168.67,2521653.0,0,3.8685,2,547346360.22,RUB,546537806.17
RTSI,GPBCBI4Y,2020-09-23,Индикатор GPBCBI4Y,Индикатор GPBCBI4Y,1211.34,1211.34,1211.34,1211.34,106463940.0,0,6.1272,2,563583107.11,RUB,562872651.78
INAV,GPBMA,2020-09-23,iNAV ГПБ - Корп. облигации 4г,Расчетная цена одного пая Биржевого ПИФа «Газпромбанк – Корпоративные облигации 4 года»,57595.65,57537.51,57612.79,57488.89,0.0,0,0.0,2,0.0,RUB,0.0
INAV,GPBSA,2020-09-23,iNAV ГПБ - Корп. облигации 2г,Расчетная цена одного пая Биржевого ПИФа «Газпромбанк – Корпоративные облигации 2 года»,56014.8,55876.81,56015.12,55872.88,0.0,0,0.0,2,0.0,RUB,0.0
SNDX,IMOEX,2020-09-23,Индекс МосБиржи,Индекс МосБиржи,2916.39,2933.33,2968.55,2916.27,144057907966.0,0,0.0,2,14026996372700.0,RUB,4809707787.42
SNDX,IMOEX2,2020-09-23,Индекс МосБиржи (доп. сессия),Индекс МосБиржи (Дополнительная сессия),2916.39,2917.36,2928.05,2905.04,8727930906.95,0,0.0,2,14026996372700.0,RUB,4809707787.42
RTSI,MCFTR,2020-09-23,MOEX Russia Total Return,Индекс МосБиржи полной доходности «брутто»,5164.07,5164.07,5164.07,5164.07,144057907965.55,,,2,14026996372661.09,RUB,
RTSI,MCFTRN,2020-09-23,MOEX Russia Net-TR-NR,Индекс МосБиржи полной доходности «нетто» (по налоговым ставкам иностранных организаций),4740.83,4740.83,4740.83,4740.83,144057907965.55,,,2,14026996372661.09,RUB,
RTSI,MCFTRR,2020-09-23,MOEX Russia Net-TR-Res,Индекс МосБиржи полной доходности «нетто» (по налоговым ставкам российских организаций),4843.35,4843.35,4843.35,4843.35,144057907965.55,,,2,14026996372661.09,RUB,
RTSI,MCXSM,2020-09-23,Индекс МосБиржи SMID,Индекс МосБиржи средней и малой капитализации,1794.65,1794.65,1794.65,1794.65,7681901384.77,,,2,560722088559.7471,RUB,312441516.846
RTSI,MEBCTR,2020-09-23,MOEX Blue Chip Total Return,Индекс МосБиржи голубых фишек полной доходности «брутто»,31372.61,31372.61,31372.61,31372.61,119023227021.0,,,2,11200966621203.34,RUB,
RTSI,MEBCTRN,2020-09-23,MOEX Blue Chip Net-TR-NR,Индекс МосБиржи голубых фишек полной доходности «нетто» (по налоговым ставкам иностр. орг.),29115.04,29115.04,29115.04,29115.04,119023227021.0,,,2,11200966621203.34,RUB,
RTSI,MEBCTRR,2020-09-23,MOEX Blue Chip Net-TR-Res,Индекс МосБиржи голубых фишек полной доходности «нетто» (по налоговым ставкам росс. орг.),29613.23,29613.23,29613.23,29613.23,119023227021.0,,,2,11200966621203.34,RUB,
SNDX,MECHTR,2020-09-23,MOEX Chemicals Total Return,Индекс МосБиржи химии и нефтехимии полной доходности «брутто»,25638.94,25638.94,25638.94,25638.94,293306810.0,0,0.0,2,0.0,RUB,0.0
SNDX,MECHTRN,2020-09-23,MOEX Chemicals Net TR-NR,Индекс МосБиржи химии и нефтехимии полной доходности «нетто» (по налог.ставкам ин.орг-й),24085.15,24085.15,24085.15,24085.15,293306810.0,0,0.0,2,0.0,RUB,0.0
SNDX,MECHTRR,2020-09-23,MOEX Chemicals Net TR-Res,Индекс МосБиржи химии и нефтехимии полной доходности «нетто» (по налог.ставкам рос.орг-й),24326.44,24326.44,24326.44,24326.44,293306810.0,0,0.0,2,0.0,RUB,0.0
SNDX,MECNTR,2020-09-23,MOEX Consumer Total Return,Индекс МосБиржи потребительского сектора полной доходности «брутто»,10028.15,10028.15,10028.15,10028.15,5876296973.0,0,0.0,2,0.0,RUB,0.0
SNDX,MECNTRN,2020-09-23,MOEX Consumer Net TR-NR,Индекс МосБиржи потребит. сектора полной доходности «нетто» (по налог.ставкам ин.орг-й),9710.47,9710.47,9710.47,9710.47,5876296973.0,0,0.0,2,0.0,RUB,0.0
SNDX,MECNTRR,2020-09-23,MOEX Consumer Net TR-Res,Индекс МосБиржи потреб. сектора полной доходности «нетто» (по налог.ставкам рос.орг-й),9645.43,9645.43,9645.43,9645.43,5876296973.0,0,0.0,2,0.0,RUB,0.0
SNDX,MEEUTR,2020-09-23,MOEX El.Utilities Total Return,Индекс МосБиржи электроэнергетики полной доходности «брутто»,3129.03,3129.03,3129.03,3129.03,2489401427.0,0,0.0,2,0.0,RUB,0.0
SNDX,MEEUTRN,2020-09-23,MOEX El. Utilities Net TR-NR,Индекс МосБиржи электроэнергетики полной доходности «нетто» (по налог.ставкам ин.орг-й),2966.2,2966.2,2966.2,2966.2,2489401427.0,0,0.0,2,0.0,RUB,0.0
SNDX,MEEUTRR,2020-09-23,MOEX El. Utilities Net TR-Res,Индекс МосБиржи электроэнергетики полной доходности «нетто» (по налог.ставкам рос.орг-й),2992.42,2992.42,2992.42,2992.42,2489401427.0,0,0.0,2,0.0,RUB,0.0
SNDX,MEFNTR,2020-09-23,MOEX Financials Total Return,Индекс МосБиржи финансов полной доходности «брутто»,10241.61,10241.61,10241.61,10241.61,23057963339.0,0,0.0,2,0.0,RUB,0.0
SNDX,MEFNTRN,2020-09-23,MOEX Financials Net TR-NR,Индекс МосБиржи финансов полной доходности «нетто» (по налог.ставкам ин.орг-й),9833.36,9833.36,9833.36,9833.36,23057963339.0,0,0.0,2,0.0,RUB,0.0
SNDX,MEFNTRR,2020-09-23,MOEX Financials Net TR-Res,Индекс МосБиржи финансов полной доходности «нетто» (по налог.ставкам рос.орг-й),9900.72,9900.72,9900.72,9900.72,23057963339.0,0,0.0,2,0.0,RUB,0.0
SNDX,MEMMTR,2020-09-23,MOEX Metals & Min Total Return,Индекс МосБиржи металлов и добычи полной доходности «брутто»,14021.17,14021.17,14021.17,14021.17,18320729530.0,0,0.0,2,0.0,RUB,0.0
SNDX,MEMMTRN,2020-09-23,MOEX Metals & Mining Net TR-NR,Индекс МосБиржи металлов и добычи полной доходности «нетто» (по налог.ставкам ин.орг-й),13060.53,13060.53,13060.53,13060.53,18320729530.0,0,0.0,2,0.0,RUB,0.0
SNDX,MEMMTRR,2020-09-23,MOEX Metals & Min Net TR-Res,Индекс МосБиржи металлов и добычи полной доходности «нетто» (по налог.ставкам рос.орг-й),13216.02,13216.02,13216.02,13216.02,18320729530.0,0,0.0,2,0.0,RUB,0.0
SNDX,MEOGTR,2020-09-23,MOEX Oil & Gas Total Return,Индекс МосБиржи нефти и газа полной доходности «брутто»,9310.82,9310.82,9310.82,9310.82,21040109504.0,0,0.0,2,0.0,RUB,0.0
SNDX,MEOGTRN,2020-09-23,MOEX Oil & Gas Net TR-NR,Индекс МосБиржи нефти и газа полной доходности «нетто» (по налог.ставкам ин.орг-й),8830.76,8830.76,8830.76,8830.76,21040109504.0,0,0.0,2,0.0,RUB,0.0
SNDX,MEOGTRR,2020-09-23,MOEX Oil & Gas Net TR-Res,Индекс МосБиржи нефти и газа полной доходности «нетто» (по налог.ставкам рос.орг-й),8909.51,8909.51,8909.51,8909.51,21040109504.0,0,0.0,2,0.0,RUB,0.0
SNDX,MESMTR,2020-09-23,MOEX SMID Total Return,Индекс МосБиржи средней и малой капитализации полной доходности «брутто»,2489.73,2489.73,2489.73,2489.73,7681901387.0,0,0.0,2,0.0,RUB,0.0
SNDX,MESMTRN,2020-09-23,MOEX SMID Net TR-NR,Индекс МосБиржи средней капитализации полной доходности «нетто» (по нал.ставкам ин.орг-й),2370.57,2370.57,2370.57,2370.57,7681901387.0,0,0.0,2,0.0,RUB,0.0
SNDX,MESMTRR,2020-09-23,MOEX SMID Net TR-Res,Индекс МосБиржи средней капитализации полной доходности «нетто» (по нал.ставкам рос.орг-й),2391.12,2391.12,2391.12,2391.12,7681901387.0,0,0.0,2,0.0,RUB,0.0
SNDX,METLTR,2020-09-23,MOEX Telecom Total Return,Индекс МосБиржи телекоммуникаций полной доходности «брутто»,4436.35,4436.35,4436.35,4436.35,1672309972.0,0,0.0,2,0.0,RUB,0.0
SNDX,METLTRN,2020-09-23,MOEX Telecom Net TR-NR,Индекс МосБиржи телекоммуникаций полной доходности «нетто» (по налог.ставкам ин.орг-й),4043.25,4043.25,4043.25,4043.25,1672309972.0,0,0.0,2,0.0,RUB,0.0
SNDX,METLTRR,2020-09-23,MOEX Telecom Net TR-Res,Индекс МосБиржи телекоммуникаций полной доходности «нетто» (по налог.ставкам рос.орг-й),4106.07,4106.07,4106.07,4106.07,1672309972.0,0,0.0,2,0.0,RUB,0.0
SNDX,METNTR,2020-09-23,MOEX Transport Total Return,Индекс МосБиржи транспорта полной доходности «брутто»,1895.67,1895.67,1895.67,1895.67,564637537.0,0,0.0,2,0.0,RUB,0.0
SNDX,METNTRN,2020-09-23,MOEX Transport Net TR-NR,Индекс МосБиржи транспорта полной доходности «нетто» (по налог.ставкам ин.орг-й),1802.3,1802.3,1802.3,1802.3,564637537.0,0,0.0,2,0.0,RUB,0.0
SNDX,METNTRR,2020-09-23,MOEX Transport Net TR-Res,Индекс МосБиржи транспорта полной доходности «нетто» (по налог.ставкам рос.орг-й),1816.34,1816.34,1816.34,1816.34,564637537.0,0,0.0,2,0.0,RUB,0.0
SNDX,MOEX10,2020-09-23,Индекс МосБиржи 10,Индекс МосБиржи 10,4859.79,4889.65,4948.99,4857.24,105967489063.0,0,0.0,2,10226919425200.0,RUB,5009.22
RTSI,MOEXBC,2020-09-23,Индекс голубых фишек,Индекс МосБиржи голубых фишек,19043.25,19174.94,19437.97,19035.4,119023227021.0,0,0.0,2,11200966621200.0,RUB,588185545.473
SNDX,MOEXBMI,2020-09-23,Индекс широкого рынка,Индекс МосБиржи широкого рынка,2086.65,2099.95,2124.05,2086.47,145369274496.0,0,0.0,2,15805507689900.0,RUB,7574573330.95
SNDX,MOEXCH,2020-09-23,Индекс химии и нефтехимии,Индекс МосБиржи химии и нефтехимии,16859.9,16855.65,17020.51,16807.51,293199493.5,0,0.0,2,178812239000.0,RUB,10605772.4903
SNDX,MOEXCN,2020-09-23,Индекс потребительского сектора / Индекс потребит сектора,Индекс МосБиржи потребительского сектора,7715.96,7635.84,7776.33,7603.02,5874381799.76,0,0.0,2,111897266685.0,RUB,14502059.4659
SNDX,MOEXEU,2020-09-23,Индекс электроэнергетики,Индекс МосБиржи электроэнергетики,2190.42,2204.62,2208.21,2190.42,2488406376.5,0,0.0,2,267548086082.0,RUB,122144387.914
SNDX,MOEXFN,2020-09-23,Индекс финансов,Индекс МосБиржи финансов,7800.41,7815.07,7897.61,7793.09,23025442611.2,0,0.0,2,842678539417.0,RUB,108030067.926
SNDX,MOEXINN,2020-09-23,Индекс МосБиржи инноваций,Индекс МосБиржи инноваций,402.48,400.52,405.51,398.71,160116454.5,0,0.0,2,2541850782.4,RUB,6315514.9888
SNDX,MOEXMM,2020-09-23,Индекс металлов и добычи,Индекс МосБиржи металлов и добычи,8729.36,8740.65,8833.78,8697.95,18305536026.2,0,0.0,2,1401321846000.0,RUB,160529704.482
SNDX,MOEXOG,2020-09-23,Индекс нефти и газа,Индекс МосБиржи нефти и газа,6530.41,6627.13,6636.16,6523.19,21021805484.8,0,0.0,2,1128426045660.0,RUB,172795585.061
SNDX,MOEXREPO,2020-09-23,MXREPO,MOEXREPO обл 12:30,4.17,4.17,4.17,4.17,507376368320.0,,,2,,RUB,
SNDX,MOEXREPO1W,2020-09-23,MOEXREPO1W,MOEXREPO 1 неделя 12:30,4.28,4.28,4.28,4.28,127458225642.0,,,2,,RUB,
SNDX,MOEXREPO1WE,2020-09-23,MOEXREPO1WE,MOEXREPO 1 неделя 19:00,4.29,4.29,4.29,4.29,,,,2,,RUB,
SNDX,MOEXREPOE,2020-09-23,MXREPOE,MOEXREPO обл 19:00,4.02,4.02,4.02,4.02,150522215176.0,,,2,,RUB,
SNDX,MOEXREPOEQ,2020-09-23,MXREPOEQ,MOEXREPO акц 12:30,4.25,4.25,4.25,4.25,41789193936.0,,,2,,RUB,
SNDX,MOEXREPOEQE,2020-09-23,MXREPOEQE,MOEXREPO акц 19:00,4.19,4.19,4.19,4.19,36267278172.0,,,2,,RUB,
SNDX,MOEXREPOUSD,2020-09-23,MOEXREPOUSD,MOEXREPO USD 12:30,0.31,0.31,0.31,0.31,1275093059.0,,,2,,USD,
SNDX,MOEXREPOUSDE,2020-09-23,MOEXREPOUSDE,MOEXREPO USD 19:00,0.25,0.25,0.25,0.25,418349131.0,,,2,,USD,
SNDX,MOEXTL,2020-09-23,Индекс телекоммуникаций,Индекс МосБиржи телекоммуникаций,2371.05,2363.45,2391.08,2356.5,1670663754.3,0,0.0,2,422047380955.0,RUB,178000185.54
SNDX,MOEXTN,2020-09-23,Индекс транспорта,Индекс МосБиржи транспорта,1348.35,1356.29,1359.75,1343.22,564368887.7,0,0.0,2,61765913900.1,RUB,45808634.8417
SNDX,MRBC,2020-09-23,Индекс МосБиржи 15,Индекс МосБиржи 15,1463.05,1471.38,1493.52,1462.39,119023227021.0,0,0.0,2,9350864943810.0,RUB,6391340404.16
RTSI,MRBCTR,2020-09-23,Индекс МосБиржи полн дох-ти 15,Индекс МосБиржи полной доходности 15,1733.31,1733.31,1733.31,1733.31,119196318393.0,0,0.0,2,0.0,RUB,0.0
RTSI,MREDC,2020-09-23,Индекс недвиж-ти ДомКлик Москва,Индекс московской недвижимости ДомКлик,192843.85,192843.85,192843.85,192843.85,0.0,0,0.0,2,6315907.96,RUB,1.0
RTSI,MRRT,2020-09-23,"Индекс ""Ответственность и открытость""",Индекс МосБиржи - РСПП Ответственность и открытость,2171.02,2171.02,2171.02,2171.02,56050459976.0,0,0.0,2,32253212824100.0,RUB,3929301536.33
RTSI,MRSV,2020-09-23,"Индекс ""Вектор устойчивого развития""",Индекс МосБиржи - РСПП Вектор устойчивого развития,2466.63,2466.63,2466.63,2466.63,54543299377.0,0,0.0,2,31618978631600.0,RUB,81467120.5622
RTSI,MRSVT,2020-09-23,Индекс МосБиржи-РСПП Вектор TR,"Индекс МосБиржи - РСПП Вектор устойчивого развития, полной доходности брутто",3037.06,3037.06,3037.06,3037.06,54543299377.0,0,0.0,2,0.0,RUB,0.0
INAV,MTEKA,2020-09-23,iNAV Фридом - Лидеры Технологий,Расчетная цена одного пая Биржевого ПИФа «Фридом - Лидеры Технологий»,1764.41,1768.48,1786.46,1762.13,0.0,0,0.0,2,0.0,RUB,0.0
RTSI,OPSI,2020-09-23,Субиндекс ОФЗ,Индексы активов пенсионных накоплений - Субиндекс ОФЗ,2063.5596,2063.5596,2063.5596,2063.5596,3258430439.46,,,2,5227996796175.65,RUB,
INAV,RFBC15,2020-09-23,iNAV «Raiffeisen-MOEX Index 15»,Расчетная цена одного пая Биржевого ПИФа «Райффайзен – Индекс МосБиржи полной доходности 15»,1087.23,1094.49,1110.88,1086.92,0.0,0,0.0,2,0.0,RUB,0.0
SNDX,RGBI,2020-09-23,Индекс Мосбиржи гос обл RGBI,Индекс Мосбиржи государственных облигаций ценовой,152.25,152.41,152.44,152.25,17446965822.5,1868,5.93,2,8847826188890.0,RUB,1.0
SNDX,RGBITR,2020-09-23,Индекс Мосбиржи гос обл RGBITR,Индекс Мосбиржи государственных облигаций,606.36,606.99,607.11,606.35,17446965822.5,1868,5.93,2,9030027756200.0,RUB,1.0
SNDX,RPGCC,2020-09-23,MOEXREPOGCC,MOEXREPO КСУ 12:30,4.22,4.22,4.22,4.22,84401526000.0,,,2,,RUB,
SNDX,RPGCC1W,2020-09-23,MOEXREPOGCC1W,MOEXREPO КСУ 1 неделя 12:30,4.28,4.28,4.28,4.28,8302210000.0,,,2,,RUB,
SNDX,RPGCC1WE,2020-09-23,MOEXREPOGCC1WE,MOEXREPO КСУ 1 неделя 19:00,4.25,4.25,4.25,4.25,,,,2,,RUB,
SNDX,RPGCCE,2020-09-23,MOEXREPOGCCE,MOEXREPO КСУ 19:00,4.05,4.05,4.05,4.05,53794493000.0,,,2,,RUB,
RTSI,RTSCH,2020-09-23,Индекс РТС химии и нефтехимии,Индекс РТС химии и нефтехимии,228.84,230.98,231.84,228.84,3816126.59228,0,0.0,2,2327323734.87,USD,10170280.6297
RTSI,RTSCR,2020-09-23,Индекс РТС потреб. сектора,Индекс РТС потребительских товаров и розничной торговли,227.46,227.26,229.28,225.42,76457787.6028,0,0.0,2,1456394517.95,USD,6402778.8808
RTSI,RTSEU,2020-09-23,Индекс РТС электроэнергетики,Индекс РТС электроэнергетики,72.28,73.44,73.48,72.28,32387756.3102,0,0.0,2,3482261697.73,USD,48180107.4121
RTSI,RTSFN,2020-09-23,Индекс РТС финансов,Индекс РТС финансов,176.52,178.55,179.92,176.52,299686751.837,0,0.0,2,10967849721.1,USD,62134706.3129
RTSI,RTSI,2020-09-23,Индекс РТС,Индекс РТС,1195.77,1214.29,1225.06,1195.77,1874980092.4,0,0.0,2,182567825164.0,USD,152678585.651
RTSI,RTSMM,2020-09-23,Индекс РТС металлов и добычи,Индекс РТС металлов и добычи,238.83,241.44,242.48,238.74,238254991.445,0,0.0,2,18238849927.9,USD,76366315.1958
RTSI,RTSOG,2020-09-23,Индекс РТС нефти и газа,Индекс РТС нефти и газа,165.02,169.07,169.07,164.8,273608490.829,0,0.0,2,14686985263.3,USD,89003323.6986
RTSI,RTSSM,2020-09-23,RTS SMID Index,Индекс РТС средней и малой капитализации,1097.41,1097.41,1097.41,1097.41,99983488.39,,,2,7298056512.6079,USD,6650265.8786
RTSI,RTSTL,2020-09-23,Индекс РТС телекоммуникаций,Индекс РТС телекоммуникаций ,94.62,95.22,95.91,94.62,21744459.0488,0,0.0,2,5493141254.91,USD,58056740.3599
RTSI,RTSTN,2020-09-23,Индекс РТС транспорта,Индекс РТС транспорта,42.88,43.55,43.65,42.81,7345521.28483,0,0.0,2,803911847.585,USD,18747461.487
RTSI,RTSTR,2020-09-23,RTS Total Return,Индекс РТС полной доходности «брутто»,2115.97,2115.97,2115.97,2115.97,1874980092.44,,,2,182567825164.11,USD,
RTSI,RTSTRN,2020-09-23,RTS Net-TR-NR,Индекс РТС полной доходности «нетто» (по налоговым ставкам иностранных организаций),1942.74,1942.74,1942.74,1942.74,1874980092.44,,,2,182567825164.11,USD,
RTSI,RTSTRR,2020-09-23,RTS Net-TR-Res,Индекс РТС полной доходности «нетто» (по налоговым ставкам российских организаций),1984.67,1984.67,1984.67,1984.67,1874980092.44,,,2,182567825164.11,USD,
RTSI,RTSUSDCUR,2020-09-23,RTSUSDCUR,Курс доллара США на момент закрытия Индекса РТС,76.8317,76.8317,76.8317,76.8317,0.0,,,2,0.0,USD,
RTSI,RUABICP,2020-09-23,ABI CP,Композитный индекс облигаций ,115.23,115.23,115.23,115.23,5695761148.26,1730,5.68,2,10707644804361.69,RUB,
RTSI,RUABITR,2020-09-23,ABI TR,Композитный индекс облигаций — совокупный доход,220.42,220.42,220.42,220.42,5695761148.26,1730,5.68,2,10707644804361.69,RUB,
RTSI,RUBMI,2020-09-23,Индекс РТС широкого рынка,Индекс РТС широкого рынка,871.85,885.83,893.27,871.85,1892048132.42,0,0.0,2,205715969970.0,USD,235953303.434
SNDX,RUCBCP3Y,2020-09-23,Индекс Мосбиржи корп обл CBICP 3-5,Индекс Мосбиржи корпоративных облигаций MOEX 1 - 3 ценовой,93.12,93.14,93.18,93.06,1089295236.78,657,5.96,2,807717824440.0,RUB,1.0
SNDX,RUCBCP5Y,2020-09-23,Индекс Мосбиржи корп обл CBICP 1-3,Индекс Мосбиржи корпоративных облигаций ценовой 3-5,123.12,123.21,123.28,122.9,131627144.8,1325,6.31,2,369873545120.0,RUB,1.0
SNDX,RUCBICP,2020-09-23,Индекс Мосбиржи корп обл CBICP,Индекс Мосбиржи корпоративных облигаций ценовой,97.17,97.2,97.22,97.13,1229042722.48,969,6.19,2,1278533369560.0,RUB,1.0
RTSI,RUCBICP1Y,2020-09-23,CBI CP 1Y,"Индекс корпоративных облигаций (≤ 1 года, рейтинг ≥ B-)",92.37,92.37,92.37,92.37,45933793.77,159,5.42,2,189295876319.31,RUB,
RTSI,RUCBICP3+,2020-09-23,CBI CP 3+,"Индекс корпоративных облигаций (< 1 года, рейтинг > B-)",125.56,125.56,125.56,125.56,120157415.4,1504,6.35,2,479049353717.08,RUB,
RTSI,RUCBICPB,2020-09-23,CBI CP B,"Индекс корпоративных облигаций (> 1 года, B- ≤ рейтинг < BB-)",78.03,78.03,78.03,78.03,45404646.18,821,7.28,2,57015534519.8,RUB,
RTSI,RUCBICPB3Y,2020-09-23,CBI CP B 3Y,"Индекс корпоративных облигаций (1-3 года, B- ≤ рейтинг < BB-)",79.31,79.31,79.31,79.31,34562847.88,758,7.27,2,45446434726.72,RUB,
RTSI,RUCBICPBB,2020-09-23,CBI CP BB,"Индекс корпоративных облигаций (> 1 года, BB- ≤ рейтинг < BBB-)",94.14,94.14,94.14,94.14,170932273.5,891,6.3,2,554090193924.0,RUB,
RTSI,RUCBICPBB3+,2020-09-23,CBI CP BB 3+,"Индекс корпоративных облигаций (> 3 лет, BB- ≤ рейтинг < BBB-)",120.26,120.26,120.26,120.26,87286336.6,1378,6.58,2,155441003924.0,RUB,
RTSI,RUCBICPBB3Y,2020-09-23,CBI CP BBB 3Y,"Индекс корпоративных облигаций (1-3 года, BB- ≤ рейтинг < BBB-)",92.54,92.54,92.54,92.54,83645936.9,701,6.19,2,398649190000.0,RUB,
RTSI,RUCBICPBB5Y,2020-09-23,CBI CP BB 5Y,"Индекс корпоративных облигаций (3-5 лет, BB- ≤ рейтинг < BBB-)",120.4,120.4,120.4,120.4,86054675.8,1319,6.6,2,140068253924.0,RUB,
RTSI,RUCBICPBBB,2020-09-23,CBI CP BBB,"Индекс корпоративных облигаций (> 1 года, рейтинг ≥ BBB-)",100.19,100.19,100.19,100.19,104190464.3,1043,5.76,2,690251935341.44,RUB,
RTSI,RUCBICPBBB3+,2020-09-23,CBI CP BBB 3+,"Индекс корпоративных облигаций (3-5 лет, рейтинг ≥ BBB-)",129.77,129.77,129.77,129.77,22029280.5,1583,6.2,2,312039250000.0,RUB,
RTSI,RUCBICPBBB3Y,2020-09-23,CBI CP BBB 3Y,"Индекс корпоративных облигаций (1-3 года, рейтинг ≥ BBB-)",96.0,96.0,96.0,96.0,82161183.8,598,5.39,2,378212685341.44,RUB,
