BOARDID,SECID,TRADEDATE,SHORTNAME,NAME,CLOSE,OPEN,HIGH,LOW,VALUE,DURATION,YIELD,DECIMALS,CAPITALIZATION,CURRENCYID,DIVISOR
INAV,AKEUA,2020-07-10,iNAV Альфа-Капитал ЕВРОПА 600,Расчетная цена одного пая Биржевого ПИФа «ЕВРОПА 600»,9.95,9.87,9.96,9.82,,,,2,,EUR,
INAV,AKMBA,2020-07-10,iNAV Альфа Управляемые облигации,Расчетная цена одного пая Биржевого ПИФа РФИ «Альфа-Капитал Управляемые облигации»,1.0108,1.0122,1.0134,1.0108,,,,2,,RUB,
INAV,AKNXA,2020-07-10,iNAV Технологии 100,Расчетная цена одного пая Биржевого ПИФа «ТЕХНОЛОГИИ 100»,15.62,15.64,15.64,15.47,,,,2,,USD,
INAV,AKSPA,2020-07-10,iNAV Альфа - Капитал Эс энд Пи 500,Расчетная цена одного пая Биржевого ПИФа «Альфа - Капитал Эс энд Пи 500»,10.89,10.86,10.89,10.8,,,,2,,USD,
RTSI,BPSI,2020-07-10,Субиндекс облигаций,Индексы активов пенсионных накоплений - Субиндекс облигаций,2942.0911,2942.0911,2942.0911,2942.0911,166021657.1,,,2,413379500230.0,RUB,0.001
RTSI,EPSI,2020-07-10,Субиндекс акций,Индексы активов пенсионных накоплений - Субиндекс акций,1647.8063,1647.8063,1647.8063,1647.8063,46869119397.35,,,2,6457227092815.703,RUB,3918680996.809
INAV,ESGRA,2020-07-10,iNAV RSHB-MOEX-RSPP ESG VecTR ,Расчетная цена одного пая Биржевого ПИФа «РСХБ–Индекс МосБиржи–РСПП Вектор развития полн дох-ти»,1007.27,997.65,1007.27,996.96,,,,2,,RUB,
RTSI,GPBCBI2Y,2020-07-10,Индикатор GPBCBI2Y,Индикатор GPBCBI2Y,1156.57,1156.57,1156.57,1156.57,,,,2,,RUB,
RTSI,GPBCBI4Y,2020-07-10,Индикатор GPBCBI4Y,Индикатор GPBCBI4Y,1198.15,1198.15,1198.15,1198.15,,,,2,,RUB,
INAV,GPBMA,2020-07-10,iNAV ГПБ - Корп. облигации 4г,Расчетная цена одного пая Биржевого ПИФа «Газпромбанк – Корпоративные облигации 4 года»,56964.59,56909.24,56968.94,56873.85,,,,2,,RUB,
INAV,GPBSA,2020-07-10,iNAV ГПБ - Корп. облигации 2г,Расчетная цена одного пая Биржевого ПИФа «Газпромбанк – Корпоративные облигации 2 года»,55406.12,55372.02,55432.33,55372.02,,,,2,,RUB,
SNDX,IMOEX,2020-07-10,Индекс МосБиржи,Индекс МосБиржи,2800.94,2768.67,2800.94,2765.49,52675376381.7,0,0.0,2,11925972169600.0,RUB,4257839328.87
SNDX,IMOEX2,2020-07-10,Индекс МосБиржи (доп. сессия),Индекс МосБиржи (Дополнительная сессия),2798.79,2799.79,2800.94,2791.6,3193308277.55,0,0.0,2,11916811299300.0,RUB,4257839328.87
RTSI,MCFTR,2020-07-10,MOEX Russia Total Return,Индекс МосБиржи полной доходности «брутто»,4890.62,4890.62,4890.62,4890.62,52675376381.7,,,2,11925972169635.76,RUB,
RTSI,MCFTRN,2020-07-10,MOEX Russia Net-TR-NR,Индекс МосБиржи полной доходности «нетто» (по налоговым ставкам иностранных организаций),4499.21,4499.21,4499.21,4499.21,52675376381.7,,,2,11925972169635.76,RUB,
RTSI,MCFTRR,2020-07-10,MOEX Russia Net-TR-Res,Индекс МосБиржи полной доходности «нетто» (по налоговым ставкам российских организаций),4595.21,4595.21,4595.21,4595.21,52675376381.7,,,2,11925972169635.76,RUB,
RTSI,MCXSM,2020-07-10,Индекс МосБиржи SMID,Индекс МосБиржи средней и малой капитализации,1646.87,1646.87,1646.87,1646.87,2660805712.0,,,2,452838785972.1773,RUB,274969708.379
RTSI,MEBCTR,2020-07-10,MOEX Blue Chip Total Return,Индекс МосБиржи голубых фишек полной доходности «брутто»,30141.23,30141.23,30141.23,30141.23,43551968201.9,,,2,9817663293832.92,RUB,
RTSI,MEBCTRN,2020-07-10,MOEX Blue Chip Net-TR-NR,Индекс МосБиржи голубых фишек полной доходности «нетто» (по налоговым ставкам иностр. орг.),28037.71,28037.71,28037.71,28037.71,43551968201.9,,,2,9817663293832.92,RUB,
RTSI,MEBCTRR,2020-07-10,MOEX Blue Chip Net-TR-Res,Индекс МосБиржи голубых фишек полной доходности «нетто» (по налоговым ставкам росс. орг.),28508.57,28508.57,28508.57,28508.57,43551968201.9,,,2,9817663293832.92,RUB,
SNDX,MECHTR,2020-07-10,MOEX Chemicals Total Return,Индекс МосБиржи химии и нефтехимии полной доходности «брутто»,25355.27,25355.27,25355.27,25355.27,,,,2,,RUB,
SNDX,MECHTRN,2020-07-10,MOEX Chemicals Net TR-NR,Индекс МосБиржи химии и нефтехимии полной доходности «нетто» (по налог.ставкам ин.орг-й),23818.69,23818.69,23818.69,23818.69,,,,2,,RUB,
SNDX,MECHTRR,2020-07-10,MOEX Chemicals Net TR-Res,Индекс МосБиржи химии и нефтехимии полной доходности «нетто» (по налог.ставкам рос.орг-й),24057.28,24057.28,24057.28,24057.28,,,,2,,RUB,
SNDX,MECNTR,2020-07-10,MOEX Consumer Total Return,Индекс МосБиржи потребительского сектора полной доходности «брутто»,8516.02,8516.02,8516.02,8516.02,,,,2,,RUB,
SNDX,MECNTRN,2020-07-10,MOEX Consumer Net TR-NR,Индекс МосБиржи потребит. сектора полной доходности «нетто» (по налог.ставкам ин.орг-й),8249.09,8249.09,8249.09,8249.09,,,,2,,RUB,
SNDX,MECNTRR,2020-07-10,MOEX Consumer Net TR-Res,Индекс МосБиржи потреб. сектора полной доходности «нетто» (по налог.ставкам рос.орг-й),8193.49,8193.49,8193.49,8193.49,,,,2,,RUB,
SNDX,MEEUTR,2020-07-10,MOEX El.Utilities Total Return,Индекс МосБиржи электроэнергетики полной доходности «брутто»,3084.39,3084.39,3084.39,3084.39,,,,2,,RUB,
SNDX,MEEUTRN,2020-07-10,MOEX El. Utilities Net TR-NR,Индекс МосБиржи электроэнергетики полной доходности «нетто» (по налог.ставкам ин.орг-й),2923.86,2923.86,2923.86,2923.86,,,,2,,RUB,
SNDX,MEEUTRR,2020-07-10,MOEX El. Utilities Net TR-Res,Индекс МосБиржи электроэнергетики полной доходности «нетто» (по налог.ставкам рос.орг-й),2949.72,2949.72,2949.72,2949.72,,,,2,,RUB,
SNDX,MEFNTR,2020-07-10,MOEX Financials Total Return,Индекс МосБиржи финансов полной доходности «брутто»,8960.65,8960.65,8960.65,8960.65,,,,2,,RUB,
SNDX,MEFNTRN,2020-07-10,MOEX Financials Net TR-NR,Индекс МосБиржи финансов полной доходности «нетто» (по налог.ставкам ин.орг-й),8607.02,8607.02,8607.02,8607.02,,,,2,,RUB,
SNDX,MEFNTRR,2020-07-10,MOEX Financials Net TR-Res,Индекс МосБиржи финансов полной доходности «нетто» (по налог.ставкам рос.орг-й),8665.51,8665.51,8665.51,8665.51,,,,2,,RUB,
SNDX,MEMMTR,2020-07-10,MOEX Metals & Min Total Return,Индекс МосБиржи металлов и добычи полной доходности «брутто»,12306.2,12306.2,12306.2,12306.2,,,,2,,RUB,
SNDX,MEMMTRN,2020-07-10,MOEX Metals & Mining Net TR-NR,Индекс МосБиржи металлов и добычи полной доходности «нетто» (по налог.ставкам ин.орг-й),11477.32,11477.32,11477.32,11477.32,,,,2,,RUB,
SNDX,MEMMTRR,2020-07-10,MOEX Metals & Min Net TR-Res,Индекс МосБиржи металлов и добычи полной доходности «нетто» (по налог.ставкам рос.орг-й),11612.0,11612.0,11612.0,11612.0,,,,2,,RUB,
SNDX,MEOGTR,2020-07-10,MOEX Oil & Gas Total Return,Индекс МосБиржи нефти и газа полной доходности «брутто»,9834.25,9834.25,9834.25,9834.25,,,,2,,RUB,
SNDX,MEOGTRN,2020-07-10,MOEX Oil & Gas Net TR-NR,Индекс МосБиржи нефти и газа полной доходности «нетто» (по налог.ставкам ин.орг-й),9347.73,9347.73,9347.73,9347.73,,,,2,,RUB,
SNDX,MEOGTRR,2020-07-10,MOEX Oil & Gas Net TR-Res,Индекс МосБиржи нефти и газа полной доходности «нетто» (по налог.ставкам рос.орг-й),9428.34,9428.34,9428.34,9428.34,,,,2,,RUB,
SNDX,MESMTR,2020-07-10,MOEX SMID Total Return,Индекс МосБиржи средней и малой капитализации полной доходности «брутто»,2268.97,2268.97,2268.97,2268.97,,,,2,,RUB,
SNDX,MESMTRN,2020-07-10,MOEX SMID Net TR-NR,Индекс МосБиржи средней капитализации полной доходности «нетто» (по нал.ставкам ин.орг-й),2162.61,2162.61,2162.61,2162.61,,,,2,,RUB,
SNDX,MESMTRR,2020-07-10,MOEX SMID Net TR-Res,Индекс МосБиржи средней капитализации полной доходности «нетто» (по нал.ставкам рос.орг-й),2181.07,2181.07,2181.07,2181.07,,,,2,,RUB,
SNDX,METLTR,2020-07-10,MOEX Telecom Total Return,Индекс МосБиржи телекоммуникаций полной доходности «брутто»,4002.3,4002.3,4002.3,4002.3,,,,2,,RUB,
SNDX,METLTRN,2020-07-10,MOEX Telecom Net TR-NR,Индекс МосБиржи телекоммуникаций полной доходности «нетто» (по налог.ставкам ин.орг-й),3653.72,3653.72,3653.72,3653.72,,,,2,,RUB,
SNDX,METLTRR,2020-07-10,MOEX Telecom Net TR-Res,Индекс МосБиржи телекоммуникаций полной доходности «нетто» (по налог.ставкам рос.орг-й),3709.66,3709.66,3709.66,3709.66,,,,2,,RUB,
SNDX,METNTR,2020-07-10,MOEX Transport Total Return,Индекс МосБиржи транспорта полной доходности «брутто»,1948.26,1948.26,1948.26,1948.26,,,,2,,RUB,
SNDX,METNTRN,2020-07-10,MOEX Transport Net TR-NR,Индекс МосБиржи транспорта полной доходности «нетто» (по налог.ставкам ин.орг-й),1862.79,1862.79,1862.79,1862.79,,,,2,,RUB,
SNDX,METNTRR,2020-07-10,MOEX Transport Net TR-Res,Индекс МосБиржи транспорта полной доходности «нетто» (по налог.ставкам рос.орг-й),1875.91,1875.91,1875.91,1875.91,,,,2,,RUB,
SNDX,MOEX10,2020-07-10,Индекс МосБиржи 10,Индекс МосБиржи 10,4959.88,4888.82,4959.88,4884.18,33259764457.2,0,0.0,2,9154707551460.0,RUB,4928.35
RTSI,MOEXBC,2020-07-10,Индекс голубых фишек,Индекс МосБиржи голубых фишек,18584.54,18348.55,18584.54,18332.64,43551968201.9,0,0.0,2,9817663293830.0,RUB,528270321.54
SNDX,MOEXBMI,2020-07-10,Индекс широкого рынка,Индекс МосБиржи широкого рынка,2011.38,1990.31,2011.38,1987.95,54050693039.1,0,0.0,2,14612531213300.0,RUB,7264932269.15
SNDX,MOEXCH,2020-07-10,Индекс химии и нефтехимии,Индекс МосБиржи химии и нефтехимии,16673.36,16749.95,16791.31,16657.94,180230280.2,0,0.0,2,176833899611.0,RUB,10605772.4903
SNDX,MOEXCN,2020-07-10,Индекс потребительского сектора / Индекс потребит сектора,Индекс МосБиржи потребительского сектора,6567.43,6537.51,6585.14,6531.21,4608763474.84,0,0.0,2,170733599238.0,RUB,25997023.5935
SNDX,MOEXEU,2020-07-10,Индекс электроэнергетики,Индекс МосБиржи электроэнергетики,2159.17,2153.84,2160.94,2146.27,1424700480.8,0,0.0,2,277391920211.0,RUB,128471361.257
SNDX,MOEXFN,2020-07-10,Индекс финансов,Индекс МосБиржи финансов,6843.65,6709.04,6843.65,6708.24,13923365424.5,0,0.0,2,741493120904.0,RUB,108347612.073
SNDX,MOEXINN,2020-07-10,Индекс МосБиржи инноваций,Индекс МосБиржи инноваций,399.89,397.89,402.65,396.99,35480857.0,0,0.0,2,2899911168.8,RUB,7251762.984
SNDX,MOEXMM,2020-07-10,Индекс металлов и добычи,Индекс МосБиржи металлов и добычи,7721.69,7670.31,7752.02,7666.72,12851026574.1,0,0.0,2,1223761669790.0,RUB,158483724.864
SNDX,MOEXOG,2020-07-10,Индекс нефти и газа,Индекс МосБиржи нефти и газа,6999.74,6924.29,6999.74,6892.48,18067210191.4,0,0.0,2,1158020699430.0,RUB,165437748.083
SNDX,MOEXREPO,2020-07-10,MXREPO,MOEXREPO обл 12:30,4.35,4.35,4.35,4.35,432391843127.0,,,2,,RUB,
SNDX,MOEXREPO1W,2020-07-10,MOEXREPO1W,MOEXREPO 1 неделя 12:30,4.39,4.39,4.39,4.39,56218045535.0,,,2,,RUB,
SNDX,MOEXREPO1WE,2020-07-10,MOEXREPO1WE,MOEXREPO 1 неделя 19:00,4.5,,,,,,,2,,RUB,
SNDX,MOEXREPOE,2020-07-10,MXREPOE,MOEXREPO обл 19:00,4.29,4.29,4.29,4.29,64909642252.0,,,2,,RUB,
SNDX,MOEXREPOEQ,2020-07-10,MXREPOEQ,MOEXREPO акц 12:30,4.25,4.25,4.25,4.25,40952699221.0,,,2,,RUB,
SNDX,MOEXREPOEQE,2020-07-10,MXREPOEQE,MOEXREPO акц 19:00,4.37,4.37,4.37,4.37,42166595874.0,,,2,,RUB,
SNDX,MOEXREPOUSD,2020-07-10,MOEXREPOUSD,MOEXREPO USD 12:30,0.48,0.48,0.48,0.48,1047567018.0,,,2,,USD,
SNDX,MOEXREPOUSDE,2020-07-10,MOEXREPOUSDE,MOEXREPO USD 19:00,0.38,0.38,0.38,0.38,444808188.0,,,2,,USD,
SNDX,MOEXTL,2020-07-10,Индекс телекоммуникаций,Индекс МосБиржи телекоммуникаций,2162.8,2167.42,2188.11,2160.26,1580154416.9,0,0.0,2,366652886144.0,RUB,169526680.988
SNDX,MOEXTN,2020-07-10,Индекс транспорта,Индекс МосБиржи транспорта,1439.87,1428.25,1441.64,1426.04,611987205.4,0,0.0,2,65958458412.8,RUB,45808634.8417
SNDX,MRBC,2020-07-10,Индекс МосБиржи 15,Индекс МосБиржи 15,1396.25,1380.2,1396.25,1379.64,,,,2,,RUB,
RTSI,MRBCTR,2020-07-10,Индекс МосБиржи полн дох-ти 15,Индекс МосБиржи полной доходности 15,1635.87,1635.87,1635.87,1635.87,,,,2,,RUB,
RTSI,MRRT,2020-07-10,"Индекс ""Ответственность и открытость""",Индекс МосБиржи - РСПП Ответственность и открытость,2169.28,2169.28,2169.28,2169.28,,,,2,,RUB,
RTSI,MRSV,2020-07-10,"Индекс ""Вектор устойчивого развития""",Индекс МосБиржи - РСПП Вектор устойчивого развития,2317.58,2317.58,2317.58,2317.58,,,,2,,RUB,
RTSI,MRSVT,2020-07-10,Индекс МосБиржи-РСПП Вектор TR,"Индекс МосБиржи - РСПП Вектор устойчивого развития, полной доходности брутто",2829.68,2829.68,2829.68,2829.68,,,,2,,RUB,
INAV,MTEKA,2020-07-10,iNAV Фридом - Лидеры Технологий,Расчетная цена одного пая Биржевого ПИФа «Фридом - Лидеры Технологий»,1558.48,1562.65,1570.93,1545.76,,,,2,,RUB,
RTSI,OPSI,2020-07-10,Субиндекс ОФЗ,Индексы активов пенсионных накоплений - Субиндекс ОФЗ,2058.9766,2058.9766,2058.9766,2058.9766,2056549922.69,,,2,4852345584405.66,RUB,
INAV,RFBC15,2020-07-10,iNAV «Raiffeisen-MOEX Index 15»,Расчетная цена одного пая Биржевого ПИФа «Райффайзен – Индекс МосБиржи полной доходности 15»,1031.29,1021.27,1031.29,1019.83,,,,2,,RUB,
SNDX,RGBI,2020-07-10,Индекс Мосбиржи гос обл RGBI,Индекс Мосбиржи государственных облигаций ценовой,155.5,155.72,155.73,155.5,7627251158.32,1816,5.5,2,8400780157870.0,RUB,1.0
SNDX,RGBITR,2020-07-10,Индекс Мосбиржи гос обл RGBITR,Индекс Мосбиржи государственных облигаций,611.13,612.01,612.02,611.13,7627251158.32,1816,5.5,2,8554242225500.0,RUB,1.0
SNDX,RPGCC,2020-07-10,MOEXREPOGCC,MOEXREPO КСУ 12:30,4.4,4.4,4.4,4.4,93721669000.0,,,2,,RUB,
SNDX,RPGCC1W,2020-07-10,MOEXREPOGCC1W,MOEXREPO КСУ 1 неделя 12:30,4.48,4.48,4.48,4.48,13543435000.0,,,2,,RUB,
SNDX,RPGCC1WE,2020-07-10,MOEXREPOGCC1WE,MOEXREPO КСУ 1 неделя 19:00,4.47,4.47,4.47,4.47,1449000000.0,,,2,,RUB,
SNDX,RPGCCE,2020-07-10,MOEXREPOGCCE,MOEXREPO КСУ 19:00,4.32,4.32,4.32,4.32,50170348000.0,,,2,,RUB,
RTSI,RTSCH,2020-07-10,Индекс РТС химии и нефтехимии,Индекс РТС химии и нефтехимии,245.46,246.24,246.45,244.21,2544356.84186,0,0.0,2,2496409270.67,USD,10170280.6297
RTSI,RTSCR,2020-07-10,Индекс РТС потреб. сектора,Индекс РТС потребительских товаров и розничной торговли,209.99,208.74,210.45,207.38,65063089.6578,0,0.0,2,2410289774.13,USD,11477900.3644
RTSI,RTSEU,2020-07-10,Индекс РТС электроэнергетики,Индекс РТС электроэнергетики,77.28,76.98,77.41,76.34,20112860.1248,0,0.0,2,3916012499.58,USD,50675795.1837
RTSI,RTSFN,2020-07-10,Индекс РТС финансов,Индекс РТС финансов,167.98,164.44,167.98,164.24,196559701.513,0,0.0,2,10467847540.8,USD,62317345.3938
RTSI,RTSI,2020-07-10,Индекс РТС,Индекс РТС,1245.65,1229.46,1245.65,1221.96,743631725.731,0,0.0,2,168361991403.0,USD,135160162.611
RTSI,RTSMM,2020-07-10,Индекс РТС металлов и добычи,Индекс РТС металлов и добычи,229.15,227.3,229.15,225.93,181421220.409,0,0.0,2,17276155670.8,USD,75393012.9342
RTSI,RTSOG,2020-07-10,Индекс РТС нефти и газа,Индекс РТС нефти и газа,191.85,189.51,191.85,187.93,255059415.17,0,0.0,2,16348073621.8,USD,85213458.6621
RTSI,RTSSM,2020-07-10,RTS SMID Index,Индекс РТС средней и малой капитализации,1092.29,1092.29,1092.29,1092.29,37563273.0,,,2,6392840659.5608,USD,5852684.6488
RTSI,RTSTL,2020-07-10,Индекс РТС телекоммуникаций,Индекс РТС телекоммуникаций ,93.61,93.68,94.65,93.11,22307442.9966,0,0.0,2,5176132325.89,USD,55293012.6018
RTSI,RTSTN,2020-07-10,Индекс РТС транспорта,Индекс РТС транспорта,49.67,49.2,49.77,48.88,8639579.49497,0,0.0,2,931152383.243,USD,18747461.487
RTSI,RTSTR,2020-07-10,RTS Total Return,Индекс РТС полной доходности «брутто»,2173.56,2173.56,2173.56,2173.56,743631725.76,,,2,168361991403.1,USD,
RTSI,RTSTRN,2020-07-10,RTS Net-TR-NR,Индекс РТС полной доходности «нетто» (по налоговым ставкам иностранных организаций),1999.8,1999.8,1999.8,1999.8,743631725.76,,,2,168361991403.1,USD,
RTSI,RTSTRR,2020-07-10,RTS Net-TR-Res,Индекс РТС полной доходности «нетто» (по налоговым ставкам российских организаций),2042.39,2042.39,2042.39,2042.39,743631725.76,,,2,168361991403.1,USD,
RTSI,RTSUSDCUR,2020-07-10,RTSUSDCUR,Курс доллара США на момент закрытия Индекса РТС,70.8353,70.8353,70.8353,70.8353,0.0,,,2,0.0,USD,
RTSI,RUABICP,2020-07-10,ABI CP,Композитный индекс облигаций ,117.43,117.43,117.43,117.43,3513271437.43,1692,5.33,2,10177103545269.0,RUB,
RTSI,RUABITR,2020-07-10,ABI TR,Композитный индекс облигаций — совокупный доход,221.54,221.54,221.54,221.54,3513271437.43,1692,5.33,2,10177103545269.0,RUB,
RTSI,RUBMI,2020-07-10,Индекс РТС широкого рынка,Индекс РТС широкого рынка,911.54,900.73,911.54,894.66,763047421.823,0,0.0,2,206288830756.0,USD,226307765.894
SNDX,RUCBCP3Y,2020-07-10,Индекс Мосбиржи корп обл CBICP 3-5,Индекс Мосбиржи корпоративных облигаций MOEX 1 - 3 ценовой,93.36,93.27,93.37,93.12,236177408.96,656,5.85,2,638127048922.0,RUB,1.0
SNDX,RUCBCP5Y,2020-07-10,Индекс Мосбиржи корп обл CBICP 1-3,Индекс Мосбиржи корпоративных облигаций ценовой 3-5,123.99,123.89,124.01,123.82,326508383.0,1351,6.27,2,506121594495.0,RUB,1.0
SNDX,RUCBICP,2020-07-10,Индекс Мосбиржи корп обл CBICP,Индекс Мосбиржи корпоративных облигаций ценовой,97.61,97.53,97.62,97.43,601165926.36,1065,6.14,2,1246045143420.0,RUB,1.0
RTSI,RUCBICP1Y,2020-07-10,CBI CP 1Y,"Индекс корпоративных облигаций (≤ 1 года, рейтинг ≥ B-)",92.77,92.77,92.77,92.77,69568648.24,161,5.63,2,204552614370.98,RUB,
RTSI,RUCBICP3+,2020-07-10,CBI CP 3+,"Индекс корпоративных облигаций (< 1 года, рейтинг > B-)",126.41,126.41,126.41,126.41,295051589.4,1494,6.28,2,616724209188.03,RUB,
RTSI,RUCBICPB,2020-07-10,CBI CP B,"Индекс корпоративных облигаций (> 1 года, B- ≤ рейтинг < BB-)",77.92,77.92,77.92,77.92,96231634.16,868,7.25,2,54571496628.14,RUB,
RTSI,RUCBICPB3Y,2020-07-10,CBI CP B 3Y,"Индекс корпоративных облигаций (1-3 года, B- ≤ рейтинг < BB-)",79.24,79.24,79.24,79.24,36420843.96,739,7.12,2,35846091735.61,RUB,
RTSI,RUCBICPBB,2020-07-10,CBI CP BB,"Индекс корпоративных облигаций (> 1 года, BB- ≤ рейтинг < BBB-)",94.35,94.35,94.35,94.35,244529458.3,994,6.35,2,475999756295.5,RUB,
RTSI,RUCBICPBB3+,2020-07-10,CBI CP BB 3+,"Индекс корпоративных облигаций (> 3 лет, BB- ≤ рейтинг < BBB-)",120.56,120.56,120.56,120.56,119973332.5,1374,6.6,2,207233044295.5,RUB,
RTSI,RUCBICPBB3Y,2020-07-10,CBI CP BBB 3Y,"Индекс корпоративных облигаций (1-3 года, BB- ≤ рейтинг < BBB-)",92.73,92.73,92.73,92.73,124556125.8,702,6.16,2,268766712000.0,RUB,
RTSI,RUCBICPBB5Y,2020-07-10,CBI CP BB 5Y,"Индекс корпоративных облигаций (3-5 лет, BB- ≤ рейтинг < BBB-)",120.7,120.7,120.7,120.7,117890212.1,1327,6.62,2,191773444295.5,RUB,
RTSI,RUCBICPBBB,2020-07-10,CBI CP BBB,"Индекс корпоративных облигаций (> 1 года, рейтинг ≥ BBB-)",100.87,100.87,100.87,100.87,188575327.4,1123,5.75,2,736516186841.08,RUB,
RTSI,RUCBICPBBB3+,2020-07-10,CBI CP BBB 3+,"Индекс корпоративных облигаций (3-5 лет, рейтинг ≥ BBB-)",131.01,131.01,131.01,131.01,115267466.7,1576,6.06,2,390765760000.0,RUB,
RTSI,RUCBICPBBB3Y,2020-07-10,CBI CP BBB 3Y,"Индекс корпоративных облигаций (1-3 года, рейтинг ≥ BBB-)",96.35,96.35,96.35,96.35,73307860.7,612,5.41,2,345750426841.08,RUB,
RTSI,RUCBICPBBB5Y,2020-07-10,CBI CP BBB 5Y,"Индекс корпоративных облигаций (3-5 лет, рейтинг ≥ BBB-)",129.69,129.69,129.69,129.69,78870452.7,1380,5.99,2,303005810000.0,RUB,
RTSI,RUCBICPL1,2020-07-10,CBI CP L1,Индекс корпоративных облигаций Котировальный лист 1 - ценовой,94.12,94.12,94.12,94.12,325111460.56,950,6.0,2,558909226628.14,RUB,
RTSI,RUCBICPL2,2020-07-10,CBI CP L2,Индекс корпоративных облигаций Котировальный лист 2 - ценовой,105.93,105.93,105.93,105.93,108460366.7,1158,5.98,2,470449672753.54,RUB,
RTSI,RUCBICPL3,2020-07-10,CBI CP L3,Индекс корпоративных облигаций Котировальный лист 3 - ценовой,103.57,103.57,103.57,103.57,95764592.6,1147,6.26,2,237728540383.04,RUB,
SNDX,RUCBITR,2020-07-10,Индекс Мосбиржи корп обл CBITR,Индекс Мосбиржи корпоративных облигаций,444.91,444.54,444.95,444.13,601165926.36,1065,6.14,2,1267207643140.0,RUB,1.0
RTSI,RUCBITR1Y,2020-07-10,CBI TR 1Y,"Индекс корпоративных облигаций (≤ 1 года, рейтинг ≥ B-)— совокупный доход",229.96,229.96,229.96,229.96,69568648.24,161,5.63,2,204552614370.98,RUB,
RTSI,RUCBITR3+,2020-07-10,CBI TR 3+,"Индекс корпоративных облигаций (> 3 лет, рейтинг ≥ B-) — совокупный доход",573.3,573.3,573.3,573.3,295051589.4,1494,6.28,2,616724209188.03,RUB,
RTSI,RUCBITRB,2020-07-10,CBI TR B,"Индекс корпоративных облигаций (> 1 года, B- ≤ рейтинг < BB-) — совокупный доход",437.13,437.13,437.13,437.13,96231634.16,868,7.25,2,54571496628.14,RUB,
RTSI,RUCBITRB3Y,2020-07-10,CBI TR B 3Y,"Индекс корпоративных облигаций (1-3 года, B- ≤ рейтинг < BB-) — совокупный доход",439.98,439.98,439.98,439.98,36420843.96,739,7.12,2,35846091735.61,RUB,
