BOARDID,SECID,TRADEDATE,SHORTNAME,NAME,CLOSE,OPEN,HIGH,LOW,VALUE,DURATION,YIELD,DECIMALS,CAPITALIZATION,CURRENCYID,DIVISOR
INAV,AKEUA,2020-07-30,iNAV Альфа-Капитал ЕВРОПА 600,Расчетная цена одного пая Биржевого ПИФа «ЕВРОПА 600»,9.79,9.96,9.96,9.69,,,,2,,EUR,
INAV,AKMBA,2020-07-30,iNAV Альфа Управляемые облигации,Расчетная цена одного пая Биржевого ПИФа РФИ «Альфа-Капитал Управляемые облигации»,1.0174,1.0191,1.0197,1.0174,,,,2,,RUB,
INAV,AKNXA,2020-07-30,iNAV Технологии 100,Расчетная цена одного пая Биржевого ПИФа «ТЕХНОЛОГИИ 100»,15.45,15.49,15.49,15.31,,,,2,,USD,
INAV,AKSPA,2020-07-30,iNAV Альфа - Капитал Эс энд Пи 500,Расчетная цена одного пая Биржевого ПИФа «Альфа - Капитал Эс энд Пи 500»,11.12,11.22,11.22,11.03,,,,2,,USD,
RTSI,BPSI,2020-07-30,Субиндекс облигаций,Индексы активов пенсионных накоплений - Субиндекс облигаций,2951.1058,2951.1058,2951.1058,2951.1058,88853886.0,,,2,412910437020.0,RUB,0.001
RTSI,EPSI,2020-07-30,Субиндекс акций,Индексы активов пенсионных накоплений - Субиндекс акций,1711.3233,1711.3233,1711.3233,1711.3233,51615920040.1,,,2,6706130072497.524,RUB,3918680996.809
INAV,ESGRA,2020-07-30,iNAV RSHB-MOEX-RSPP ESG VecTR ,Расчетная цена одного пая Биржевого ПИФа «РСХБ–Индекс МосБиржи–РСПП Вектор развития полн дох-ти»,1058.25,1070.97,1071.79,1053.24,,,,2,,RUB,
RTSI,GPBCBI2Y,2020-07-30,Индикатор GPBCBI2Y,Индикатор GPBCBI2Y,1155.23,1155.23,1155.23,1155.23,,,,2,,RUB,
RTSI,GPBCBI4Y,2020-07-30,Индикатор GPBCBI4Y,Индикатор GPBCBI4Y,1200.55,1200.55,1200.55,1200.55,,,,2,,RUB,
INAV,GPBMA,2020-07-30,iNAV ГПБ - Корп. облигации 4г,Расчетная цена одного пая Биржевого ПИФа «Газпромбанк – Корпоративные облигации 4 года»,57121.07,57198.99,57307.99,57112.03,,,,2,,RUB,
INAV,GPBSA,2020-07-30,iNAV ГПБ - Корп. облигации 2г,Расчетная цена одного пая Биржевого ПИФа «Газпромбанк – Корпоративные облигации 2 года»,55346.65,55438.3,55439.86,55337.23,,,,2,,RUB,
SNDX,IMOEX,2020-07-30,Индекс МосБиржи,Индекс МосБиржи,2882.63,2915.94,2919.35,2869.99,58998044298.8,0,0.0,2,12273765898200.0,RUB,4257839328.87
SNDX,IMOEX2,2020-07-30,Индекс МосБиржи (доп. сессия),Индекс МосБиржи (Дополнительная сессия),2896.93,2884.74,2897.81,2882.63,3437763737.75,0,0.0,2,12334682260800.0,RUB,4257839328.87
RTSI,MCFTR,2020-07-30,MOEX Russia Total Return,Индекс МосБиржи полной доходности «брутто»,5095.54,5095.54,5095.54,5095.54,58998044298.8,,,2,12273765898247.22,RUB,
RTSI,MCFTRN,2020-07-30,MOEX Russia Net-TR-NR,Индекс МосБиржи полной доходности «нетто» (по налоговым ставкам иностранных организаций),4679.12,4679.12,4679.12,4679.12,58998044298.8,,,2,12273765898247.22,RUB,
RTSI,MCFTRR,2020-07-30,MOEX Russia Net-TR-Res,Индекс МосБиржи полной доходности «нетто» (по налоговым ставкам российских организаций),4780.14,4780.14,4780.14,4780.14,58998044298.8,,,2,12273765898247.22,RUB,
RTSI,MCXSM,2020-07-30,Индекс МосБиржи SMID,Индекс МосБиржи средней и малой капитализации,1747.45,1747.45,1747.45,1747.45,6142287578.78,,,2,480494921424.8689,RUB,274969708.379
RTSI,MEBCTR,2020-07-30,MOEX Blue Chip Total Return,Индекс МосБиржи голубых фишек полной доходности «брутто»,31260.27,31260.27,31260.27,31260.27,43703245222.4,,,2,10036723873065.15,RUB,
RTSI,MEBCTRN,2020-07-30,MOEX Blue Chip Net-TR-NR,Индекс МосБиржи голубых фишек полной доходности «нетто» (по налоговым ставкам иностр. орг.),29016.32,29016.32,29016.32,29016.32,43703245222.4,,,2,10036723873065.15,RUB,
RTSI,MEBCTRR,2020-07-30,MOEX Blue Chip Net-TR-Res,Индекс МосБиржи голубых фишек полной доходности «нетто» (по налоговым ставкам росс. орг.),29512.07,29512.07,29512.07,29512.07,43703245222.4,,,2,10036723873065.15,RUB,
SNDX,MECHTR,2020-07-30,MOEX Chemicals Total Return,Индекс МосБиржи химии и нефтехимии полной доходности «брутто»,25715.06,25715.06,25715.06,25715.06,,,,2,,RUB,
SNDX,MECHTRN,2020-07-30,MOEX Chemicals Net TR-NR,Индекс МосБиржи химии и нефтехимии полной доходности «нетто» (по налог.ставкам ин.орг-й),24156.65,24156.65,24156.65,24156.65,,,,2,,RUB,
SNDX,MECHTRR,2020-07-30,MOEX Chemicals Net TR-Res,Индекс МосБиржи химии и нефтехимии полной доходности «нетто» (по налог.ставкам рос.орг-й),24398.63,24398.63,24398.63,24398.63,,,,2,,RUB,
SNDX,MECNTR,2020-07-30,MOEX Consumer Total Return,Индекс МосБиржи потребительского сектора полной доходности «брутто»,9461.92,9461.92,9461.92,9461.92,,,,2,,RUB,
SNDX,MECNTRN,2020-07-30,MOEX Consumer Net TR-NR,Индекс МосБиржи потребит. сектора полной доходности «нетто» (по налог.ставкам ин.орг-й),9165.34,9165.34,9165.34,9165.34,,,,2,,RUB,
SNDX,MECNTRR,2020-07-30,MOEX Consumer Net TR-Res,Индекс МосБиржи потреб. сектора полной доходности «нетто» (по налог.ставкам рос.орг-й),9103.55,9103.55,9103.55,9103.55,,,,2,,RUB,
SNDX,MEEUTR,2020-07-30,MOEX El.Utilities Total Return,Индекс МосБиржи электроэнергетики полной доходности «брутто»,3157.53,3157.53,3157.53,3157.53,,,,2,,RUB,
SNDX,MEEUTRN,2020-07-30,MOEX El. Utilities Net TR-NR,Индекс МосБиржи электроэнергетики полной доходности «нетто» (по налог.ставкам ин.орг-й),2993.2,2993.2,2993.2,2993.2,,,,2,,RUB,
SNDX,MEEUTRR,2020-07-30,MOEX El. Utilities Net TR-Res,Индекс МосБиржи электроэнергетики полной доходности «нетто» (по налог.ставкам рос.орг-й),3019.67,3019.67,3019.67,3019.67,,,,2,,RUB,
SNDX,MEFNTR,2020-07-30,MOEX Financials Total Return,Индекс МосБиржи финансов полной доходности «брутто»,9658.15,9658.15,9658.15,9658.15,,,,2,,RUB,
SNDX,MEFNTRN,2020-07-30,MOEX Financials Net TR-NR,Индекс МосБиржи финансов полной доходности «нетто» (по налог.ставкам ин.орг-й),9277.0,9277.0,9277.0,9277.0,,,,2,,RUB,
SNDX,MEFNTRR,2020-07-30,MOEX Financials Net TR-Res,Индекс МосБиржи финансов полной доходности «нетто» (по налог.ставкам рос.орг-й),9340.03,9340.03,9340.03,9340.03,,,,2,,RUB,
SNDX,MEMMTR,2020-07-30,MOEX Metals & Min Total Return,Индекс МосБиржи металлов и добычи полной доходности «брутто»,13621.38,13621.38,13621.38,13621.38,,,,2,,RUB,
SNDX,MEMMTRN,2020-07-30,MOEX Metals & Mining Net TR-NR,Индекс МосБиржи металлов и добычи полной доходности «нетто» (по налог.ставкам ин.орг-й),12703.48,12703.48,12703.48,12703.48,,,,2,,RUB,
SNDX,MEMMTRR,2020-07-30,MOEX Metals & Min Net TR-Res,Индекс МосБиржи металлов и добычи полной доходности «нетто» (по налог.ставкам рос.орг-й),12852.62,12852.62,12852.62,12852.62,,,,2,,RUB,
SNDX,MEOGTR,2020-07-30,MOEX Oil & Gas Total Return,Индекс МосБиржи нефти и газа полной доходности «брутто»,9778.87,9778.87,9778.87,9778.87,,,,2,,RUB,
SNDX,MEOGTRN,2020-07-30,MOEX Oil & Gas Net TR-NR,Индекс МосБиржи нефти и газа полной доходности «нетто» (по налог.ставкам ин.орг-й),9274.7,9274.7,9274.7,9274.7,,,,2,,RUB,
SNDX,MEOGTRR,2020-07-30,MOEX Oil & Gas Net TR-Res,Индекс МосБиржи нефти и газа полной доходности «нетто» (по налог.ставкам рос.орг-й),9357.42,9357.42,9357.42,9357.42,,,,2,,RUB,
SNDX,MESMTR,2020-07-30,MOEX SMID Total Return,Индекс МосБиржи средней и малой капитализации полной доходности «брутто»,2410.76,2410.76,2410.76,2410.76,,,,2,,RUB,
SNDX,MESMTRN,2020-07-30,MOEX SMID Net TR-NR,Индекс МосБиржи средней капитализации полной доходности «нетто» (по нал.ставкам ин.орг-й),2297.28,2297.28,2297.28,2297.28,,,,2,,RUB,
SNDX,MESMTRR,2020-07-30,MOEX SMID Net TR-Res,Индекс МосБиржи средней капитализации полной доходности «нетто» (по нал.ставкам рос.орг-й),2316.96,2316.96,2316.96,2316.96,,,,2,,RUB,
SNDX,METLTR,2020-07-30,MOEX Telecom Total Return,Индекс МосБиржи телекоммуникаций полной доходности «брутто»,4149.69,4149.69,4149.69,4149.69,,,,2,,RUB,
SNDX,METLTRN,2020-07-30,MOEX Telecom Net TR-NR,Индекс МосБиржи телекоммуникаций полной доходности «нетто» (по налог.ставкам ин.орг-й),3788.29,3788.29,3788.29,3788.29,,,,2,,RUB,
SNDX,METLTRR,2020-07-30,MOEX Telecom Net TR-Res,Индекс МосБиржи телекоммуникаций полной доходности «нетто» (по налог.ставкам рос.орг-й),3846.27,3846.27,3846.27,3846.27,,,,2,,RUB,
SNDX,METNTR,2020-07-30,MOEX Transport Total Return,Индекс МосБиржи транспорта полной доходности «брутто»,1956.8,1956.8,1956.8,1956.8,,,,2,,RUB,
SNDX,METNTRN,2020-07-30,MOEX Transport Net TR-NR,Индекс МосБиржи транспорта полной доходности «нетто» (по налог.ставкам ин.орг-й),1860.41,1860.41,1860.41,1860.41,,,,2,,RUB,
SNDX,METNTRR,2020-07-30,MOEX Transport Net TR-Res,Индекс МосБиржи транспорта полной доходности «нетто» (по налог.ставкам рос.орг-й),1874.93,1874.93,1874.93,1874.93,,,,2,,RUB,
SNDX,MOEX10,2020-07-30,Индекс МосБиржи 10,Индекс МосБиржи 10,4968.28,5035.21,5043.33,4945.48,34672130067.7,0,0.0,2,8993643682080.0,RUB,4928.35
RTSI,MOEXBC,2020-07-30,Индекс голубых фишек,Индекс МосБиржи голубых фишек,18999.22,19216.82,19248.04,18926.08,43703245222.4,0,0.0,2,10036723873100.0,RUB,528270321.54
SNDX,MOEXBMI,2020-07-30,Индекс широкого рынка,Индекс МосБиржи широкого рынка,2066.67,2092.03,2092.71,2058.36,62046126299.9,0,0.0,2,15009316795800.0,RUB,7262560801.2
SNDX,MOEXCH,2020-07-30,Индекс химии и нефтехимии,Индекс МосБиржи химии и нефтехимии,16909.94,16991.63,16991.63,16857.5,267912710.5,0,0.0,2,179342979831.0,RUB,10605772.4903
SNDX,MOEXCN,2020-07-30,Индекс потребительского сектора / Индекс потребит сектора,Индекс МосБиржи потребительского сектора,7296.89,7432.36,7448.32,7257.61,5964672452.22,0,0.0,2,184575573860.0,RUB,25295101.5043
SNDX,MOEXEU,2020-07-30,Индекс электроэнергетики,Индекс МосБиржи электроэнергетики,2210.37,2254.66,2256.8,2209.5,4404673643.8,0,0.0,2,283969392982.0,RUB,128471361.257
SNDX,MOEXFN,2020-07-30,Индекс финансов,Индекс МосБиржи финансов,7376.36,7495.84,7495.84,7336.61,15132237719.0,0,0.0,2,799211467263.0,RUB,108347612.073
SNDX,MOEXINN,2020-07-30,Индекс МосБиржи инноваций,Индекс МосБиржи инноваций,425.84,420.01,428.75,418.17,235019709.5,0,0.0,2,3088089121.3,RUB,7251762.984
SNDX,MOEXMM,2020-07-30,Индекс металлов и добычи,Индекс МосБиржи металлов и добычи,8544.9,8587.08,8628.45,8468.26,14656004742.3,0,0.0,2,1354227974180.0,RUB,158483724.864
SNDX,MOEXOG,2020-07-30,Индекс нефти и газа,Индекс МосБиржи нефти и газа,6858.7,6940.87,6947.38,6840.81,18070885687.3,0,0.0,2,1134687675680.0,RUB,165437748.083
SNDX,MOEXREPO,2020-07-30,MXREPO,MOEXREPO обл 12:30,4.23,4.23,4.23,4.23,369761637457.0,,,2,,RUB,
SNDX,MOEXREPO1W,2020-07-30,MOEXREPO1W,MOEXREPO 1 неделя 12:30,4.13,4.13,4.13,4.13,51941765967.0,,,2,,RUB,
SNDX,MOEXREPO1WE,2020-07-30,MOEXREPO1WE,MOEXREPO 1 неделя 19:00,4.35,4.35,4.35,4.35,5354154964.0,,,2,,RUB,
SNDX,MOEXREPOE,2020-07-30,MXREPOE,MOEXREPO обл 19:00,4.33,4.33,4.33,4.33,156778588060.0,,,2,,RUB,
SNDX,MOEXREPOEQ,2020-07-30,MXREPOEQ,MOEXREPO акц 12:30,4.28,4.28,4.28,4.28,39109578198.0,,,2,,RUB,
SNDX,MOEXREPOEQE,2020-07-30,MXREPOEQE,MOEXREPO акц 19:00,4.37,4.37,4.37,4.37,38856611686.0,,,2,,RUB,
SNDX,MOEXREPOUSD,2020-07-30,MOEXREPOUSD,MOEXREPO USD 12:30,0.46,0.46,0.46,0.46,997233128.0,,,2,,USD,
SNDX,MOEXREPOUSDE,2020-07-30,MOEXREPOUSDE,MOEXREPO USD 19:00,0.49,0.49,0.49,0.49,825245053.0,,,2,,USD,
SNDX,MOEXTL,2020-07-30,Индекс телекоммуникаций,Индекс МосБиржи телекоммуникаций,2242.45,2268.74,2269.76,2241.43,1253077849.3,0,0.0,2,380155176627.0,RUB,169526680.988
SNDX,MOEXTN,2020-07-30,Индекс транспорта,Индекс МосБиржи транспорта,1391.83,1417.46,1417.46,1385.61,1416305498.0,0,0.0,2,63757939668.2,RUB,45808634.8417
SNDX,MRBC,2020-07-30,Индекс МосБиржи 15,Индекс МосБиржи 15,1451.7,1467.56,1470.05,1446.12,,,,2,,RUB,
RTSI,MRBCTR,2020-07-30,Индекс МосБиржи полн дох-ти 15,Индекс МосБиржи полной доходности 15,1717.35,1717.35,1717.35,1717.35,,,,2,,RUB,
RTSI,MRRT,2020-07-30,"Индекс ""Ответственность и открытость""",Индекс МосБиржи - РСПП Ответственность и открытость,2197.69,2197.69,2197.69,2197.69,,,,2,,RUB,
RTSI,MRSV,2020-07-30,"Индекс ""Вектор устойчивого развития""",Индекс МосБиржи - РСПП Вектор устойчивого развития,2414.7,2414.7,2414.7,2414.7,,,,2,,RUB,
RTSI,MRSVT,2020-07-30,Индекс МосБиржи-РСПП Вектор TR,"Индекс МосБиржи - РСПП Вектор устойчивого развития, полной доходности брутто",2958.07,2958.07,2958.07,2958.07,,,,2,,RUB,
INAV,MTEKA,2020-07-30,iNAV Фридом - Лидеры Технологий,Расчетная цена одного пая Биржевого ПИФа «Фридом - Лидеры Технологий»,1580.09,1558.17,1582.38,1557.98,,,,2,,RUB,
RTSI,OPSI,2020-07-30,Субиндекс ОФЗ,Индексы активов пенсионных накоплений - Субиндекс ОФЗ,2059.507,2059.507,2059.507,2059.507,2577826157.09,,,2,4817157276251.84,RUB,
INAV,RFBC15,2020-07-30,iNAV «Raiffeisen-MOEX Index 15»,Расчетная цена одного пая Биржевого ПИФа «Райффайзен – Индекс МосБиржи полной доходности 15»,1076.19,1088.63,1089.6,1072.25,,,,2,,RUB,
SNDX,RGBI,2020-07-30,Индекс Мосбиржи гос обл RGBI,Индекс Мосбиржи государственных облигаций ценовой,154.76,155.42,155.57,154.75,13488439774.2,1798,5.58,2,8359704263650.0,RUB,1.0
SNDX,RGBITR,2020-07-30,Индекс Мосбиржи гос обл RGBITR,Индекс Мосбиржи государственных облигаций,610.37,612.92,613.49,610.29,13488439774.2,1798,5.58,2,8495561644720.0,RUB,1.0
SNDX,RPGCC,2020-07-30,MOEXREPOGCC,MOEXREPO КСУ 12:30,4.29,4.29,4.29,4.29,132138597000.0,,,2,,RUB,
SNDX,RPGCC1W,2020-07-30,MOEXREPOGCC1W,MOEXREPO КСУ 1 неделя 12:30,4.31,4.31,4.31,4.31,16623741000.0,,,2,,RUB,
SNDX,RPGCC1WE,2020-07-30,MOEXREPOGCC1WE,MOEXREPO КСУ 1 неделя 19:00,4.34,4.34,4.34,4.34,5979020000.0,,,2,,RUB,
SNDX,RPGCCE,2020-07-30,MOEXREPOGCCE,MOEXREPO КСУ 19:00,4.43,4.43,4.43,4.43,59034848000.0,,,2,,RUB,
RTSI,RTSCH,2020-07-30,Индекс РТС химии и нефтехимии,Индекс РТС химии и нефтехимии,239.31,244.14,244.14,238.95,3635790.96754,0,0.0,2,2433828484.45,USD,10170280.6297
RTSI,RTSCR,2020-07-30,Индекс РТС потреб. сектора,Индекс РТС потребительских товаров и розничной торговли,224.29,231.94,232.42,223.07,80945402.6487,0,0.0,2,2504838994.08,USD,11167995.9719
RTSI,RTSEU,2020-07-30,Индекс РТС электроэнергетики,Индекс РТС электроэнергетики,76.05,78.75,78.8,76.02,59774964.0889,0,0.0,2,3853693063.45,USD,50675795.1837
RTSI,RTSFN,2020-07-30,Индекс РТС финансов,Индекс РТС финансов,174.04,179.56,179.56,173.1,205356636.924,0,0.0,2,10845942428.1,USD,62317345.3938
RTSI,RTSI,2020-07-30,Индекс РТС,Индекс РТС,1232.35,1265.6,1266.81,1226.86,800650914.113,0,0.0,2,166564875206.0,USD,135160162.611
RTSI,RTSMM,2020-07-30,Индекс РТС металлов и добычи,Индекс РТС металлов и добычи,243.76,248.71,249.53,241.57,198893772.389,0,0.0,2,18377962834.7,USD,75393012.9342
RTSI,RTSOG,2020-07-30,Индекс РТС нефти и газа,Индекс РТС нефти и газа,180.71,185.66,185.67,180.23,245236453.451,0,0.0,2,15398624404.6,USD,85213458.6621
RTSI,RTSSM,2020-07-30,RTS SMID Index,Индекс РТС средней и малой капитализации,1114.14,1114.14,1114.14,1114.14,83355782.77,,,2,6520702552.7342,USD,5852684.6488
RTSI,RTSTL,2020-07-30,Индекс РТС телекоммуникаций,Индекс РТС телекоммуникаций ,93.3,95.84,95.89,93.28,17005274.2836,0,0.0,2,5159011511.12,USD,55293012.6018
RTSI,RTSTN,2020-07-30,Индекс РТС транспорта,Индекс РТС транспорта,46.15,47.72,47.72,45.94,19220404.7628,0,0.0,2,865246522.728,USD,18747461.487
RTSI,RTSTR,2020-07-30,RTS Total Return,Индекс РТС полной доходности «брутто»,2176.96,2176.96,2176.96,2176.96,800650914.11,,,2,166564875206.24,USD,
RTSI,RTSTRN,2020-07-30,RTS Net-TR-NR,Индекс РТС полной доходности «нетто» (по налоговым ставкам иностранных организаций),1999.25,1999.25,1999.25,1999.25,800650914.11,,,2,166564875206.24,USD,
RTSI,RTSTRR,2020-07-30,RTS Net-TR-Res,Индекс РТС полной доходности «нетто» (по налоговым ставкам российских организаций),2042.33,2042.33,2042.33,2042.33,800650914.11,,,2,166564875206.24,USD,
RTSI,RTSUSDCUR,2020-07-30,RTSUSDCUR,Курс доллара США на момент закрытия Индекса РТС,73.6876,73.6876,73.6876,73.6876,0.0,,,2,0.0,USD,
RTSI,RUABICP,2020-07-30,ABI CP,Композитный индекс облигаций ,116.93,116.93,116.93,116.93,4686585774.88,1676,5.38,2,10118031184883.48,RUB,
RTSI,RUABITR,2020-07-30,ABI TR,Композитный индекс облигаций — совокупный доход,221.42,221.42,221.42,221.42,4686585774.88,1676,5.38,2,10118031184883.48,RUB,
RTSI,RUBMI,2020-07-30,Индекс РТС широкого рынка,Индекс РТС широкого рынка,900.34,925.31,925.55,896.72,842015838.485,0,0.0,2,203688501129.0,USD,226233892.995
SNDX,RUCBCP3Y,2020-07-30,Индекс Мосбиржи корп обл CBICP 3-5,Индекс Мосбиржи корпоративных облигаций MOEX 1 - 3 ценовой,93.29,93.33,93.41,93.28,572175687.92,638,5.85,2,637570700804.0,RUB,1.0
SNDX,RUCBCP5Y,2020-07-30,Индекс Мосбиржи корп обл CBICP 1-3,Индекс Мосбиржи корпоративных облигаций ценовой 3-5,123.83,124.04,124.17,123.82,689579957.8,1338,6.29,2,505430744760.0,RUB,1.0
SNDX,RUCBICP,2020-07-30,Индекс Мосбиржи корп обл CBICP,Индекс Мосбиржи корпоративных облигаций ценовой,97.47,97.59,97.65,97.46,1391625605.02,1049,6.17,2,1244352945560.0,RUB,1.0
RTSI,RUCBICP1Y,2020-07-30,CBI CP 1Y,"Индекс корпоративных облигаций (≤ 1 года, рейтинг ≥ B-)",92.58,92.58,92.58,92.58,190609749.24,142,5.81,2,204721056812.09,RUB,
RTSI,RUCBICP3+,2020-07-30,CBI CP 3+,"Индекс корпоративных облигаций (< 1 года, рейтинг > B-)",126.18,126.18,126.18,126.18,371910067.1,1482,6.32,2,615352241683.99,RUB,
RTSI,RUCBICPB,2020-07-30,CBI CP B,"Индекс корпоративных облигаций (> 1 года, B- ≤ рейтинг < BB-)",77.8,77.8,77.8,77.8,55457926.52,857,7.25,2,54272744456.39,RUB,
RTSI,RUCBICPB3Y,2020-07-30,CBI CP B 3Y,"Индекс корпоративных облигаций (1-3 года, B- ≤ рейтинг < BB-)",79.23,79.23,79.23,79.23,18675779.72,728,7.05,2,35546337067.4,RUB,
RTSI,RUCBICPBB,2020-07-30,CBI CP BB,"Индекс корпоративных облигаций (> 1 года, BB- ≤ рейтинг < BBB-)",94.43,94.43,94.43,94.43,161208356.6,976,6.27,2,477750745295.0,RUB,
RTSI,RUCBICPBB3+,2020-07-30,CBI CP BB 3+,"Индекс корпоративных облигаций (> 3 лет, BB- ≤ рейтинг < BBB-)",120.63,120.63,120.63,120.63,79804282.3,1358,6.56,2,207671034295.0,RUB,
RTSI,RUCBICPBB3Y,2020-07-30,CBI CP BBB 3Y,"Индекс корпоративных облигаций (1-3 года, BB- ≤ рейтинг < BBB-)",92.82,92.82,92.82,92.82,81404074.3,682,6.05,2,270079711000.0,RUB,
RTSI,RUCBICPBB5Y,2020-07-30,CBI CP BB 5Y,"Индекс корпоративных облигаций (3-5 лет, BB- ≤ рейтинг < BBB-)",120.81,120.81,120.81,120.81,71690813.6,1312,6.58,2,192196134295.0,RUB,
RTSI,RUCBICPBBB,2020-07-30,CBI CP BBB,"Индекс корпоративных облигаций (> 1 года, рейтинг ≥ BBB-)",100.58,100.58,100.58,100.58,328024985.9,1109,5.85,2,733895403410.4,RUB,
RTSI,RUCBICPBBB3+,2020-07-30,CBI CP BBB 3+,"Индекс корпоративных облигаций (3-5 лет, рейтинг ≥ BBB-)",130.62,130.62,130.62,130.62,255323638.0,1565,6.12,2,388954800000.0,RUB,
RTSI,RUCBICPBBB3Y,2020-07-30,CBI CP BBB 3Y,"Индекс корпоративных облигаций (1-3 года, рейтинг ≥ BBB-)",96.1,96.1,96.1,96.1,72701347.9,594,5.55,2,344940603410.4,RUB,
RTSI,RUCBICPBBB5Y,2020-07-30,CBI CP BBB 5Y,"Индекс корпоративных облигаций (3-5 лет, рейтинг ≥ BBB-)",129.35,129.35,129.35,129.35,133567147.4,1370,6.05,2,301274500000.0,RUB,
RTSI,RUCBICPL1,2020-07-30,CBI CP L1,Индекс корпоративных облигаций Котировальный лист 1 - ценовой,93.97,93.97,93.97,93.97,347996054.62,936,6.03,2,556606184456.39,RUB,
RTSI,RUCBICPL2,2020-07-30,CBI CP L2,Индекс корпоративных облигаций Котировальный лист 2 - ценовой,105.9,105.9,105.9,105.9,100523236.9,1139,5.96,2,471548372397.24,RUB,
RTSI,RUCBICPL3,2020-07-30,CBI CP L3,Индекс корпоративных облигаций Котировальный лист 3 - ценовой,103.23,103.23,103.23,103.23,96171977.5,1127,6.38,2,237764336308.16,RUB,
SNDX,RUCBITR,2020-07-30,Индекс Мосбиржи корп обл CBITR,Индекс Мосбиржи корпоративных облигаций,446.09,446.62,446.88,446.05,1391625605.02,1049,6.17,2,1266035018710.0,RUB,1.0
RTSI,RUCBITR1Y,2020-07-30,CBI TR 1Y,"Индекс корпоративных облигаций (≤ 1 года, рейтинг ≥ B-)— совокупный доход",230.51,230.51,230.51,230.51,190609749.24,142,5.81,2,204721056812.09,RUB,
RTSI,RUCBITR3+,2020-07-30,CBI TR 3+,"Индекс корпоративных облигаций (> 3 лет, рейтинг ≥ B-) — совокупный доход",574.43,574.43,574.43,574.43,371910067.1,1482,6.32,2,615352241683.99,RUB,
RTSI,RUCBITRB,2020-07-30,CBI TR B,"Индекс корпоративных облигаций (> 1 года, B- ≤ рейтинг < BB-) — совокупный доход",438.46,438.46,438.46,438.46,55457926.52,857,7.25,2,54272744456.39,RUB,
