BOARDID,SECID,TRADEDATE,SHORTNAME,NAME,CLOSE,OPEN,HIGH,LOW,VALUE,DURATION,YIELD,DECIMALS,CAPITALIZATION,CURRENCYID,DIVISOR
INAV,AKEUA,2020-07-20,iNAV Альфа-Капитал ЕВРОПА 600,Расчетная цена одного пая Биржевого ПИФа «ЕВРОПА 600»,10.18,10.11,10.19,10.03,,,,2,,EUR,
INAV,AKMBA,2020-07-20,iNAV Альфа Управляемые облигации,Расчетная цена одного пая Биржевого ПИФа РФИ «Альфа-Капитал Управляемые облигации»,1.0173,1.0151,1.0175,1.0151,,,,2,,RUB,
INAV,AKNXA,2020-07-20,iNAV Технологии 100,Расчетная цена одного пая Биржевого ПИФа «ТЕХНОЛОГИИ 100»,15.68,15.47,15.69,15.46,,,,2,,USD,
INAV,AKSPA,2020-07-20,iNAV Альфа - Капитал Эс энд Пи 500,Расчетная цена одного пая Биржевого ПИФа «Альфа - Капитал Эс энд Пи 500»,11.13,11.1,11.15,11.07,,,,2,,USD,
RTSI,BPSI,2020-07-20,Субиндекс облигаций,Индексы активов пенсионных накоплений - Субиндекс облигаций,2945.1022,2945.1022,2945.1022,2945.1022,68529023.3,,,2,413001118455.0,RUB,0.001
RTSI,EPSI,2020-07-20,Субиндекс акций,Индексы активов пенсионных накоплений - Субиндекс акций,1652.7783,1652.7783,1652.7783,1652.7783,45439854666.85,,,2,6476710738306.707,RUB,3918680996.809
INAV,ESGRA,2020-07-20,iNAV RSHB-MOEX-RSPP ESG VecTR ,Расчетная цена одного пая Биржевого ПИФа «РСХБ–Индекс МосБиржи–РСПП Вектор развития полн дох-ти»,1030.29,1014.63,1030.73,1013.42,,,,2,,RUB,
RTSI,GPBCBI2Y,2020-07-20,Индикатор GPBCBI2Y,Индикатор GPBCBI2Y,1155.14,1155.14,1155.14,1155.14,,,,2,,RUB,
RTSI,GPBCBI4Y,2020-07-20,Индикатор GPBCBI4Y,Индикатор GPBCBI4Y,1200.17,1200.17,1200.17,1200.17,,,,2,,RUB,
INAV,GPBMA,2020-07-20,iNAV ГПБ - Корп. облигации 4г,Расчетная цена одного пая Биржевого ПИФа «Газпромбанк – Корпоративные облигации 4 года»,57105.48,56966.82,57152.8,56966.82,,,,2,,RUB,
INAV,GPBSA,2020-07-20,iNAV ГПБ - Корп. облигации 2г,Расчетная цена одного пая Биржевого ПИФа «Газпромбанк – Корпоративные облигации 2 года»,55335.28,55280.43,55411.25,55253.34,,,,2,,RUB,
SNDX,IMOEX,2020-07-20,Индекс МосБиржи,Индекс МосБиржи,2802.24,2771.85,2802.24,2758.69,50915459756.8,0,0.0,2,11931494977500.0,RUB,4257839328.87
SNDX,IMOEX2,2020-07-20,Индекс МосБиржи (доп. сессия),Индекс МосБиржи (Дополнительная сессия),2808.74,2802.23,2809.4,2800.68,4016744894.15,0,0.0,2,11959160064600.0,RUB,4257839328.87
RTSI,MCFTR,2020-07-20,MOEX Russia Total Return,Индекс МосБиржи полной доходности «брутто»,4953.43,4953.43,4953.43,4953.43,50915459756.85,,,2,11931494977522.85,RUB,
RTSI,MCFTRN,2020-07-20,MOEX Russia Net-TR-NR,Индекс МосБиржи полной доходности «нетто» (по налоговым ставкам иностранных организаций),4548.63,4548.63,4548.63,4548.63,50915459756.85,,,2,11931494977522.85,RUB,
RTSI,MCFTRR,2020-07-20,MOEX Russia Net-TR-Res,Индекс МосБиржи полной доходности «нетто» (по налоговым ставкам российских организаций),4646.83,4646.83,4646.83,4646.83,50915459756.85,,,2,11931494977522.85,RUB,
RTSI,MCXSM,2020-07-20,Индекс МосБиржи SMID,Индекс МосБиржи средней и малой капитализации,1693.81,1693.81,1693.81,1693.81,5071578896.76,,,2,465747124386.3303,RUB,274969708.379
RTSI,MEBCTR,2020-07-20,MOEX Blue Chip Total Return,Индекс МосБиржи голубых фишек полной доходности «брутто»,30404.7,30404.7,30404.7,30404.7,34645037974.4,,,2,9762027688390.05,RUB,
RTSI,MEBCTRN,2020-07-20,MOEX Blue Chip Net-TR-NR,Индекс МосБиржи голубых фишек полной доходности «нетто» (по налоговым ставкам иностр. орг.),28222.17,28222.17,28222.17,28222.17,34645037974.4,,,2,9762027688390.05,RUB,
RTSI,MEBCTRR,2020-07-20,MOEX Blue Chip Net-TR-Res,Индекс МосБиржи голубых фишек полной доходности «нетто» (по налоговым ставкам росс. орг.),28704.35,28704.35,28704.35,28704.35,34645037974.4,,,2,9762027688390.05,RUB,
SNDX,MECHTR,2020-07-20,MOEX Chemicals Total Return,Индекс МосБиржи химии и нефтехимии полной доходности «брутто»,25539.55,25539.55,25539.55,25539.55,,,,2,,RUB,
SNDX,MECHTRN,2020-07-20,MOEX Chemicals Net TR-NR,Индекс МосБиржи химии и нефтехимии полной доходности «нетто» (по налог.ставкам ин.орг-й),23991.8,23991.8,23991.8,23991.8,,,,2,,RUB,
SNDX,MECHTRR,2020-07-20,MOEX Chemicals Net TR-Res,Индекс МосБиржи химии и нефтехимии полной доходности «нетто» (по налог.ставкам рос.орг-й),24232.13,24232.13,24232.13,24232.13,,,,2,,RUB,
SNDX,MECNTR,2020-07-20,MOEX Consumer Total Return,Индекс МосБиржи потребительского сектора полной доходности «брутто»,8838.35,8838.35,8838.35,8838.35,,,,2,,RUB,
SNDX,MECNTRN,2020-07-20,MOEX Consumer Net TR-NR,Индекс МосБиржи потребит. сектора полной доходности «нетто» (по налог.ставкам ин.орг-й),8561.31,8561.31,8561.31,8561.31,,,,2,,RUB,
SNDX,MECNTRR,2020-07-20,MOEX Consumer Net TR-Res,Индекс МосБиржи потреб. сектора полной доходности «нетто» (по налог.ставкам рос.орг-й),8503.6,8503.6,8503.6,8503.6,,,,2,,RUB,
SNDX,MEEUTR,2020-07-20,MOEX El.Utilities Total Return,Индекс МосБиржи электроэнергетики полной доходности «брутто»,3157.95,3157.95,3157.95,3157.95,,,,2,,RUB,
SNDX,MEEUTRN,2020-07-20,MOEX El. Utilities Net TR-NR,Индекс МосБиржи электроэнергетики полной доходности «нетто» (по налог.ставкам ин.орг-й),2993.58,2993.58,2993.58,2993.58,,,,2,,RUB,
SNDX,MEEUTRR,2020-07-20,MOEX El. Utilities Net TR-Res,Индекс МосБиржи электроэнергетики полной доходности «нетто» (по налог.ставкам рос.орг-й),3020.07,3020.07,3020.07,3020.07,,,,2,,RUB,
SNDX,MEFNTR,2020-07-20,MOEX Financials Total Return,Индекс МосБиржи финансов полной доходности «брутто»,9269.22,9269.22,9269.22,9269.22,,,,2,,RUB,
SNDX,MEFNTRN,2020-07-20,MOEX Financials Net TR-NR,Индекс МосБиржи финансов полной доходности «нетто» (по налог.ставкам ин.орг-й),8903.4,8903.4,8903.4,8903.4,,,,2,,RUB,
SNDX,MEFNTRR,2020-07-20,MOEX Financials Net TR-Res,Индекс МосБиржи финансов полной доходности «нетто» (по налог.ставкам рос.орг-й),8963.91,8963.91,8963.91,8963.91,,,,2,,RUB,
SNDX,MEMMTR,2020-07-20,MOEX Metals & Min Total Return,Индекс МосБиржи металлов и добычи полной доходности «брутто»,12389.57,12389.57,12389.57,12389.57,,,,2,,RUB,
SNDX,MEMMTRN,2020-07-20,MOEX Metals & Mining Net TR-NR,Индекс МосБиржи металлов и добычи полной доходности «нетто» (по налог.ставкам ин.орг-й),11554.67,11554.67,11554.67,11554.67,,,,2,,RUB,
SNDX,MEMMTRR,2020-07-20,MOEX Metals & Min Net TR-Res,Индекс МосБиржи металлов и добычи полной доходности «нетто» (по налог.ставкам рос.орг-й),11690.31,11690.31,11690.31,11690.31,,,,2,,RUB,
SNDX,MEOGTR,2020-07-20,MOEX Oil & Gas Total Return,Индекс МосБиржи нефти и газа полной доходности «брутто»,9827.69,9827.69,9827.69,9827.69,,,,2,,RUB,
SNDX,MEOGTRN,2020-07-20,MOEX Oil & Gas Net TR-NR,Индекс МосБиржи нефти и газа полной доходности «нетто» (по налог.ставкам ин.орг-й),9321.0,9321.0,9321.0,9321.0,,,,2,,RUB,
SNDX,MEOGTRR,2020-07-20,MOEX Oil & Gas Net TR-Res,Индекс МосБиржи нефти и газа полной доходности «нетто» (по налог.ставкам рос.орг-й),9404.13,9404.13,9404.13,9404.13,,,,2,,RUB,
SNDX,MESMTR,2020-07-20,MOEX SMID Total Return,Индекс МосБиржи средней и малой капитализации полной доходности «брутто»,2336.75,2336.75,2336.75,2336.75,,,,2,,RUB,
SNDX,MESMTRN,2020-07-20,MOEX SMID Net TR-NR,Индекс МосБиржи средней капитализации полной доходности «нетто» (по нал.ставкам ин.орг-й),2226.76,2226.76,2226.76,2226.76,,,,2,,RUB,
SNDX,MESMTRR,2020-07-20,MOEX SMID Net TR-Res,Индекс МосБиржи средней капитализации полной доходности «нетто» (по нал.ставкам рос.орг-й),2245.84,2245.84,2245.84,2245.84,,,,2,,RUB,
SNDX,METLTR,2020-07-20,MOEX Telecom Total Return,Индекс МосБиржи телекоммуникаций полной доходности «брутто»,4107.47,4107.47,4107.47,4107.47,,,,2,,RUB,
SNDX,METLTRN,2020-07-20,MOEX Telecom Net TR-NR,Индекс МосБиржи телекоммуникаций полной доходности «нетто» (по налог.ставкам ин.орг-й),3749.74,3749.74,3749.74,3749.74,,,,2,,RUB,
SNDX,METLTRR,2020-07-20,MOEX Telecom Net TR-Res,Индекс МосБиржи телекоммуникаций полной доходности «нетто» (по налог.ставкам рос.орг-й),3807.13,3807.13,3807.13,3807.13,,,,2,,RUB,
SNDX,METNTR,2020-07-20,MOEX Transport Total Return,Индекс МосБиржи транспорта полной доходности «брутто»,2009.71,2009.71,2009.71,2009.71,,,,2,,RUB,
SNDX,METNTRN,2020-07-20,MOEX Transport Net TR-NR,Индекс МосБиржи транспорта полной доходности «нетто» (по налог.ставкам ин.орг-й),1921.54,1921.54,1921.54,1921.54,,,,2,,RUB,
SNDX,METNTRR,2020-07-20,MOEX Transport Net TR-Res,Индекс МосБиржи транспорта полной доходности «нетто» (по налог.ставкам рос.орг-й),1935.08,1935.08,1935.08,1935.08,,,,2,,RUB,
SNDX,MOEX10,2020-07-20,Индекс МосБиржи 10,Индекс МосБиржи 10,4913.85,4848.7,4914.18,4825.04,29397271357.0,0,0.0,2,8903219399170.0,RUB,4928.35
RTSI,MOEXBC,2020-07-20,Индекс голубых фишек,Индекс МосБиржи голубых фишек,18479.23,18295.61,18479.23,18204.82,34645037974.4,0,0.0,2,9762027688390.0,RUB,528270321.54
SNDX,MOEXBMI,2020-07-20,Индекс широкого рынка,Индекс МосБиржи широкого рынка,2011.26,1987.52,2011.26,1981.9,53027379207.8,0,0.0,2,14606877405400.0,RUB,7262560801.2
SNDX,MOEXCH,2020-07-20,Индекс химии и нефтехимии,Индекс МосБиржи химии и нефтехимии,16794.54,16753.98,16811.02,16677.39,129649881.6,0,0.0,2,178119118203.0,RUB,10605772.4903
SNDX,MOEXCN,2020-07-20,Индекс потребительского сектора / Индекс потребит сектора,Индекс МосБиржи потребительского сектора,6816.0,6726.91,6823.18,6726.91,5493877217.78,0,0.0,2,172411469402.0,RUB,25295101.5043
SNDX,MOEXEU,2020-07-20,Индекс электроэнергетики,Индекс МосБиржи электроэнергетики,2210.66,2157.14,2213.78,2151.74,6986626401.3,0,0.0,2,284005903707.0,RUB,128471361.257
SNDX,MOEXFN,2020-07-20,Индекс финансов,Индекс МосБиржи финансов,7079.31,6963.83,7080.65,6945.48,13380229402.6,0,0.0,2,767025937440.0,RUB,108347612.073
SNDX,MOEXINN,2020-07-20,Индекс МосБиржи инноваций,Индекс МосБиржи инноваций,417.41,410.2,417.42,410.16,140805273.0,0,0.0,2,3026944680.51,RUB,7251762.984
SNDX,MOEXMM,2020-07-20,Индекс металлов и добычи,Индекс МосБиржи металлов и добычи,7772.16,7696.93,7783.43,7688.42,9388193127.78,0,0.0,2,1231761636220.0,RUB,158483724.864
SNDX,MOEXOG,2020-07-20,Индекс нефти и газа,Индекс МосБиржи нефти и газа,6892.94,6825.29,6892.94,6801.35,14506644631.9,0,0.0,2,1140352397600.0,RUB,165437748.083
SNDX,MOEXREPO,2020-07-20,MXREPO,MOEXREPO обл 12:30,4.17,4.17,4.17,4.17,438321667785.0,,,2,,RUB,
SNDX,MOEXREPO1W,2020-07-20,MOEXREPO1W,MOEXREPO 1 неделя 12:30,4.54,4.54,4.54,4.54,127223892943.0,,,2,,RUB,
SNDX,MOEXREPO1WE,2020-07-20,MOEXREPO1WE,MOEXREPO 1 неделя 19:00,4.34,4.34,4.34,4.34,23142918981.0,,,2,,RUB,
SNDX,MOEXREPOE,2020-07-20,MXREPOE,MOEXREPO обл 19:00,4.24,4.24,4.24,4.24,108144240838.0,,,2,,RUB,
SNDX,MOEXREPOEQ,2020-07-20,MXREPOEQ,MOEXREPO акц 12:30,4.25,4.25,4.25,4.25,42350723077.0,,,2,,RUB,
SNDX,MOEXREPOEQE,2020-07-20,MXREPOEQE,MOEXREPO акц 19:00,5.67,5.67,5.67,5.67,138180083803.0,,,2,,RUB,
SNDX,MOEXREPOUSD,2020-07-20,MOEXREPOUSD,MOEXREPO USD 12:30,0.41,0.41,0.41,0.41,1045950814.0,,,2,,USD,
SNDX,MOEXREPOUSDE,2020-07-20,MOEXREPOUSDE,MOEXREPO USD 19:00,0.32,0.32,0.32,0.32,312419919.0,,,2,,USD,
SNDX,MOEXTL,2020-07-20,Индекс телекоммуникаций,Индекс МосБиржи телекоммуникаций,2219.63,2204.2,2222.03,2200.12,849318711.5,0,0.0,2,376287347869.0,RUB,169526680.988
SNDX,MOEXTN,2020-07-20,Индекс транспорта,Индекс МосБиржи транспорта,1485.28,1466.18,1486.94,1465.88,1214897365.4,0,0.0,2,68038728034.4,RUB,45808634.8417
SNDX,MRBC,2020-07-20,Индекс МосБиржи 15,Индекс МосБиржи 15,1403.71,1389.68,1403.71,1382.94,,,,2,,RUB,
RTSI,MRBCTR,2020-07-20,Индекс МосБиржи полн дох-ти 15,Индекс МосБиржи полной доходности 15,1660.57,1660.57,1660.57,1660.57,,,,2,,RUB,
RTSI,MRRT,2020-07-20,"Индекс ""Ответственность и открытость""",Индекс МосБиржи - РСПП Ответственность и открытость,2151.28,2151.28,2151.28,2151.28,,,,2,,RUB,
RTSI,MRSV,2020-07-20,"Индекс ""Вектор устойчивого развития""",Индекс МосБиржи - РСПП Вектор устойчивого развития,2348.42,2348.42,2348.42,2348.42,,,,2,,RUB,
RTSI,MRSVT,2020-07-20,Индекс МосБиржи-РСПП Вектор TR,"Индекс МосБиржи - РСПП Вектор устойчивого развития, полной доходности брутто",2876.88,2876.88,2876.88,2876.88,,,,2,,RUB,
INAV,MTEKA,2020-07-20,iNAV Фридом - Лидеры Технологий,Расчетная цена одного пая Биржевого ПИФа «Фридом - Лидеры Технологий»,1549.4,1528.87,1551.8,1517.72,,,,2,,RUB,
RTSI,OPSI,2020-07-20,Субиндекс ОФЗ,Индексы активов пенсионных накоплений - Субиндекс ОФЗ,2062.6249,2062.6249,2062.6249,2062.6249,1658161139.62,,,2,4860943588152.06,RUB,
INAV,RFBC15,2020-07-20,iNAV «Raiffeisen-MOEX Index 15»,Расчетная цена одного пая Биржевого ПИФа «Райффайзен – Индекс МосБиржи полной доходности 15»,1046.7,1034.75,1046.7,1031.81,,,,2,,RUB,
SNDX,RGBI,2020-07-20,Индекс Мосбиржи гос обл RGBI,Индекс Мосбиржи государственных облигаций ценовой,155.74,155.55,155.75,155.52,33717520677.0,1806,5.46,2,8412922884460.0,RUB,1.0
SNDX,RGBITR,2020-07-20,Индекс Мосбиржи гос обл RGBITR,Индекс Мосбиржи государственных облигаций,613.09,612.36,613.13,612.24,33717520677.0,1806,5.46,2,8581535056590.0,RUB,1.0
SNDX,RPGCC,2020-07-20,MOEXREPOGCC,MOEXREPO КСУ 12:30,4.18,4.18,4.18,4.18,85620885000.0,,,2,,RUB,
SNDX,RPGCC1W,2020-07-20,MOEXREPOGCC1W,MOEXREPO КСУ 1 неделя 12:30,4.29,4.29,4.29,4.29,6160260000.0,,,2,,RUB,
SNDX,RPGCC1WE,2020-07-20,MOEXREPOGCC1WE,MOEXREPO КСУ 1 неделя 19:00,4.2,4.2,4.2,4.2,,,,2,,RUB,
SNDX,RPGCCE,2020-07-20,MOEXREPOGCCE,MOEXREPO КСУ 19:00,4.26,4.26,4.26,4.26,88748800000.0,,,2,,RUB,
RTSI,RTSCH,2020-07-20,Индекс РТС химии и нефтехимии,Индекс РТС химии и нефтехимии,245.19,243.1,245.19,241.82,1815067.12325,0,0.0,2,2493624764.49,USD,10170280.6297
RTSI,RTSCR,2020-07-20,Индекс РТС потреб. сектора,Индекс РТС потребительских товаров и розничной торговли,216.13,212.0,216.31,211.75,76912958.146,0,0.0,2,2413719055.65,USD,11167995.9719
RTSI,RTSEU,2020-07-20,Индекс РТС электроэнергетики,Индекс РТС электроэнергетики,78.46,76.09,78.65,75.83,97811087.2675,0,0.0,2,3976014264.45,USD,50675795.1837
RTSI,RTSFN,2020-07-20,Индекс РТС финансов,Индекс РТС финансов,172.31,168.47,172.31,167.53,187319989.733,0,0.0,2,10738178427.5,USD,62317345.3938
RTSI,RTSI,2020-07-20,Индекс РТС,Индекс РТС,1235.85,1214.76,1235.85,1205.79,712804176.364,0,0.0,2,167038056631.0,USD,135160162.611
RTSI,RTSMM,2020-07-20,Индекс РТС металлов и добычи,Индекс РТС металлов и добычи,228.73,225.13,229.19,224.17,131432443.151,0,0.0,2,17244366304.0,USD,75393012.9342
RTSI,RTSOG,2020-07-20,Индекс РТС нефти и газа,Индекс РТС нефти и газа,187.35,184.38,187.35,183.15,203089531.707,0,0.0,2,15964658974.2,USD,85213458.6621
RTSI,RTSSM,2020-07-20,RTS SMID Index,Индекс РТС средней и малой капитализации,1114.08,1114.08,1114.08,1114.08,71000883.34,,,2,6520347591.4302,USD,5852684.6488
RTSI,RTSTL,2020-07-20,Индекс РТС телекоммуникаций,Индекс РТС телекоммуникаций ,95.27,94.03,95.35,93.56,11890257.4486,0,0.0,2,5267932261.73,USD,55293012.6018
RTSI,RTSTN,2020-07-20,Индекс РТС транспорта,Индекс РТС транспорта,50.81,49.85,50.85,49.76,17008270.5733,0,0.0,2,952525809.037,USD,18747461.487
RTSI,RTSTR,2020-07-20,RTS Total Return,Индекс РТС полной доходности «брутто»,2183.15,2183.15,2183.15,2183.15,712804176.37,,,2,167038056630.75,USD,
RTSI,RTSTRN,2020-07-20,RTS Net-TR-NR,Индекс РТС полной доходности «нетто» (по налоговым ставкам иностранных организаций),2004.93,2004.93,2004.93,2004.93,712804176.37,,,2,167038056630.75,USD,
RTSI,RTSTRR,2020-07-20,RTS Net-TR-Res,Индекс РТС полной доходности «нетто» (по налоговым ставкам российских организаций),2048.13,2048.13,2048.13,2048.13,712804176.37,,,2,167038056630.75,USD,
RTSI,RTSUSDCUR,2020-07-20,RTSUSDCUR,Курс доллара США на момент закрытия Индекса РТС,71.4298,71.4298,71.4298,71.4298,0.0,,,2,0.0,USD,
RTSI,RUABICP,2020-07-20,ABI CP,Композитный индекс облигаций ,117.55,117.55,117.55,117.55,4272374969.93,1683,5.3,2,10203423355007.68,RUB,
RTSI,RUABITR,2020-07-20,ABI TR,Композитный индекс облигаций — совокупный доход,222.17,222.17,222.17,222.17,4272374969.93,1683,5.3,2,10203423355007.68,RUB,
RTSI,RUBMI,2020-07-20,Индекс РТС широкого рынка,Индекс РТС широкого рынка,903.9,887.77,903.9,882.9,742370540.135,0,0.0,2,204492766400.0,USD,226233892.995
SNDX,RUCBCP3Y,2020-07-20,Индекс Мосбиржи корп обл CBICP 3-5,Индекс Мосбиржи корпоративных облигаций MOEX 1 - 3 ценовой,93.24,93.31,93.35,93.23,594106384.22,648,5.91,2,637216485100.0,RUB,1.0
SNDX,RUCBCP5Y,2020-07-20,Индекс Мосбиржи корп обл CBICP 1-3,Индекс Мосбиржи корпоративных облигаций ценовой 3-5,124.06,123.88,124.06,123.85,661556495.5,1342,6.24,2,506376644375.0,RUB,1.0
SNDX,RUCBICP,2020-07-20,Индекс Мосбиржи корп обл CBICP,Индекс Мосбиржи корпоративных облигаций ценовой,97.56,97.54,97.6,97.52,1264213499.32,1057,6.15,2,1245333629470.0,RUB,1.0
RTSI,RUCBICP1Y,2020-07-20,CBI CP 1Y,"Индекс корпоративных облигаций (≤ 1 года, рейтинг ≥ B-)",92.89,92.89,92.89,92.89,127429335.78,151,5.51,2,205240435385.86,RUB,
RTSI,RUCBICP3+,2020-07-20,CBI CP 3+,"Индекс корпоративных облигаций (< 1 года, рейтинг > B-)",126.46,126.46,126.46,126.46,237341910.1,1486,6.26,2,617524809705.31,RUB,
RTSI,RUCBICPB,2020-07-20,CBI CP B,"Индекс корпоративных облигаций (> 1 года, B- ≤ рейтинг < BB-)",77.93,77.93,77.93,77.93,33887459.12,862,7.2,2,54473610919.21,RUB,
RTSI,RUCBICPB3Y,2020-07-20,CBI CP B 3Y,"Индекс корпоративных облигаций (1-3 года, B- ≤ рейтинг < BB-)",79.3,79.3,79.3,79.3,4663564.82,733,7.02,2,35722520256.9,RUB,
RTSI,RUCBICPBB,2020-07-20,CBI CP BB,"Индекс корпоративных облигаций (> 1 года, BB- ≤ рейтинг < BBB-)",94.38,94.38,94.38,94.38,245220267.2,985,6.37,2,476965250043.0,RUB,
RTSI,RUCBICPBB3+,2020-07-20,CBI CP BB 3+,"Индекс корпоративных облигаций (> 3 лет, BB- ≤ рейтинг < BBB-)",120.84,120.84,120.84,120.84,112926127.4,1364,6.52,2,208107014043.0,RUB,
RTSI,RUCBICPBB3Y,2020-07-20,CBI CP BBB 3Y,"Индекс корпоративных облигаций (1-3 года, BB- ≤ рейтинг < BBB-)",92.6,92.6,92.6,92.6,132294139.8,692,6.25,2,268858236000.0,RUB,
RTSI,RUCBICPBB5Y,2020-07-20,CBI CP BB 5Y,"Индекс корпоративных облигаций (3-5 лет, BB- ≤ рейтинг < BBB-)",121.0,121.0,121.0,121.0,112096643.2,1317,6.54,2,192621764043.0,RUB,
RTSI,RUCBICPBBB,2020-07-20,CBI CP BBB,"Индекс корпоративных облигаций (> 1 года, рейтинг ≥ BBB-)",100.74,100.74,100.74,100.74,246621353.0,1117,5.82,2,735372775457.78,RUB,
RTSI,RUCBICPBBB3+,2020-07-20,CBI CP BBB 3+,"Индекс корпоративных облигаций (3-5 лет, рейтинг ≥ BBB-)",130.93,130.93,130.93,130.93,95191888.4,1569,6.07,2,390666705000.0,RUB,
RTSI,RUCBICPBBB3Y,2020-07-20,CBI CP BBB 3Y,"Индекс корпоративных облигаций (1-3 года, рейтинг ≥ BBB-)",96.18,96.18,96.18,96.18,151429464.6,604,5.53,2,344706070457.78,RUB,
RTSI,RUCBICPBBB5Y,2020-07-20,CBI CP BBB 5Y,"Индекс корпоративных облигаций (3-5 лет, рейтинг ≥ BBB-)",129.6,129.6,129.6,129.6,87470753.0,1372,6.0,2,302798255000.0,RUB,
RTSI,RUCBICPL1,2020-07-20,CBI CP L1,Индекс корпоративных облигаций Котировальный лист 1 - ценовой,94.06,94.06,94.06,94.06,344152175.12,942,6.06,2,558144850919.21,RUB,
RTSI,RUCBICPL2,2020-07-20,CBI CP L2,Индекс корпоративных облигаций Котировальный лист 2 - ценовой,105.87,105.87,105.87,105.87,115703759.0,1149,5.99,2,470582359992.94,RUB,
RTSI,RUCBICPL3,2020-07-20,CBI CP L3,Индекс корпоративных облигаций Котировальный лист 3 - ценовой,103.51,103.51,103.51,103.51,65873145.2,1139,6.32,2,238084425507.84,RUB,
SNDX,RUCBITR,2020-07-20,Индекс Мосбиржи корп обл CBITR,Индекс Мосбиржи корпоративных облигаций,445.54,445.47,445.72,445.38,1264213499.32,1057,6.15,2,1266927335500.0,RUB,1.0
RTSI,RUCBITR1Y,2020-07-20,CBI TR 1Y,"Индекс корпоративных облигаций (≤ 1 года, рейтинг ≥ B-)— совокупный доход",230.73,230.73,230.73,230.73,127429335.78,151,5.51,2,205240435385.86,RUB,
RTSI,RUCBITR3+,2020-07-20,CBI TR 3+,"Индекс корпоративных облигаций (> 3 лет, рейтинг ≥ B-) — совокупный доход",574.58,574.58,574.58,574.58,237341910.1,1486,6.26,2,617524809705.31,RUB,
RTSI,RUCBITRB,2020-07-20,CBI TR B,"Индекс корпоративных облигаций (> 1 года, B- ≤ рейтинг < BB-) — совокупный доход",438.22,438.22,438.22,438.22,33887459.12,862,7.2,2,54473610919.21,RUB,
RTSI,RUCBITRB3Y,2020-07-20,CBI TR B 3Y,"Индекс корпоративных облигаций (1-3 года, B- ≤ рейтинг < BB-) — совокупный доход",441.32,441.32,441.32,441.32,4663564.82,733,7.02,2,35722520256.9,RUB,
