BOARDID,SECID,TRADEDATE,SHORTNAME,NAME,CLOSE,OPEN,HIGH,LOW,VALUE,DURATION,YIELD,DECIMALS,CAPITALIZATION,CURRENCYID,DIVISOR
INAV,AKCHA,2021-02-02,iNAV Альфа Китайские акции,Расчетная цена одного пая Биржевого ПИФа РФИ «Альфа-Капитал Китайские акции»,114.56,114.0,114.88,113.41,0.0,0,0.0,2,0.0,RUB,0.0
INAV,AKEUA,2021-02-02,iNAV Альфа-Капитал ЕВРОПА 600,Расчетная цена одного пая Биржевого ПИФа «ЕВРОПА 600»,10.96,10.83,10.97,10.83,0.0,0,0.0,2,0.0,EUR,0.0
INAV,AKMBA,2021-02-02,iNAV Альфа Управляемые облигации,Расчетная цена одного пая Биржевого ПИФа РФИ «Альфа-Капитал Управляемые облигации»,1.0674,1.0671,1.0679,1.0669,0.0,0,0.0,4,0.0,RUB,0.0
INAV,AKMEI,2021-02-02,iNAV Альфа Управляемые акции,Расчетная цена одного пая Биржевого ПИФа РФИ «Альфа-Капитал Управляемые Российские Акции»,104.8,104.02,105.12,103.58,0.0,0,0.0,2,0.0,RUB,0.0
INAV,AKNXA,2021-02-02,iNAV Технологии 100,Расчетная цена одного пая Биржевого ПИФа «ТЕХНОЛОГИИ 100»,19.6,19.31,19.62,19.31,0.0,0,0.0,2,0.0,USD,0.0
INAV,AKSPA,2021-02-02,iNAV Альфа - Капитал Эс энд Пи 500,Расчетная цена одного пая Биржевого ПИФа «Альфа - Капитал Эс энд Пи 500»,13.17,12.95,13.17,12.95,0.0,0,0.0,2,0.0,USD,0.0
RTSI,BPSI,2021-02-02,Субиндекс облигаций,Субиндекс облигаций активов пенсионных накоплений,3035.09,3035.09,3035.09,3035.09,1149410162.0,971,6.0,2,2007948910176.42,RUB,1000000000000.0
RTSI,BPSIG,2021-02-02,Субиндекс облигаций ОФЗ,Субиндекс облигаций ОФЗ активов пенсионных накоплений,2066.11,2066.11,2066.11,2066.11,10528821912.0,1780,5.7,2,8918546746874.07,RUB,1000000000000.0
INAV,DIVDA,2021-02-02,iNAV ДОХОДЪ Дивидендные акции РФ,Расчетная цена одного пая Биржевого ПИФа РФИ «ДОХОДЪ Индекс дивидендных акций РФ»,974.56,968.36,977.09,965.94,0.0,0,0.0,2,0.0,RUB,0.0
RTSI,EPSI,2021-02-02,Субиндекс акций,Субиндекс акций активов пенсионных накоплений,1994.92,1994.92,1994.92,1994.92,98580029755.0,0,0.0,2,48287366918153.19,RUB,7568983455.3956
RTSI,EPSITR,2021-02-02,Субиндекс акций полной доходности,Субиндекс акций полной дох-ти,2008.26,2008.26,2008.26,2008.26,98580029755.0,0,0.0,2,0.0,RUB,0.0
INAV,ESGRA,2021-02-02,iNAV RSHB-MOEX-RSPP ESG VecTR ,Расчетная цена одного пая Биржевого ПИФа «РСХБ–Индекс МосБиржи–РСПП Вектор развития полн дох-ти»,1322.9,1317.39,1324.37,1314.08,0.0,0,0.0,2,0.0,RUB,0.0
INAV,GPBMA,2021-02-02,iNAV ГПБ - Корп. облигации 4г,Расчетная цена одного пая Биржевого ПИФа «Газпромбанк – Корпоративные облигации 4 года»,58808.44,58825.27,58897.46,58793.01,0.0,0,0.0,2,0.0,RUB,0.0
INAV,GPBSA,2021-02-02,iNAV ГПБ - Корп. облигации 2г,Расчетная цена одного пая Биржевого ПИФа «Газпромбанк – Корпоративные облигации 2 года»,57101.08,57101.37,57109.86,57067.77,0.0,0,0.0,2,0.0,RUB,0.0
SNDX,IMOEX,2021-02-02,Индекс МосБиржи,Индекс МосБиржи,3360.25,3324.24,3366.13,3321.7,98441733596.85,0,0.0,2,17067476302938.854,RUB,5079230865.8227
SNDX,IMOEX2,2021-02-02,Индекс МосБиржи (доп. сессия),Индекс МосБиржи (Дополнительная сессия),3360.25,3364.97,3366.53,3331.41,14287421907.9,0,0.0,2,17067476302938.854,RUB,5079230865.8227
RTSI,MCFTR,2021-02-02,MOEX Russia Total Return,Индекс МосБиржи полной доходности «брутто»,6089.46,6089.46,6089.46,6089.46,98580029755.0,0,0.0,2,0.0,RUB,0.0
RTSI,MCFTRN,2021-02-02,MOEX Russia Net-TR-NR,Индекс МосБиржи полной доходности «нетто» (по налоговым ставкам иностранных организаций),5571.11,5571.11,5571.11,5571.11,98580029755.0,0,0.0,2,0.0,RUB,0.0
RTSI,MCFTRR,2021-02-02,MOEX Russia Net-TR-Res,Индекс МосБиржи полной доходности «нетто» (по налоговым ставкам российских организаций),5693.48,5693.48,5693.48,5693.48,98580029755.0,0,0.0,2,0.0,RUB,0.0
RTSI,MCXSM,2021-02-02,Индекс МосБиржи SMID,Индекс МосБиржи средней и малой капитализации,2032.59,2032.59,2032.59,2032.59,7000939488.0,0,0.0,2,4816968122700.365,RUB,414265307.9884
RTSI,MEBCTR,2021-02-02,MOEX Blue Chip Total Return,Индекс МосБиржи голубых фишек полной доходности «брутто»,36991.72,36991.72,36991.72,36991.72,76482785960.0,0,0.0,2,0.0,RUB,0.0
RTSI,MEBCTRN,2021-02-02,MOEX Blue Chip Net-TR-NR,Индекс МосБиржи голубых фишек полной доходности «нетто» (по налоговым ставкам иностр. орг.),34211.01,34211.01,34211.01,34211.01,76482785960.0,0,0.0,2,0.0,RUB,0.0
RTSI,MEBCTRR,2021-02-02,MOEX Blue Chip Net-TR-Res,Индекс МосБиржи голубых фишек полной доходности «нетто» (по налоговым ставкам росс. орг.),34808.54,34808.54,34808.54,34808.54,76482785960.0,0,0.0,2,0.0,RUB,0.0
SNDX,MECHTR,2021-02-02,MOEX Chemicals Total Return,Индекс МосБиржи химии и нефтехимии полной доходности «брутто»,31078.15,31078.15,31078.15,31078.15,697433760.0,0,0.0,2,0.0,RUB,0.0
SNDX,MECHTRN,2021-02-02,MOEX Chemicals Net TR-NR,Индекс МосБиржи химии и нефтехимии полной доходности «нетто» (по налог.ставкам ин.орг-й),29079.13,29079.13,29079.13,29079.13,697433760.0,0,0.0,2,0.0,RUB,0.0
SNDX,MECHTRR,2021-02-02,MOEX Chemicals Net TR-Res,Индекс МосБиржи химии и нефтехимии полной доходности «нетто» (по налог.ставкам рос.орг-й),29386.0,29386.0,29386.0,29386.0,697433760.0,0,0.0,2,0.0,RUB,0.0
SNDX,MECNTR,2021-02-02,MOEX Consumer Total Return,Индекс МосБиржи потребительского сектора полной доходности «брутто»,11390.49,11390.49,11390.49,11390.49,4362595080.0,0,0.0,2,0.0,RUB,0.0
SNDX,MECNTRN,2021-02-02,MOEX Consumer Net TR-NR,Индекс МосБиржи потребит. сектора полной доходности «нетто» (по налог.ставкам ин.орг-й),10990.59,10990.59,10990.59,10990.59,4362595080.0,0,0.0,2,0.0,RUB,0.0
SNDX,MECNTRR,2021-02-02,MOEX Consumer Net TR-Res,Индекс МосБиржи потреб. сектора полной доходности «нетто» (по налог.ставкам рос.орг-й),10922.19,10922.19,10922.19,10922.19,4362595080.0,0,0.0,2,0.0,RUB,0.0
SNDX,MEEUTR,2021-02-02,MOEX El.Utilities Total Return,Индекс МосБиржи электроэнергетики полной доходности «брутто»,3305.4,3305.4,3305.4,3305.4,1663572288.0,0,0.0,2,0.0,RUB,0.0
SNDX,MEEUTRN,2021-02-02,MOEX El. Utilities Net TR-NR,Индекс МосБиржи электроэнергетики полной доходности «нетто» (по налог.ставкам ин.орг-й),3128.06,3128.06,3128.06,3128.06,1663572288.0,0,0.0,2,0.0,RUB,0.0
SNDX,MEEUTRR,2021-02-02,MOEX El. Utilities Net TR-Res,Индекс МосБиржи электроэнергетики полной доходности «нетто» (по налог.ставкам рос.орг-й),3156.47,3156.47,3156.47,3156.47,1663572288.0,0,0.0,2,0.0,RUB,0.0
SNDX,MEFNTR,2021-02-02,MOEX Financials Total Return,Индекс МосБиржи финансов полной доходности «брутто»,12627.77,12627.77,12627.77,12627.77,21987780864.0,0,0.0,2,0.0,RUB,0.0
SNDX,MEFNTRN,2021-02-02,MOEX Financials Net TR-NR,Индекс МосБиржи финансов полной доходности «нетто» (по налог.ставкам ин.орг-й),12074.78,12074.78,12074.78,12074.78,21987780864.0,0,0.0,2,0.0,RUB,0.0
SNDX,MEFNTRR,2021-02-02,MOEX Financials Net TR-Res,Индекс МосБиржи финансов полной доходности «нетто» (по налог.ставкам рос.орг-й),12164.17,12164.17,12164.17,12164.17,21987780864.0,0,0.0,2,0.0,RUB,0.0
SNDX,MEMMTR,2021-02-02,MOEX Metals & Min Total Return,Индекс МосБиржи металлов и добычи полной доходности «брутто»,17089.5,17089.5,17089.5,17089.5,21020904363.0,0,0.0,2,0.0,RUB,0.0
SNDX,MEMMTRN,2021-02-02,MOEX Metals & Mining Net TR-NR,Индекс МосБиржи металлов и добычи полной доходности «нетто» (по налог.ставкам ин.орг-й),15870.42,15870.42,15870.42,15870.42,21020904363.0,0,0.0,2,0.0,RUB,0.0
SNDX,MEMMTRR,2021-02-02,MOEX Metals & Min Net TR-Res,Индекс МосБиржи металлов и добычи полной доходности «нетто» (по налог.ставкам рос.орг-й),16065.83,16065.83,16065.83,16065.83,21020904363.0,0,0.0,2,0.0,RUB,0.0
SNDX,MEOGTR,2021-02-02,MOEX Oil & Gas Total Return,Индекс МосБиржи нефти и газа полной доходности «брутто»,10973.11,10973.11,10973.11,10973.11,40746519336.0,0,0.0,2,0.0,RUB,0.0
SNDX,MEOGTRN,2021-02-02,MOEX Oil & Gas Net TR-NR,Индекс МосБиржи нефти и газа полной доходности «нетто» (по налог.ставкам ин.орг-й),10388.59,10388.59,10388.59,10388.59,40746519336.0,0,0.0,2,0.0,RUB,0.0
SNDX,MEOGTRR,2021-02-02,MOEX Oil & Gas Net TR-Res,Индекс МосБиржи нефти и газа полной доходности «нетто» (по налог.ставкам рос.орг-й),10483.72,10483.72,10483.72,10483.72,40746519336.0,0,0.0,2,0.0,RUB,0.0
SNDX,MESMTR,2021-02-02,MOEX SMID Total Return,Индекс МосБиржи средней и малой капитализации полной доходности «брутто»,2862.94,2862.94,2862.94,2862.94,7000939488.0,0,0.0,2,0.0,RUB,0.0
SNDX,MESMTRN,2021-02-02,MOEX SMID Net TR-NR,Индекс МосБиржи средней капитализации полной доходности «нетто» (по нал.ставкам ин.орг-й),2719.76,2719.76,2719.76,2719.76,7000939488.0,0,0.0,2,0.0,RUB,0.0
SNDX,MESMTRR,2021-02-02,MOEX SMID Net TR-Res,Индекс МосБиржи средней капитализации полной доходности «нетто» (по нал.ставкам рос.орг-й),2744.23,2744.23,2744.23,2744.23,7000939488.0,0,0.0,2,0.0,RUB,0.0
SNDX,METLTR,2021-02-02,MOEX Telecom Total Return,Индекс МосБиржи телекоммуникаций полной доходности «брутто»,4494.67,4494.67,4494.67,4494.67,761496822.0,0,0.0,2,0.0,RUB,0.0
SNDX,METLTRN,2021-02-02,MOEX Telecom Net TR-NR,Индекс МосБиржи телекоммуникаций полной доходности «нетто» (по налог.ставкам ин.орг-й),4084.5,4084.5,4084.5,4084.5,761496822.0,0,0.0,2,0.0,RUB,0.0
SNDX,METLTRR,2021-02-02,MOEX Telecom Net TR-Res,Индекс МосБиржи телекоммуникаций полной доходности «нетто» (по налог.ставкам рос.орг-й),4149.58,4149.58,4149.58,4149.58,761496822.0,0,0.0,2,0.0,RUB,0.0
SNDX,METNTR,2021-02-02,MOEX Transport Total Return,Индекс МосБиржи транспорта полной доходности «брутто»,1905.85,1905.85,1905.85,1905.85,863977386.0,0,0.0,2,0.0,RUB,0.0
SNDX,METNTRN,2021-02-02,MOEX Transport Net TR-NR,Индекс МосБиржи транспорта полной доходности «нетто» (по налог.ставкам ин.орг-й),1811.83,1811.83,1811.83,1811.83,863977386.0,0,0.0,2,0.0,RUB,0.0
SNDX,METNTRR,2021-02-02,MOEX Transport Net TR-Res,Индекс МосБиржи транспорта полной доходности «нетто» (по налог.ставкам рос.орг-й),1826.01,1826.01,1826.01,1826.01,863977386.0,0,0.0,2,0.0,RUB,0.0
SNDX,MOEX10,2021-02-02,Индекс МосБиржи 10,Индекс МосБиржи 10,5404.4,5364.3,5417.23,5339.51,63694296257.2,0,0.0,2,12143567485855.463,RUB,5391.01
RTSI,MOEXBC,2021-02-02,Индекс голубых фишек,Индекс МосБиржи голубых фишек,21938.89,21687.99,21984.75,21641.71,76364305729.2,0,0.0,2,13516515066741.611,RUB,616098470.6265
SNDX,MOEXBMI,2021-02-02,Индекс широкого рынка,Индекс МосБиржи широкого рынка,2404.26,2385.77,2408.46,2377.51,100296865378.31,0,0.0,2,18657041908074.637,RUB,7760008376.088
SNDX,MOEXCH,2021-02-02,Индекс химии и нефтехимии,Индекс МосБиржи химии и нефтехимии,19899.24,19885.22,20069.91,19838.45,697381710.5,0,0.0,2,208425192340.3,RUB,10474029.9738
SNDX,MOEXCN,2021-02-02,Индекс потребительского сектора / Индекс потребит сектора,Индекс МосБиржи потребительского сектора,8558.79,8496.7,8559.66,8496.39,4358061800.2,0,0.0,2,165304296158.6098,RUB,19313982.7282
SNDX,MOEXEU,2021-02-02,Индекс электроэнергетики,Индекс МосБиржи электроэнергетики,2287.65,2282.75,2290.6,2279.45,1662711985.6,0,0.0,2,284903072159.5431,RUB,124539818.5684
SNDX,MOEXFN,2021-02-02,Индекс финансов,Индекс МосБиржи финансов,9356.16,9339.19,9385.44,9259.86,21936500270.2,0,0.0,2,955279868085.3951,RUB,102101671.187
SNDX,MOEXINN,2021-02-02,Индекс МосБиржи инноваций,Индекс МосБиржи инноваций,393.68,386.52,400.53,386.26,185535777.2,0,0.0,2,11056214550.1917,RUB,28084330.4761
SNDX,MOEXMM,2021-02-02,Индекс металлов и добычи,Индекс МосБиржи металлов и добычи,10420.96,10410.91,10438.34,10350.55,20992364381.79,0,0.0,2,1850163992614.899,RUB,177542507.7844
SNDX,MOEXOG,2021-02-02,Индекс нефти и газа,Индекс МосБиржи нефти и газа,7604.3,7514.34,7630.76,7492.47,40693672479.5,0,0.0,2,1237326549919.0122,RUB,162714074.6339
SNDX,MOEXREPO,2021-02-02,MXREPO,MOEXREPO обл 12:30,4.24,4.24,4.24,4.24,457304011504.0,,,2,,RUB,
SNDX,MOEXREPO1W,2021-02-02,MOEXREPO1W,MOEXREPO 1 неделя 12:30,4.31,4.31,4.31,4.31,71339893195.0,,,2,,RUB,
SNDX,MOEXREPO1WE,2021-02-02,MOEXREPO1WE,MOEXREPO 1 неделя 19:00,4.31,4.31,4.31,4.31,9720211234.0,,,2,,RUB,
SNDX,MOEXREPOE,2021-02-02,MXREPOE,MOEXREPO обл 19:00,4.05,4.05,4.05,4.05,117913530682.0,,,2,,RUB,
SNDX,MOEXREPOEQ,2021-02-02,MXREPOEQ,MOEXREPO акц 12:30,4.19,4.19,4.19,4.19,33037644660.0,,,2,,RUB,
SNDX,MOEXREPOEQE,2021-02-02,MXREPOEQE,MOEXREPO акц 19:00,4.24,4.24,4.24,4.24,31359404802.0,,,2,,RUB,
SNDX,MOEXREPOUSD,2021-02-02,MOEXREPOUSD,MOEXREPO USD 12:30,0.19,0.19,0.19,0.19,802032705.0,,,2,,USD,
SNDX,MOEXREPOUSDE,2021-02-02,MOEXREPOUSDE,MOEXREPO USD 19:00,0.24,0.24,0.24,0.24,128845219.0,,,2,,USD,
SNDX,MOEXTL,2021-02-02,Индекс телекоммуникаций,Индекс МосБиржи телекоммуникаций,2355.6,2349.26,2356.24,2338.35,761436581.6,0,0.0,2,419297276107.3308,RUB,178000185.54
SNDX,MOEXTN,2021-02-02,Индекс транспорта,Индекс МосБиржи транспорта,1354.85,1346.95,1356.6,1346.95,863597473.9,0,0.0,2,185662616334.2444,RUB,137035373.9192
SNDX,MRBC,2021-02-02,Индекс МосБиржи 15,Индекс МосБиржи 15,1679.22,1660.09,1682.41,1657.52,76364305729.2,0,0.0,2,10934955190379.746,RUB,6511921170.5989
RTSI,MRBCTR,2021-02-02,Индекс МосБиржи полн дох-ти 15,Индекс МосБиржи полной доходности 15,2030.34,2030.34,2030.34,2030.34,76482785960.0,0,0.0,2,0.0,RUB,0.0
RTSI,MRRT,2021-02-02,"Индекс ""Ответственность и открытость""",Индекс МосБиржи - РСПП Ответственность и открытость,2620.79,2620.79,2620.79,2620.79,87006108890.0,0,0.0,2,41396487009942.41,RUB,4957833678.8508
RTSI,MRSV,2021-02-02,"Индекс ""Вектор устойчивого развития""",Индекс МосБиржи - РСПП Вектор устойчивого развития,2969.6,2969.6,2969.6,2969.6,83548680150.0,0,0.0,2,39426727677480.41,RUB,291060494.3854
RTSI,MRSVT,2021-02-02,Индекс МосБиржи-РСПП Вектор TR,"Индекс МосБиржи - РСПП Вектор устойчивого развития, полной доходности брутто",3724.05,3724.05,3724.05,3724.05,83548680150.0,0,0.0,2,0.0,RUB,0.0
INAV,MTEKA,2021-02-02,iNAV Фридом - Лидеры Технологий,Расчетная цена одного пая Биржевого ПИФа «Фридом - Лидеры Технологий»,1968.16,1949.26,1974.4,1928.74,0.0,0,0.0,2,0.0,RUB,0.0
INAV,OPNWO,2021-02-02,iNAV «Открытие – Всепогодный»,Биржевой паевой инвестиционный фонд рыночных финансовых инструментов «Открытие – Всепогодный»,1.1249,1.1147,1.1253,1.1147,0.0,0,0.0,4,0.0,USD,0.0
INAV,RCMBD,2021-02-02,iNAV «Райффайзен –Еврооблигации»,Биржевой паевой инвестиционный фонд рыночных финансовых инструментов «Райффайзен – Еврооблигации»,12.96,12.95,12.96,12.95,0.0,0,0.0,2,0.0,USD,0.0
INAV,RFBC15,2021-02-02,iNAV «Raiffeisen-MOEX Index 15»,Расчетная цена одного пая Биржевого ПИФа «Райффайзен – Индекс МосБиржи полной доходности 15»,1263.62,1252.99,1265.95,1247.46,0.0,0,0.0,2,0.0,RUB,0.0
SNDX,RGBI,2021-02-02,Индекс Мосбиржи гос обл RGBI,Индекс Мосбиржи государственных облигаций ценовой,150.98,151.01,151.19,150.98,10528414171.35,1776,6.06,2,8773497818916.259,RUB,1.0
SNDX,RGBITR,2021-02-02,Индекс Мосбиржи гос обл RGBITR,Индекс Мосбиржи государственных облигаций,615.43,615.56,616.26,615.43,10528414171.35,1776,6.06,2,8918546746874.084,RUB,1.0
SNDX,RPGCC,2021-02-02,MOEXREPOGCC,MOEXREPO КСУ 12:30,4.24,4.24,4.24,4.24,103749106000.0,,,2,,RUB,
SNDX,RPGCC1W,2021-02-02,MOEXREPOGCC1W,MOEXREPO КСУ 1 неделя 12:30,4.3,4.3,4.3,4.3,6600000000.0,,,2,,RUB,
SNDX,RPGCC1WE,2021-02-02,MOEXREPOGCC1WE,MOEXREPO КСУ 1 неделя 19:00,4.15,4.15,4.15,4.15,2803707000.0,,,2,,RUB,
SNDX,RPGCCE,2021-02-02,MOEXREPOGCCE,MOEXREPO КСУ 19:00,4.07,4.07,4.07,4.07,101770304000.0,,,2,,RUB,
RTSI,RTSCH,2021-02-02,Индекс РТС химии и нефтехимии,Индекс РТС химии и нефтехимии,274.25,272.37,276.4,272.33,9216677.0258983,0,0.0,2,2754571353.0169744,USD,10043947.695
RTSI,RTSCR,2021-02-02,Индекс РТС потреб. сектора,Индекс РТС потребительских товаров и розничной торговли,256.2,252.77,257.04,252.76,57596646.80989411,0,0.0,2,2184680621.4562297,USD,8527282.6944
RTSI,RTSEU,2021-02-02,Индекс РТС электроэнергетики,Индекс РТС электроэнергетики,76.65,76.01,76.95,76.01,21974593.149823166,0,0.0,2,3765311823.1306205,USD,49124990.0073
RTSI,RTSFN,2021-02-02,Индекс РТС финансов,Индекс РТС финансов,214.99,213.27,215.52,212.39,289915314.70477843,0,0.0,2,12625088786.990519,USD,58724922.3762
RTSI,RTSI,2021-02-02,Индекс РТС,Индекс РТС,1398.99,1375.46,1406.62,1375.46,1301017291.9235,0,0.0,2,225565733031.02155,USD,161234282.6352
RTSI,RTSMM,2021-02-02,Индекс РТС металлов и добычи,Индекс РТС металлов и добычи,289.51,287.45,290.93,286.03,277437506.0369893,0,0.0,2,24451980469.421864,USD,84459553.1639
RTSI,RTSOG,2021-02-02,Индекс РТС нефти и газа,Индекс РТС нефти и газа,195.11,191.62,196.34,191.55,537812263.4910104,0,0.0,2,16352650226.51116,USD,83810552.5083
RTSI,RTSSM,2021-02-02,RTS SMID Index,Индекс РТС средней и малой капитализации,1262.07,1262.07,1262.07,1262.07,1222824.0036013913,0,0.0,2,841359114.0325024,USD,8817568.3892
RTSI,RTSTL,2021-02-02,Индекс РТС телекоммуникаций,Индекс РТС телекоммуникаций ,95.45,94.61,95.77,94.45,10063233.581620084,0,0.0,2,5541481105.01698,USD,58056740.3599
RTSI,RTSTN,2021-02-02,Индекс РТС транспорта,Индекс РТС транспорта,43.75,43.23,43.88,43.23,11413403.703419803,0,0.0,2,2453738526.2213593,USD,56082557.4433
RTSI,RTSTR,2021-02-02,RTS Total Return,Индекс РТС полной доходности «брутто»,2533.69,2533.69,2533.69,2533.69,98580029755.0,0,0.0,2,0.0,USD,0.0
RTSI,RTSTRN,2021-02-02,RTS Net-TR-NR,Индекс РТС полной доходности «нетто» (по налоговым ставкам иностранных организаций),2318.15,2318.15,2318.15,2318.15,98580029755.0,0,0.0,2,0.0,USD,0.0
RTSI,RTSTRR,2021-02-02,RTS Net-TR-Res,Индекс РТС полной доходности «нетто» (по налоговым ставкам российских организаций),2368.99,2368.99,2368.99,2368.99,98580029755.0,0,0.0,2,0.0,USD,0.0
RTSI,RTSUSDCUR,2021-02-02,RTSUSDCUR,Курс доллара США на момент закрытия Индекса РТС,75.6652,75.6652,75.6652,75.6652,0.0,,,2,0.0,USD,
RTSI,RUABICP,2021-02-02,ABI CP,Композитный индекс облигаций ,114.39,114.39,114.39,114.39,11258468876.0,1650,5.75,2,10459843152284.521,RUB,1000000000000.0
RTSI,RUABITR,2021-02-02,ABI TR,Композитный индекс облигаций — совокупный доход,223.85,223.85,223.85,223.85,11258468876.0,1653,5.75,2,10628803465501.062,RUB,1000000000000.0
RTSI,RUBMI,2021-02-02,Индекс РТС широкого рынка,Индекс РТС широкого рынка,1020.04,1005.95,1025.54,1004.66,1325534927.262599,0,0.0,2,246573615190.00323,USD,241729735.9223
RTSI,RUCBCP3A3YNS,2021-02-02,RUCBCP3A3YNS,Индекс МосБиржи Корпоративных Облигаций RUCBCP3A3YNS,105.3,105.3,105.3,105.3,10957773.0,595,5.38,2,193694000000.0,RUB,193924000000.0
RTSI,RUCBCP3A5YNS,2021-02-02,RUCBCP3A5YNS,Индекс МосБиржи Корпоративных Облигаций RUCBCP3A5YNS,110.27,110.27,110.27,110.27,51600157.0,1368,6.1,2,214639500000.0,RUB,214831000000.0
SNDX,RUCBCP3Y,2021-02-02,Индекс Мосбиржи корп обл CBICP 3-5,Индекс Мосбиржи корпоративных облигаций MOEX 1 - 3 ценовой,92.9,92.9,92.93,92.86,301518159.8,645,5.89,2,748438770711.8993,RUB,1.0
RTSI,RUCBCP3YNS,2021-02-02,RUCBCP3YNS,Индекс МосБиржи Корпоративных Облигаций RUCBCP3YNS,103.55,103.55,103.55,103.55,318308838.0,646,5.79,2,785113655952.8,RUB,757707395485.309
SNDX,RUCBCP5Y,2021-02-02,Индекс Мосбиржи корп обл CBICP 1-3,Индекс Мосбиржи корпоративных облигаций ценовой 3-5,123.06,123.1,123.16,123.06,389160845.8,1294,6.26,2,446932650000.0,RUB,1.0
RTSI,RUCBCP5YNS,2021-02-02,RUCBCP5YNS,Индекс МосБиржи Корпоративных Облигаций RUCBCP5YNS,109.93,109.93,109.93,109.93,385005095.0,1317,6.32,2,430177650000.0,RUB,354780481101.85
RTSI,RUCBCPA3YNS,2021-02-02,RUCBCPA3YNS,Индекс МосБиржи Корпоративных Облигаций RUCBCPA3YNS,100.53,100.53,100.53,100.53,47547240.0,637,6.29,2,158210300000.0,RUB,104314891589.76
RTSI,RUCBCPA5YNS,2021-02-02,RUCBCPA5YNS,Индекс МосБиржи Корпоративных Облигаций RUCBCPA5YNS,109.99,109.99,109.99,109.99,225278321.0,1329,6.79,2,101287400000.0,RUB,101397800000.0
RTSI,RUCBCPAA3YNS,2021-02-02,RUCBCPAA3YNS,Индекс МосБиржи Корпоративных Облигаций RUCBCPAA3YNS,100.06,100.06,100.06,100.06,211053969.0,639,5.76,2,397638855952.8,RUB,255329540430.5853
RTSI,RUCBCPAA5YNS,2021-02-02,RUCBCPAA5YNS,Индекс МосБиржи Корпоративных Облигаций RUCBCPAA5YNS,111.1,111.1,111.1,111.1,108126617.0,1293,6.2,2,114250750000.0,RUB,114019250000.0
RTSI,RUCBCPAAANS,2021-02-02,RUCBCPAAANS,Индекс МосБиржи Корпоративных Облигаций RUCBCPAAANS,107.98,107.98,107.98,107.98,125762327.0,1222,5.88,2,543880500000.0,RUB,269531382999.1
