BOARDID,SECID,TRADEDATE,SHORTNAME,NAME,CLOSE,OPEN,HIGH,LOW,VALUE,DURATION,YIELD,DECIMALS,CAPITALIZATION,CURRENCYID,DIVISOR
INAV,AKEUA,2020-09-14,iNAV Альфа-Капитал ЕВРОПА 600,Расчетная цена одного пая Биржевого ПИФа «ЕВРОПА 600»,9.98,10.03,10.03,9.95,,,,2,,EUR,
INAV,AKMBA,2020-09-14,iNAV Альфа Управляемые облигации,Расчетная цена одного пая Биржевого ПИФа РФИ «Альфа-Капитал Управляемые облигации»,1.0302,1.0304,1.0307,1.0302,,,,2,,RUB,
INAV,AKNXA,2020-09-14,iNAV Технологии 100,Расчетная цена одного пая Биржевого ПИФа «ТЕХНОЛОГИИ 100»,16.54,16.17,16.56,16.17,,,,2,,USD,
INAV,AKSPA,2020-09-14,iNAV Альфа - Капитал Эс энд Пи 500,Расчетная цена одного пая Биржевого ПИФа «Альфа - Капитал Эс энд Пи 500»,11.69,11.51,11.72,11.51,,,,2,,USD,
RTSI,BPSI,2020-09-14,Субиндекс облигаций,Индексы активов пенсионных накоплений - Субиндекс облигаций,2972.4851,2972.4851,2972.4851,2972.4851,89987876.8,,,2,413163198980.0,RUB,0.001
RTSI,EPSI,2020-09-14,Субиндекс акций,Индексы активов пенсионных накоплений - Субиндекс акций,1727.8296,1727.8296,1727.8296,1727.8296,52039089887.75,,,2,6770812889193.487,RUB,3918680996.809
INAV,ESGRA,2020-09-14,iNAV RSHB-MOEX-RSPP ESG VecTR ,Расчетная цена одного пая Биржевого ПИФа «РСХБ–Индекс МосБиржи–РСПП Вектор развития полн дох-ти»,1093.43,1093.9,1096.08,1090.64,,,,2,,RUB,
RTSI,GPBCBI2Y,2020-09-14,Индикатор GPBCBI2Y,Индикатор GPBCBI2Y,1165.5,1165.5,1165.5,1165.5,,,,2,,RUB,
RTSI,GPBCBI4Y,2020-09-14,Индикатор GPBCBI4Y,Индикатор GPBCBI4Y,1208.5,1208.5,1208.5,1208.5,,,,2,,RUB,
INAV,GPBMA,2020-09-14,iNAV ГПБ - Корп. облигации 4г,Расчетная цена одного пая Биржевого ПИФа «Газпромбанк – Корпоративные облигации 4 года»,57469.93,57488.09,57495.74,57390.1,,,,2,,RUB,
INAV,GPBSA,2020-09-14,iNAV ГПБ - Корп. облигации 2г,Расчетная цена одного пая Биржевого ПИФа «Газпромбанк – Корпоративные облигации 2 года»,55865.04,55912.51,55955.96,55863.89,,,,2,,RUB,
SNDX,IMOEX,2020-09-14,Индекс МосБиржи,Индекс МосБиржи,2928.38,2918.29,2938.24,2918.29,62169731197.1,0,0.0,2,12468585748000.0,RUB,4257839328.87
SNDX,IMOEX2,2020-09-14,Индекс МосБиржи (доп. сессия),Индекс МосБиржи (Дополнительная сессия),2934.97,2929.25,2936.05,2926.14,2646487344.9,0,0.0,2,12496623623100.0,RUB,4257839328.87
RTSI,MCFTR,2020-09-14,MOEX Russia Total Return,Индекс МосБиржи полной доходности «брутто»,5185.03,5185.03,5185.03,5185.03,62169731197.1,,,2,12468585748034.73,RUB,
RTSI,MCFTRN,2020-09-14,MOEX Russia Net-TR-NR,Индекс МосБиржи полной доходности «нетто» (по налоговым ставкам иностранных организаций),4760.11,4760.11,4760.11,4760.11,62169731197.1,,,2,12468585748034.73,RUB,
RTSI,MCFTRR,2020-09-14,MOEX Russia Net-TR-Res,Индекс МосБиржи полной доходности «нетто» (по налоговым ставкам российских организаций),4863.04,4863.04,4863.04,4863.04,62169731197.1,,,2,12468585748034.73,RUB,
RTSI,MCXSM,2020-09-14,Индекс МосБиржи SMID,Индекс МосБиржи средней и малой капитализации,1802.9,1802.9,1802.9,1802.9,3522311635.6,,,2,495744062130.4869,RUB,274969708.379
RTSI,MEBCTR,2020-09-14,MOEX Blue Chip Total Return,Индекс МосБиржи голубых фишек полной доходности «брутто»,31646.03,31646.03,31646.03,31646.03,49628035295.2,,,2,10147663268113.32,RUB,
RTSI,MEBCTRN,2020-09-14,MOEX Blue Chip Net-TR-NR,Индекс МосБиржи голубых фишек полной доходности «нетто» (по налоговым ставкам иностр. орг.),29368.79,29368.79,29368.79,29368.79,49628035295.2,,,2,10147663268113.32,RUB,
RTSI,MEBCTRR,2020-09-14,MOEX Blue Chip Net-TR-Res,Индекс МосБиржи голубых фишек полной доходности «нетто» (по налоговым ставкам росс. орг.),29871.32,29871.32,29871.32,29871.32,49628035295.2,,,2,10147663268113.32,RUB,
SNDX,MECHTR,2020-09-14,MOEX Chemicals Total Return,Индекс МосБиржи химии и нефтехимии полной доходности «брутто»,25979.29,25979.29,25979.29,25979.29,,,,2,,RUB,
SNDX,MECHTRN,2020-09-14,MOEX Chemicals Net TR-NR,Индекс МосБиржи химии и нефтехимии полной доходности «нетто» (по налог.ставкам ин.орг-й),24404.87,24404.87,24404.87,24404.87,,,,2,,RUB,
SNDX,MECHTRR,2020-09-14,MOEX Chemicals Net TR-Res,Индекс МосБиржи химии и нефтехимии полной доходности «нетто» (по налог.ставкам рос.орг-й),24649.38,24649.38,24649.38,24649.38,,,,2,,RUB,
SNDX,MECNTR,2020-09-14,MOEX Consumer Total Return,Индекс МосБиржи потребительского сектора полной доходности «брутто»,9637.75,9637.75,9637.75,9637.75,,,,2,,RUB,
SNDX,MECNTRN,2020-09-14,MOEX Consumer Net TR-NR,Индекс МосБиржи потребит. сектора полной доходности «нетто» (по налог.ставкам ин.орг-й),9335.38,9335.38,9335.38,9335.38,,,,2,,RUB,
SNDX,MECNTRR,2020-09-14,MOEX Consumer Net TR-Res,Индекс МосБиржи потреб. сектора полной доходности «нетто» (по налог.ставкам рос.орг-й),9272.45,9272.45,9272.45,9272.45,,,,2,,RUB,
SNDX,MEEUTR,2020-09-14,MOEX El.Utilities Total Return,Индекс МосБиржи электроэнергетики полной доходности «брутто»,3125.05,3125.05,3125.05,3125.05,,,,2,,RUB,
SNDX,MEEUTRN,2020-09-14,MOEX El. Utilities Net TR-NR,Индекс МосБиржи электроэнергетики полной доходности «нетто» (по налог.ставкам ин.орг-й),2962.42,2962.42,2962.42,2962.42,,,,2,,RUB,
SNDX,MEEUTRR,2020-09-14,MOEX El. Utilities Net TR-Res,Индекс МосБиржи электроэнергетики полной доходности «нетто» (по налог.ставкам рос.орг-й),2988.62,2988.62,2988.62,2988.62,,,,2,,RUB,
SNDX,MEFNTR,2020-09-14,MOEX Financials Total Return,Индекс МосБиржи финансов полной доходности «брутто»,9800.73,9800.73,9800.73,9800.73,,,,2,,RUB,
SNDX,MEFNTRN,2020-09-14,MOEX Financials Net TR-NR,Индекс МосБиржи финансов полной доходности «нетто» (по налог.ставкам ин.орг-й),9411.3,9411.3,9411.3,9411.3,,,,2,,RUB,
SNDX,MEFNTRR,2020-09-14,MOEX Financials Net TR-Res,Индекс МосБиржи финансов полной доходности «нетто» (по налог.ставкам рос.орг-й),9475.61,9475.61,9475.61,9475.61,,,,2,,RUB,
SNDX,MEMMTR,2020-09-14,MOEX Metals & Min Total Return,Индекс МосБиржи металлов и добычи полной доходности «брутто»,14522.7,14522.7,14522.7,14522.7,,,,2,,RUB,
SNDX,MEMMTRN,2020-09-14,MOEX Metals & Mining Net TR-NR,Индекс МосБиржи металлов и добычи полной доходности «нетто» (по налог.ставкам ин.орг-й),13529.26,13529.26,13529.26,13529.26,,,,2,,RUB,
SNDX,MEMMTRR,2020-09-14,MOEX Metals & Min Net TR-Res,Индекс МосБиржи металлов и добычи полной доходности «нетто» (по налог.ставкам рос.орг-й),13690.13,13690.13,13690.13,13690.13,,,,2,,RUB,
SNDX,MEOGTR,2020-09-14,MOEX Oil & Gas Total Return,Индекс МосБиржи нефти и газа полной доходности «брутто»,9654.41,9654.41,9654.41,9654.41,,,,2,,RUB,
SNDX,MEOGTRN,2020-09-14,MOEX Oil & Gas Net TR-NR,Индекс МосБиржи нефти и газа полной доходности «нетто» (по налог.ставкам ин.орг-й),9156.64,9156.64,9156.64,9156.64,,,,2,,RUB,
SNDX,MEOGTRR,2020-09-14,MOEX Oil & Gas Net TR-Res,Индекс МосБиржи нефти и газа полной доходности «нетто» (по налог.ставкам рос.орг-й),9238.3,9238.3,9238.3,9238.3,,,,2,,RUB,
SNDX,MESMTR,2020-09-14,MOEX SMID Total Return,Индекс МосБиржи средней и малой капитализации полной доходности «брутто»,2499.18,2499.18,2499.18,2499.18,,,,2,,RUB,
SNDX,MESMTRN,2020-09-14,MOEX SMID Net TR-NR,Индекс МосБиржи средней капитализации полной доходности «нетто» (по нал.ставкам ин.орг-й),2379.86,2379.86,2379.86,2379.86,,,,2,,RUB,
SNDX,MESMTRR,2020-09-14,MOEX SMID Net TR-Res,Индекс МосБиржи средней капитализации полной доходности «нетто» (по нал.ставкам рос.орг-й),2400.45,2400.45,2400.45,2400.45,,,,2,,RUB,
SNDX,METLTR,2020-09-14,MOEX Telecom Total Return,Индекс МосБиржи телекоммуникаций полной доходности «брутто»,4334.76,4334.76,4334.76,4334.76,,,,2,,RUB,
SNDX,METLTRN,2020-09-14,MOEX Telecom Net TR-NR,Индекс МосБиржи телекоммуникаций полной доходности «нетто» (по налог.ставкам ин.орг-й),3950.67,3950.67,3950.67,3950.67,,,,2,,RUB,
SNDX,METLTRR,2020-09-14,MOEX Telecom Net TR-Res,Индекс МосБиржи телекоммуникаций полной доходности «нетто» (по налог.ставкам рос.орг-й),4012.06,4012.06,4012.06,4012.06,,,,2,,RUB,
SNDX,METNTR,2020-09-14,MOEX Transport Total Return,Индекс МосБиржи транспорта полной доходности «брутто»,1943.16,1943.16,1943.16,1943.16,,,,2,,RUB,
SNDX,METNTRN,2020-09-14,MOEX Transport Net TR-NR,Индекс МосБиржи транспорта полной доходности «нетто» (по налог.ставкам ин.орг-й),1847.45,1847.45,1847.45,1847.45,,,,2,,RUB,
SNDX,METNTRR,2020-09-14,MOEX Transport Net TR-Res,Индекс МосБиржи транспорта полной доходности «нетто» (по налог.ставкам рос.орг-й),1861.85,1861.85,1861.85,1861.85,,,,2,,RUB,
SNDX,MOEX10,2020-09-14,Индекс МосБиржи 10,Индекс МосБиржи 10,4936.17,4921.51,4961.61,4920.17,36055913071.2,0,0.0,2,8920114898180.0,RUB,4928.35
RTSI,MOEXBC,2020-09-14,Индекс голубых фишек,Индекс МосБиржи голубых фишек,19209.22,19154.97,19290.72,19153.39,49628035295.2,0,0.0,2,10147663268100.0,RUB,528270321.54
SNDX,MOEXBMI,2020-09-14,Индекс широкого рынка,Индекс МосБиржи широкого рынка,2095.1,2090.2,2101.91,2088.57,63456847609.4,0,0.0,2,15215822186400.0,RUB,7262560801.2
SNDX,MOEXCH,2020-09-14,Индекс химии и нефтехимии,Индекс МосБиржи химии и нефтехимии,17083.71,17045.05,17150.93,17014.54,139652180.8,0,0.0,2,181185940848.0,RUB,10605772.4903
SNDX,MOEXCN,2020-09-14,Индекс потребительского сектора / Индекс потребит сектора,Индекс МосБиржи потребительского сектора,7431.06,7434.91,7470.22,7409.69,7807323782.78,0,0.0,2,187969442050.0,RUB,25295101.5043
SNDX,MOEXEU,2020-09-14,Индекс электроэнергетики,Индекс МосБиржи электроэнергетики,2187.64,2183.0,2195.16,2178.47,2550116241.3,0,0.0,2,281049219459.0,RUB,128471361.257
SNDX,MOEXFN,2020-09-14,Индекс финансов,Индекс МосБиржи финансов,7471.17,7438.75,7491.94,7425.55,17998890580.8,0,0.0,2,809482888758.0,RUB,108347612.073
SNDX,MOEXINN,2020-09-14,Индекс МосБиржи инноваций,Индекс МосБиржи инноваций,393.01,395.52,396.47,391.66,126743096.0,0,0.0,2,2850011512.42,RUB,7251762.984
SNDX,MOEXMM,2020-09-14,Индекс металлов и добычи,Индекс МосБиржи металлов и добычи,9044.05,9091.6,9096.49,9013.93,15868676276.9,0,0.0,2,1433335040000.0,RUB,158483724.864
SNDX,MOEXOG,2020-09-14,Индекс нефти и газа,Индекс МосБиржи нефти и газа,6771.4,6760.75,6824.27,6759.77,16628821789.3,0,0.0,2,1120245481740.0,RUB,165437748.083
SNDX,MOEXREPO,2020-09-14,MXREPO,MOEXREPO обл 12:30,4.2,4.2,4.2,4.2,343537253321.0,,,2,,RUB,
SNDX,MOEXREPO1W,2020-09-14,MOEXREPO1W,MOEXREPO 1 неделя 12:30,4.31,4.31,4.31,4.31,107646888555.0,,,2,,RUB,
SNDX,MOEXREPO1WE,2020-09-14,MOEXREPO1WE,MOEXREPO 1 неделя 19:00,4.26,4.26,4.26,4.26,,,,2,,RUB,
SNDX,MOEXREPOE,2020-09-14,MXREPOE,MOEXREPO обл 19:00,4.13,4.13,4.13,4.13,126223893684.0,,,2,,RUB,
SNDX,MOEXREPOEQ,2020-09-14,MXREPOEQ,MOEXREPO акц 12:30,4.2,4.2,4.2,4.2,46860016999.0,,,2,,RUB,
SNDX,MOEXREPOEQE,2020-09-14,MXREPOEQE,MOEXREPO акц 19:00,4.34,4.34,4.34,4.34,27692002437.0,,,2,,RUB,
SNDX,MOEXREPOUSD,2020-09-14,MOEXREPOUSD,MOEXREPO USD 12:30,0.31,0.31,0.31,0.31,1359558026.0,,,2,,USD,
SNDX,MOEXREPOUSDE,2020-09-14,MOEXREPOUSDE,MOEXREPO USD 19:00,0.27,0.27,0.27,0.27,402413973.0,,,2,,USD,
SNDX,MOEXTL,2020-09-14,Индекс телекоммуникаций,Индекс МосБиржи телекоммуникаций,2316.76,2308.29,2320.58,2305.69,1161673061.3,0,0.0,2,392751905549.0,RUB,169526680.988
SNDX,MOEXTN,2020-09-14,Индекс транспорта,Индекс МосБиржи транспорта,1382.13,1385.48,1389.52,1371.03,840555009.4,0,0.0,2,63313595707.1,RUB,45808634.8417
SNDX,MRBC,2020-09-14,Индекс МосБиржи 15,Индекс МосБиржи 15,1481.02,1477.19,1487.36,1476.63,,,,2,,RUB,
RTSI,MRBCTR,2020-09-14,Индекс МосБиржи полн дох-ти 15,Индекс МосБиржи полной доходности 15,1754.59,1754.59,1754.59,1754.59,,,,2,,RUB,
RTSI,MRRT,2020-09-14,"Индекс ""Ответственность и открытость""",Индекс МосБиржи - РСПП Ответственность и открытость,2216.52,2216.52,2216.52,2216.52,,,,2,,RUB,
RTSI,MRSV,2020-09-14,"Индекс ""Вектор устойчивого развития""",Индекс МосБиржи - РСПП Вектор устойчивого развития,2491.38,2491.38,2491.38,2491.38,,,,2,,RUB,
RTSI,MRSVT,2020-09-14,Индекс МосБиржи-РСПП Вектор TR,"Индекс МосБиржи - РСПП Вектор устойчивого развития, полной доходности брутто",3065.41,3065.41,3065.41,3065.41,,,,2,,RUB,
INAV,MTEKA,2020-09-14,iNAV Фридом - Лидеры Технологий,Расчетная цена одного пая Биржевого ПИФа «Фридом - Лидеры Технологий»,1772.36,1721.73,1784.42,1720.77,,,,2,,RUB,
RTSI,OPSI,2020-09-14,Субиндекс ОФЗ,Индексы активов пенсионных накоплений - Субиндекс ОФЗ,2065.6019,2065.6019,2065.6019,2065.6019,2397186168.34,,,2,4787297820121.16,RUB,
INAV,RFBC15,2020-09-14,iNAV «Raiffeisen-MOEX Index 15»,Расчетная цена одного пая Биржевого ПИФа «Райффайзен – Индекс МосБиржи полной доходности 15»,1095.93,1100.07,1100.41,1093.17,,,,2,,RUB,
SNDX,RGBI,2020-09-14,Индекс Мосбиржи гос обл RGBI,Индекс Мосбиржи государственных облигаций ценовой,153.0,153.14,153.17,152.99,16504604656.9,1878,5.84,2,8891337087680.0,RUB,1.0
SNDX,RGBITR,2020-09-14,Индекс Мосбиржи гос обл RGBITR,Индекс Мосбиржи государственных облигаций,608.32,608.86,609.01,608.3,16504604656.9,1878,5.84,2,9059202139010.0,RUB,1.0
SNDX,RPGCC,2020-09-14,MOEXREPOGCC,MOEXREPO КСУ 12:30,4.22,4.22,4.22,4.22,103212059000.0,,,2,,RUB,
SNDX,RPGCC1W,2020-09-14,MOEXREPOGCC1W,MOEXREPO КСУ 1 неделя 12:30,4.23,4.23,4.23,4.23,3359770000.0,,,2,,RUB,
SNDX,RPGCC1WE,2020-09-14,MOEXREPOGCC1WE,MOEXREPO КСУ 1 неделя 19:00,4.23,4.23,4.23,4.23,2535772000.0,,,2,,RUB,
SNDX,RPGCCE,2020-09-14,MOEXREPOGCCE,MOEXREPO КСУ 19:00,4.24,4.24,4.24,4.24,68865828000.0,,,2,,RUB,
RTSI,RTSCH,2020-09-14,Индекс РТС химии и нефтехимии,Индекс РТС химии и нефтехимии,237.24,236.68,239.43,235.32,1859715.59114,0,0.0,2,2412811007.75,USD,10170280.6297
RTSI,RTSCR,2020-09-14,Индекс РТС потреб. сектора,Индекс РТС потребительских товаров и розничной торговли,224.14,224.23,226.71,222.32,103968313.855,0,0.0,2,2503145314.56,USD,11167995.9719
RTSI,RTSEU,2020-09-14,Индекс РТС электроэнергетики,Индекс РТС электроэнергетики,73.86,73.69,74.56,73.23,33959304.5092,0,0.0,2,3742667048.31,USD,50675795.1837
RTSI,RTSFN,2020-09-14,Индекс РТС финансов,Индекс РТС финансов,172.98,172.21,173.82,171.28,239687037.069,0,0.0,2,10779695242.6,USD,62317345.3938
RTSI,RTSI,2020-09-14,Индекс РТС,Индекс РТС,1228.48,1224.14,1239.42,1218.41,827899841.891,0,0.0,2,166041254653.0,USD,135160162.611
RTSI,RTSMM,2020-09-14,Индекс РТС металлов и добычи,Индекс РТС металлов и добычи,253.17,254.48,255.73,251.89,211319468.94,0,0.0,2,19087389154.6,USD,75393012.9342
RTSI,RTSOG,2020-09-14,Индекс РТС нефти и газа,Индекс РТС нефти и газа,175.07,174.78,177.33,174.03,221442149.823,0,0.0,2,14918048371.1,USD,85213458.6621
RTSI,RTSSM,2020-09-14,RTS SMID Index,Индекс РТС средней и малой капитализации,1127.98,1127.98,1127.98,1127.98,46905804.32,,,2,6601708303.2774,USD,5852684.6488
RTSI,RTSTL,2020-09-14,Индекс РТС телекоммуникаций,Индекс РТС телекоммуникаций ,94.59,94.24,95.24,93.64,15469729.8068,0,0.0,2,5230185722.95,USD,55293012.6018
RTSI,RTSTN,2020-09-14,Индекс РТС транспорта,Индекс РТС транспорта,44.97,45.08,45.42,44.45,11193475.4419,0,0.0,2,843132419.364,USD,18747461.487
RTSI,RTSTR,2020-09-14,RTS Total Return,Индекс РТС полной доходности «брутто»,2173.74,2173.74,2173.74,2173.74,827899841.88,,,2,166041254653.01,USD,
RTSI,RTSTRN,2020-09-14,RTS Net-TR-NR,Индекс РТС полной доходности «нетто» (по налоговым ставкам иностранных организаций),1995.8,1995.8,1995.8,1995.8,827899841.88,,,2,166041254653.01,USD,
RTSI,RTSTRR,2020-09-14,RTS Net-TR-Res,Индекс РТС полной доходности «нетто» (по налоговым ставкам российских организаций),2038.87,2038.87,2038.87,2038.87,827899841.88,,,2,166041254653.01,USD,
RTSI,RUABICP,2020-09-14,ABI CP,Композитный индекс облигаций ,115.71,115.71,115.71,115.71,2491410153.16,1740,5.59,2,10737787428502.75,RUB,
RTSI,RUABITR,2020-09-14,ABI TR,Композитный индекс облигаций — совокупный доход,220.98,220.98,220.98,220.98,2491410153.16,1740,5.59,2,10737787428502.75,RUB,
RTSI,RUBMI,2020-09-14,Индекс РТС широкого рынка,Индекс РТС широкого рынка,895.65,893.47,903.62,888.24,845040071.61,0,0.0,2,202625562952.0,USD,226233892.995
SNDX,RUCBCP3Y,2020-09-14,Индекс Мосбиржи корп обл CBICP 3-5,Индекс Мосбиржи корпоративных облигаций MOEX 1 - 3 ценовой,93.17,93.17,93.22,93.11,2270701768.83,665,5.96,2,808022312456.0,RUB,1.0
SNDX,RUCBCP5Y,2020-09-14,Индекс Мосбиржи корп обл CBICP 1-3,Индекс Мосбиржи корпоративных облигаций ценовой 3-5,123.28,123.34,123.45,123.21,92912529.9,1332,6.29,2,370320795050.0,RUB,1.0
SNDX,RUCBICP,2020-09-14,Индекс Мосбиржи корп обл CBICP,Индекс Мосбиржи корпоративных облигаций ценовой,97.22,97.23,97.28,97.17,3066024310.53,976,6.18,2,1279050607510.0,RUB,1.0
RTSI,RUCBICP1Y,2020-09-14,CBI CP 1Y,"Индекс корпоративных облигаций (≤ 1 года, рейтинг ≥ B-)",92.37,92.37,92.37,92.37,158682924.78,167,5.6,2,190753726640.14,RUB,
RTSI,RUCBICP3+,2020-09-14,CBI CP 3+,"Индекс корпоративных облигаций (< 1 года, рейтинг > B-)",125.62,125.62,125.62,125.62,74524723.3,1510,6.33,2,478941685936.16,RUB,
RTSI,RUCBICPB,2020-09-14,CBI CP B,"Индекс корпоративных облигаций (> 1 года, B- ≤ рейтинг < BB-)",78.07,78.07,78.07,78.07,36598684.73,830,7.28,2,56922739840.82,RUB,
RTSI,RUCBICPB3Y,2020-09-14,CBI CP B 3Y,"Индекс корпоративных облигаций (1-3 года, B- ≤ рейтинг < BB-)",79.38,79.38,79.38,79.38,29576230.03,768,7.26,2,45395487878.16,RUB,
RTSI,RUCBICPBB,2020-09-14,CBI CP BB,"Индекс корпоративных облигаций (> 1 года, BB- ≤ рейтинг < BBB-)",94.14,94.14,94.14,94.14,107848667.6,898,6.29,2,553360813973.5,RUB,
RTSI,RUCBICPBB3+,2020-09-14,CBI CP BB 3+,"Индекс корпоративных облигаций (> 3 лет, BB- ≤ рейтинг < BBB-)",120.09,120.09,120.09,120.09,50646079.8,1385,6.62,2,155092233973.5,RUB,
RTSI,RUCBICPBB3Y,2020-09-14,CBI CP BBB 3Y,"Индекс корпоративных облигаций (1-3 года, BB- ≤ рейтинг < BBB-)",92.6,92.6,92.6,92.6,57202587.8,709,6.16,2,398268580000.0,RUB,
RTSI,RUCBICPBB5Y,2020-09-14,CBI CP BB 5Y,"Индекс корпоративных облигаций (3-5 лет, BB- ≤ рейтинг < BBB-)",120.25,120.25,120.25,120.25,48942057.1,1326,6.64,2,139782933973.5,RUB,
RTSI,RUCBICPBBB,2020-09-14,CBI CP BBB,"Индекс корпоративных облигаций (> 1 года, рейтинг ≥ BBB-)",100.27,100.27,100.27,100.27,790840452.9,1051,5.76,2,690921816679.36,RUB,
RTSI,RUCBICPBBB3+,2020-09-14,CBI CP BBB 3+,"Индекс корпоративных облигаций (3-5 лет, рейтинг ≥ BBB-)",129.96,129.96,129.96,129.96,16856188.8,1588,6.14,2,312322200000.0,RUB,
RTSI,RUCBICPBBB3Y,2020-09-14,CBI CP BBB 3Y,"Индекс корпоративных облигаций (1-3 года, рейтинг ≥ BBB-)",96.02,96.02,96.02,96.02,773984264.1,606,5.44,2,378599616679.36,RUB,
RTSI,RUCBICPBBB5Y,2020-09-14,CBI CP BBB 5Y,"Индекс корпоративных облигаций (3-5 лет, рейтинг ≥ BBB-)",128.79,128.79,128.79,128.79,8487699.7,1350,6.01,2,225158450000.0,RUB,
RTSI,RUCBICPL1,2020-09-14,CBI CP L1,Индекс корпоративных облигаций Котировальный лист 1 - ценовой,93.87,93.87,93.87,93.87,159023412.9,964,5.95,2,712490238003.4,RUB,
RTSI,RUCBICPL2,2020-09-14,CBI CP L2,Индекс корпоративных облигаций Котировальный лист 2 - ценовой,105.33,105.33,105.33,105.33,709571206.73,957,6.14,2,422255442490.28,RUB,
RTSI,RUCBICPL3,2020-09-14,CBI CP L3,Индекс корпоративных облигаций Котировальный лист 3 - ценовой,103.03,103.03,103.03,103.03,66693185.6,1079,6.24,2,166459690000.0,RUB,
SNDX,RUCBITR,2020-09-14,Индекс Мосбиржи корп обл CBITR,Индекс Мосбиржи корпоративных облигаций,448.63,448.68,448.93,448.43,3066024310.53,976,6.18,2,1300756635650.0,RUB,1.0
RTSI,RUCBITR1Y,2020-09-14,CBI TR 1Y,"Индекс корпоративных облигаций (≤ 1 года, рейтинг ≥ B-)— совокупный доход",232.24,232.24,232.24,232.24,158682924.78,167,5.6,2,190753726640.14,RUB,
RTSI,RUCBITR3+,2020-09-14,CBI TR 3+,"Индекс корпоративных облигаций (> 3 лет, рейтинг ≥ B-) — совокупный доход",576.89,576.89,576.89,576.89,74524723.3,1510,6.33,2,478941685936.16,RUB,
RTSI,RUCBITRB,2020-09-14,CBI TR B,"Индекс корпоративных облигаций (> 1 года, B- ≤ рейтинг < BB-) — совокупный доход",444.71,444.71,444.71,444.71,36598684.73,830,7.28,2,56922739840.82,RUB,
RTSI,RUCBITRB3Y,2020-09-14,CBI TR B 3Y,"Индекс корпоративных облигаций (1-3 года, B- ≤ рейтинг < BB-) — совокупный доход",447.63,447.63,447.63,447.63,29576230.03,768,7.26,2,45395487878.16,RUB,
