BOARDID,SECID,TRADEDATE,SHORTNAME,NAME,CLOSE,OPEN,HIGH,LOW,VALUE,DURATION,YIELD,DECIMALS,CAPITALIZATION,CURRENCYID,DIVISOR
INAV,AKEUA,2020-07-09,iNAV Альфа-Капитал ЕВРОПА 600,Расчетная цена одного пая Биржевого ПИФа «ЕВРОПА 600»,9.87,9.93,9.99,9.85,,,,2,,EUR,
INAV,AKMBA,2020-07-09,iNAV Альфа Управляемые облигации,Расчетная цена одного пая Биржевого ПИФа РФИ «Альфа-Капитал Управляемые облигации»,1.0121,1.012,1.0124,1.0108,,,,2,,RUB,
INAV,AKNXA,2020-07-09,iNAV Технологии 100,Расчетная цена одного пая Биржевого ПИФа «ТЕХНОЛОГИИ 100»,15.43,15.51,15.65,15.38,,,,2,,USD,
INAV,AKSPA,2020-07-09,iNAV Альфа - Капитал Эс энд Пи 500,Расчетная цена одного пая Биржевого ПИФа «Альфа - Капитал Эс энд Пи 500»,10.75,10.92,10.95,10.74,,,,2,,USD,
RTSI,BPSI,2020-07-09,Субиндекс облигаций,Индексы активов пенсионных накоплений - Субиндекс облигаций,2940.013,2940.013,2940.013,2940.013,147393249.8,,,2,413087512505.0,RUB,0.001
RTSI,EPSI,2020-07-09,Субиндекс акций,Индексы активов пенсионных накоплений - Субиндекс акций,1657.9545,1657.9545,1657.9545,1657.9545,57168266344.6,,,2,6496994732108.067,RUB,3918680996.809
INAV,ESGRA,2020-07-09,iNAV RSHB-MOEX-RSPP ESG VecTR ,Расчетная цена одного пая Биржевого ПИФа «РСХБ–Индекс МосБиржи–РСПП Вектор развития полн дох-ти»,1004.3,1014.07,1014.67,1001.87,,,,2,,RUB,
RTSI,GPBCBI2Y,2020-07-09,Индикатор GPBCBI2Y,Индикатор GPBCBI2Y,1155.81,1155.81,1155.81,1155.81,,,,2,,RUB,
RTSI,GPBCBI4Y,2020-07-09,Индикатор GPBCBI4Y,Индикатор GPBCBI4Y,1196.71,1196.71,1196.71,1196.71,,,,2,,RUB,
INAV,GPBMA,2020-07-09,iNAV ГПБ - Корп. облигации 4г,Расчетная цена одного пая Биржевого ПИФа «Газпромбанк – Корпоративные облигации 4 года»,56898.3,56909.51,56973.97,56830.08,,,,2,,RUB,
INAV,GPBSA,2020-07-09,iNAV ГПБ - Корп. облигации 2г,Расчетная цена одного пая Биржевого ПИФа «Газпромбанк – Корпоративные облигации 2 года»,55360.71,55375.63,55401.84,55346.9,,,,2,,RUB,
SNDX,IMOEX,2020-07-09,Индекс МосБиржи,Индекс МосБиржи,2782.43,2805.85,2810.74,2773.48,64509467616.0,0,0.0,2,11847159055700.0,RUB,4257839328.87
SNDX,IMOEX2,2020-07-09,Индекс МосБиржи (доп. сессия),Индекс МосБиржи (Дополнительная сессия),2786.67,2781.98,2788.41,2781.13,2692092277.65,0,0.0,2,11865189636200.0,RUB,4257839328.87
RTSI,MCFTR,2020-07-09,MOEX Russia Total Return,Индекс МосБиржи полной доходности «брутто»,4854.13,4854.13,4854.13,4854.13,64509467616.0,,,2,11847159055738.62,RUB,
RTSI,MCFTRN,2020-07-09,MOEX Russia Net-TR-NR,Индекс МосБиржи полной доходности «нетто» (по налоговым ставкам иностранных организаций),4466.21,4466.21,4466.21,4466.21,64509467616.0,,,2,11847159055738.62,RUB,
RTSI,MCFTRR,2020-07-09,MOEX Russia Net-TR-Res,Индекс МосБиржи полной доходности «нетто» (по налоговым ставкам российских организаций),4561.44,4561.44,4561.44,4561.44,64509467616.0,,,2,11847159055738.62,RUB,
RTSI,MCXSM,2020-07-09,Индекс МосБиржи SMID,Индекс МосБиржи средней и малой капитализации,1647.66,1647.66,1647.66,1647.66,4447237013.71,,,2,453057585828.687,RUB,274969708.379
RTSI,MEBCTR,2020-07-09,MOEX Blue Chip Total Return,Индекс МосБиржи голубых фишек полной доходности «брутто»,29898.15,29898.15,29898.15,29898.15,52151355689.1,,,2,9745018589481.7,RUB,
RTSI,MEBCTRN,2020-07-09,MOEX Blue Chip Net-TR-NR,Индекс МосБиржи голубых фишек полной доходности «нетто» (по налоговым ставкам иностр. орг.),27814.39,27814.39,27814.39,27814.39,52151355689.1,,,2,9745018589481.7,RUB,
RTSI,MEBCTRR,2020-07-09,MOEX Blue Chip Net-TR-Res,Индекс МосБиржи голубых фишек полной доходности «нетто» (по налоговым ставкам росс. орг.),28281.13,28281.13,28281.13,28281.13,52151355689.1,,,2,9745018589481.7,RUB,
SNDX,MECHTR,2020-07-09,MOEX Chemicals Total Return,Индекс МосБиржи химии и нефтехимии полной доходности «брутто»,25524.45,25524.45,25524.45,25524.45,,,,2,,RUB,
SNDX,MECHTRN,2020-07-09,MOEX Chemicals Net TR-NR,Индекс МосБиржи химии и нефтехимии полной доходности «нетто» (по налог.ставкам ин.орг-й),23977.62,23977.62,23977.62,23977.62,,,,2,,RUB,
SNDX,MECHTRR,2020-07-09,MOEX Chemicals Net TR-Res,Индекс МосБиржи химии и нефтехимии полной доходности «нетто» (по налог.ставкам рос.орг-й),24217.8,24217.8,24217.8,24217.8,,,,2,,RUB,
SNDX,MECNTR,2020-07-09,MOEX Consumer Total Return,Индекс МосБиржи потребительского сектора полной доходности «брутто»,8478.44,8478.44,8478.44,8478.44,,,,2,,RUB,
SNDX,MECNTRN,2020-07-09,MOEX Consumer Net TR-NR,Индекс МосБиржи потребит. сектора полной доходности «нетто» (по налог.ставкам ин.орг-й),8212.69,8212.69,8212.69,8212.69,,,,2,,RUB,
SNDX,MECNTRR,2020-07-09,MOEX Consumer Net TR-Res,Индекс МосБиржи потреб. сектора полной доходности «нетто» (по налог.ставкам рос.орг-й),8157.33,8157.33,8157.33,8157.33,,,,2,,RUB,
SNDX,MEEUTR,2020-07-09,MOEX El.Utilities Total Return,Индекс МосБиржи электроэнергетики полной доходности «брутто»,3079.89,3079.89,3079.89,3079.89,,,,2,,RUB,
SNDX,MEEUTRN,2020-07-09,MOEX El. Utilities Net TR-NR,Индекс МосБиржи электроэнергетики полной доходности «нетто» (по налог.ставкам ин.орг-й),2919.59,2919.59,2919.59,2919.59,,,,2,,RUB,
SNDX,MEEUTRR,2020-07-09,MOEX El. Utilities Net TR-Res,Индекс МосБиржи электроэнергетики полной доходности «нетто» (по налог.ставкам рос.орг-й),2945.42,2945.42,2945.42,2945.42,,,,2,,RUB,
SNDX,MEFNTR,2020-07-09,MOEX Financials Total Return,Индекс МосБиржи финансов полной доходности «брутто»,8839.63,8839.63,8839.63,8839.63,,,,2,,RUB,
SNDX,MEFNTRN,2020-07-09,MOEX Financials Net TR-NR,Индекс МосБиржи финансов полной доходности «нетто» (по налог.ставкам ин.орг-й),8490.77,8490.77,8490.77,8490.77,,,,2,,RUB,
SNDX,MEFNTRR,2020-07-09,MOEX Financials Net TR-Res,Индекс МосБиржи финансов полной доходности «нетто» (по налог.ставкам рос.орг-й),8548.47,8548.47,8548.47,8548.47,,,,2,,RUB,
SNDX,MEMMTR,2020-07-09,MOEX Metals & Min Total Return,Индекс МосБиржи металлов и добычи полной доходности «брутто»,12297.08,12297.08,12297.08,12297.08,,,,2,,RUB,
SNDX,MEMMTRN,2020-07-09,MOEX Metals & Mining Net TR-NR,Индекс МосБиржи металлов и добычи полной доходности «нетто» (по налог.ставкам ин.орг-й),11483.11,11483.11,11483.11,11483.11,,,,2,,RUB,
SNDX,MEMMTRR,2020-07-09,MOEX Metals & Min Net TR-Res,Индекс МосБиржи металлов и добычи полной доходности «нетто» (по налог.ставкам рос.орг-й),11615.93,11615.93,11615.93,11615.93,,,,2,,RUB,
SNDX,MEOGTR,2020-07-09,MOEX Oil & Gas Total Return,Индекс МосБиржи нефти и газа полной доходности «брутто»,9758.83,9758.83,9758.83,9758.83,,,,2,,RUB,
SNDX,MEOGTRN,2020-07-09,MOEX Oil & Gas Net TR-NR,Индекс МосБиржи нефти и газа полной доходности «нетто» (по налог.ставкам ин.орг-й),9276.04,9276.04,9276.04,9276.04,,,,2,,RUB,
SNDX,MEOGTRR,2020-07-09,MOEX Oil & Gas Net TR-Res,Индекс МосБиржи нефти и газа полной доходности «нетто» (по налог.ставкам рос.орг-й),9356.04,9356.04,9356.04,9356.04,,,,2,,RUB,
SNDX,MESMTR,2020-07-09,MOEX SMID Total Return,Индекс МосБиржи средней и малой капитализации полной доходности «брутто»,2270.06,2270.06,2270.06,2270.06,,,,2,,RUB,
SNDX,MESMTRN,2020-07-09,MOEX SMID Net TR-NR,Индекс МосБиржи средней капитализации полной доходности «нетто» (по нал.ставкам ин.орг-й),2163.65,2163.65,2163.65,2163.65,,,,2,,RUB,
SNDX,MESMTRR,2020-07-09,MOEX SMID Net TR-Res,Индекс МосБиржи средней капитализации полной доходности «нетто» (по нал.ставкам рос.орг-й),2182.12,2182.12,2182.12,2182.12,,,,2,,RUB,
SNDX,METLTR,2020-07-09,MOEX Telecom Total Return,Индекс МосБиржи телекоммуникаций полной доходности «брутто»,4023.12,4023.12,4023.12,4023.12,,,,2,,RUB,
SNDX,METLTRN,2020-07-09,MOEX Telecom Net TR-NR,Индекс МосБиржи телекоммуникаций полной доходности «нетто» (по налог.ставкам ин.орг-й),3672.73,3672.73,3672.73,3672.73,,,,2,,RUB,
SNDX,METLTRR,2020-07-09,MOEX Telecom Net TR-Res,Индекс МосБиржи телекоммуникаций полной доходности «нетто» (по налог.ставкам рос.орг-й),3728.96,3728.96,3728.96,3728.96,,,,2,,RUB,
SNDX,METNTR,2020-07-09,MOEX Transport Total Return,Индекс МосБиржи транспорта полной доходности «брутто»,1934.42,1934.42,1934.42,1934.42,,,,2,,RUB,
SNDX,METNTRN,2020-07-09,MOEX Transport Net TR-NR,Индекс МосБиржи транспорта полной доходности «нетто» (по налог.ставкам ин.орг-й),1849.56,1849.56,1849.56,1849.56,,,,2,,RUB,
SNDX,METNTRR,2020-07-09,MOEX Transport Net TR-Res,Индекс МосБиржи транспорта полной доходности «нетто» (по налог.ставкам рос.орг-й),1862.58,1862.58,1862.58,1862.58,,,,2,,RUB,
SNDX,MOEX10,2020-07-09,Индекс МосБиржи 10,Индекс МосБиржи 10,4916.28,4960.66,4972.62,4899.83,39899859851.6,0,0.0,2,9067580825030.0,RUB,4928.35
RTSI,MOEXBC,2020-07-09,Индекс голубых фишек,Индекс МосБиржи голубых фишек,18447.03,18611.25,18644.19,18378.31,52151355689.1,0,0.0,2,9745018589480.0,RUB,528270321.54
SNDX,MOEXBMI,2020-07-09,Индекс широкого рынка,Индекс МосБиржи широкого рынка,1998.07,2016.3,2018.71,1992.1,66595899078.9,0,0.0,2,14515810470300.0,RUB,7264932269.15
SNDX,MOEXCH,2020-07-09,Индекс химии и нефтехимии,Индекс МосБиржи химии и нефтехимии,16784.61,16809.56,16907.7,16723.31,397823905.4,0,0.0,2,178013782320.0,RUB,10605772.4903
SNDX,MOEXCN,2020-07-09,Индекс потребительского сектора / Индекс потребит сектора,Индекс МосБиржи потребительского сектора,6538.45,6517.39,6569.18,6490.34,5633625162.22,0,0.0,2,169980142526.0,RUB,25997023.5935
SNDX,MOEXEU,2020-07-09,Индекс электроэнергетики,Индекс МосБиржи электроэнергетики,2156.02,2175.56,2178.52,2150.4,2813162128.6,0,0.0,2,276986882235.0,RUB,128471361.257
SNDX,MOEXFN,2020-07-09,Индекс финансов,Индекс МосБиржи финансов,6751.22,6743.42,6780.33,6739.15,13060298851.4,0,0.0,2,731478382832.0,RUB,108347612.073
SNDX,MOEXINN,2020-07-09,Индекс МосБиржи инноваций,Индекс МосБиржи инноваций,397.68,397.96,401.42,395.72,62611120.5,0,0.0,2,2883861869.61,RUB,7251762.984
SNDX,MOEXMM,2020-07-09,Индекс металлов и добычи,Индекс МосБиржи металлов и добычи,7780.54,7815.22,7857.01,7736.8,17620663110.3,0,0.0,2,1233089028740.0,RUB,158483724.864
SNDX,MOEXOG,2020-07-09,Индекс нефти и газа,Индекс МосБиржи нефти и газа,6946.06,7035.31,7045.38,6922.72,22932790913.0,0,0.0,2,1149141103260.0,RUB,165437748.083
SNDX,MOEXREPO,2020-07-09,MXREPO,MOEXREPO обл 12:30,4.39,4.39,4.39,4.39,332394145242.0,,,2,,RUB,
SNDX,MOEXREPO1W,2020-07-09,MOEXREPO1W,MOEXREPO 1 неделя 12:30,4.33,4.33,4.33,4.33,81650008216.0,,,2,,RUB,
SNDX,MOEXREPO1WE,2020-07-09,MOEXREPO1WE,MOEXREPO 1 неделя 19:00,4.5,4.5,4.5,4.5,,,,2,,RUB,
SNDX,MOEXREPOE,2020-07-09,MXREPOE,MOEXREPO обл 19:00,4.32,4.32,4.32,4.32,133150402500.0,,,2,,RUB,
SNDX,MOEXREPOEQ,2020-07-09,MXREPOEQ,MOEXREPO акц 12:30,4.32,4.32,4.32,4.32,34290567820.0,,,2,,RUB,
SNDX,MOEXREPOEQE,2020-07-09,MXREPOEQE,MOEXREPO акц 19:00,4.37,4.37,4.37,4.37,44053064063.0,,,2,,RUB,
SNDX,MOEXREPOUSD,2020-07-09,MOEXREPOUSD,MOEXREPO USD 12:30,0.49,0.49,0.49,0.49,1128228735.0,,,2,,USD,
SNDX,MOEXREPOUSDE,2020-07-09,MOEXREPOUSDE,MOEXREPO USD 19:00,0.44,0.44,0.44,0.44,326678014.0,,,2,,USD,
SNDX,MOEXTL,2020-07-09,Индекс телекоммуникаций,Индекс МосБиржи телекоммуникаций,2174.05,2205.51,2212.03,2174.05,1826067299.5,0,0.0,2,368560080615.0,RUB,169526680.988
SNDX,MOEXTN,2020-07-09,Индекс транспорта,Индекс МосБиржи транспорта,1429.64,1437.93,1442.93,1426.25,1098704309.1,0,0.0,2,65489858227.5,RUB,45808634.8417
SNDX,MRBC,2020-07-09,Индекс МосБиржи 15,Индекс МосБиржи 15,1387.04,1398.34,1400.92,1382.07,,,,2,,RUB,
RTSI,MRBCTR,2020-07-09,Индекс МосБиржи полн дох-ти 15,Индекс МосБиржи полной доходности 15,1623.8,1623.8,1623.8,1623.8,,,,2,,RUB,
RTSI,MRRT,2020-07-09,"Индекс ""Ответственность и открытость""",Индекс МосБиржи - РСПП Ответственность и открытость,2155.7,2155.7,2155.7,2155.7,,,,2,,RUB,
RTSI,MRSV,2020-07-09,"Индекс ""Вектор устойчивого развития""",Индекс МосБиржи - РСПП Вектор устойчивого развития,2317.64,2317.64,2317.64,2317.64,,,,2,,RUB,
RTSI,MRSVT,2020-07-09,Индекс МосБиржи-РСПП Вектор TR,"Индекс МосБиржи - РСПП Вектор устойчивого развития, полной доходности брутто",2819.8,2819.8,2819.8,2819.8,,,,2,,RUB,
INAV,MTEKA,2020-07-09,iNAV Фридом - Лидеры Технологий,Расчетная цена одного пая Биржевого ПИФа «Фридом - Лидеры Технологий»,1544.58,1551.61,1559.76,1540.5,,,,2,,RUB,
RTSI,OPSI,2020-07-09,Субиндекс ОФЗ,Индексы активов пенсионных накоплений - Субиндекс ОФЗ,2059.3949,2059.3949,2059.3949,2059.3949,1887462060.03,,,2,4853331499610.27,RUB,
INAV,RFBC15,2020-07-09,iNAV «Raiffeisen-MOEX Index 15»,Расчетная цена одного пая Биржевого ПИФа «Райффайзен – Индекс МосБиржи полной доходности 15»,1016.73,1025.39,1026.78,1013.27,,,,2,,RUB,
SNDX,RGBI,2020-07-09,Индекс Мосбиржи гос обл RGBI,Индекс Мосбиржи государственных облигаций ценовой,155.7,155.21,155.71,155.21,28729319149.5,1818,5.47,2,8411767833970.0,RUB,1.0
SNDX,RGBITR,2020-07-09,Индекс Мосбиржи гос обл RGBITR,Индекс Мосбиржи государственных облигаций,611.81,609.9,611.83,609.9,28729319149.5,1818,5.47,2,8563701421940.0,RUB,1.0
SNDX,RPGCC,2020-07-09,MOEXREPOGCC,MOEXREPO КСУ 12:30,4.47,4.47,4.47,4.47,137103386000.0,,,2,,RUB,
SNDX,RPGCC1W,2020-07-09,MOEXREPOGCC1W,MOEXREPO КСУ 1 неделя 12:30,4.5,4.5,4.5,4.5,12598000000.0,,,2,,RUB,
SNDX,RPGCC1WE,2020-07-09,MOEXREPOGCC1WE,MOEXREPO КСУ 1 неделя 19:00,4.4,4.4,4.4,4.4,2650000000.0,,,2,,RUB,
SNDX,RPGCCE,2020-07-09,MOEXREPOGCCE,MOEXREPO КСУ 19:00,4.3,4.3,4.3,4.3,52681827000.0,,,2,,RUB,
RTSI,RTSCH,2020-07-09,Индекс РТС химии и нефтехимии,Индекс РТС химии и нефтехимии,246.5,246.51,249.9,245.67,5602569.66739,0,0.0,2,2506975080.34,USD,10170280.6297
RTSI,RTSCR,2020-07-09,Индекс РТС потреб. сектора,Индекс РТС потребительских товаров и розничной торговли,208.56,207.58,210.68,207.33,79338564.1809,0,0.0,2,2393837015.95,USD,11477900.3644
RTSI,RTSEU,2020-07-09,Индекс РТС электроэнергетики,Индекс РТС электроэнергетики,76.98,77.56,78.27,76.73,39617872.6245,0,0.0,2,3900817129.41,USD,50675795.1837
RTSI,RTSFN,2020-07-09,Индекс РТС финансов,Индекс РТС финансов,165.31,164.87,167.0,164.87,183928701.113,0,0.0,2,10301438763.2,USD,62317345.3938
RTSI,RTSI,2020-07-09,Индекс РТС,Индекс РТС,1234.42,1242.94,1252.25,1230.07,908489363.306,0,0.0,2,166844005776.0,USD,135160162.611
RTSI,RTSMM,2020-07-09,Индекс РТС металлов и добычи,Индекс РТС металлов и добычи,230.33,231.02,233.28,228.99,248152489.885,0,0.0,2,17365641168.9,USD,75393012.9342
RTSI,RTSOG,2020-07-09,Индекс РТС нефти и газа,Индекс РТС нефти и газа,189.92,192.07,193.09,189.28,322963394.139,0,0.0,2,16183399240.9,USD,85213458.6621
RTSI,RTSSM,2020-07-09,RTS SMID Index,Индекс РТС средней и малой капитализации,1090.17,1090.17,1090.17,1090.17,62630613.34,,,2,6380427755.821,USD,5852684.6488
RTSI,RTSTL,2020-07-09,Индекс РТС телекоммуникаций,Индекс РТС телекоммуникаций ,93.87,95.09,95.7,93.87,25716577.4201,0,0.0,2,5190446074.85,USD,55293012.6018
RTSI,RTSTN,2020-07-09,Индекс РТС транспорта,Индекс РТС транспорта,49.2,49.41,49.92,49.06,15473095.89,0,0.0,2,922296242.751,USD,18747461.487
RTSI,RTSTR,2020-07-09,RTS Total Return,Индекс РТС полной доходности «брутто»,2152.12,2152.12,2152.12,2152.12,908489363.31,,,2,166844005776.0,USD,
RTSI,RTSTRN,2020-07-09,RTS Net-TR-NR,Индекс РТС полной доходности «нетто» (по налоговым ставкам иностранных организаций),1980.33,1980.33,1980.33,1980.33,908489363.31,,,2,166844005776.0,USD,
RTSI,RTSTRR,2020-07-09,RTS Net-TR-Res,Индекс РТС полной доходности «нетто» (по налоговым ставкам российских организаций),2022.46,2022.46,2022.46,2022.46,908489363.31,,,2,166844005776.0,USD,
RTSI,RTSUSDCUR,2020-07-09,RTSUSDCUR,Курс доллара США на момент закрытия Индекса РТС,71.0074,71.0074,71.0074,71.0074,0.0,,,2,0.0,USD,
RTSI,RUABICP,2020-07-09,ABI CP,Композитный индекс облигаций ,117.55,117.55,117.55,117.55,8144094254.92,1694,5.32,2,10185755667030.19,RUB,
RTSI,RUABITR,2020-07-09,ABI TR,Композитный индекс облигаций — совокупный доход,221.72,221.72,221.72,221.72,8144094254.92,1694,5.32,2,10185755667030.19,RUB,
RTSI,RUBMI,2020-07-09,Индекс РТС широкого рынка,Индекс РТС широкого рынка,903.31,910.23,916.21,900.41,937872659.453,0,0.0,2,204426728345.0,USD,226307765.894
SNDX,RUCBCP3Y,2020-07-09,Индекс Мосбиржи корп обл CBICP 3-5,Индекс Мосбиржи корпоративных облигаций MOEX 1 - 3 ценовой,93.28,93.38,93.38,93.25,503594026.98,657,5.91,2,637548624019.0,RUB,1.0
SNDX,RUCBCP5Y,2020-07-09,Индекс Мосбиржи корп обл CBICP 1-3,Индекс Мосбиржи корпоративных облигаций ценовой 3-5,123.88,123.92,124.02,123.77,710816963.0,1352,6.29,2,505665894550.0,RUB,1.0
SNDX,RUCBICP,2020-07-09,Индекс Мосбиржи корп обл CBICP,Индекс Мосбиржи корпоративных облигаций ценовой,97.53,97.57,97.6,97.48,1303239409.58,1066,6.18,2,1245037518570.0,RUB,1.0
RTSI,RUCBICP1Y,2020-07-09,CBI CP 1Y,"Индекс корпоративных облигаций (≤ 1 года, рейтинг ≥ B-)",92.78,92.78,92.78,92.78,122743660.22,162,5.67,2,204531116295.58,RUB,
RTSI,RUCBICP3+,2020-07-09,CBI CP 3+,"Индекс корпоративных облигаций (< 1 года, рейтинг > B-)",126.32,126.32,126.32,126.32,470460767.6,1495,6.3,2,616177392501.44,RUB,
RTSI,RUCBICPB,2020-07-09,CBI CP B,"Индекс корпоративных облигаций (> 1 года, B- ≤ рейтинг < BB-)",77.86,77.86,77.86,77.86,23907080.88,869,7.29,2,54518578749.97,RUB,
RTSI,RUCBICPB3Y,2020-07-09,CBI CP B 3Y,"Индекс корпоративных облигаций (1-3 года, B- ≤ рейтинг < BB-)",79.13,79.13,79.13,79.13,14962004.38,739,7.19,2,35790835612.53,RUB,
RTSI,RUCBICPBB,2020-07-09,CBI CP BB,"Индекс корпоративных облигаций (> 1 года, BB- ≤ рейтинг < BBB-)",94.29,94.29,94.29,94.29,168588676.9,995,6.38,2,475603720364.0,RUB,
RTSI,RUCBICPBB3+,2020-07-09,CBI CP BB 3+,"Индекс корпоративных облигаций (> 3 лет, BB- ≤ рейтинг < BBB-)",120.51,120.51,120.51,120.51,98045685.2,1375,6.61,2,207100684364.0,RUB,
RTSI,RUCBICPBB3Y,2020-07-09,CBI CP BBB 3Y,"Индекс корпоративных облигаций (1-3 года, BB- ≤ рейтинг < BBB-)",92.66,92.66,92.66,92.66,70542991.7,702,6.2,2,268503036000.0,RUB,
RTSI,RUCBICPBB5Y,2020-07-09,CBI CP BB 5Y,"Индекс корпоративных облигаций (3-5 лет, BB- ≤ рейтинг < BBB-)",120.65,120.65,120.65,120.65,94569044.6,1327,6.63,2,191661784364.0,RUB,
RTSI,RUCBICPBBB,2020-07-09,CBI CP BBB,"Индекс корпоративных облигаций (> 1 года, рейтинг ≥ BBB-)",100.78,100.78,100.78,100.78,421085810.8,1125,5.81,2,735719946973.44,RUB,
RTSI,RUCBICPBBB3+,2020-07-09,CBI CP BBB 3+,"Индекс корпоративных облигаций (3-5 лет, рейтинг ≥ BBB-)",130.89,130.89,130.89,130.89,363470005.9,1578,6.08,2,390348965000.0,RUB,
RTSI,RUCBICPBBB3Y,2020-07-09,CBI CP BBB 3Y,"Индекс корпоративных облигаций (1-3 года, рейтинг ≥ BBB-)",96.26,96.26,96.26,96.26,57615804.9,613,5.5,2,345370981973.44,RUB,
RTSI,RUCBICPBBB5Y,2020-07-09,CBI CP BBB 5Y,"Индекс корпоративных облигаций (3-5 лет, рейтинг ≥ BBB-)",129.52,129.52,129.52,129.52,278118226.9,1381,6.03,2,302560515000.0,RUB,
RTSI,RUCBICPL1,2020-07-09,CBI CP L1,Индекс корпоративных облигаций Котировальный лист 1 - ценовой,94.08,94.08,94.08,94.08,187916213.68,950,6.03,2,558595208749.97,RUB,
RTSI,RUCBICPL2,2020-07-09,CBI CP L2,Индекс корпоративных облигаций Котировальный лист 2 - ценовой,105.77,105.77,105.77,105.77,323755478.6,1159,6.05,2,469642126920.16,RUB,
RTSI,RUCBICPL3,2020-07-09,CBI CP L3,Индекс корпоративных облигаций Котировальный лист 3 - ценовой,103.53,103.53,103.53,103.53,101909876.3,1149,6.3,2,237604910417.28,RUB,
SNDX,RUCBITR,2020-07-09,Индекс Мосбиржи корп обл CBITR,Индекс Мосбиржи корпоративных облигаций,444.47,444.66,444.8,444.26,1303239409.58,1066,6.18,2,1265962627340.0,RUB,1.0
RTSI,RUCBITR1Y,2020-07-09,CBI TR 1Y,"Индекс корпоративных облигаций (≤ 1 года, рейтинг ≥ B-)— совокупный доход",229.94,229.94,229.94,229.94,122743660.22,162,5.67,2,204531116295.58,RUB,
RTSI,RUCBITR3+,2020-07-09,CBI TR 3+,"Индекс корпоративных облигаций (> 3 лет, рейтинг ≥ B-) — совокупный доход",572.79,572.79,572.79,572.79,470460767.6,1495,6.3,2,616177392501.44,RUB,
RTSI,RUCBITRB,2020-07-09,CBI TR B,"Индекс корпоративных облигаций (> 1 года, B- ≤ рейтинг < BB-) — совокупный доход",436.71,436.71,436.71,436.71,23907080.88,869,7.29,2,54518578749.97,RUB,
RTSI,RUCBITRB3Y,2020-07-09,CBI TR B 3Y,"Индекс корпоративных облигаций (1-3 года, B- ≤ рейтинг < BB-) — совокупный доход",439.3,439.3,439.3,439.3,14962004.38,739,7.19,2,35790835612.53,RUB,
