BOARDID,SECID,TRADEDATE,SHORTNAME,NAME,CLOSE,OPEN,HIGH,LOW,VALUE,DURATION,YIELD,DECIMALS,CAPITALIZATION,CURRENCYID,DIVISOR
INAV,AKCHA,2021-02-18,iNAV Альфа Китайские акции,Расчетная цена одного пая Биржевого ПИФа РФИ «Альфа-Капитал Китайские акции»,120.07,123.26,123.42,119.99,0.0,0,0.0,2,0.0,RUB,0.0
INAV,AKEUA,2021-02-18,iNAV Альфа-Капитал ЕВРОПА 600,Расчетная цена одного пая Биржевого ПИФа «ЕВРОПА 600»,11.16,11.22,11.27,11.13,0.0,0,0.0,2,0.0,EUR,0.0
INAV,AKMBA,2021-02-18,iNAV Альфа Управляемые облигации,Расчетная цена одного пая Биржевого ПИФа РФИ «Альфа-Капитал Управляемые облигации»,1.0649,1.066,1.0665,1.0649,0.0,0,0.0,4,0.0,RUB,0.0
INAV,AKMEI,2021-02-18,iNAV Альфа Управляемые акции,Расчетная цена одного пая Биржевого ПИФа РФИ «Альфа-Капитал Управляемые Российские Акции»,105.89,107.87,107.97,105.75,0.0,0,0.0,2,0.0,RUB,0.0
INAV,AKNXA,2021-02-18,iNAV Технологии 100,Расчетная цена одного пая Биржевого ПИФа «ТЕХНОЛОГИИ 100»,19.73,20.03,20.03,19.72,0.0,0,0.0,2,0.0,USD,0.0
INAV,AKSPA,2021-02-18,iNAV Альфа - Капитал Эс энд Пи 500,Расчетная цена одного пая Биржевого ПИФа «Альфа - Капитал Эс энд Пи 500»,13.37,13.51,13.51,13.36,0.0,0,0.0,2,0.0,USD,0.0
RTSI,BPSI,2021-02-18,Субиндекс облигаций,Субиндекс облигаций активов пенсионных накоплений,3027.23,3027.23,3027.23,3027.23,2193078932.0,957,6.21,2,1994024819581.7,RUB,1000000000000.0
RTSI,BPSIG,2021-02-18,Субиндекс облигаций ОФЗ,Субиндекс облигаций ОФЗ активов пенсионных накоплений,2043.09,2043.09,2043.09,2043.09,17564389613.0,1759,6.01,2,8782457219680.75,RUB,1000000000000.0
INAV,DIVDA,2021-02-18,iNAV ДОХОДЪ Дивидендные акции РФ,Расчетная цена одного пая Биржевого ПИФа РФИ «ДОХОДЪ Индекс дивидендных акций РФ»,970.85,985.79,986.0,970.17,0.0,0,0.0,2,0.0,RUB,0.0
RTSI,EPSI,2021-02-18,Субиндекс акций,Субиндекс акций активов пенсионных накоплений,2019.53,2019.53,2019.53,2019.53,90065627835.0,0,0.0,2,48828591001570.9,RUB,7568983455.3956
RTSI,EPSITR,2021-02-18,Субиндекс акций полной доходности,Субиндекс акций полной дох-ти,2033.04,2033.04,2033.04,2033.04,90065627835.0,0,0.0,2,0.0,RUB,0.0
INAV,ESGRA,2021-02-18,iNAV RSHB-MOEX-RSPP ESG VecTR ,Расчетная цена одного пая Биржевого ПИФа «РСХБ–Индекс МосБиржи–РСПП Вектор развития полн дох-ти»,1318.95,1338.28,1338.55,1318.65,0.0,0,0.0,2,0.0,RUB,0.0
INAV,FMUSA,2021-02-18,iNAV Дивидендные аристократы США,Расчетная цена одного пая Биржевого ПИФа РФИ «Дивидендные Аристократы США»,9.76,9.74,9.81,9.73,0.0,0,0.0,2,0.0,RUB,0.0
INAV,GPBMA,2021-02-18,iNAV ГПБ - Корп. облигации 4г,Расчетная цена одного пая Биржевого ПИФа «Газпромбанк – Корпоративные облигации 4 года»,58332.32,58383.39,58424.38,58257.78,0.0,0,0.0,2,0.0,RUB,0.0
INAV,GPBSA,2021-02-18,iNAV ГПБ - Корп. облигации 2г,Расчетная цена одного пая Биржевого ПИФа «Газпромбанк – Корпоративные облигации 2 года»,57014.91,57035.61,57039.76,56970.59,0.0,0,0.0,2,0.0,RUB,0.0
SNDX,IMOEX,2021-02-18,Индекс МосБиржи,Индекс МосБиржи,3400.17,3451.69,3461.15,3395.98,89976816783.6,0,0.0,2,17270245871655.635,RUB,5079230865.8227
SNDX,IMOEX2,2021-02-18,Индекс МосБиржи (доп. сессия),Индекс МосБиржи (Дополнительная сессия),3400.17,3404.82,3414.95,3400.17,7674069969.45,0,0.0,2,17270245871655.635,RUB,5079230865.8227
RTSI,MCFTR,2021-02-18,MOEX Russia Total Return,Индекс МосБиржи полной доходности «брутто»,6161.81,6161.81,6161.81,6161.81,90065627835.0,0,0.0,2,0.0,RUB,0.0
RTSI,MCFTRN,2021-02-18,MOEX Russia Net-TR-NR,Индекс МосБиржи полной доходности «нетто» (по налоговым ставкам иностранных организаций),5637.3,5637.3,5637.3,5637.3,90065627835.0,0,0.0,2,0.0,RUB,0.0
RTSI,MCFTRR,2021-02-18,MOEX Russia Net-TR-Res,Индекс МосБиржи полной доходности «нетто» (по налоговым ставкам российских организаций),5761.12,5761.12,5761.12,5761.12,90065627835.0,0,0.0,2,0.0,RUB,0.0
RTSI,MCXSM,2021-02-18,Индекс МосБиржи SMID,Индекс МосБиржи средней и малой капитализации,2037.18,2037.18,2037.18,2037.18,5801676860.0,0,0.0,2,4869039490326.956,RUB,414265307.9884
RTSI,MEBCTR,2021-02-18,MOEX Blue Chip Total Return,Индекс МосБиржи голубых фишек полной доходности «брутто»,37352.78,37352.78,37352.78,37352.78,64575064278.0,0,0.0,2,0.0,RUB,0.0
RTSI,MEBCTRN,2021-02-18,MOEX Blue Chip Net-TR-NR,Индекс МосБиржи голубых фишек полной доходности «нетто» (по налоговым ставкам иностр. орг.),34544.94,34544.94,34544.94,34544.94,64575064278.0,0,0.0,2,0.0,RUB,0.0
RTSI,MEBCTRR,2021-02-18,MOEX Blue Chip Net-TR-Res,Индекс МосБиржи голубых фишек полной доходности «нетто» (по налоговым ставкам росс. орг.),35148.3,35148.3,35148.3,35148.3,64575064278.0,0,0.0,2,0.0,RUB,0.0
SNDX,MECHTR,2021-02-18,MOEX Chemicals Total Return,Индекс МосБиржи химии и нефтехимии полной доходности «брутто»,31387.27,31387.27,31387.27,31387.27,641467987.0,0,0.0,2,0.0,RUB,0.0
SNDX,MECHTRN,2021-02-18,MOEX Chemicals Net TR-NR,Индекс МосБиржи химии и нефтехимии полной доходности «нетто» (по налог.ставкам ин.орг-й),29368.37,29368.37,29368.37,29368.37,641467987.0,0,0.0,2,0.0,RUB,0.0
SNDX,MECHTRR,2021-02-18,MOEX Chemicals Net TR-Res,Индекс МосБиржи химии и нефтехимии полной доходности «нетто» (по налог.ставкам рос.орг-й),29678.28,29678.28,29678.28,29678.28,641467987.0,0,0.0,2,0.0,RUB,0.0
SNDX,MECNTR,2021-02-18,MOEX Consumer Total Return,Индекс МосБиржи потребительского сектора полной доходности «брутто»,12573.96,12573.96,12573.96,12573.96,8465186746.0,0,0.0,2,0.0,RUB,0.0
SNDX,MECNTRN,2021-02-18,MOEX Consumer Net TR-NR,Индекс МосБиржи потребит. сектора полной доходности «нетто» (по налог.ставкам ин.орг-й),12132.51,12132.51,12132.51,12132.51,8465186746.0,0,0.0,2,0.0,RUB,0.0
SNDX,MECNTRR,2021-02-18,MOEX Consumer Net TR-Res,Индекс МосБиржи потреб. сектора полной доходности «нетто» (по налог.ставкам рос.орг-й),12057.01,12057.01,12057.01,12057.01,8465186746.0,0,0.0,2,0.0,RUB,0.0
SNDX,MEEUTR,2021-02-18,MOEX El.Utilities Total Return,Индекс МосБиржи электроэнергетики полной доходности «брутто»,3310.48,3310.48,3310.48,3310.48,3230190555.0,0,0.0,2,0.0,RUB,0.0
SNDX,MEEUTRN,2021-02-18,MOEX El. Utilities Net TR-NR,Индекс МосБиржи электроэнергетики полной доходности «нетто» (по налог.ставкам ин.орг-й),3132.87,3132.87,3132.87,3132.87,3230190555.0,0,0.0,2,0.0,RUB,0.0
SNDX,MEEUTRR,2021-02-18,MOEX El. Utilities Net TR-Res,Индекс МосБиржи электроэнергетики полной доходности «нетто» (по налог.ставкам рос.орг-й),3161.32,3161.32,3161.32,3161.32,3230190555.0,0,0.0,2,0.0,RUB,0.0
SNDX,MEFNTR,2021-02-18,MOEX Financials Total Return,Индекс МосБиржи финансов полной доходности «брутто»,13488.98,13488.98,13488.98,13488.98,22885784515.0,0,0.0,2,0.0,RUB,0.0
SNDX,MEFNTRN,2021-02-18,MOEX Financials Net TR-NR,Индекс МосБиржи финансов полной доходности «нетто» (по налог.ставкам ин.орг-й),12898.26,12898.26,12898.26,12898.26,22885784515.0,0,0.0,2,0.0,RUB,0.0
SNDX,MEFNTRR,2021-02-18,MOEX Financials Net TR-Res,Индекс МосБиржи финансов полной доходности «нетто» (по налог.ставкам рос.орг-й),12993.77,12993.77,12993.77,12993.77,22885784515.0,0,0.0,2,0.0,RUB,0.0
SNDX,MEMMTR,2021-02-18,MOEX Metals & Min Total Return,Индекс МосБиржи металлов и добычи полной доходности «брутто»,16587.92,16587.92,16587.92,16587.92,19263333592.0,0,0.0,2,0.0,RUB,0.0
SNDX,MEMMTRN,2021-02-18,MOEX Metals & Mining Net TR-NR,Индекс МосБиржи металлов и добычи полной доходности «нетто» (по налог.ставкам ин.орг-й),15404.63,15404.63,15404.63,15404.63,19263333592.0,0,0.0,2,0.0,RUB,0.0
SNDX,MEMMTRR,2021-02-18,MOEX Metals & Min Net TR-Res,Индекс МосБиржи металлов и добычи полной доходности «нетто» (по налог.ставкам рос.орг-й),15594.29,15594.29,15594.29,15594.29,19263333592.0,0,0.0,2,0.0,RUB,0.0
SNDX,MEOGTR,2021-02-18,MOEX Oil & Gas Total Return,Индекс МосБиржи нефти и газа полной доходности «брутто»,11107.59,11107.59,11107.59,11107.59,27719027531.0,0,0.0,2,0.0,RUB,0.0
SNDX,MEOGTRN,2021-02-18,MOEX Oil & Gas Net TR-NR,Индекс МосБиржи нефти и газа полной доходности «нетто» (по налог.ставкам ин.орг-й),10515.91,10515.91,10515.91,10515.91,27719027531.0,0,0.0,2,0.0,RUB,0.0
SNDX,MEOGTRR,2021-02-18,MOEX Oil & Gas Net TR-Res,Индекс МосБиржи нефти и газа полной доходности «нетто» (по налог.ставкам рос.орг-й),10612.22,10612.22,10612.22,10612.22,27719027531.0,0,0.0,2,0.0,RUB,0.0
SNDX,MESMTR,2021-02-18,MOEX SMID Total Return,Индекс МосБиржи средней и малой капитализации полной доходности «брутто»,2869.41,2869.41,2869.41,2869.41,5801676860.0,0,0.0,2,0.0,RUB,0.0
SNDX,MESMTRN,2021-02-18,MOEX SMID Net TR-NR,Индекс МосБиржи средней капитализации полной доходности «нетто» (по нал.ставкам ин.орг-й),2725.89,2725.89,2725.89,2725.89,5801676860.0,0,0.0,2,0.0,RUB,0.0
SNDX,MESMTRR,2021-02-18,MOEX SMID Net TR-Res,Индекс МосБиржи средней капитализации полной доходности «нетто» (по нал.ставкам рос.орг-й),2750.42,2750.42,2750.42,2750.42,5801676860.0,0,0.0,2,0.0,RUB,0.0
SNDX,METLTR,2021-02-18,MOEX Telecom Total Return,Индекс МосБиржи телекоммуникаций полной доходности «брутто»,4397.99,4397.99,4397.99,4397.99,1280239244.0,0,0.0,2,0.0,RUB,0.0
SNDX,METLTRN,2021-02-18,MOEX Telecom Net TR-NR,Индекс МосБиржи телекоммуникаций полной доходности «нетто» (по налог.ставкам ин.орг-й),3996.64,3996.64,3996.64,3996.64,1280239244.0,0,0.0,2,0.0,RUB,0.0
SNDX,METLTRR,2021-02-18,MOEX Telecom Net TR-Res,Индекс МосБиржи телекоммуникаций полной доходности «нетто» (по налог.ставкам рос.орг-й),4060.32,4060.32,4060.32,4060.32,1280239244.0,0,0.0,2,0.0,RUB,0.0
SNDX,METNTR,2021-02-18,MOEX Transport Total Return,Индекс МосБиржи транспорта полной доходности «брутто»,1859.84,1859.84,1859.84,1859.84,1150949052.0,0,0.0,2,0.0,RUB,0.0
SNDX,METNTRN,2021-02-18,MOEX Transport Net TR-NR,Индекс МосБиржи транспорта полной доходности «нетто» (по налог.ставкам ин.орг-й),1768.09,1768.09,1768.09,1768.09,1150949052.0,0,0.0,2,0.0,RUB,0.0
SNDX,METNTRR,2021-02-18,MOEX Transport Net TR-Res,Индекс МосБиржи транспорта полной доходности «нетто» (по налог.ставкам рос.орг-й),1781.93,1781.93,1781.93,1781.93,1150949052.0,0,0.0,2,0.0,RUB,0.0
SNDX,MOEX10,2021-02-18,Индекс МосБиржи 10,Индекс МосБиржи 10,5385.05,5486.63,5492.6,5381.67,52857454266.3,0,0.0,2,12305355879997.773,RUB,5391.01
RTSI,MOEXBC,2021-02-18,Индекс голубых фишек,Индекс МосБиржи голубых фишек,22153.03,22528.77,22595.11,22121.46,64507942148.3,0,0.0,2,13648447484685.418,RUB,616098470.6265
SNDX,MOEXBMI,2021-02-18,Индекс широкого рынка,Индекс МосБиржи широкого рынка,2435.36,2475.76,2477.41,2432.55,94821062978.8,0,0.0,2,18898423615316.043,RUB,7760008376.088
SNDX,MOEXCH,2021-02-18,Индекс химии и нефтехимии,Индекс МосБиржи химии и нефтехимии,20097.17,20340.53,20374.71,20065.04,641394746.7,0,0.0,2,210498370995.15,RUB,10474029.9738
SNDX,MOEXCN,2021-02-18,Индекс потребительского сектора / Индекс потребит сектора,Индекс МосБиржи потребительского сектора,9448.04,9271.89,9487.36,9271.89,8457541977.64,0,0.0,2,182479301505.8929,RUB,19313982.7282
SNDX,MOEXEU,2021-02-18,Индекс электроэнергетики,Индекс МосБиржи электроэнергетики,2291.16,2314.29,2315.18,2291.16,3229474136.0,0,0.0,2,285340772115.5416,RUB,124539818.5684
SNDX,MOEXFN,2021-02-18,Индекс финансов,Индекс МосБиржи финансов,9994.23,10087.62,10155.43,9966.58,22868004272.85,0,0.0,2,1020428061790.7415,RUB,102101671.187
SNDX,MOEXINN,2021-02-18,Индекс МосБиржи инноваций,Индекс МосБиржи инноваций,408.37,401.04,416.96,399.27,496009555.5,0,0.0,2,11468813302.7693,RUB,28084330.4761
SNDX,MOEXMM,2021-02-18,Индекс металлов и добычи,Индекс МосБиржи металлов и добычи,10115.1,10291.01,10291.01,10115.01,19252901311.21,0,0.0,2,1795860375656.2263,RUB,177542507.7844
SNDX,MOEXOG,2021-02-18,Индекс нефти и газа,Индекс МосБиржи нефти и газа,7697.5,7854.33,7858.73,7683.85,27675559715.6,0,0.0,2,1252491958153.0908,RUB,162714074.6339
SNDX,MOEXREPO,2021-02-18,MXREPO,MOEXREPO обл 12:30,4.16,4.16,4.16,4.16,243125014900.0,,,2,,RUB,
SNDX,MOEXREPO1W,2021-02-18,MOEXREPO1W,MOEXREPO 1 неделя 12:30,4.17,4.17,4.17,4.17,76847826433.0,,,2,,RUB,
SNDX,MOEXREPO1WE,2021-02-18,MOEXREPO1WE,MOEXREPO 1 неделя 19:00,4.28,4.28,4.28,4.28,20698117374.0,,,2,,RUB,
SNDX,MOEXREPOE,2021-02-18,MXREPOE,MOEXREPO обл 19:00,4.05,4.05,4.05,4.05,178749400232.0,,,2,,RUB,
SNDX,MOEXREPOEQ,2021-02-18,MXREPOEQ,MOEXREPO акц 12:30,4.18,4.18,4.18,4.18,39734709947.0,,,2,,RUB,
SNDX,MOEXREPOEQE,2021-02-18,MXREPOEQE,MOEXREPO акц 19:00,4.18,4.18,4.18,4.18,25905588354.0,,,2,,RUB,
SNDX,MOEXREPOUSD,2021-02-18,MOEXREPOUSD,MOEXREPO USD 12:30,0.22,0.22,0.22,0.22,1253031348.0,,,2,,USD,
SNDX,MOEXREPOUSDE,2021-02-18,MOEXREPOUSDE,MOEXREPO USD 19:00,0.24,0.24,0.24,0.24,50338927.0,,,2,,USD,
SNDX,MOEXTL,2021-02-18,Индекс телекоммуникаций,Индекс МосБиржи телекоммуникаций,2304.93,2316.03,2320.84,2300.3,1278724275.3,0,0.0,2,410277530037.252,RUB,178000185.54
SNDX,MOEXTN,2021-02-18,Индекс транспорта,Индекс МосБиржи транспорта,1322.14,1331.91,1335.91,1322.14,1150465675.5,0,0.0,2,181180134888.168,RUB,137035373.9192
SNDX,MRBC,2021-02-18,Индекс МосБиржи 15,Индекс МосБиржи 15,1694.44,1723.09,1727.46,1692.22,64507942148.3,0,0.0,2,11034032448114.498,RUB,6511921170.5989
RTSI,MRBCTR,2021-02-18,Индекс МосБиржи полн дох-ти 15,Индекс МосБиржи полной доходности 15,2048.75,2048.75,2048.75,2048.75,64575064278.0,0,0.0,2,0.0,RUB,0.0
RTSI,MRRT,2021-02-18,"Индекс ""Ответственность и открытость""",Индекс МосБиржи - РСПП Ответственность и открытость,2641.93,2641.93,2641.93,2641.93,70079838183.0,0,0.0,2,41773871744978.41,RUB,4957833678.8508
RTSI,MRSV,2021-02-18,"Индекс ""Вектор устойчивого развития""",Индекс МосБиржи - РСПП Вектор устойчивого развития,2962.58,2962.58,2962.58,2962.58,65754710600.0,0,0.0,2,39824633771508.46,RUB,291060494.3854
RTSI,MRSVT,2021-02-18,Индекс МосБиржи-РСПП Вектор TR,"Индекс МосБиржи - РСПП Вектор устойчивого развития, полной доходности брутто",3715.26,3715.26,3715.26,3715.26,65754710600.0,0,0.0,2,0.0,RUB,0.0
INAV,MTEKA,2021-02-18,iNAV Фридом - Лидеры Технологий,Расчетная цена одного пая Биржевого ПИФа «Фридом - Лидеры Технологий»,1978.07,2007.93,2012.22,1977.17,0.0,0,0.0,2,0.0,RUB,0.0
INAV,OPNWO,2021-02-18,iNAV «Открытие – Всепогодный»,Биржевой паевой инвестиционный фонд рыночных финансовых инструментов «Открытие – Всепогодный»,1.1254,1.1335,1.1335,1.1249,0.0,0,0.0,4,0.0,USD,0.0
INAV,RCMBD,2021-02-18,iNAV «Райффайзен –Еврооблигации»,Биржевой паевой инвестиционный фонд рыночных финансовых инструментов «Райффайзен – Еврооблигации»,12.97,12.97,12.97,12.96,0.0,0,0.0,2,0.0,USD,0.0
INAV,RFBC15,2021-02-18,iNAV «Raiffeisen-MOEX Index 15»,Расчетная цена одного пая Биржевого ПИФа «Райффайзен – Индекс МосБиржи полной доходности 15»,1274.45,1298.21,1298.94,1272.94,0.0,0,0.0,2,0.0,RUB,0.0
SNDX,RGBI,2021-02-18,Индекс Мосбиржи гос обл RGBI,Индекс Мосбиржи государственных облигаций ценовой,148.84,148.56,148.91,148.56,17564285070.51,1758,6.36,2,8648935263032.898,RUB,1.0
SNDX,RGBITR,2021-02-18,Индекс Мосбиржи гос обл RGBITR,Индекс Мосбиржи государственных облигаций,608.57,607.45,608.87,607.44,17564285070.51,1758,6.36,2,8782457219680.758,RUB,1.0
SNDX,RPGCC,2021-02-18,MOEXREPOGCC,MOEXREPO КСУ 12:30,4.19,4.19,4.19,4.19,79188325000.0,,,2,,RUB,
SNDX,RPGCC1W,2021-02-18,MOEXREPOGCC1W,MOEXREPO КСУ 1 неделя 12:30,4.33,4.33,4.33,4.33,21811238000.0,,,2,,RUB,
SNDX,RPGCC1WE,2021-02-18,MOEXREPOGCC1WE,MOEXREPO КСУ 1 неделя 19:00,4.31,4.31,4.31,4.31,5371568000.0,,,2,,RUB,
SNDX,RPGCCE,2021-02-18,MOEXREPOGCCE,MOEXREPO КСУ 19:00,4.11,4.11,4.11,4.11,45444271000.0,,,2,,RUB,
RTSI,RTSCH,2021-02-18,Индекс РТС химии и нефтехимии,Индекс РТС химии и нефтехимии,283.06,287.72,288.51,282.42,8662872.476178257,0,0.0,2,2843055004.3578086,USD,10043947.695
RTSI,RTSCR,2021-02-18,Индекс РТС потреб. сектора,Индекс РТС потребительских товаров и розничной торговли,289.03,284.86,291.59,284.86,114230133.61300386,0,0.0,2,2464620932.149635,USD,8527282.6944
RTSI,RTSEU,2021-02-18,Индекс РТС электроэнергетики,Индекс РТС электроэнергетики,78.45,79.58,79.6,78.42,43618259.65869569,0,0.0,2,3853899231.025893,USD,49124990.0073
RTSI,RTSFN,2021-02-18,Индекс РТС финансов,Индекс РТС финансов,234.69,237.9,239.43,234.28,308862219.1242512,0,0.0,2,13782211681.477339,USD,58724922.3762
RTSI,RTSI,2021-02-18,Индекс РТС,Индекс РТС,1446.7,1475.0,1478.99,1443.69,1215254246.498153,0,0.0,2,233257192061.74585,USD,161234282.6352
RTSI,RTSMM,2021-02-18,Индекс РТС металлов и добычи,Индекс РТС металлов и добычи,287.18,293.43,293.43,286.95,260035539.28929827,0,0.0,2,24255436296.25032,USD,84459553.1639
RTSI,RTSOG,2021-02-18,Индекс РТС нефти и газа,Индекс РТС нефти и газа,201.84,206.84,206.87,201.33,373794524.7550294,0,0.0,2,16916537228.818275,USD,83810552.5083
RTSI,RTSSM,2021-02-18,RTS SMID Index,Индекс РТС средней и малой капитализации,1292.69,1292.69,1292.69,1292.69,1058343.3406776113,0,0.0,2,888211398.9512165,USD,8817568.3892
RTSI,RTSTL,2021-02-18,Индекс РТС телекоммуникаций,Индекс РТС телекоммуникаций ,95.45,96.32,96.73,95.28,17270838.880597517,0,0.0,2,5541333072.714591,USD,58056740.3599
RTSI,RTSTN,2021-02-18,Индекс РТС транспорта,Индекс РТС транспорта,43.63,44.14,44.31,43.6,15538539.232436739,0,0.0,2,2447073992.7763963,USD,56082557.4433
RTSI,RTSTR,2021-02-18,RTS Total Return,Индекс РТС полной доходности «брутто»,2620.11,2620.11,2620.11,2620.11,90065627835.0,0,0.0,2,0.0,USD,0.0
RTSI,RTSTRN,2021-02-18,RTS Net-TR-NR,Индекс РТС полной доходности «нетто» (по налоговым ставкам иностранных организаций),2397.19,2397.19,2397.19,2397.19,90065627835.0,0,0.0,2,0.0,USD,0.0
RTSI,RTSTRR,2021-02-18,RTS Net-TR-Res,Индекс РТС полной доходности «нетто» (по налоговым ставкам российских организаций),2449.78,2449.78,2449.78,2449.78,90065627835.0,0,0.0,2,0.0,USD,0.0
RTSI,RTSUSDCUR,2021-02-18,RTSUSDCUR,Курс доллара США на момент закрытия Индекса РТС,74.0395,74.0395,74.0395,74.0395,0.0,,,2,0.0,USD,
RTSI,RUABICP,2021-02-18,ABI CP,Композитный индекс облигаций ,112.93,112.93,112.93,112.93,18190017363.0,1631,6.04,2,10325357617855.377,RUB,1000000000000.0
RTSI,RUABITR,2021-02-18,ABI TR,Композитный индекс облигаций — совокупный доход,221.67,221.67,221.67,221.67,18190017363.0,1633,6.04,2,10482485141371.877,RUB,1000000000000.0
RTSI,RUBMI,2021-02-18,Индекс РТС широкого рынка,Индекс РТС широкого рынка,1055.92,1078.05,1079.01,1053.85,1280682108.5879834,0,0.0,2,255247855743.4349,USD,241729735.9223
RTSI,RUCBCP3A3YNS,2021-02-18,RUCBCP3A3YNS,Индекс МосБиржи Корпоративных Облигаций RUCBCP3A3YNS,104.79,104.79,104.79,104.79,12192523.0,583,5.64,2,192796500000.0,RUB,192755700000.0
RTSI,RUCBCP3A5YNS,2021-02-18,RUCBCP3A5YNS,Индекс МосБиржи Корпоративных Облигаций RUCBCP3A5YNS,109.57,109.57,109.57,109.57,15174777.0,1355,6.27,2,213243500000.0,RUB,213388000000.0
SNDX,RUCBCP3Y,2021-02-18,Индекс Мосбиржи корп обл CBICP 3-5,Индекс Мосбиржи корпоративных облигаций MOEX 1 - 3 ценовой,92.45,92.47,92.51,92.42,442676960.9,631,6.14,2,744813454743.1018,RUB,1.0
RTSI,RUCBCP3YNS,2021-02-18,RUCBCP3YNS,Индекс МосБиржи Корпоративных Облигаций RUCBCP3YNS,103.1,103.1,103.1,103.1,427129761.0,631,6.02,2,781591661965.6,RUB,754139750366.3054
SNDX,RUCBCP5Y,2021-02-18,Индекс Мосбиржи корп обл CBICP 1-3,Индекс Мосбиржи корпоративных облигаций ценовой 3-5,122.31,122.33,122.45,122.31,119917072.2,1279,6.43,2,444212300000.0,RUB,1.0
RTSI,RUCBCP5YNS,2021-02-18,RUCBCP5YNS,Индекс МосБиржи Корпоративных Облигаций RUCBCP5YNS,109.15,109.15,109.15,109.15,134109627.0,1303,6.51,2,427085300000.0,RUB,352341019090.1
RTSI,RUCBCPA3YNS,2021-02-18,RUCBCPA3YNS,Индекс МосБиржи Корпоративных Облигаций RUCBCPA3YNS,100.0,100.0,100.0,100.0,73519588.0,622,6.56,2,157414700000.0,RUB,103895777932.03
RTSI,RUCBCPA5YNS,2021-02-18,RUCBCPA5YNS,Индекс МосБиржи Корпоративных Облигаций RUCBCPA5YNS,109.11,109.11,109.11,109.11,65119380.0,1311,7.01,2,100472800000.0,RUB,100646300000.0
RTSI,RUCBCPAA3YNS,2021-02-18,RUCBCPAA3YNS,Индекс МосБиржи Корпоративных Облигаций RUCBCPAA3YNS,99.59,99.59,99.59,99.59,324016099.0,624,6.0,2,395855461965.6,RUB,254143062019.742
RTSI,RUCBCPAA5YNS,2021-02-18,RUCBCPAA5YNS,Индекс МосБиржи Корпоративных Облигаций RUCBCPAA5YNS,110.23,110.23,110.23,110.23,53815470.0,1281,6.42,2,113369000000.0,RUB,113142100000.0
