BOARDID,SECID,TRADEDATE,SHORTNAME,NAME,CLOSE,OPEN,HIGH,LOW,VALUE,DURATION,YIELD,DECIMALS,CAPITALIZATION,CURRENCYID,DIVISOR
INAV,AKCHA,2020-12-29,iNAV Альфа Китайские акции,Расчетная цена одного пая Биржевого ПИФа РФИ «Альфа-Капитал Китайские акции»,99.47,98.67,99.53,98.23,0.0,0,0.0,2,0.0,RUB,0.0
INAV,AKEUA,2020-12-29,iNAV Альфа-Капитал ЕВРОПА 600,Расчетная цена одного пая Биржевого ПИФа «ЕВРОПА 600»,10.88,10.82,10.91,10.82,0.0,0,0.0,2,0.0,EUR,0.0
INAV,AKMBA,2020-12-29,iNAV Альфа Управляемые облигации,Расчетная цена одного пая Биржевого ПИФа РФИ «Альфа-Капитал Управляемые облигации»,1.0587,1.0588,1.0591,1.0585,0.0,0,0.0,4,0.0,RUB,0.0
INAV,AKMEI,2020-12-29,iNAV Альфа Управляемые акции,Расчетная цена одного пая Биржевого ПИФа РФИ «Альфа-Капитал Управляемые Российские Акции»,102.13,102.07,102.26,101.65,0.0,0,0.0,2,0.0,RUB,0.0
INAV,AKNXA,2020-12-29,iNAV Технологии 100,Расчетная цена одного пая Биржевого ПИФа «ТЕХНОЛОГИИ 100»,18.7,18.67,18.78,18.64,0.0,0,0.0,2,0.0,USD,0.0
INAV,AKSPA,2020-12-29,iNAV Альфа - Капитал Эс энд Пи 500,Расчетная цена одного пая Биржевого ПИФа «Альфа - Капитал Эс энд Пи 500»,12.85,12.83,12.89,12.82,0.0,0,0.0,2,0.0,USD,0.0
RTSI,BPSI,2020-12-29,Субиндекс облигаций,Субиндекс облигаций активов пенсионных накоплений,3031.83,3031.83,3031.83,3031.83,3814128649.0,1000,5.8631,2,2017041149882.24,RUB,1000000000000.0
RTSI,BPSIG,2020-12-29,Субиндекс облигаций ОФЗ,Субиндекс облигаций ОФЗ активов пенсионных накоплений,2082.68,2082.68,2082.68,2082.68,14616594259.0,1818,5.447,2,9052658873759.031,RUB,1000000000000.0
RTSI,EPSI,2020-12-29,Субиндекс акций,Субиндекс акций активов пенсионных накоплений,1940.09,1940.09,1940.09,1940.09,62131340742.0,0,0.0,2,46672804958828.266,RUB,7568983455.3956
RTSI,EPSITR,2020-12-29,Субиндекс акций полной доходности,Субиндекс акций полной дох-ти,1950.22,1950.22,1950.22,1950.22,62131340742.0,0,0.0,2,0.0,RUB,0.0
INAV,ESGRA,2020-12-29,iNAV RSHB-MOEX-RSPP ESG VecTR ,Расчетная цена одного пая Биржевого ПИФа «РСХБ–Индекс МосБиржи–РСПП Вектор развития полн дох-ти»,1281.15,1289.54,1289.54,1273.18,0.0,0,0.0,2,0.0,RUB,0.0
INAV,GPBMA,2020-12-29,iNAV ГПБ - Корп. облигации 4г,Расчетная цена одного пая Биржевого ПИФа «Газпромбанк – Корпоративные облигации 4 года»,58657.9,58630.85,58704.62,58630.85,0.0,0,0.0,2,0.0,RUB,0.0
INAV,GPBSA,2020-12-29,iNAV ГПБ - Корп. облигации 2г,Расчетная цена одного пая Биржевого ПИФа «Газпромбанк – Корпоративные облигации 2 года»,56946.45,56833.85,56965.3,56827.5,0.0,0,0.0,2,0.0,RUB,0.0
SNDX,IMOEX,2020-12-29,Индекс МосБиржи,Индекс МосБиржи,3274.67,3269.71,3282.23,3264.33,62071933973.8,0,0.0,2,16632815890405.033,RUB,5079230865.8227
SNDX,IMOEX2,2020-12-29,Индекс МосБиржи (доп. сессия),Индекс МосБиржи (Дополнительная сессия),3274.67,3275.32,3277.76,3261.85,5107620656.9,0,0.0,2,16632815890405.027,RUB,5079230865.8227
RTSI,MCFTR,2020-12-29,MOEX Russia Total Return,Индекс МосБиржи полной доходности «брутто»,5926.8,5926.8,5926.8,5926.8,62131340742.0,0,0.0,2,0.0,RUB,0.0
RTSI,MCFTRN,2020-12-29,MOEX Russia Net-TR-NR,Индекс МосБиржи полной доходности «нетто» (по налоговым ставкам иностранных организаций),5423.32,5423.32,5423.32,5423.32,62131340742.0,0,0.0,2,0.0,RUB,0.0
RTSI,MCFTRR,2020-12-29,MOEX Russia Net-TR-Res,Индекс МосБиржи полной доходности «нетто» (по налоговым ставкам российских организаций),5542.46,5542.46,5542.46,5542.46,62131340742.0,0,0.0,2,0.0,RUB,0.0
RTSI,MCXSM,2020-12-29,Индекс МосБиржи SMID,Индекс МосБиржи средней и малой капитализации,1941.58,1941.58,1941.58,1941.58,8253450256.0,0,0.0,2,4622099958692.376,RUB,414265307.9884
RTSI,MEBCTR,2020-12-29,MOEX Blue Chip Total Return,Индекс МосБиржи голубых фишек полной доходности «брутто»,36241.88,36241.88,36241.88,36241.88,39479569949.0,0,0.0,2,0.0,RUB,0.0
RTSI,MEBCTRN,2020-12-29,MOEX Blue Chip Net-TR-NR,Индекс МосБиржи голубых фишек полной доходности «нетто» (по налоговым ставкам иностр. орг.),33524.04,33524.04,33524.04,33524.04,39479569949.0,0,0.0,2,0.0,RUB,0.0
RTSI,MEBCTRR,2020-12-29,MOEX Blue Chip Net-TR-Res,Индекс МосБиржи голубых фишек полной доходности «нетто» (по налоговым ставкам росс. орг.),34109.57,34109.57,34109.57,34109.57,39479569949.0,0,0.0,2,0.0,RUB,0.0
SNDX,MECHTR,2020-12-29,MOEX Chemicals Total Return,Индекс МосБиржи химии и нефтехимии полной доходности «брутто»,28348.79,28348.79,28348.79,28348.79,314477583.0,0,0.0,2,0.0,RUB,0.0
SNDX,MECHTRN,2020-12-29,MOEX Chemicals Net TR-NR,Индекс МосБиржи химии и нефтехимии полной доходности «нетто» (по налог.ставкам ин.орг-й),26525.3,26525.3,26525.3,26525.3,314477583.0,0,0.0,2,0.0,RUB,0.0
SNDX,MECHTRR,2020-12-29,MOEX Chemicals Net TR-Res,Индекс МосБиржи химии и нефтехимии полной доходности «нетто» (по налог.ставкам рос.орг-й),26805.22,26805.22,26805.22,26805.22,314477583.0,0,0.0,2,0.0,RUB,0.0
SNDX,MECNTR,2020-12-29,MOEX Consumer Total Return,Индекс МосБиржи потребительского сектора полной доходности «брутто»,11233.13,11233.13,11233.13,11233.13,4141853675.0,0,0.0,2,0.0,RUB,0.0
SNDX,MECNTRN,2020-12-29,MOEX Consumer Net TR-NR,Индекс МосБиржи потребит. сектора полной доходности «нетто» (по налог.ставкам ин.орг-й),10849.93,10849.93,10849.93,10849.93,4141853675.0,0,0.0,2,0.0,RUB,0.0
SNDX,MECNTRR,2020-12-29,MOEX Consumer Net TR-Res,Индекс МосБиржи потреб. сектора полной доходности «нетто» (по налог.ставкам рос.орг-й),10780.94,10780.94,10780.94,10780.94,4141853675.0,0,0.0,2,0.0,RUB,0.0
SNDX,MEEUTR,2020-12-29,MOEX El.Utilities Total Return,Индекс МосБиржи электроэнергетики полной доходности «брутто»,3332.66,3332.66,3332.66,3332.66,2988248713.0,0,0.0,2,0.0,RUB,0.0
SNDX,MEEUTRN,2020-12-29,MOEX El. Utilities Net TR-NR,Индекс МосБиржи электроэнергетики полной доходности «нетто» (по налог.ставкам ин.орг-й),3153.85,3153.85,3153.85,3153.85,2988248713.0,0,0.0,2,0.0,RUB,0.0
SNDX,MEEUTRR,2020-12-29,MOEX El. Utilities Net TR-Res,Индекс МосБиржи электроэнергетики полной доходности «нетто» (по налог.ставкам рос.орг-й),3182.48,3182.48,3182.48,3182.48,2988248713.0,0,0.0,2,0.0,RUB,0.0
SNDX,MEFNTR,2020-12-29,MOEX Financials Total Return,Индекс МосБиржи финансов полной доходности «брутто»,11635.61,11635.61,11635.61,11635.61,12639632516.0,0,0.0,2,0.0,RUB,0.0
SNDX,MEFNTRN,2020-12-29,MOEX Financials Net TR-NR,Индекс МосБиржи финансов полной доходности «нетто» (по налог.ставкам ин.орг-й),11126.12,11126.12,11126.12,11126.12,12639632516.0,0,0.0,2,0.0,RUB,0.0
SNDX,MEFNTRR,2020-12-29,MOEX Financials Net TR-Res,Индекс МосБиржи финансов полной доходности «нетто» (по налог.ставкам рос.орг-й),11208.44,11208.44,11208.44,11208.44,12639632516.0,0,0.0,2,0.0,RUB,0.0
SNDX,MEMMTR,2020-12-29,MOEX Metals & Min Total Return,Индекс МосБиржи металлов и добычи полной доходности «брутто»,16983.99,16983.99,16983.99,16983.99,20147931486.0,0,0.0,2,0.0,RUB,0.0
SNDX,MEMMTRN,2020-12-29,MOEX Metals & Mining Net TR-NR,Индекс МосБиржи металлов и добычи полной доходности «нетто» (по налог.ставкам ин.орг-й),15777.77,15777.77,15777.77,15777.77,20147931486.0,0,0.0,2,0.0,RUB,0.0
SNDX,MEMMTRR,2020-12-29,MOEX Metals & Min Net TR-Res,Индекс МосБиржи металлов и добычи полной доходности «нетто» (по налог.ставкам рос.орг-й),15971.33,15971.33,15971.33,15971.33,20147931486.0,0,0.0,2,0.0,RUB,0.0
SNDX,MEOGTR,2020-12-29,MOEX Oil & Gas Total Return,Индекс МосБиржи нефти и газа полной доходности «брутто»,10537.76,10537.76,10537.76,10537.76,17687462603.0,0,0.0,2,0.0,RUB,0.0
SNDX,MEOGTRN,2020-12-29,MOEX Oil & Gas Net TR-NR,Индекс МосБиржи нефти и газа полной доходности «нетто» (по налог.ставкам ин.орг-й),9976.43,9976.43,9976.43,9976.43,17687462603.0,0,0.0,2,0.0,RUB,0.0
SNDX,MEOGTRR,2020-12-29,MOEX Oil & Gas Net TR-Res,Индекс МосБиржи нефти и газа полной доходности «нетто» (по налог.ставкам рос.орг-й),10067.79,10067.79,10067.79,10067.79,17687462603.0,0,0.0,2,0.0,RUB,0.0
SNDX,MESMTR,2020-12-29,MOEX SMID Total Return,Индекс МосБиржи средней и малой капитализации полной доходности «брутто»,2734.78,2734.78,2734.78,2734.78,8253450256.0,0,0.0,2,0.0,RUB,0.0
SNDX,MESMTRN,2020-12-29,MOEX SMID Net TR-NR,Индекс МосБиржи средней капитализации полной доходности «нетто» (по нал.ставкам ин.орг-й),2597.97,2597.97,2597.97,2597.97,8253450256.0,0,0.0,2,0.0,RUB,0.0
SNDX,MESMTRR,2020-12-29,MOEX SMID Net TR-Res,Индекс МосБиржи средней капитализации полной доходности «нетто» (по нал.ставкам рос.орг-й),2621.35,2621.35,2621.35,2621.35,8253450256.0,0,0.0,2,0.0,RUB,0.0
SNDX,METLTR,2020-12-29,MOEX Telecom Total Return,Индекс МосБиржи телекоммуникаций полной доходности «брутто»,4402.45,4402.45,4402.45,4402.45,1021130327.0,0,0.0,2,0.0,RUB,0.0
SNDX,METLTRN,2020-12-29,MOEX Telecom Net TR-NR,Индекс МосБиржи телекоммуникаций полной доходности «нетто» (по налог.ставкам ин.орг-й),4000.66,4000.66,4000.66,4000.66,1021130327.0,0,0.0,2,0.0,RUB,0.0
SNDX,METLTRR,2020-12-29,MOEX Telecom Net TR-Res,Индекс МосБиржи телекоммуникаций полной доходности «нетто» (по налог.ставкам рос.орг-й),4064.41,4064.41,4064.41,4064.41,1021130327.0,0,0.0,2,0.0,RUB,0.0
SNDX,METNTR,2020-12-29,MOEX Transport Total Return,Индекс МосБиржи транспорта полной доходности «брутто»,1831.18,1831.18,1831.18,1831.18,1752809308.0,0,0.0,2,0.0,RUB,0.0
SNDX,METNTRN,2020-12-29,MOEX Transport Net TR-NR,Индекс МосБиржи транспорта полной доходности «нетто» (по налог.ставкам ин.орг-й),1740.99,1740.99,1740.99,1740.99,1752809308.0,0,0.0,2,0.0,RUB,0.0
SNDX,METNTRR,2020-12-29,MOEX Transport Net TR-Res,Индекс МосБиржи транспорта полной доходности «нетто» (по налог.ставкам рос.орг-й),1754.59,1754.59,1754.59,1754.59,1752809308.0,0,0.0,2,0.0,RUB,0.0
SNDX,MOEX10,2020-12-29,Индекс МосБиржи 10,Индекс МосБиржи 10,5356.16,5329.64,5368.52,5329.64,33096092294.1,0,0.0,2,11931087268558.422,RUB,5391.01
RTSI,MOEXBC,2020-12-29,Индекс голубых фишек,Индекс МосБиржи голубых фишек,21522.06,21450.55,21561.03,21441.52,39447817968.7,0,0.0,2,13259708030758.074,RUB,616098470.6265
SNDX,MOEXBMI,2020-12-29,Индекс широкого рынка,Индекс МосБиржи широкого рынка,2343.55,2343.48,2348.63,2336.48,65195533066.82,0,0.0,2,18185984259596.33,RUB,7760008376.088
SNDX,MOEXCH,2020-12-29,Индекс химии и нефтехимии,Индекс МосБиржи химии и нефтехимии,18151.62,18065.43,18177.09,17941.23,314286324.4,0,0.0,2,190120564809.55,RUB,10474029.9738
SNDX,MOEXCN,2020-12-29,Индекс потребительского сектора / Индекс потребит сектора,Индекс МосБиржи потребительского сектора,8499.08,8547.01,8583.53,8474.81,4138570023.3,0,0.0,2,164151044519.8159,RUB,19313982.7282
SNDX,MOEXEU,2020-12-29,Индекс электроэнергетики,Индекс МосБиржи электроэнергетики,2306.51,2309.31,2312.75,2291.2,2967003072.3,0,0.0,2,287252112183.2835,RUB,124539818.5684
SNDX,MOEXFN,2020-12-29,Индекс финансов,Индекс МосБиржи финансов,8621.06,8674.85,8692.12,8589.88,12628155090.9,0,0.0,2,880224665931.6575,RUB,102101671.187
SNDX,MOEXINN,2020-12-29,Индекс МосБиржи инноваций,Индекс МосБиржи инноваций,376.36,378.21,382.48,376.36,241182038.6,0,0.0,2,10569729247.3108,RUB,28084330.4761
SNDX,MOEXMM,2020-12-29,Индекс металлов и добычи,Индекс МосБиржи металлов и добычи,10379.98,10460.15,10460.15,10299.45,20136655943.46,0,0.0,2,1842888173546.8154,RUB,177542507.7844
SNDX,MOEXOG,2020-12-29,Индекс нефти и газа,Индекс МосБиржи нефти и газа,7302.62,7267.44,7312.0,7241.99,17676781319.2,0,0.0,2,1188239177524.026,RUB,162714074.6339
SNDX,MOEXREPO,2020-12-29,MXREPO,MOEXREPO обл 12:30,4.2,4.2,4.2,4.2,101705994400.0,,,2,,RUB,
SNDX,MOEXREPO1W,2020-12-29,MOEXREPO1W,MOEXREPO 1 неделя 12:30,4.38,,,,,,,2,,RUB,
SNDX,MOEXREPO1WE,2020-12-29,MOEXREPO1WE,MOEXREPO 1 неделя 19:00,4.4,,,,,,,2,,RUB,
SNDX,MOEXREPOE,2020-12-29,MXREPOE,MOEXREPO обл 19:00,4.23,4.23,4.23,4.23,236313728110.0,,,2,,RUB,
SNDX,MOEXREPOEQ,2020-12-29,MXREPOEQ,MOEXREPO акц 12:30,4.22,4.22,4.22,4.22,21868722640.0,,,2,,RUB,
SNDX,MOEXREPOEQE,2020-12-29,MXREPOEQE,MOEXREPO акц 19:00,4.43,4.43,4.43,4.43,21209702830.0,,,2,,RUB,
SNDX,MOEXREPOUSD,2020-12-29,MOEXREPOUSD,MOEXREPO USD 12:30,0.25,0.25,0.25,0.25,324622863.0,,,2,,USD,
SNDX,MOEXREPOUSDE,2020-12-29,MOEXREPOUSDE,MOEXREPO USD 19:00,0.17,0.17,0.17,0.17,208417128.0,,,2,,USD,
SNDX,MOEXTL,2020-12-29,Индекс телекоммуникаций,Индекс МосБиржи телекоммуникаций,2307.25,2283.86,2307.25,2280.31,1020896172.7,0,0.0,2,410691760320.5562,RUB,178000185.54
SNDX,MOEXTN,2020-12-29,Индекс транспорта,Индекс МосБиржи транспорта,1302.49,1295.23,1312.36,1293.92,1752315820.2,0,0.0,2,178487406900.7848,RUB,137035373.9192
SNDX,MRBC,2020-12-29,Индекс МосБиржи 15,Индекс МосБиржи 15,1645.94,1639.25,1648.24,1639.25,39447817968.7,0,0.0,2,10718222650984.234,RUB,6511921170.5989
RTSI,MRBCTR,2020-12-29,Индекс МосБиржи полн дох-ти 15,Индекс МосБиржи полной доходности 15,1986.9,1986.9,1986.9,1986.9,39479569949.0,0,0.0,2,0.0,RUB,0.0
RTSI,MRRT,2020-12-29,"Индекс ""Ответственность и открытость""",Индекс МосБиржи - РСПП Ответственность и открытость,2525.32,2525.32,2525.32,2525.32,48201220473.0,0,0.0,2,37477103525852.734,RUB,3925482061.8349
RTSI,MRSV,2020-12-29,"Индекс ""Вектор устойчивого развития""",Индекс МосБиржи - РСПП Вектор устойчивого развития,2886.52,2886.52,2886.52,2886.52,45832462346.0,0,0.0,2,36843329045786.54,RUB,78101132.9596
RTSI,MRSVT,2020-12-29,Индекс МосБиржи-РСПП Вектор TR,"Индекс МосБиржи - РСПП Вектор устойчивого развития, полной доходности брутто",3611.45,3611.45,3611.45,3611.45,45832462346.0,0,0.0,2,0.0,RUB,0.0
INAV,MTEKA,2020-12-29,iNAV Фридом - Лидеры Технологий,Расчетная цена одного пая Биржевого ПИФа «Фридом - Лидеры Технологий»,1874.78,1870.47,1880.36,1861.36,0.0,0,0.0,2,0.0,RUB,0.0
INAV,OPNWO,2020-12-29,iNAV «Открытие – Всепогодный»,Биржевой паевой инвестиционный фонд рыночных финансовых инструментов «Открытие – Всепогодный»,1.1039,1.1019,1.1066,1.1019,0.0,0,0.0,4,0.0,USD,0.0
INAV,RCMBD,2020-12-29,iNAV «Райффайзен –Еврооблигации»,Биржевой паевой инвестиционный фонд рыночных финансовых инструментов «Райффайзен – Еврооблигации»,12.98,12.98,12.99,12.98,0.0,0,0.0,2,0.0,USD,0.0
INAV,RFBC15,2020-12-29,iNAV «Raiffeisen-MOEX Index 15»,Расчетная цена одного пая Биржевого ПИФа «Райффайзен – Индекс МосБиржи полной доходности 15»,1237.39,1233.84,1238.49,1232.13,0.0,0,0.0,2,0.0,RUB,0.0
SNDX,RGBI,2020-12-29,Индекс Мосбиржи гос обл RGBI,Индекс Мосбиржи государственных облигаций ценовой,153.16,152.9,153.17,152.84,14616125996.28,1818,5.77,2,8901217710617.082,RUB,1.0
SNDX,RGBITR,2020-12-29,Индекс Мосбиржи гос обл RGBITR,Индекс Мосбиржи государственных облигаций,620.39,619.35,620.42,619.11,14616125996.28,1818,5.77,2,9052658873759.025,RUB,1.0
SNDX,RPGCC,2020-12-29,MOEXREPOGCC,MOEXREPO КСУ 12:30,4.28,4.28,4.28,4.28,145938415000.0,,,2,,RUB,
SNDX,RPGCC1W,2020-12-29,MOEXREPOGCC1W,MOEXREPO КСУ 1 неделя 12:30,4.39,4.39,4.39,4.39,3174550000.0,,,2,,RUB,
SNDX,RPGCC1WE,2020-12-29,MOEXREPOGCC1WE,MOEXREPO КСУ 1 неделя 19:00,4.39,4.39,4.39,4.39,6279032000.0,,,2,,RUB,
SNDX,RPGCCE,2020-12-29,MOEXREPOGCCE,MOEXREPO КСУ 19:00,4.24,4.24,4.24,4.24,120520942000.0,,,2,,RUB,
RTSI,RTSCH,2020-12-29,Индекс РТС химии и нефтехимии,Индекс РТС химии и нефтехимии,256.61,255.45,257.24,253.78,4260637.135989783,0,0.0,2,2577378256.24245,USD,10043947.695
RTSI,RTSCR,2020-12-29,Индекс РТС потреб. сектора,Индекс РТС потребительских товаров и розничной торговли,260.96,262.5,263.82,260.45,56104716.502790615,0,0.0,2,2225321249.7484026,USD,8527282.6944
RTSI,RTSEU,2020-12-29,Индекс РТС электроэнергетики,Индекс РТС электроэнергетики,79.27,79.38,79.62,79.02,40222314.78436279,0,0.0,2,3894146583.9981694,USD,49124990.0073
RTSI,RTSFN,2020-12-29,Индекс РТС финансов,Индекс РТС финансов,203.2,204.51,205.13,202.45,171194170.29055744,0,0.0,2,11932806515.97649,USD,58724922.3762
RTSI,RTSI,2020-12-29,Индекс РТС,Индекс РТС,1398.48,1396.52,1405.9,1395.08,841481052.3377587,0,0.0,2,225483540189.12775,USD,161234282.6352
RTSI,RTSMM,2020-12-29,Индекс РТС металлов и добычи,Индекс РТС металлов и добычи,295.8,298.15,298.29,294.11,272983510.40614057,0,0.0,2,24983199013.446945,USD,84459553.1639
RTSI,RTSOG,2020-12-29,Индекс РТС нефти и газа,Индекс РТС нефти и газа,192.2,191.32,192.79,190.99,239636105.95254394,0,0.0,2,16108419530.699827,USD,83810552.5083
RTSI,RTSSM,2020-12-29,RTS SMID Index,Индекс РТС средней и малой капитализации,1236.61,1236.61,1236.61,1236.61,8253450256.0,0,0.0,2,849449299.223485,USD,8817568.3892
RTSI,RTSTL,2020-12-29,Индекс РТС телекоммуникаций,Индекс РТС телекоммуникаций ,95.9,94.95,95.9,94.78,13839826.323017253,0,0.0,2,5567561900.147308,USD,58056740.3599
RTSI,RTSTN,2020-12-29,Индекс РТС транспорта,Индекс РТС транспорта,43.14,42.91,43.56,42.88,23755350.703788105,0,0.0,2,2419672811.4078984,USD,56082557.4433
RTSI,RTSTR,2020-12-29,RTS Total Return,Индекс РТС полной доходности «брутто»,2529.51,2529.51,2529.51,2529.51,62131340742.0,0,0.0,2,0.0,USD,0.0
RTSI,RTSTRN,2020-12-29,RTS Net-TR-NR,Индекс РТС полной доходности «нетто» (по налоговым ставкам иностранных организаций),2314.8,2314.8,2314.8,2314.8,62131340742.0,0,0.0,2,0.0,USD,0.0
RTSI,RTSTRR,2020-12-29,RTS Net-TR-Res,Индекс РТС полной доходности «нетто» (по налоговым ставкам российских организаций),2365.56,2365.56,2365.56,2365.56,62131340742.0,0,0.0,2,0.0,USD,0.0
RTSI,RTSUSDCUR,2020-12-29,RTSUSDCUR,Курс доллара США на момент закрытия Индекса РТС,73.7651,73.7651,73.7651,73.7651,0.0,,,2,0.0,USD,
RTSI,RUABICP,2020-12-29,ABI CP,Композитный индекс облигаций ,115.86,115.86,115.86,115.86,17668342497.0,1691,5.5202,2,10594362678447.355,RUB,1000000000000.0
RTSI,RUABITR,2020-12-29,ABI TR,Композитный индекс облигаций — совокупный доход,225.32,225.32,225.32,225.32,17668342497.0,1691,5.5197,2,10769776914335.557,RUB,1000000000000.0
RTSI,RUBMI,2020-12-29,Индекс РТС широкого рынка,Индекс РТС широкого рынка,1019.9,1020.09,1025.38,1017.5,883826268.3412616,0,0.0,2,246539139235.17126,USD,241729735.9223
RTSI,RUCBCP3A3YNS,2020-12-29,RUCBCP3A3YNS,Индекс МосБиржи Корпоративных Облигаций RUCBCP3A3YNS,105.42,105.42,105.42,105.42,348855764.0,623,5.3891,2,193914200000.0,RUB,193926000000.0
RTSI,RUCBCP3A5YNS,2020-12-29,RUCBCP3A5YNS,Индекс МосБиржи Корпоративных Облигаций RUCBCP3A5YNS,110.84,110.84,110.84,110.84,426003344.0,1383,5.9685,2,215727000000.0,RUB,216005000000.0
SNDX,RUCBCP3Y,2020-12-29,Индекс Мосбиржи корп обл CBICP 3-5,Индекс Мосбиржи корпоративных облигаций MOEX 1 - 3 ценовой,93.18,93.15,93.2,93.06,1774778812.3,674,5.81,2,750644077826.4001,RUB,1.0
RTSI,RUCBCP3YNS,2020-12-29,RUCBCP3YNS,Индекс МосБиржи Корпоративных Облигаций RUCBCP3YNS,103.87,103.87,103.87,103.87,2077053566.0,675,5.6657,2,787628886988.8,RUB,759796935245.9084
SNDX,RUCBCP5Y,2020-12-29,Индекс Мосбиржи корп обл CBICP 1-3,Индекс Мосбиржи корпоративных облигаций ценовой 3-5,123.66,123.64,123.74,123.57,752090624.9,1317,6.15,2,449031000000.0,RUB,1.0
RTSI,RUCBCP5YNS,2020-12-29,RUCBCP5YNS,Индекс МосБиржи Корпоративных Облигаций RUCBCP5YNS,110.6,110.6,110.6,110.6,749570553.0,1344,6.1593,2,432405000000.0,RUB,356692188955.95
RTSI,RUCBCPA3YNS,2020-12-29,RUCBCPA3YNS,Индекс МосБиржи Корпоративных Облигаций RUCBCPA3YNS,100.86,100.86,100.86,100.86,1136788156.0,666,6.1658,2,158640800000.0,RUB,104653912964.99
RTSI,RUCBCPA5YNS,2020-12-29,RUCBCPA5YNS,Индекс МосБиржи Корпоративных Облигаций RUCBCPA5YNS,110.52,110.52,110.52,110.52,315581665.0,1360,6.6643,2,101785900000.0,RUB,101560500000.0
RTSI,RUCBCPAA3YNS,2020-12-29,RUCBCPAA3YNS,Индекс МосБиржи Корпоративных Облигаций RUCBCPAA3YNS,100.44,100.44,100.44,100.44,403697293.0,671,5.606,2,399401886988.8,RUB,256314586695.1149
RTSI,RUCBCPAA5YNS,2020-12-29,RUCBCPAA5YNS,Индекс МосБиржи Корпоративных Облигаций RUCBCPAA5YNS,111.71,111.71,111.71,111.71,7985544.0,1323,6.0483,2,114892100000.0,RUB,114807600000.0
RTSI,RUCBCPAAANS,2020-12-29,RUCBCPAAANS,Индекс МосБиржи Корпоративных Облигаций RUCBCPAAANS,108.45,108.45,108.45,108.45,1002946704.0,1249,5.7959,2,546061700000.0,RUB,270491351466.85
RTSI,RUCBCPAANS,2020-12-29,RUCBCPAANS,Индекс МосБиржи Корпоративных Облигаций RUCBCPAANS,105.16,105.16,105.16,105.16,517404075.0,878,5.729,2,544970486988.8,RUB,410110792115.9479
RTSI,RUCBCPANS,2020-12-29,RUCBCPANS,Индекс МосБиржи Корпоративных Облигаций RUCBCPANS,105.28,105.28,105.28,105.28,1452369821.0,904,6.305,2,260426700000.0,RUB,180298074489.49
