BOARDID,SECID,TRADEDATE,SHORTNAME,NAME,CLOSE,OPEN,HIGH,LOW,VALUE,DURATION,YIELD,DECIMALS,CAPITALIZATION,CURRENCYID,DIVISOR
INAV,AKCHA,2021-01-05,iNAV Альфа Китайские акции,Расчетная цена одного пая Биржевого ПИФа РФИ «Альфа-Капитал Китайские акции»,106.98,104.47,107.5,104.16,0.0,0,0.0,2,0.0,RUB,0.0
INAV,AKEUA,2021-01-05,iNAV Альфа-Капитал ЕВРОПА 600,Расчетная цена одного пая Биржевого ПИФа «ЕВРОПА 600»,10.84,10.87,10.91,10.81,0.0,0,0.0,2,0.0,EUR,0.0
INAV,AKMBA,2021-01-05,iNAV Альфа Управляемые облигации,Расчетная цена одного пая Биржевого ПИФа РФИ «Альфа-Капитал Управляемые облигации»,1.065,1.0644,1.0657,1.0644,0.0,0,0.0,4,0.0,RUB,0.0
INAV,AKMEI,2021-01-05,iNAV Альфа Управляемые акции,Расчетная цена одного пая Биржевого ПИФа РФИ «Альфа-Капитал Управляемые Российские Акции»,104.67,103.45,104.9,102.87,0.0,0,0.0,2,0.0,RUB,0.0
INAV,AKNXA,2021-01-05,iNAV Технологии 100,Расчетная цена одного пая Биржевого ПИФа «ТЕХНОЛОГИИ 100»,18.56,18.5,18.62,18.45,0.0,0,0.0,2,0.0,USD,0.0
INAV,AKSPA,2021-01-05,iNAV Альфа - Капитал Эс энд Пи 500,Расчетная цена одного пая Биржевого ПИФа «Альфа - Капитал Эс энд Пи 500»,12.74,12.72,12.79,12.72,0.0,0,0.0,2,0.0,USD,0.0
RTSI,BPSI,2021-01-05,Субиндекс облигаций,Субиндекс облигаций активов пенсионных накоплений,3049.57,3049.57,3049.57,3049.57,40752959.0,994,5.6872,2,2028768198478.52,RUB,1000000000000.0
RTSI,BPSIG,2021-01-05,Субиндекс облигаций ОФЗ,Субиндекс облигаций ОФЗ активов пенсионных накоплений,2089.49,2089.49,2089.49,2089.49,157589470.0,1812,5.3877,2,9082283954361.43,RUB,1000000000000.0
RTSI,EPSI,2021-01-05,Субиндекс акций,Субиндекс акций активов пенсионных накоплений,1992.8,1992.8,1992.8,1992.8,71710994049.0,0,0.0,2,47800014138628.26,RUB,7568983455.3956
RTSI,EPSITR,2021-01-05,Субиндекс акций полной доходности,Субиндекс акций полной дох-ти,2003.22,2003.22,2003.22,2003.22,71710994049.0,0,0.0,2,0.0,RUB,0.0
INAV,ESGRA,2021-01-05,iNAV RSHB-MOEX-RSPP ESG VecTR ,Расчетная цена одного пая Биржевого ПИФа «РСХБ–Индекс МосБиржи–РСПП Вектор развития полн дох-ти»,1312.54,1293.99,1313.34,1290.81,0.0,0,0.0,2,0.0,RUB,0.0
INAV,GPBMA,2021-01-05,iNAV ГПБ - Корп. облигации 4г,Расчетная цена одного пая Биржевого ПИФа «Газпромбанк – Корпоративные облигации 4 года»,59016.11,58938.54,59052.81,58831.29,0.0,0,0.0,2,0.0,RUB,0.0
INAV,GPBSA,2021-01-05,iNAV ГПБ - Корп. облигации 2г,Расчетная цена одного пая Биржевого ПИФа «Газпромбанк – Корпоративные облигации 2 года»,57099.33,57178.4,57235.29,57077.58,0.0,0,0.0,2,0.0,RUB,0.0
SNDX,IMOEX,2021-01-05,Индекс МосБиржи,Индекс МосБиржи,3359.15,3327.94,3365.32,3301.88,71669719442.85,0,0.0,2,17061893215819.604,RUB,5079230865.8227
SNDX,IMOEX2,2021-01-05,Индекс МосБиржи (доп. сессия),Индекс МосБиржи (Дополнительная сессия),3359.15,3361.78,3378.96,3359.15,10099962263.65,0,0.0,2,17061893215819.6,RUB,5079230865.8227
RTSI,MCFTR,2021-01-05,MOEX Russia Total Return,Индекс МосБиржи полной доходности «брутто»,6079.7,6079.7,6079.7,6079.7,71710994049.0,0,0.0,2,0.0,RUB,0.0
RTSI,MCFTRN,2021-01-05,MOEX Russia Net-TR-NR,Индекс МосБиржи полной доходности «нетто» (по налоговым ставкам иностранных организаций),5563.24,5563.24,5563.24,5563.24,71710994049.0,0,0.0,2,0.0,RUB,0.0
RTSI,MCFTRR,2021-01-05,MOEX Russia Net-TR-Res,Индекс МосБиржи полной доходности «нетто» (по налоговым ставкам российских организаций),5685.44,5685.44,5685.44,5685.44,71710994049.0,0,0.0,2,0.0,RUB,0.0
RTSI,MCXSM,2021-01-05,Индекс МосБиржи SMID,Индекс МосБиржи средней и малой капитализации,1988.32,1988.32,1988.32,1988.32,5462010106.0,0,0.0,2,4709277509558.896,RUB,414265307.9884
RTSI,MEBCTR,2021-01-05,MOEX Blue Chip Total Return,Индекс МосБиржи голубых фишек полной доходности «брутто»,37230.27,37230.27,37230.27,37230.27,53038569472.0,0,0.0,2,0.0,RUB,0.0
RTSI,MEBCTRN,2021-01-05,MOEX Blue Chip Net-TR-NR,Индекс МосБиржи голубых фишек полной доходности «нетто» (по налоговым ставкам иностр. орг.),34438.31,34438.31,34438.31,34438.31,53038569472.0,0,0.0,2,0.0,RUB,0.0
RTSI,MEBCTRR,2021-01-05,MOEX Blue Chip Net-TR-Res,Индекс МосБиржи голубых фишек полной доходности «нетто» (по налоговым ставкам росс. орг.),35039.81,35039.81,35039.81,35039.81,53038569472.0,0,0.0,2,0.0,RUB,0.0
SNDX,MECHTR,2021-01-05,MOEX Chemicals Total Return,Индекс МосБиржи химии и нефтехимии полной доходности «брутто»,29849.16,29849.16,29849.16,29849.16,847262681.0,0,0.0,2,0.0,RUB,0.0
SNDX,MECHTRN,2021-01-05,MOEX Chemicals Net TR-NR,Индекс МосБиржи химии и нефтехимии полной доходности «нетто» (по налог.ставкам ин.орг-й),27929.17,27929.17,27929.17,27929.17,847262681.0,0,0.0,2,0.0,RUB,0.0
SNDX,MECHTRR,2021-01-05,MOEX Chemicals Net TR-Res,Индекс МосБиржи химии и нефтехимии полной доходности «нетто» (по налог.ставкам рос.орг-й),28223.91,28223.91,28223.91,28223.91,847262681.0,0,0.0,2,0.0,RUB,0.0
SNDX,MECNTR,2021-01-05,MOEX Consumer Total Return,Индекс МосБиржи потребительского сектора полной доходности «брутто»,11594.12,11594.12,11594.12,11594.12,4819698030.0,0,0.0,2,0.0,RUB,0.0
SNDX,MECNTRN,2021-01-05,MOEX Consumer Net TR-NR,Индекс МосБиржи потребит. сектора полной доходности «нетто» (по налог.ставкам ин.орг-й),11198.61,11198.61,11198.61,11198.61,4819698030.0,0,0.0,2,0.0,RUB,0.0
SNDX,MECNTRR,2021-01-05,MOEX Consumer Net TR-Res,Индекс МосБиржи потреб. сектора полной доходности «нетто» (по налог.ставкам рос.орг-й),11127.41,11127.41,11127.41,11127.41,4819698030.0,0,0.0,2,0.0,RUB,0.0
SNDX,MEEUTR,2021-01-05,MOEX El.Utilities Total Return,Индекс МосБиржи электроэнергетики полной доходности «брутто»,3374.75,3374.75,3374.75,3374.75,2680180681.0,0,0.0,2,0.0,RUB,0.0
SNDX,MEEUTRN,2021-01-05,MOEX El. Utilities Net TR-NR,Индекс МосБиржи электроэнергетики полной доходности «нетто» (по налог.ставкам ин.орг-й),3193.69,3193.69,3193.69,3193.69,2680180681.0,0,0.0,2,0.0,RUB,0.0
SNDX,MEEUTRR,2021-01-05,MOEX El. Utilities Net TR-Res,Индекс МосБиржи электроэнергетики полной доходности «нетто» (по налог.ставкам рос.орг-й),3222.67,3222.67,3222.67,3222.67,2680180681.0,0,0.0,2,0.0,RUB,0.0
SNDX,MEFNTR,2021-01-05,MOEX Financials Total Return,Индекс МосБиржи финансов полной доходности «брутто»,11828.27,11828.27,11828.27,11828.27,15103441682.0,0,0.0,2,0.0,RUB,0.0
SNDX,MEFNTRN,2021-01-05,MOEX Financials Net TR-NR,Индекс МосБиржи финансов полной доходности «нетто» (по налог.ставкам ин.орг-й),11310.33,11310.33,11310.33,11310.33,15103441682.0,0,0.0,2,0.0,RUB,0.0
SNDX,MEFNTRR,2021-01-05,MOEX Financials Net TR-Res,Индекс МосБиржи финансов полной доходности «нетто» (по налог.ставкам рос.орг-й),11394.02,11394.02,11394.02,11394.02,15103441682.0,0,0.0,2,0.0,RUB,0.0
SNDX,MEMMTR,2021-01-05,MOEX Metals & Min Total Return,Индекс МосБиржи металлов и добычи полной доходности «брутто»,17535.95,17535.95,17535.95,17535.95,20134300934.0,0,0.0,2,0.0,RUB,0.0
SNDX,MEMMTRN,2021-01-05,MOEX Metals & Mining Net TR-NR,Индекс МосБиржи металлов и добычи полной доходности «нетто» (по налог.ставкам ин.орг-й),16290.53,16290.53,16290.53,16290.53,20134300934.0,0,0.0,2,0.0,RUB,0.0
SNDX,MEMMTRR,2021-01-05,MOEX Metals & Min Net TR-Res,Индекс МосБиржи металлов и добычи полной доходности «нетто» (по налог.ставкам рос.орг-й),16490.38,16490.38,16490.38,16490.38,20134300934.0,0,0.0,2,0.0,RUB,0.0
SNDX,MEOGTR,2021-01-05,MOEX Oil & Gas Total Return,Индекс МосБиржи нефти и газа полной доходности «брутто»,10764.16,10764.16,10764.16,10764.16,22197576280.0,0,0.0,2,0.0,RUB,0.0
SNDX,MEOGTRN,2021-01-05,MOEX Oil & Gas Net TR-NR,Индекс МосБиржи нефти и газа полной доходности «нетто» (по налог.ставкам ин.орг-й),10190.77,10190.77,10190.77,10190.77,22197576280.0,0,0.0,2,0.0,RUB,0.0
SNDX,MEOGTRR,2021-01-05,MOEX Oil & Gas Net TR-Res,Индекс МосБиржи нефти и газа полной доходности «нетто» (по налог.ставкам рос.орг-й),10284.09,10284.09,10284.09,10284.09,22197576280.0,0,0.0,2,0.0,RUB,0.0
SNDX,MESMTR,2021-01-05,MOEX SMID Total Return,Индекс МосБиржи средней и малой капитализации полной доходности «брутто»,2800.61,2800.61,2800.61,2800.61,5462010106.0,0,0.0,2,0.0,RUB,0.0
SNDX,MESMTRN,2021-01-05,MOEX SMID Net TR-NR,Индекс МосБиржи средней капитализации полной доходности «нетто» (по нал.ставкам ин.орг-й),2660.52,2660.52,2660.52,2660.52,5462010106.0,0,0.0,2,0.0,RUB,0.0
SNDX,MESMTRR,2021-01-05,MOEX SMID Net TR-Res,Индекс МосБиржи средней капитализации полной доходности «нетто» (по нал.ставкам рос.орг-й),2684.46,2684.46,2684.46,2684.46,5462010106.0,0,0.0,2,0.0,RUB,0.0
SNDX,METLTR,2021-01-05,MOEX Telecom Total Return,Индекс МосБиржи телекоммуникаций полной доходности «брутто»,4526.35,4526.35,4526.35,4526.35,1368137076.0,0,0.0,2,0.0,RUB,0.0
SNDX,METLTRN,2021-01-05,MOEX Telecom Net TR-NR,Индекс МосБиржи телекоммуникаций полной доходности «нетто» (по налог.ставкам ин.орг-й),4113.26,4113.26,4113.26,4113.26,1368137076.0,0,0.0,2,0.0,RUB,0.0
SNDX,METLTRR,2021-01-05,MOEX Telecom Net TR-Res,Индекс МосБиржи телекоммуникаций полной доходности «нетто» (по налог.ставкам рос.орг-й),4178.8,4178.8,4178.8,4178.8,1368137076.0,0,0.0,2,0.0,RUB,0.0
SNDX,METNTR,2021-01-05,MOEX Transport Total Return,Индекс МосБиржи транспорта полной доходности «брутто»,1886.65,1886.65,1886.65,1886.65,1125069322.0,0,0.0,2,0.0,RUB,0.0
SNDX,METNTRN,2021-01-05,MOEX Transport Net TR-NR,Индекс МосБиржи транспорта полной доходности «нетто» (по налог.ставкам ин.орг-й),1793.72,1793.72,1793.72,1793.72,1125069322.0,0,0.0,2,0.0,RUB,0.0
SNDX,METNTRR,2021-01-05,MOEX Transport Net TR-Res,Индекс МосБиржи транспорта полной доходности «нетто» (по налог.ставкам рос.орг-й),1807.74,1807.74,1807.74,1807.74,1125069322.0,0,0.0,2,0.0,RUB,0.0
SNDX,MOEX10,2021-01-05,Индекс МосБиржи 10,Индекс МосБиржи 10,5525.9,5484.06,5537.47,5433.1,44286285244.3,0,0.0,2,12260408891969.043,RUB,5391.01
RTSI,MOEXBC,2021-01-05,Индекс голубых фишек,Индекс МосБиржи голубых фишек,22109.01,21890.17,22160.66,21698.7,53011804980.1,0,0.0,2,13621329651260.828,RUB,616098470.6265
SNDX,MOEXBMI,2021-01-05,Индекс широкого рынка,Индекс МосБиржи широкого рынка,2404.07,2377.04,2408.31,2363.86,73631704011.52,0,0.0,2,18655635972475.992,RUB,7760008376.088
SNDX,MOEXCH,2021-01-05,Индекс химии и нефтехимии,Индекс МосБиржи химии и нефтехимии,19112.31,18477.0,19130.68,18477.0,846966263.0,0,0.0,2,200182891153.95,RUB,10474029.9738
SNDX,MOEXCN,2021-01-05,Индекс потребительского сектора / Индекс потребит сектора,Индекс МосБиржи потребительского сектора,8772.21,8664.66,8772.21,8647.04,4817717960.82,0,0.0,2,169426336906.4444,RUB,19313982.7282
SNDX,MOEXEU,2021-01-05,Индекс электроэнергетики,Индекс МосБиржи электроэнергетики,2335.64,2311.51,2335.64,2306.48,2677951072.6,0,0.0,2,290879849958.4553,RUB,124539818.5684
SNDX,MOEXFN,2021-01-05,Индекс финансов,Индекс МосБиржи финансов,8763.8,8730.82,8796.8,8698.88,15094157694.55,0,0.0,2,894798680468.7607,RUB,102101671.187
SNDX,MOEXINN,2021-01-05,Индекс МосБиржи инноваций,Индекс МосБиржи инноваций,374.79,373.89,374.84,370.17,151915661.4,0,0.0,2,10525754070.167,RUB,28084330.4761
SNDX,MOEXMM,2021-01-05,Индекс металлов и добычи,Индекс МосБиржи металлов и добычи,10717.32,10618.92,10747.84,10563.1,20120751226.49,0,0.0,2,1902779218593.4175,RUB,177542507.7844
SNDX,MOEXOG,2021-01-05,Индекс нефти и газа,Индекс МосБиржи нефти и газа,7459.51,7362.72,7474.44,7318.68,22184742981.2,0,0.0,2,1213766724006.1587,RUB,162714074.6339
SNDX,MOEXREPO,2021-01-05,MXREPO,MOEXREPO обл 12:30,4.14,4.14,4.14,4.14,16271282364.0,,,2,,RUB,
SNDX,MOEXREPO1W,2021-01-05,MOEXREPO1W,MOEXREPO 1 неделя 12:30,4.6,4.6,4.6,4.6,,,,2,,RUB,
SNDX,MOEXREPO1WE,2021-01-05,MOEXREPO1WE,MOEXREPO 1 неделя 19:00,4.5,4.5,4.5,4.5,,,,2,,RUB,
SNDX,MOEXREPOE,2021-01-05,MXREPOE,MOEXREPO обл 19:00,4.15,4.15,4.15,4.15,25865205693.0,,,2,,RUB,
SNDX,MOEXREPOEQ,2021-01-05,MXREPOEQ,MOEXREPO акц 12:30,4.21,4.21,4.21,4.21,23146015346.0,,,2,,RUB,
SNDX,MOEXREPOEQE,2021-01-05,MXREPOEQE,MOEXREPO акц 19:00,4.73,4.73,4.73,4.73,13064328863.0,,,2,,RUB,
SNDX,MOEXREPOUSD,2021-01-05,MOEXREPOUSD,MOEXREPO USD 12:30,0.28,,,,,,,2,,USD,
SNDX,MOEXREPOUSDE,2021-01-05,MOEXREPOUSDE,MOEXREPO USD 19:00,0.23,,,,,,,2,,USD,
SNDX,MOEXTL,2021-01-05,Индекс телекоммуникаций,Индекс МосБиржи телекоммуникаций,2372.19,2320.15,2372.19,2312.06,1367634843.6,0,0.0,2,422249819475.7348,RUB,178000185.54
SNDX,MOEXTN,2021-01-05,Индекс транспорта,Индекс МосБиржи транспорта,1341.94,1329.31,1342.19,1324.92,1123621575.7,0,0.0,2,183892741464.668,RUB,137035373.9192
SNDX,MRBC,2021-01-05,Индекс МосБиржи 15,Индекс МосБиржи 15,1693.76,1676.46,1697.33,1661.91,53011804980.1,0,0.0,2,11029607907761.318,RUB,6511921170.5989
RTSI,MRBCTR,2021-01-05,Индекс МосБиржи полн дох-ти 15,Индекс МосБиржи полной доходности 15,2044.63,2044.63,2044.63,2044.63,53038569472.0,0,0.0,2,0.0,RUB,0.0
RTSI,MRRT,2021-01-05,"Индекс ""Ответственность и открытость""",Индекс МосБиржи - РСПП Ответственность и открытость,2585.62,2585.62,2585.62,2585.62,53314369418.0,0,0.0,2,38338989100545.37,RUB,3925482061.8349
RTSI,MRSV,2021-01-05,"Индекс ""Вектор устойчивого развития""",Индекс МосБиржи - РСПП Вектор устойчивого развития,2952.14,2952.14,2952.14,2952.14,52108563122.0,0,0.0,2,37698838665769.234,RUB,78101132.9596
RTSI,MRSVT,2021-01-05,Индекс МосБиржи-РСПП Вектор TR,"Индекс МосБиржи - РСПП Вектор устойчивого развития, полной доходности брутто",3693.54,3693.54,3693.54,3693.54,52108563122.0,0,0.0,2,0.0,RUB,0.0
INAV,MTEKA,2021-01-05,iNAV Фридом - Лидеры Технологий,Расчетная цена одного пая Биржевого ПИФа «Фридом - Лидеры Технологий»,1848.19,1845.05,1866.37,1839.81,0.0,0,0.0,2,0.0,RUB,0.0
INAV,OPNWO,2021-01-05,iNAV «Открытие – Всепогодный»,Биржевой паевой инвестиционный фонд рыночных финансовых инструментов «Открытие – Всепогодный»,1.1116,1.1169,1.1169,1.1109,0.0,0,0.0,4,0.0,USD,0.0
INAV,RCMBD,2021-01-05,iNAV «Райффайзен –Еврооблигации»,Биржевой паевой инвестиционный фонд рыночных финансовых инструментов «Райффайзен – Еврооблигации»,12.99,13.0,13.0,12.98,0.0,0,0.0,2,0.0,USD,0.0
INAV,RFBC15,2021-01-05,iNAV «Raiffeisen-MOEX Index 15»,Расчетная цена одного пая Биржевого ПИФа «Райффайзен – Индекс МосБиржи полной доходности 15»,1272.76,1256.95,1275.08,1248.95,0.0,0,0.0,2,0.0,RUB,0.0
SNDX,RGBI,2021-01-05,Индекс Мосбиржи гос обл RGBI,Индекс Мосбиржи государственных облигаций ценовой,153.48,153.37,153.48,153.22,157530154.14,1813,5.73,2,8919661985017.44,RUB,1.0
SNDX,RGBITR,2021-01-05,Индекс Мосбиржи гос обл RGBITR,Индекс Мосбиржи государственных облигаций,622.42,621.97,622.43,621.37,157530154.14,1813,5.73,2,9082256954361.44,RUB,1.0
SNDX,RPGCC,2021-01-05,MOEXREPOGCC,MOEXREPO КСУ 12:30,4.42,4.42,4.42,4.42,,,,2,,RUB,
SNDX,RPGCC1W,2021-01-05,MOEXREPOGCC1W,MOEXREPO КСУ 1 неделя 12:30,4.58,4.58,4.58,4.58,,,,2,,RUB,
SNDX,RPGCC1WE,2021-01-05,MOEXREPOGCC1WE,MOEXREPO КСУ 1 неделя 19:00,4.96,,,,,,,2,,RUB,
SNDX,RPGCCE,2021-01-05,MOEXREPOGCCE,MOEXREPO КСУ 19:00,4.81,4.81,4.81,4.81,,,,2,,RUB,
RTSI,RTSCH,2021-01-05,Индекс РТС химии и нефтехимии,Индекс РТС химии и нефтехимии,268.6,259.28,268.66,259.28,11414270.468340646,0,0.0,2,2697795369.879546,USD,10043947.695
RTSI,RTSCR,2021-01-05,Индекс РТС потреб. сектора,Индекс РТС потребительских товаров и розничной торговли,267.76,264.08,267.89,262.0,64926713.432719156,0,0.0,2,2283299959.3873553,USD,8527282.6944
RTSI,RTSEU,2021-01-05,Индекс РТС электроэнергетики,Индекс РТС электроэнергетики,79.8,78.86,79.8,77.99,36089817.48029713,0,0.0,2,3920086816.039041,USD,49124990.0073
RTSI,RTSFN,2021-01-05,Индекс РТС финансов,Индекс РТС финансов,205.35,204.27,205.47,201.62,203418726.27502614,0,0.0,2,12058891362.93113,USD,58724922.3762
RTSI,RTSI,2021-01-05,Индекс РТС,Индекс РТС,1426.11,1410.89,1428.7,1386.56,965867942.8542744,0,0.0,2,229937215181.9834,USD,161234282.6352
RTSI,RTSMM,2021-01-05,Индекс РТС металлов и добычи,Индекс РТС металлов и добычи,303.61,300.37,303.88,296.64,271160383.30956954,0,0.0,2,25643095352.622253,USD,84459553.1639
RTSI,RTSOG,2021-01-05,Индекс РТС нефти и газа,Индекс РТС нефти и газа,195.17,192.35,195.65,189.39,298976084.07814306,0,0.0,2,16357513018.529842,USD,83810552.5083
RTSI,RTSSM,2021-01-05,RTS SMID Index,Индекс РТС средней и малой капитализации,1258.92,1258.92,1258.92,1258.92,5462010106.0,0,0.0,2,855299816.379163,USD,8817568.3892
RTSI,RTSTL,2021-01-05,Индекс РТС телекоммуникаций,Индекс РТС телекоммуникаций ,98.02,95.72,98.02,94.57,18431140.281176887,0,0.0,2,5690514315.921517,USD,58056740.3599
RTSI,RTSTN,2021-01-05,Индекс РТС транспорта,Индекс РТС транспорта,44.19,43.71,44.22,43.28,15142658.13100385,0,0.0,2,2478258674.445409,USD,56082557.4433
RTSI,RTSTR,2021-01-05,RTS Total Return,Индекс РТС полной доходности «брутто»,2579.49,2579.49,2579.49,2579.49,71710994049.0,0,0.0,2,0.0,USD,0.0
RTSI,RTSTRN,2021-01-05,RTS Net-TR-NR,Индекс РТС полной доходности «нетто» (по налоговым ставкам иностранных организаций),2360.53,2360.53,2360.53,2360.53,71710994049.0,0,0.0,2,0.0,USD,0.0
RTSI,RTSTRR,2021-01-05,RTS Net-TR-Res,Индекс РТС полной доходности «нетто» (по налоговым ставкам российских организаций),2412.3,2412.3,2412.3,2412.3,71710994049.0,0,0.0,2,0.0,USD,0.0
RTSI,RTSUSDCUR,2021-01-05,RTSUSDCUR,Курс доллара США на момент закрытия Индекса РТС,74.2024,74.2024,74.2024,74.2024,0.0,,,2,0.0,USD,
RTSI,RUABICP,2021-01-05,ABI CP,Композитный индекс облигаций ,116.16,116.16,116.16,116.16,199209359.0,1685,5.4467,2,10622042145007.43,RUB,1000000000000.0
RTSI,RUABITR,2021-01-05,ABI TR,Композитный индекс облигаций — совокупный доход,226.14,226.14,226.14,226.14,199209359.0,1685,5.446,2,10808951946018.29,RUB,1000000000000.0
RTSI,RUBMI,2021-01-05,Индекс РТС широкого рынка,Индекс РТС широкого рынка,1040.07,1026.83,1041.94,1011.48,992308928.1683612,0,0.0,2,251415533358.43564,USD,241729735.9223
RTSI,RUCBCP3A3YNS,2021-01-05,RUCBCP3A3YNS,Индекс МосБиржи Корпоративных Облигаций RUCBCP3A3YNS,106.1,106.1,106.1,106.1,6221607.0,617,5.0186,2,195166500000.0,RUB,194982800000.0
RTSI,RUCBCP3A5YNS,2021-01-05,RUCBCP3A5YNS,Индекс МосБиржи Корпоративных Облигаций RUCBCP3A5YNS,111.27,111.27,111.27,111.27,2862571.0,1385,5.8518,2,216573500000.0,RUB,216332500000.0
SNDX,RUCBCP3Y,2021-01-05,Индекс Мосбиржи корп обл CBICP 3-5,Индекс Мосбиржи корпоративных облигаций MOEX 1 - 3 ценовой,93.9,93.93,94.08,93.86,25395227.7,668,5.6,2,756473751203.9008,RUB,1.0
RTSI,RUCBCP3YNS,2021-01-05,RUCBCP3YNS,Индекс МосБиржи Корпоративных Облигаций RUCBCP3YNS,104.74,104.74,104.74,104.74,25145893.0,669,5.45,2,794039857244.0,RUB,766188162550.8807
SNDX,RUCBCP5Y,2021-01-05,Индекс Мосбиржи корп обл CBICP 1-3,Индекс Мосбиржи корпоративных облигаций ценовой 3-5,124.03,123.79,124.05,123.71,6680241.4,1317,6.06,2,450380000000.0,RUB,1.0
RTSI,RUCBCP5YNS,2021-01-05,RUCBCP5YNS,Индекс МосБиржи Корпоративных Облигаций RUCBCP5YNS,110.93,110.93,110.93,110.93,6647303.0,1341,6.0684,2,433697000000.0,RUB,357546478044.25
RTSI,RUCBCPA3YNS,2021-01-05,RUCBCPA3YNS,Индекс МосБиржи Корпоративных Облигаций RUCBCPA3YNS,102.65,102.65,102.65,102.65,4783571.0,660,6.1117,2,162107900000.0,RUB,106592271431.34
RTSI,RUCBCPA5YNS,2021-01-05,RUCBCPA5YNS,Индекс МосБиржи Корпоративных Облигаций RUCBCPA5YNS,110.69,110.69,110.69,110.69,3173670.0,1356,6.6158,2,101935500000.0,RUB,101880000000.0
RTSI,RUCBCPAA3YNS,2021-01-05,RUCBCPAA3YNS,Индекс МосБиржи Корпоративных Облигаций RUCBCPAA3YNS,100.81,100.81,100.81,100.81,12551351.0,665,5.4077,2,400991957244.0,RUB,257371294201.7514
RTSI,RUCBCPAA5YNS,2021-01-05,RUCBCPAA5YNS,Индекс МосБиржи Корпоративных Облигаций RUCBCPAA5YNS,112.0,112.0,112.0,112.0,611062.0,1322,5.9789,2,115188000000.0,RUB,115096000000.0
RTSI,RUCBCPAAANS,2021-01-05,RUCBCPAAANS,Индекс МосБиржи Корпоративных Облигаций RUCBCPAAANS,109.12,109.12,109.12,109.12,13598317.0,1242,5.5178,2,548540500000.0,RUB,271696305235.74
RTSI,RUCBCPAANS,2021-01-05,RUCBCPAANS,Индекс МосБиржи Корпоративных Облигаций RUCBCPAANS,105.6,105.6,105.6,105.6,14977156.0,872,5.5374,2,547138457244.0,RUB,411897113087.5392
RTSI,RUCBCPANS,2021-01-05,RUCBCPANS,Индекс МосБиржи Корпоративных Облигаций RUCBCPANS,107.15,107.15,107.15,107.15,7957241.0,895,6.2594,2,264043400000.0,RUB,183709075373.04
