BOARDID,SECID,TRADEDATE,SHORTNAME,NAME,CLOSE,OPEN,HIGH,LOW,VALUE,DURATION,YIELD,DECIMALS,CAPITALIZATION,CURRENCYID,DIVISOR
INAV,AKEUA,2020-09-28,iNAV Альфа-Капитал ЕВРОПА 600,Расчетная цена одного пая Биржевого ПИФа «ЕВРОПА 600»,9.83,9.62,9.84,9.62,0.0,0,0.0,2,0.0,EUR,0.0
INAV,AKMBA,2020-09-28,iNAV Альфа Управляемые облигации,Расчетная цена одного пая Биржевого ПИФа РФИ «Альфа-Капитал Управляемые облигации»,1.0333,1.0328,1.0339,1.0325,0.0,0,0.0,4,0.0,RUB,0.0
INAV,AKNXA,2020-09-28,iNAV Технологии 100,Расчетная цена одного пая Биржевого ПИФа «ТЕХНОЛОГИИ 100»,16.44,16.21,16.49,16.21,0.0,0,0.0,2,0.0,USD,0.0
INAV,AKSPA,2020-09-28,iNAV Альфа - Капитал Эс энд Пи 500,Расчетная цена одного пая Биржевого ПИФа «Альфа - Капитал Эс энд Пи 500»,11.48,11.31,11.5,11.31,0.0,0,0.0,2,0.0,USD,0.0
RTSI,BPSI,2020-09-28,Субиндекс облигаций,Индексы активов пенсионных накоплений - Субиндекс облигаций,2980.3472,2980.3472,2980.3472,2980.3472,73095511.3,,,2,444529388220.0,RUB,0.001
RTSI,EPSI,2020-09-28,Субиндекс акций,Индексы активов пенсионных накоплений - Субиндекс акций,1711.9615,1711.9615,1711.9615,1711.9615,53681360635.6,,,2,7144919486856.253,RUB,4173528234.8069
INAV,ESGRA,2020-09-28,iNAV RSHB-MOEX-RSPP ESG VecTR ,Расчетная цена одного пая Биржевого ПИФа «РСХБ–Индекс МосБиржи–РСПП Вектор развития полн дох-ти»,1092.14,1085.24,1094.13,1083.1,0.0,0,0.0,2,0.0,RUB,0.0
INAV,GPBMA,2020-09-28,iNAV ГПБ - Корп. облигации 4г,Расчетная цена одного пая Биржевого ПИФа «Газпромбанк – Корпоративные облигации 4 года»,57490.57,57585.12,57652.51,57488.65,0.0,0,0.0,2,0.0,RUB,0.0
INAV,GPBSA,2020-09-28,iNAV ГПБ - Корп. облигации 2г,Расчетная цена одного пая Биржевого ПИФа «Газпромбанк – Корпоративные облигации 2 года»,55973.63,56060.25,56060.25,55958.74,0.0,0,0.0,2,0.0,RUB,0.0
SNDX,IMOEX,2020-09-28,Индекс МосБиржи,Индекс МосБиржи,2927.17,2909.62,2938.94,2909.62,69770125370.4,0,0.0,2,14078810348000.0,RUB,4809707787.42
SNDX,IMOEX2,2020-09-28,Индекс МосБиржи (доп. сессия),Индекс МосБиржи (Дополнительная сессия),2927.17,2930.09,2939.96,2927.17,3732018830.95,0,0.0,2,14078810348000.0,RUB,4809707787.42
RTSI,MCFTR,2020-09-28,MOEX Russia Total Return,Индекс МосБиржи полной доходности «брутто»,5184.06,5184.06,5184.06,5184.06,69770125370.35,,,2,14078810348011.45,RUB,
RTSI,MCFTRN,2020-09-28,MOEX Russia Net-TR-NR,Индекс МосБиржи полной доходности «нетто» (по налоговым ставкам иностранных организаций),4759.06,4759.06,4759.06,4759.06,69770125370.35,,,2,14078810348011.45,RUB,
RTSI,MCFTRR,2020-09-28,MOEX Russia Net-TR-Res,Индекс МосБиржи полной доходности «нетто» (по налоговым ставкам российских организаций),4861.99,4861.99,4861.99,4861.99,69770125370.35,,,2,14078810348011.45,RUB,
RTSI,MCXSM,2020-09-28,Индекс МосБиржи SMID,Индекс МосБиржи средней и малой капитализации,1809.2,1809.2,1809.2,1809.2,4949178948.15,,,2,565270673743.1918,RUB,312441516.846
RTSI,MEBCTR,2020-09-28,MOEX Blue Chip Total Return,Индекс МосБиржи голубых фишек полной доходности «брутто»,31474.87,31474.87,31474.87,31474.87,52224967273.1,,,2,11237475064072.62,RUB,
RTSI,MEBCTRN,2020-09-28,MOEX Blue Chip Net-TR-NR,Индекс МосБиржи голубых фишек полной доходности «нетто» (по налоговым ставкам иностр. орг.),29209.94,29209.94,29209.94,29209.94,52224967273.1,,,2,11237475064072.62,RUB,
RTSI,MEBCTRR,2020-09-28,MOEX Blue Chip Net-TR-Res,Индекс МосБиржи голубых фишек полной доходности «нетто» (по налоговым ставкам росс. орг.),29709.75,29709.75,29709.75,29709.75,52224967273.1,,,2,11237475064072.62,RUB,
SNDX,MECHTR,2020-09-28,MOEX Chemicals Total Return,Индекс МосБиржи химии и нефтехимии полной доходности «брутто»,26144.61,26144.61,26144.61,26144.61,209817507.0,0,0.0,2,0.0,RUB,0.0
SNDX,MECHTRN,2020-09-28,MOEX Chemicals Net TR-NR,Индекс МосБиржи химии и нефтехимии полной доходности «нетто» (по налог.ставкам ин.орг-й),24560.17,24560.17,24560.17,24560.17,209817507.0,0,0.0,2,0.0,RUB,0.0
SNDX,MECHTRR,2020-09-28,MOEX Chemicals Net TR-Res,Индекс МосБиржи химии и нефтехимии полной доходности «нетто» (по налог.ставкам рос.орг-й),24806.22,24806.22,24806.22,24806.22,209817507.0,0,0.0,2,0.0,RUB,0.0
SNDX,MECNTR,2020-09-28,MOEX Consumer Total Return,Индекс МосБиржи потребительского сектора полной доходности «брутто»,10230.44,10230.44,10230.44,10230.44,3866417168.0,0,0.0,2,0.0,RUB,0.0
SNDX,MECNTRN,2020-09-28,MOEX Consumer Net TR-NR,Индекс МосБиржи потребит. сектора полной доходности «нетто» (по налог.ставкам ин.орг-й),9901.86,9901.86,9901.86,9901.86,3866417168.0,0,0.0,2,0.0,RUB,0.0
SNDX,MECNTRR,2020-09-28,MOEX Consumer Net TR-Res,Индекс МосБиржи потреб. сектора полной доходности «нетто» (по налог.ставкам рос.орг-й),9836.14,9836.14,9836.14,9836.14,3866417168.0,0,0.0,2,0.0,RUB,0.0
SNDX,MEEUTR,2020-09-28,MOEX El.Utilities Total Return,Индекс МосБиржи электроэнергетики полной доходности «брутто»,3152.68,3152.68,3152.68,3152.68,2309272268.0,0,0.0,2,0.0,RUB,0.0
SNDX,MEEUTRN,2020-09-28,MOEX El. Utilities Net TR-NR,Индекс МосБиржи электроэнергетики полной доходности «нетто» (по налог.ставкам ин.орг-й),2988.63,2988.63,2988.63,2988.63,2309272268.0,0,0.0,2,0.0,RUB,0.0
SNDX,MEEUTRR,2020-09-28,MOEX El. Utilities Net TR-Res,Индекс МосБиржи электроэнергетики полной доходности «нетто» (по налог.ставкам рос.орг-й),3015.05,3015.05,3015.05,3015.05,2309272268.0,0,0.0,2,0.0,RUB,0.0
SNDX,MEFNTR,2020-09-28,MOEX Financials Total Return,Индекс МосБиржи финансов полной доходности «брутто»,10284.98,10284.98,10284.98,10284.98,19020434301.0,0,0.0,2,0.0,RUB,0.0
SNDX,MEFNTRN,2020-09-28,MOEX Financials Net TR-NR,Индекс МосБиржи финансов полной доходности «нетто» (по налог.ставкам ин.орг-й),9875.0,9875.0,9875.0,9875.0,19020434301.0,0,0.0,2,0.0,RUB,0.0
SNDX,MEFNTRR,2020-09-28,MOEX Financials Net TR-Res,Индекс МосБиржи финансов полной доходности «нетто» (по налог.ставкам рос.орг-й),9942.64,9942.64,9942.64,9942.64,19020434301.0,0,0.0,2,0.0,RUB,0.0
SNDX,MEMMTR,2020-09-28,MOEX Metals & Min Total Return,Индекс МосБиржи металлов и добычи полной доходности «брутто»,14115.76,14115.76,14115.76,14115.76,11421038657.0,0,0.0,2,0.0,RUB,0.0
SNDX,MEMMTRN,2020-09-28,MOEX Metals & Mining Net TR-NR,Индекс МосБиржи металлов и добычи полной доходности «нетто» (по налог.ставкам ин.орг-й),13148.63,13148.63,13148.63,13148.63,11421038657.0,0,0.0,2,0.0,RUB,0.0
SNDX,MEMMTRR,2020-09-28,MOEX Metals & Min Net TR-Res,Индекс МосБиржи металлов и добычи полной доходности «нетто» (по налог.ставкам рос.орг-й),13305.17,13305.17,13305.17,13305.17,11421038657.0,0,0.0,2,0.0,RUB,0.0
SNDX,MEOGTR,2020-09-28,MOEX Oil & Gas Total Return,Индекс МосБиржи нефти и газа полной доходности «брутто»,9431.25,9431.25,9431.25,9431.25,22416287091.0,0,0.0,2,0.0,RUB,0.0
SNDX,MEOGTRN,2020-09-28,MOEX Oil & Gas Net TR-NR,Индекс МосБиржи нефти и газа полной доходности «нетто» (по налог.ставкам ин.орг-й),8944.98,8944.98,8944.98,8944.98,22416287091.0,0,0.0,2,0.0,RUB,0.0
SNDX,MEOGTRR,2020-09-28,MOEX Oil & Gas Net TR-Res,Индекс МосБиржи нефти и газа полной доходности «нетто» (по налог.ставкам рос.орг-й),9024.75,9024.75,9024.75,9024.75,22416287091.0,0,0.0,2,0.0,RUB,0.0
SNDX,MESMTR,2020-09-28,MOEX SMID Total Return,Индекс МосБиржи средней и малой капитализации полной доходности «брутто»,2514.72,2514.72,2514.72,2514.72,4949178951.0,0,0.0,2,0.0,RUB,0.0
SNDX,MESMTRN,2020-09-28,MOEX SMID Net TR-NR,Индекс МосБиржи средней капитализации полной доходности «нетто» (по нал.ставкам ин.орг-й),2393.68,2393.68,2393.68,2393.68,4949178951.0,0,0.0,2,0.0,RUB,0.0
SNDX,MESMTRR,2020-09-28,MOEX SMID Net TR-Res,Индекс МосБиржи средней капитализации полной доходности «нетто» (по нал.ставкам рос.орг-й),2414.53,2414.53,2414.53,2414.53,4949178951.0,0,0.0,2,0.0,RUB,0.0
SNDX,METLTR,2020-09-28,MOEX Telecom Total Return,Индекс МосБиржи телекоммуникаций полной доходности «брутто»,4477.5,4477.5,4477.5,4477.5,1075526098.0,0,0.0,2,0.0,RUB,0.0
SNDX,METLTRN,2020-09-28,MOEX Telecom Net TR-NR,Индекс МосБиржи телекоммуникаций полной доходности «нетто» (по налог.ставкам ин.орг-й),4080.74,4080.74,4080.74,4080.74,1075526098.0,0,0.0,2,0.0,RUB,0.0
SNDX,METLTRR,2020-09-28,MOEX Telecom Net TR-Res,Индекс МосБиржи телекоммуникаций полной доходности «нетто» (по налог.ставкам рос.орг-й),4144.15,4144.15,4144.15,4144.15,1075526098.0,0,0.0,2,0.0,RUB,0.0
SNDX,METNTR,2020-09-28,MOEX Transport Total Return,Индекс МосБиржи транспорта полной доходности «брутто»,1857.02,1857.02,1857.02,1857.02,683212771.0,0,0.0,2,0.0,RUB,0.0
SNDX,METNTRN,2020-09-28,MOEX Transport Net TR-NR,Индекс МосБиржи транспорта полной доходности «нетто» (по налог.ставкам ин.орг-й),1765.56,1765.56,1765.56,1765.56,683212771.0,0,0.0,2,0.0,RUB,0.0
SNDX,METNTRR,2020-09-28,MOEX Transport Net TR-Res,Индекс МосБиржи транспорта полной доходности «нетто» (по налог.ставкам рос.орг-й),1779.3,1779.3,1779.3,1779.3,683212771.0,0,0.0,2,0.0,RUB,0.0
SNDX,MOEX10,2020-09-28,Индекс МосБиржи 10,Индекс МосБиржи 10,4864.16,4830.18,4881.1,4830.18,46201501471.6,0,0.0,2,10229132877500.0,RUB,5009.22
RTSI,MOEXBC,2020-09-28,Индекс голубых фишек,Индекс МосБиржи голубых фишек,19105.32,19018.74,19194.77,19018.74,52224967273.1,0,0.0,2,11237475064100.0,RUB,588185545.473
SNDX,MOEXBMI,2020-09-28,Индекс широкого рынка,Индекс МосБиржи широкого рынка,2093.31,2086.18,2101.32,2085.6,71355807861.6,0,0.0,2,15855952255900.0,RUB,7574573330.95
SNDX,MOEXCH,2020-09-28,Индекс химии и нефтехимии,Индекс МосБиржи химии и нефтехимии,17192.42,16996.15,17205.96,16979.83,209728229.8,0,0.0,2,182338895392.0,RUB,10605772.4903
SNDX,MOEXCN,2020-09-28,Индекс потребительского сектора / Индекс потребит сектора,Индекс МосБиржи потребительского сектора,7847.82,7741.27,7874.95,7732.94,3863463343.42,0,0.0,2,113809615103.0,RUB,14502059.4659
SNDX,MOEXEU,2020-09-28,Индекс электроэнергетики,Индекс МосБиржи электроэнергетики,2206.98,2190.63,2211.62,2186.08,2304845074.6,0,0.0,2,269569625733.0,RUB,122144387.914
SNDX,MOEXFN,2020-09-28,Индекс финансов,Индекс МосБиржи финансов,7833.44,7748.9,7852.9,7748.9,18953551734.2,0,0.0,2,846247226466.0,RUB,108030067.926
SNDX,MOEXINN,2020-09-28,Индекс МосБиржи инноваций,Индекс МосБиржи инноваций,422.15,422.79,424.6,413.0,183135083.0,0,0.0,2,2666123332.09,RUB,6315514.9888
SNDX,MOEXMM,2020-09-28,Индекс металлов и добычи,Индекс МосБиржи металлов и добычи,8779.41,8737.71,8852.48,8727.94,11412663645.8,0,0.0,2,1409355578910.0,RUB,160529704.482
SNDX,MOEXOG,2020-09-28,Индекс нефти и газа,Индекс МосБиржи нефти и газа,6614.88,6590.17,6639.5,6566.3,22373296632.9,0,0.0,2,1143022456150.0,RUB,172795585.061
SNDX,MOEXREPO,2020-09-28,MXREPO,MOEXREPO обл 12:30,4.2,4.2,4.2,4.2,443687828222.0,,,2,,RUB,
SNDX,MOEXREPO1W,2020-09-28,MOEXREPO1W,MOEXREPO 1 неделя 12:30,4.33,4.33,4.33,4.33,85060427449.0,,,2,,RUB,
SNDX,MOEXREPO1WE,2020-09-28,MOEXREPO1WE,MOEXREPO 1 неделя 19:00,4.37,4.37,4.37,4.37,,,,2,,RUB,
SNDX,MOEXREPOE,2020-09-28,MXREPOE,MOEXREPO обл 19:00,4.15,4.15,4.15,4.15,193489140035.0,,,2,,RUB,
SNDX,MOEXREPOEQ,2020-09-28,MXREPOEQ,MOEXREPO акц 12:30,4.18,4.18,4.18,4.18,41437973008.0,,,2,,RUB,
SNDX,MOEXREPOEQE,2020-09-28,MXREPOEQE,MOEXREPO акц 19:00,4.23,4.23,4.23,4.23,37470488727.0,,,2,,RUB,
SNDX,MOEXREPOUSD,2020-09-28,MOEXREPOUSD,MOEXREPO USD 12:30,0.32,0.32,0.32,0.32,1110887980.0,,,2,,USD,
SNDX,MOEXREPOUSDE,2020-09-28,MOEXREPOUSDE,MOEXREPO USD 19:00,0.29,0.29,0.29,0.29,796617422.0,,,2,,USD,
SNDX,MOEXTL,2020-09-28,Индекс телекоммуникаций,Индекс МосБиржи телекоммуникаций,2393.04,2365.28,2394.63,2365.14,1074621110.7,0,0.0,2,425962429125.0,RUB,178000185.54
SNDX,MOEXTN,2020-09-28,Индекс транспорта,Индекс МосБиржи транспорта,1320.86,1310.39,1328.08,1302.85,682538901.8,0,0.0,2,60506638821.1,RUB,45808634.8417
SNDX,MRBC,2020-09-28,Индекс МосБиржи 15,Индекс МосБиржи 15,1469.16,1461.41,1476.51,1461.41,52224967273.1,0,0.0,2,9389887243220.0,RUB,6391340404.16
RTSI,MRBCTR,2020-09-28,Индекс МосБиржи полн дох-ти 15,Индекс МосБиржи полной доходности 15,1740.54,1740.54,1740.54,1740.54,52339702384.0,0,0.0,2,0.0,RUB,0.0
RTSI,MRRT,2020-09-28,"Индекс ""Ответственность и открытость""",Индекс МосБиржи - РСПП Ответственность и открытость,2181.42,2181.42,2181.42,2181.42,46920719410.0,0,0.0,2,32488172837400.0,RUB,3929301536.33
RTSI,MRSV,2020-09-28,"Индекс ""Вектор устойчивого развития""",Индекс МосБиржи - РСПП Вектор устойчивого развития,2487.23,2487.23,2487.23,2487.23,45522305932.0,0,0.0,2,31855916857100.0,RUB,81467120.5622
RTSI,MRSVT,2020-09-28,Индекс МосБиржи-РСПП Вектор TR,"Индекс МосБиржи - РСПП Вектор устойчивого развития, полной доходности брутто",3063.59,3063.59,3063.59,3063.59,45522305932.0,0,0.0,2,0.0,RUB,0.0
INAV,MTEKA,2020-09-28,iNAV Фридом - Лидеры Технологий,Расчетная цена одного пая Биржевого ПИФа «Фридом - Лидеры Технологий»,1848.02,1810.0,1856.53,1808.3,0.0,0,0.0,2,0.0,RUB,0.0
INAV,ONLYO,2020-09-28,iNAV «Открытие – Всепогодный»,Биржевой паевой инвестиционный фонд рыночных финансовых инструментов «Открытие – Всепогодный»,1.0311,1.015,1.0319,1.0149,0.0,0,0.0,4,0.0,USD,0.0
RTSI,OPSI,2020-09-28,Субиндекс ОФЗ,Индексы активов пенсионных накоплений - Субиндекс ОФЗ,2063.1706,2063.1706,2063.1706,2063.1706,2237115020.83,,,2,5227011290172.25,RUB,
INAV,RFBC15,2020-09-28,iNAV «Raiffeisen-MOEX Index 15»,Расчетная цена одного пая Биржевого ПИФа «Райффайзен – Индекс МосБиржи полной доходности 15»,1092.52,1089.16,1097.9,1088.63,0.0,0,0.0,2,0.0,RUB,0.0
SNDX,RGBI,2020-09-28,Индекс Мосбиржи гос обл RGBI,Индекс Мосбиржи государственных облигаций ценовой,151.98,152.16,152.17,151.93,7287649566.14,1861,5.97,2,8832317581790.0,RUB,1.0
SNDX,RGBITR,2020-09-28,Индекс Мосбиржи гос обл RGBITR,Индекс Мосбиржи государственных облигаций,605.85,606.54,606.6,605.65,7287649566.14,1861,5.97,2,9008948706700.0,RUB,1.0
SNDX,RPGCC,2020-09-28,MOEXREPOGCC,MOEXREPO КСУ 12:30,4.25,4.25,4.25,4.25,85544925000.0,,,2,,RUB,
SNDX,RPGCC1W,2020-09-28,MOEXREPOGCC1W,MOEXREPO КСУ 1 неделя 12:30,4.29,4.29,4.29,4.29,6535000000.0,,,2,,RUB,
SNDX,RPGCC1WE,2020-09-28,MOEXREPOGCC1WE,MOEXREPO КСУ 1 неделя 19:00,4.24,4.24,4.24,4.24,2414490000.0,,,2,,RUB,
SNDX,RPGCCE,2020-09-28,MOEXREPOGCCE,MOEXREPO КСУ 19:00,4.23,4.23,4.23,4.23,74497869000.0,,,2,,RUB,
RTSI,RTSCH,2020-09-28,Индекс РТС химии и нефтехимии,Индекс РТС химии и нефтехимии,226.87,226.62,227.01,224.44,2653910.92057,0,0.0,2,2307324989.99,USD,10170280.6297
RTSI,RTSCR,2020-09-28,Индекс РТС потреб. сектора,Индекс РТС потребительских товаров и розничной торговли,224.93,224.18,226.44,222.17,48888447.5309,0,0.0,2,1440152242.14,USD,6402778.8808
RTSI,RTSEU,2020-09-28,Индекс РТС электроэнергетики,Индекс РТС электроэнергетики,70.8,71.01,71.29,70.23,29165618.3792,0,0.0,2,3411146769.65,USD,48180107.4121
RTSI,RTSFN,2020-09-28,Индекс РТС финансов,Индекс РТС финансов,172.34,172.26,173.33,171.51,239839138.389,0,0.0,2,10708452352.6,USD,62134706.3129
RTSI,RTSI,2020-09-28,Индекс РТС,Индекс РТС,1166.86,1171.87,1178.65,1163.08,882874460.088,0,0.0,2,178153930765.0,USD,152678585.651
RTSI,RTSMM,2020-09-28,Индекс РТС металлов и добычи,Индекс РТС металлов и добычи,233.53,234.85,236.58,232.9,144416384.534,0,0.0,2,17834052027.2,USD,76366315.1958
RTSI,RTSOG,2020-09-28,Индекс РТС нефти и газа,Индекс РТС нефти и газа,162.51,163.59,163.69,161.53,283112751.773,0,0.0,2,14463860118.9,USD,89003323.6986
RTSI,RTSSM,2020-09-28,RTS SMID Index,Индекс РТС средней и малой капитализации,1075.59,1075.59,1075.59,1075.59,62627144.05,,,2,7152961790.3858,USD,6650265.8786
RTSI,RTSTL,2020-09-28,Индекс РТС телекоммуникаций,Индекс РТС телекоммуникаций ,92.84,92.72,93.18,92.23,13598306.2646,0,0.0,2,5390148686.63,USD,58056740.3599
RTSI,RTSTN,2020-09-28,Индекс РТС транспорта,Индекс РТС транспорта,40.84,40.94,41.22,40.47,8636879.48412,0,0.0,2,765653863.991,USD,18747461.487
RTSI,RTSTR,2020-09-28,RTS Total Return,Индекс РТС полной доходности «брутто»,2065.18,2065.18,2065.18,2065.18,882874460.09,,,2,178153930764.79,USD,
RTSI,RTSTRN,2020-09-28,RTS Net-TR-NR,Индекс РТС полной доходности «нетто» (по налоговым ставкам иностранных организаций),1896.05,1896.05,1896.05,1896.05,882874460.09,,,2,178153930764.79,USD,
RTSI,RTSTRR,2020-09-28,RTS Net-TR-Res,Индекс РТС полной доходности «нетто» (по налоговым ставкам российских организаций),1936.98,1936.98,1936.98,1936.98,882874460.09,,,2,178153930764.79,USD,
RTSI,RTSUSDCUR,2020-09-28,RTSUSDCUR,Курс доллара США на момент закрытия Индекса РТС,79.0261,79.0261,79.0261,79.0261,0.0,,,2,0.0,USD,
RTSI,RUABICP,2020-09-28,ABI CP,Композитный индекс облигаций ,115.06,115.06,115.06,115.06,4416008302.04,1724,5.71,2,10686308856013.39,RUB,
RTSI,RUABITR,2020-09-28,ABI TR,Композитный индекс облигаций — совокупный доход,220.31,220.31,220.31,220.31,4416008302.04,1724,5.71,2,10686308856013.39,RUB,
RTSI,RUBMI,2020-09-28,Индекс РТС широкого рынка,Индекс РТС широкого рынка,850.35,856.28,858.87,847.63,902939761.188,0,0.0,2,200641968361.0,USD,235953303.434
SNDX,RUCBCP3Y,2020-09-28,Индекс Мосбиржи корп обл CBICP 3-5,Индекс Мосбиржи корпоративных облигаций MOEX 1 - 3 ценовой,93.03,93.15,93.2,93.02,1118186697.71,653,6.01,2,806872967706.0,RUB,1.0
SNDX,RUCBCP5Y,2020-09-28,Индекс Мосбиржи корп обл CBICP 1-3,Индекс Мосбиржи корпоративных облигаций ценовой 3-5,123.71,123.77,124.07,123.71,1427896989.4,1319,6.17,2,371662045555.0,RUB,1.0
SNDX,RUCBICP,2020-09-28,Индекс Мосбиржи корп обл CBICP,Индекс Мосбиржи корпоративных облигаций ценовой,97.24,97.34,97.42,97.23,2555023132.31,966,6.15,2,1279383013260.0,RUB,1.0
RTSI,RUCBICP1Y,2020-09-28,CBI CP 1Y,"Индекс корпоративных облигаций (≤ 1 года, рейтинг ≥ B-)",92.37,92.37,92.37,92.37,80313663.01,155,5.45,2,189253977035.12,RUB,
RTSI,RUCBICP3+,2020-09-28,CBI CP 3+,"Индекс корпоративных облигаций (< 1 года, рейтинг > B-)",126.02,126.02,126.02,126.02,104202128.1,1500,6.22,2,481078621877.27,RUB,
RTSI,RUCBICPB,2020-09-28,CBI CP B,"Индекс корпоративных облигаций (> 1 года, B- ≤ рейтинг < BB-)",78.0,78.0,78.0,78.0,67790349.51,816,7.28,2,57061206976.31,RUB,
RTSI,RUCBICPB3Y,2020-09-28,CBI CP B 3Y,"Индекс корпоративных облигаций (1-3 года, B- ≤ рейтинг < BB-)",79.28,79.28,79.28,79.28,54801941.11,753,7.27,2,45483670601.04,RUB,
RTSI,RUCBICPBB,2020-09-28,CBI CP BB,"Индекс корпоративных облигаций (> 1 года, BB- ≤ рейтинг < BBB-)",94.04,94.04,94.04,94.04,194604040.5,887,6.34,2,553050285502.0,RUB,
RTSI,RUCBICPBB3+,2020-09-28,CBI CP BB 3+,"Индекс корпоративных облигаций (> 3 лет, BB- ≤ рейтинг < BBB-)",120.13,120.13,120.13,120.13,41029091.2,1373,6.61,2,155304165502.0,RUB,
RTSI,RUCBICPBB3Y,2020-09-28,CBI CP BBB 3Y,"Индекс корпоративных облигаций (1-3 года, BB- ≤ рейтинг < BBB-)",92.44,92.44,92.44,92.44,153574949.3,697,6.23,2,397746120000.0,RUB,
RTSI,RUCBICPBB5Y,2020-09-28,CBI CP BB 5Y,"Индекс корпоративных облигаций (3-5 лет, BB- ≤ рейтинг < BBB-)",120.25,120.25,120.25,120.25,38728823.2,1314,6.64,2,139910415502.0,RUB,
RTSI,RUCBICPBBB,2020-09-28,CBI CP BBB,"Индекс корпоративных облигаций (> 1 года, рейтинг ≥ BBB-)",100.41,100.41,100.41,100.41,158664298.3,1041,5.73,2,691508957830.4,RUB,
RTSI,RUCBICPBBB3+,2020-09-28,CBI CP BBB 3+,"Индекс корпоративных облигаций (3-5 лет, рейтинг ≥ BBB-)",130.55,130.55,130.55,130.55,50184628.5,1579,5.99,2,314196920000.0,RUB,
RTSI,RUCBICPBBB3Y,2020-09-28,CBI CP BBB 3Y,"Индекс корпоративных облигаций (1-3 года, рейтинг ≥ BBB-)",95.9,95.9,95.9,95.9,108479669.8,595,5.51,2,377312037830.4,RUB,
RTSI,RUCBICPBBB5Y,2020-09-28,CBI CP BBB 5Y,"Индекс корпоративных облигаций (3-5 лет, рейтинг ≥ BBB-)",129.56,129.56,129.56,129.56,43545451.3,1335,5.81,2,227067170000.0,RUB,
RTSI,RUCBICPL1,2020-09-28,CBI CP L1,Индекс корпоративных облигаций Котировальный лист 1 - ценовой,93.81,93.81,93.81,93.81,294424335.4,954,5.98,2,711855943891.43,RUB,
RTSI,RUCBICPL2,2020-09-28,CBI CP L2,Индекс корпоративных облигаций Котировальный лист 2 - ценовой,105.59,105.59,105.59,105.59,98707955.51,945,6.04,2,423479631417.28,RUB,
RTSI,RUCBICPL3,2020-09-28,CBI CP L3,Индекс корпоративных облигаций Котировальный лист 3 - ценовой,102.93,102.93,102.93,102.93,27926397.4,1071,6.43,2,166284875000.0,RUB,
SNDX,RUCBITR,2020-09-28,Индекс Мосбиржи корп обл CBITR,Индекс Мосбиржи корпоративных облигаций,449.99,450.46,450.84,449.99,2555023132.31,966,6.15,2,1301737168330.0,RUB,1.0
