BOARDID,SECID,TRADEDATE,SHORTNAME,NAME,CLOSE,OPEN,HIGH,LOW,VALUE,DURATION,YIELD,DECIMALS,CAPITALIZATION,CURRENCYID,DIVISOR
INAV,AKEUA,2020-10-16,iNAV Альфа-Капитал ЕВРОПА 600,Расчетная цена одного пая Биржевого ПИФа «ЕВРОПА 600»,9.95,9.83,9.98,9.83,0.0,0,0.0,2,0.0,EUR,0.0
INAV,AKMBA,2020-10-16,iNAV Альфа Управляемые облигации,Расчетная цена одного пая Биржевого ПИФа РФИ «Альфа-Капитал Управляемые облигации»,1.0406,1.0402,1.0414,1.04,0.0,0,0.0,4,0.0,RUB,0.0
INAV,AKNXA,2020-10-16,iNAV Технологии 100,Расчетная цена одного пая Биржевого ПИФа «ТЕХНОЛОГИИ 100»,17.3,17.3,17.49,17.3,0.0,0,0.0,2,0.0,USD,0.0
INAV,AKSPA,2020-10-16,iNAV Альфа - Капитал Эс энд Пи 500,Расчетная цена одного пая Биржевого ПИФа «Альфа - Капитал Эс энд Пи 500»,12.02,11.98,12.09,11.98,0.0,0,0.0,2,0.0,USD,0.0
RTSI,BPSI,2020-10-16,Субиндекс облигаций,Индексы активов пенсионных накоплений - Субиндекс облигаций,2987.3149,2987.3149,2987.3149,2987.3149,125311678.2,,,2,443781202731.0,RUB,0.001
RTSI,EPSI,2020-10-16,Субиндекс акций,Индексы активов пенсионных накоплений - Субиндекс акций,1657.1536,1657.1536,1657.1536,1657.1536,56108100233.5,,,2,6916177365729.149,RUB,4173528234.8069
INAV,ESGRA,2020-10-16,iNAV RSHB-MOEX-RSPP ESG VecTR ,Расчетная цена одного пая Биржевого ПИФа «РСХБ–Индекс МосБиржи–РСПП Вектор развития полн дох-ти»,1073.02,1075.34,1079.66,1067.17,0.0,0,0.0,2,0.0,RUB,0.0
INAV,GPBMA,2020-10-16,iNAV ГПБ - Корп. облигации 4г,Расчетная цена одного пая Биржевого ПИФа «Газпромбанк – Корпоративные облигации 4 года»,57651.13,57665.17,57776.39,57635.98,0.0,0,0.0,2,0.0,RUB,0.0
INAV,GPBSA,2020-10-16,iNAV ГПБ - Корп. облигации 2г,Расчетная цена одного пая Биржевого ПИФа «Газпромбанк – Корпоративные облигации 2 года»,56039.04,56096.47,56310.03,56014.87,0.0,0,0.0,2,0.0,RUB,0.0
SNDX,IMOEX,2020-10-16,Индекс МосБиржи,Индекс МосБиржи,2799.54,2819.04,2819.04,2785.85,71062651943.55,0,0.0,2,13464960048324.197,RUB,4809707787.4153
SNDX,IMOEX2,2020-10-16,Индекс МосБиржи (доп. сессия),Индекс МосБиржи (Дополнительная сессия),2799.54,2798.31,2801.8,2791.45,5127846094.9,0,0.0,2,13464960048324.201,RUB,4809707787.4153
RTSI,MCFTR,2020-10-16,MOEX Russia Total Return,Индекс МосБиржи полной доходности «брутто»,5036.28,5036.28,5036.28,5036.28,71062651943.55,,,2,13464960048324.2,RUB,
RTSI,MCFTRN,2020-10-16,MOEX Russia Net-TR-NR,Индекс МосБиржи полной доходности «нетто» (по налоговым ставкам иностранных организаций),4612.6,4612.6,4612.6,4612.6,71062651943.55,,,2,13464960048324.2,RUB,
RTSI,MCFTRR,2020-10-16,MOEX Russia Net-TR-Res,Индекс МосБиржи полной доходности «нетто» (по налоговым ставкам российских организаций),4713.83,4713.83,4713.83,4713.83,71062651943.55,,,2,13464960048324.2,RUB,
RTSI,MCXSM,2020-10-16,Индекс МосБиржи SMID,Индекс МосБиржи средней и малой капитализации,1765.4,1765.4,1765.4,1765.4,6106052573.62,,,2,551584202168.4034,RUB,312441516.846
RTSI,MEBCTR,2020-10-16,MOEX Blue Chip Total Return,Индекс МосБиржи голубых фишек полной доходности «брутто»,30575.8,30575.8,30575.8,30575.8,53786896723.6,,,2,10733290793000.48,RUB,
RTSI,MEBCTRN,2020-10-16,MOEX Blue Chip Net-TR-NR,Индекс МосБиржи голубых фишек полной доходности «нетто» (по налоговым ставкам иностр. орг.),28304.03,28304.03,28304.03,28304.03,53786896723.6,,,2,10733290793000.48,RUB,
RTSI,MEBCTRR,2020-10-16,MOEX Blue Chip Net-TR-Res,Индекс МосБиржи голубых фишек полной доходности «нетто» (по налоговым ставкам росс. орг.),28798.05,28798.05,28798.05,28798.05,53786896723.6,,,2,10733290793000.48,RUB,
SNDX,MECHTR,2020-10-16,MOEX Chemicals Total Return,Индекс МосБиржи химии и нефтехимии полной доходности «брутто»,25776.64,25776.64,25776.64,25776.64,152321067.0,0,0.0,2,0.0,RUB,0.0
SNDX,MECHTRN,2020-10-16,MOEX Chemicals Net TR-NR,Индекс МосБиржи химии и нефтехимии полной доходности «нетто» (по налог.ставкам ин.орг-й),24193.08,24193.08,24193.08,24193.08,152321067.0,0,0.0,2,0.0,RUB,0.0
SNDX,MECHTRR,2020-10-16,MOEX Chemicals Net TR-Res,Индекс МосБиржи химии и нефтехимии полной доходности «нетто» (по налог.ставкам рос.орг-й),24438.34,24438.34,24438.34,24438.34,152321067.0,0,0.0,2,0.0,RUB,0.0
SNDX,MECNTR,2020-10-16,MOEX Consumer Total Return,Индекс МосБиржи потребительского сектора полной доходности «брутто»,10200.0,10200.0,10200.0,10200.0,3294282632.0,0,0.0,2,0.0,RUB,0.0
SNDX,MECNTRN,2020-10-16,MOEX Consumer Net TR-NR,Индекс МосБиржи потребит. сектора полной доходности «нетто» (по налог.ставкам ин.орг-й),9872.38,9872.38,9872.38,9872.38,3294282632.0,0,0.0,2,0.0,RUB,0.0
SNDX,MECNTRR,2020-10-16,MOEX Consumer Net TR-Res,Индекс МосБиржи потреб. сектора полной доходности «нетто» (по налог.ставкам рос.орг-й),9806.87,9806.87,9806.87,9806.87,3294282632.0,0,0.0,2,0.0,RUB,0.0
SNDX,MEEUTR,2020-10-16,MOEX El.Utilities Total Return,Индекс МосБиржи электроэнергетики полной доходности «брутто»,2990.57,2990.57,2990.57,2990.57,1709649022.0,0,0.0,2,0.0,RUB,0.0
SNDX,MEEUTRN,2020-10-16,MOEX El. Utilities Net TR-NR,Индекс МосБиржи электроэнергетики полной доходности «нетто» (по налог.ставкам ин.орг-й),2831.83,2831.83,2831.83,2831.83,1709649022.0,0,0.0,2,0.0,RUB,0.0
SNDX,MEEUTRR,2020-10-16,MOEX El. Utilities Net TR-Res,Индекс МосБиржи электроэнергетики полной доходности «нетто» (по налог.ставкам рос.орг-й),2857.3,2857.3,2857.3,2857.3,1709649022.0,0,0.0,2,0.0,RUB,0.0
SNDX,MEFNTR,2020-10-16,MOEX Financials Total Return,Индекс МосБиржи финансов полной доходности «брутто»,9729.97,9729.97,9729.97,9729.97,18551742510.0,0,0.0,2,0.0,RUB,0.0
SNDX,MEFNTRN,2020-10-16,MOEX Financials Net TR-NR,Индекс МосБиржи финансов полной доходности «нетто» (по налог.ставкам ин.орг-й),9309.02,9309.02,9309.02,9309.02,18551742510.0,0,0.0,2,0.0,RUB,0.0
SNDX,MEFNTRR,2020-10-16,MOEX Financials Net TR-Res,Индекс МосБиржи финансов полной доходности «нетто» (по налог.ставкам рос.орг-й),9377.21,9377.21,9377.21,9377.21,18551742510.0,0,0.0,2,0.0,RUB,0.0
SNDX,MEMMTR,2020-10-16,MOEX Metals & Min Total Return,Индекс МосБиржи металлов и добычи полной доходности «брутто»,14411.18,14411.18,14411.18,14411.18,11644619938.0,0,0.0,2,0.0,RUB,0.0
SNDX,MEMMTRN,2020-10-16,MOEX Metals & Mining Net TR-NR,Индекс МосБиржи металлов и добычи полной доходности «нетто» (по налог.ставкам ин.орг-й),13415.95,13415.95,13415.95,13415.95,11644619938.0,0,0.0,2,0.0,RUB,0.0
SNDX,MEMMTRR,2020-10-16,MOEX Metals & Min Net TR-Res,Индекс МосБиржи металлов и добычи полной доходности «нетто» (по налог.ставкам рос.орг-й),13576.74,13576.74,13576.74,13576.74,11644619938.0,0,0.0,2,0.0,RUB,0.0
SNDX,MEOGTR,2020-10-16,MOEX Oil & Gas Total Return,Индекс МосБиржи нефти и газа полной доходности «брутто»,9110.99,9110.99,9110.99,9110.99,21023525892.0,0,0.0,2,0.0,RUB,0.0
SNDX,MEOGTRN,2020-10-16,MOEX Oil & Gas Net TR-NR,Индекс МосБиржи нефти и газа полной доходности «нетто» (по налог.ставкам ин.орг-й),8635.32,8635.32,8635.32,8635.32,21023525892.0,0,0.0,2,0.0,RUB,0.0
SNDX,MEOGTRR,2020-10-16,MOEX Oil & Gas Net TR-Res,Индекс МосБиржи нефти и газа полной доходности «нетто» (по налог.ставкам рос.орг-й),8713.12,8713.12,8713.12,8713.12,21023525892.0,0,0.0,2,0.0,RUB,0.0
SNDX,MESMTR,2020-10-16,MOEX SMID Total Return,Индекс МосБиржи средней и малой капитализации полной доходности «брутто»,2461.46,2461.46,2461.46,2461.46,6106052575.0,0,0.0,2,0.0,RUB,0.0
SNDX,MESMTRN,2020-10-16,MOEX SMID Net TR-NR,Индекс МосБиржи средней капитализации полной доходности «нетто» (по нал.ставкам ин.орг-й),2341.9,2341.9,2341.9,2341.9,6106052575.0,0,0.0,2,0.0,RUB,0.0
SNDX,MESMTRR,2020-10-16,MOEX SMID Net TR-Res,Индекс МосБиржи средней капитализации полной доходности «нетто» (по нал.ставкам рос.орг-й),2362.46,2362.46,2362.46,2362.46,6106052575.0,0,0.0,2,0.0,RUB,0.0
SNDX,METLTR,2020-10-16,MOEX Telecom Total Return,Индекс МосБиржи телекоммуникаций полной доходности «брутто»,4286.4,4286.4,4286.4,4286.4,2826478147.0,0,0.0,2,0.0,RUB,0.0
SNDX,METLTRN,2020-10-16,MOEX Telecom Net TR-NR,Индекс МосБиржи телекоммуникаций полной доходности «нетто» (по налог.ставкам ин.орг-й),3895.2,3895.2,3895.2,3895.2,2826478147.0,0,0.0,2,0.0,RUB,0.0
SNDX,METLTRR,2020-10-16,MOEX Telecom Net TR-Res,Индекс МосБиржи телекоммуникаций полной доходности «нетто» (по налог.ставкам рос.орг-й),3957.25,3957.25,3957.25,3957.25,2826478147.0,0,0.0,2,0.0,RUB,0.0
SNDX,METNTR,2020-10-16,MOEX Transport Total Return,Индекс МосБиржи транспорта полной доходности «брутто»,1628.4,1628.4,1628.4,1628.4,1434004799.0,0,0.0,2,0.0,RUB,0.0
SNDX,METNTRN,2020-10-16,MOEX Transport Net TR-NR,Индекс МосБиржи транспорта полной доходности «нетто» (по налог.ставкам ин.орг-й),1548.2,1548.2,1548.2,1548.2,1434004799.0,0,0.0,2,0.0,RUB,0.0
SNDX,METNTRR,2020-10-16,MOEX Transport Net TR-Res,Индекс МосБиржи транспорта полной доходности «нетто» (по налог.ставкам рос.орг-й),1560.26,1560.26,1560.26,1560.26,1434004799.0,0,0.0,2,0.0,RUB,0.0
SNDX,MOEX10,2020-10-16,Индекс МосБиржи 10,Индекс МосБиржи 10,4581.6,4614.95,4614.95,4561.19,46927758289.6,0,0.0,2,9636759886078.193,RUB,5009.22
RTSI,MOEXBC,2020-10-16,Индекс голубых фишек,Индекс МосБиржи голубых фишек,18248.14,18368.89,18368.89,18149.68,53786896723.6,0,0.0,2,10733290793000.482,RUB,588185545.4728
SNDX,MOEXBMI,2020-10-16,Индекс широкого рынка,Индекс МосБиржи широкого рынка,2000.21,2012.92,2014.23,1991.0,72165810468.84,0,0.0,2,15150750458547.475,RUB,7574573330.9507
SNDX,MOEXCH,2020-10-16,Индекс химии и нефтехимии,Индекс МосБиржи химии и нефтехимии,16850.54,16789.08,16931.94,16691.84,152209597.0,0,0.0,2,178712989939.8,RUB,10605772.4903
SNDX,MOEXCN,2020-10-16,Индекс потребительского сектора / Индекс потребит сектора,Индекс МосБиржи потребительского сектора,7824.46,7827.15,7879.76,7755.82,3294073833.76,0,0.0,2,113470785556.7602,RUB,14502059.4659
SNDX,MOEXEU,2020-10-16,Индекс электроэнергетики,Индекс МосБиржи электроэнергетики,2078.19,2093.84,2102.92,2077.58,1709463816.5,0,0.0,2,253839226977.8497,RUB,122144387.9137
SNDX,MOEXFN,2020-10-16,Индекс финансов,Индекс МосБиржи финансов,7235.72,7371.79,7381.2,7235.72,18540175504.0,0,0.0,2,781675692831.1171,RUB,108030067.9261
SNDX,MOEXINN,2020-10-16,Индекс МосБиржи инноваций,Индекс МосБиржи инноваций,389.05,396.15,396.15,387.87,43610698.5,0,0.0,2,2457069842.3897,RUB,6315514.9888
SNDX,MOEXMM,2020-10-16,Индекс металлов и добычи,Индекс МосБиржи металлов и добычи,8932.68,8924.26,8993.43,8914.65,11641917457.44,0,0.0,2,1433960836379.2095,RUB,160529704.4824
SNDX,MOEXOG,2020-10-16,Индекс нефти и газа,Индекс МосБиржи нефти и газа,6361.08,6378.52,6383.37,6313.58,21014916694.6,0,0.0,2,1099166491325.233,RUB,172795585.0609
SNDX,MOEXREPO,2020-10-16,MXREPO,MOEXREPO обл 12:30,4.24,4.24,4.24,4.24,340585263821.0,,,2,,RUB,
SNDX,MOEXREPO1W,2020-10-16,MOEXREPO1W,MOEXREPO 1 неделя 12:30,4.26,4.26,4.26,4.26,51773604624.0,,,2,,RUB,
SNDX,MOEXREPO1WE,2020-10-16,MOEXREPO1WE,MOEXREPO 1 неделя 19:00,4.33,4.33,4.33,4.33,,,,2,,RUB,
SNDX,MOEXREPOE,2020-10-16,MXREPOE,MOEXREPO обл 19:00,4.31,4.31,4.31,4.31,190781996925.0,,,2,,RUB,
SNDX,MOEXREPOEQ,2020-10-16,MXREPOEQ,MOEXREPO акц 12:30,4.25,4.25,4.25,4.25,41267579123.0,,,2,,RUB,
SNDX,MOEXREPOEQE,2020-10-16,MXREPOEQE,MOEXREPO акц 19:00,4.34,4.34,4.34,4.34,36301857630.0,,,2,,RUB,
SNDX,MOEXREPOUSD,2020-10-16,MOEXREPOUSD,MOEXREPO USD 12:30,0.38,0.38,0.38,0.38,1057626468.0,,,2,,USD,
SNDX,MOEXREPOUSDE,2020-10-16,MOEXREPOUSDE,MOEXREPO USD 19:00,0.34,0.34,0.34,0.34,593508552.0,,,2,,USD,
SNDX,MOEXTL,2020-10-16,Индекс телекоммуникаций,Индекс МосБиржи телекоммуникаций,2246.43,2240.44,2257.01,2194.25,2823795846.7,0,0.0,2,399864568215.8694,RUB,178000185.54
SNDX,MOEXTN,2020-10-16,Индекс транспорта,Индекс МосБиржи транспорта,1158.25,1156.23,1165.59,1149.52,1433076177.6,0,0.0,2,53057693715.2042,RUB,45808634.8417
SNDX,MRBC,2020-10-16,Индекс МосБиржи 15,Индекс МосБиржи 15,1418.42,1425.63,1426.14,1410.62,53786896723.6,0,0.0,2,9065589851620.512,RUB,6391340404.1646
RTSI,MRBCTR,2020-10-16,Индекс МосБиржи полн дох-ти 15,Индекс МосБиржи полной доходности 15,1702.21,1702.21,1702.21,1702.21,53810410706.0,0,0.0,2,0.0,RUB,0.0
RTSI,MRRT,2020-10-16,"Индекс ""Ответственность и открытость""",Индекс МосБиржи - РСПП Ответственность и открытость,2102.83,2102.83,2102.83,2102.83,49385238852.0,0,0.0,2,31437247835999.62,RUB,3929301536.3335
RTSI,MRSV,2020-10-16,"Индекс ""Вектор устойчивого развития""",Индекс МосБиржи - РСПП Вектор устойчивого развития,2422.28,2422.28,2422.28,2422.28,46788191113.0,0,0.0,2,30842166797410.645,RUB,81467120.5622
RTSI,MRSVT,2020-10-16,Индекс МосБиржи-РСПП Вектор TR,"Индекс МосБиржи - РСПП Вектор устойчивого развития, полной доходности брутто",3005.83,3005.83,3005.83,3005.83,46788191113.0,0,0.0,2,0.0,RUB,0.0
INAV,MTEKA,2020-10-16,iNAV Фридом - Лидеры Технологий,Расчетная цена одного пая Биржевого ПИФа «Фридом - Лидеры Технологий»,1926.02,1934.97,1958.03,1925.16,0.0,0,0.0,2,0.0,RUB,0.0
INAV,ONLYO,2020-10-16,iNAV «Открытие – Всепогодный»,Биржевой паевой инвестиционный фонд рыночных финансовых инструментов «Открытие – Всепогодный»,1.0575,1.0556,1.0599,1.0555,0.0,0,0.0,4,0.0,USD,0.0
RTSI,OPSI,2020-10-16,Субиндекс ОФЗ,Индексы активов пенсионных накоплений - Субиндекс ОФЗ,2073.7288,2073.7288,2073.7288,2073.7288,3579711529.67,,,2,5237480273421.47,RUB,
INAV,RFBC15,2020-10-16,iNAV «Raiffeisen-MOEX Index 15»,Расчетная цена одного пая Биржевого ПИФа «Райффайзен – Индекс МосБиржи полной доходности 15»,1069.84,1073.18,1074.99,1063.65,0.0,0,0.0,2,0.0,RUB,0.0
SNDX,RGBI,2020-10-16,Индекс Мосбиржи гос обл RGBI,Индекс Мосбиржи государственных облигаций ценовой,153.56,153.55,153.6,153.43,8676862893.34,1873,5.75,2,8924254848515.422,RUB,1.0
SNDX,RGBITR,2020-10-16,Индекс Мосбиржи гос обл RGBITR,Индекс Мосбиржи государственных облигаций,613.98,613.92,614.11,613.46,8676862893.34,1873,5.75,2,9053258653063.434,RUB,1.0
SNDX,RPGCC,2020-10-16,MOEXREPOGCC,MOEXREPO КСУ 12:30,4.26,4.26,4.26,4.26,211670254000.0,,,2,,RUB,
SNDX,RPGCC1W,2020-10-16,MOEXREPOGCC1W,MOEXREPO КСУ 1 неделя 12:30,4.28,4.28,4.28,4.28,4590855000.0,,,2,,RUB,
SNDX,RPGCC1WE,2020-10-16,MOEXREPOGCC1WE,MOEXREPO КСУ 1 неделя 19:00,4.31,4.31,4.31,4.31,,,,2,,RUB,
SNDX,RPGCCE,2020-10-16,MOEXREPOGCCE,MOEXREPO КСУ 19:00,4.25,4.25,4.25,4.25,84822482000.0,,,2,,RUB,
RTSI,RTSCH,2020-10-16,Индекс РТС химии и нефтехимии,Индекс РТС химии и нефтехимии,225.71,224.22,226.5,222.39,1955092.1930974952,0,0.0,2,2295521296.442393,USD,10170280.6297
RTSI,RTSCR,2020-10-16,Индекс РТС потреб. сектора,Индекс РТС потребительских товаров и розничной торговли,227.64,227.04,229.03,224.37,42311510.9875162,0,0.0,2,1457502360.949434,USD,6402778.8808
RTSI,RTSEU,2020-10-16,Индекс РТС электроэнергетики,Индекс РТС электроэнергетики,67.67,67.98,68.42,67.38,21957612.580905784,0,0.0,2,3260498028.690642,USD,48180107.4121
RTSI,RTSFN,2020-10-16,Индекс РТС финансов,Индекс РТС финансов,161.59,164.14,164.48,160.84,238143672.28452632,0,0.0,2,10040418440.817453,USD,62134706.3129
RTSI,RTSI,2020-10-16,Индекс РТС,Индекс РТС,1132.8,1137.25,1138.87,1121.29,912781051.7469484,0,0.0,2,172953866179.9907,USD,152678585.651
RTSI,RTSMM,2020-10-16,Индекс РТС металлов и добычи,Индекс РТС металлов и добычи,241.19,240.25,242.47,239.36,149537364.15008304,0,0.0,2,18418849347.669895,USD,76366315.1958
RTSI,RTSOG,2020-10-16,Индекс РТС нефти и газа,Индекс РТС нефти и газа,158.63,158.59,159.0,156.64,269931071.2202114,0,0.0,2,14118504144.6784,USD,89003323.6986
RTSI,RTSSM,2020-10-16,RTS SMID Index,Индекс РТС средней и малой капитализации,1065.36,1065.36,1065.36,1065.36,78430637.44,,,2,7084953831.7574,USD,6650265.8786
RTSI,RTSTL,2020-10-16,Индекс РТС телекоммуникаций,Индекс РТС телекоммуникаций ,88.47,87.97,88.82,86.09,36270914.07898742,0,0.0,2,5136155084.985522,USD,58056740.3599
RTSI,RTSTN,2020-10-16,Индекс РТС транспорта,Индекс РТС транспорта,36.35,36.18,36.55,35.91,18407486.138602413,0,0.0,2,681512104.432901,USD,18747461.487
RTSI,RTSTR,2020-10-16,RTS Total Return,Индекс РТС полной доходности «брутто»,2036.54,2036.54,2036.54,2036.54,912781051.74,,,2,172953866179.99,USD,
RTSI,RTSTRN,2020-10-16,RTS Net-TR-NR,Индекс РТС полной доходности «нетто» (по налоговым ставкам иностранных организаций),1865.4,1865.4,1865.4,1865.4,912781051.74,,,2,172953866179.99,USD,
RTSI,RTSTRR,2020-10-16,RTS Net-TR-Res,Индекс РТС полной доходности «нетто» (по налоговым ставкам российских организаций),1906.25,1906.25,1906.25,1906.25,912781051.74,,,2,172953866179.99,USD,
RTSI,RTSUSDCUR,2020-10-16,RTSUSDCUR,Курс доллара США на момент закрытия Индекса РТС,77.8529,77.8529,77.8529,77.8529,0.0,,,2,0.0,USD,
RTSI,RUABICP,2020-10-16,ABI CP,Композитный индекс облигаций ,116.06,116.06,116.06,116.06,3822675692.6,1729,5.52,2,10727939976720.78,RUB,
RTSI,RUABITR,2020-10-16,ABI TR,Композитный индекс облигаций — совокупный доход,222.84,222.84,222.84,222.84,3822675692.6,1729,5.52,2,10727939976720.78,RUB,
RTSI,RUBMI,2020-10-16,Индекс РТС широкого рынка,Индекс РТС широкого рынка,824.77,827.55,829.36,816.52,926950832.5167077,0,0.0,2,194607400091.03677,USD,235953303.4342
SNDX,RUCBCP3Y,2020-10-16,Индекс Мосбиржи корп обл CBICP 3-5,Индекс Мосбиржи корпоративных облигаций MOEX 1 - 3 ценовой,93.09,93.15,93.2,93.03,2307315827.93,638,5.93,2,807284570927.9998,RUB,1.0
SNDX,RUCBCP5Y,2020-10-16,Индекс Мосбиржи корп обл CBICP 1-3,Индекс Мосбиржи корпоративных облигаций ценовой 3-5,123.4,123.25,123.4,123.16,333111762.0,1308,6.23,2,370735445395.0,RUB,1.0
SNDX,RUCBICP,2020-10-16,Индекс Мосбиржи корп обл CBICP,Индекс Мосбиржи корпоративных облигаций ценовой,97.19,97.2,97.24,97.15,2739318935.13,952,6.15,2,1278718516322.9995,RUB,1.0
RTSI,RUCBICP1Y,2020-10-16,CBI CP 1Y,"Индекс корпоративных облигаций (≤ 1 года, рейтинг ≥ B-)",92.17,92.17,92.17,92.17,325486829.7,138,5.65,2,187193419271.84,RUB,
RTSI,RUCBICP3+,2020-10-16,CBI CP 3+,"Индекс корпоративных облигаций (< 1 года, рейтинг > B-)",125.74,125.74,125.74,125.74,136543547.2,1489,6.28,2,479100786025.38,RUB,
RTSI,RUCBICPB,2020-10-16,CBI CP B,"Индекс корпоративных облигаций (> 1 года, B- ≤ рейтинг < BB-)",78.28,78.28,78.28,78.28,17099573.53,802,7.05,2,57241561444.73,RUB,
RTSI,RUCBICPB3Y,2020-10-16,CBI CP B 3Y,"Индекс корпоративных облигаций (1-3 года, B- ≤ рейтинг < BB-)",79.6,79.6,79.6,79.6,12218019.53,740,7.01,2,45595355521.85,RUB,
RTSI,RUCBICPBB,2020-10-16,CBI CP BB,"Индекс корпоративных облигаций (> 1 года, BB- ≤ рейтинг < BBB-)",94.1,94.1,94.1,94.1,146143704.7,874,6.27,2,552730545102.5,RUB,
RTSI,RUCBICPBB3+,2020-10-16,CBI CP BB 3+,"Индекс корпоративных облигаций (> 3 лет, BB- ≤ рейтинг < BBB-)",120.13,120.13,120.13,120.13,33926258.0,1364,6.6,2,155114905102.5,RUB,
RTSI,RUCBICPBB3Y,2020-10-16,CBI CP BBB 3Y,"Индекс корпоративных облигаций (1-3 года, BB- ≤ рейтинг < BBB-)",92.52,92.52,92.52,92.52,112217446.7,683,6.13,2,397615640000.0,RUB,
RTSI,RUCBICPBB5Y,2020-10-16,CBI CP BB 5Y,"Индекс корпоративных облигаций (3-5 лет, BB- ≤ рейтинг < BBB-)",120.24,120.24,120.24,120.24,30621119.3,1306,6.63,2,139672255102.5,RUB,
RTSI,RUCBICPBBB,2020-10-16,CBI CP BBB,"Индекс корпоративных облигаций (> 1 года, рейтинг ≥ BBB-)",100.2,100.2,100.2,100.2,235595760.8,1027,5.73,2,688885902110.08,RUB,
RTSI,RUCBICPBBB3+,2020-10-16,CBI CP BBB 3+,"Индекс корпоративных облигаций (3-5 лет, рейтинг ≥ BBB-)",130.07,130.07,130.07,130.07,97735735.2,1567,6.08,2,312339675000.0,RUB,
RTSI,RUCBICPBBB3Y,2020-10-16,CBI CP BBB 3Y,"Индекс корпоративных облигаций (1-3 года, рейтинг ≥ BBB-)",95.86,95.86,95.86,95.86,137860025.6,579,5.43,2,376546227110.08,RUB,
RTSI,RUCBICPBBB5Y,2020-10-16,CBI CP BBB 5Y,"Индекс корпоративных облигаций (3-5 лет, рейтинг ≥ BBB-)",128.98,128.98,128.98,128.98,2149528.7,1324,5.93,2,225973725000.0,RUB,
RTSI,RUCBICPL1,2020-10-16,CBI CP L1,Индекс корпоративных облигаций Котировальный лист 1 - ценовой,93.76,93.76,93.76,93.76,293703751.8,938,5.97,2,711209971681.81,RUB,
RTSI,RUCBICPL2,2020-10-16,CBI CP L2,Индекс корпоративных облигаций Котировальный лист 2 - ценовой,105.36,105.36,105.36,105.36,60142564.83,934,6.07,2,420402246975.5,RUB,
RTSI,RUCBICPL3,2020-10-16,CBI CP L3,Индекс корпоративных облигаций Котировальный лист 3 - ценовой,103.29,103.29,103.29,103.29,44992722.4,1054,6.07,2,167245790000.0,RUB,
